Article Title,Article Link,Article Text,Article Summary,Article Image
"Trust fund babies – but there's a twist! What are ‘Trump Accounts’? Here's how to claim your $1,000",https://timesofindia.indiatimes.com/business/international-business/trust-fund-babies-but-theres-a-twist-what-are-trump-accounts-heres-how-to-claim-your-1000/articleshow/125778800.cms,"So, what exactly is the Trump Account?



Who qualifies for the $1,000?



They must be US citizens and have a Social Security number. The programme is limited only to the babies born during Trump administration, i.e., born between January 1, 2025 and December 31, 2028. A parent can open the account regardless of their own immigration status.

Nothing for older children?



Enrolling for Trump Accounts



Why supporters say the programme matters



Concerns from critics



The journey into adulthood has looked different for everyone, depending on the family they are born into. In affluent homes, young people often leave with a trust fund to soften the landing, while for the less privileged, turning 18 can mean stepping into financial responsibility almost overnight. This, however, might change with the less famous provision of US President Donald Trump's tax legislation, which aims to give $1,000 to every new born.Say hello to the Trump Account that promises to help narrow that divide by ensuring every child enters adulthood with something to build on.Inside this provision, every newborn gets $1,000, provided their parents open an investment account under the new programme. The bill, which became law earlier this year, allows private firms to invest the funds in the stock market, and the child gains access only when they turn 18. Parents of older children can also participate by opening an account, although those children won’t receive the $1,000 incentive.However, a significant boost arrived earlier this week when philanthropists Michael and Susan Dell pledged funding that will allow some children aged 10 and below to receive $250 if their parents open an account.The Dell donation applies to children living in ZIP codes where the median family income is $150,000 or less, and who would not otherwise qualify for the Treasury-funded $1,000.A Trump Account functions as a long-term savings vehicle tied directly to the stock market. Money is held until the child turns 18 and can only be used for specific milestones, including paying for higher education, starting a business or making a down payment on a house.When an account is created for an eligible newborn, the US Treasury contributes $1,000. Private banks and brokerages manage the investments, and the rules require that funds be placed in US equity index funds with annual fees capped at 0.10%.Parents may also add up to the funds, contributing up to $2,500 per year in pretax income, much like a retirement account. Employers, friends, relatives, local governments and charitable groups can also contribute. There is a $5,000 yearly contribution cap, not considering government and charitable donations.The $1,000 seed deposit is available to babies who tick all these boxes:Though children born before 2025 will not receive the $1,000 Treasury incentive, an account can still be opened for any child younger than 18.These accounts allow up to $2,500 per year in pretax contributions from parents. Some may also qualify for the Dells’ $250 donation if they are aged 10 or under and live in eligible ZIP codes.While contributions cannot be made until July 2026, families can begin the enrolment process by submitting Form 4547 to the Internal Revenue Service.Parents who sign up early will receive instructions in May to complete the setup process. The White House says an online portal for account registration will go live in July.Another thing to keep in mind is that the money cannot be used before the child turns 18 except in exceptional cases, and withdrawals will be taxed, meaning the programme is not designed to assist with immediate household needs.Those backing the idea argue that the initiative expands access to stock market investing and offers even children born into poverty the opportunity to gain from long-term financial growth. They say that providing every newborn with $1,000 could counter the rising appeal of socialism by giving more Americans a direct path to wealth creation. The US Securities and Exchange Commission reports that 58% of American households owned stocks or bonds in 2022, but the richest 1% held almost half of the total value.Before Trump Accounts, there were ""baby bonds,"" introduced by states like California, Connecticut and the district of Columbia, that targeted children raised in poverty, foster care or those who lost a parent to COVID-19. Several other states, including Maryland, are weighing similar schemes.However, unlike Trump Accounts, those state-led programmes exclude wealthier children and are funded and managed by governments instead of private investment firms.Opponents argue that the programme offers no support to children during their early years, the stage when families are most financially vulnerable. They also note that the accounts do not compensate for cuts made elsewhere. The Trump administration and congressional Republicans reduced funding for programmes including Medicaid and food assistance in the same tax bill that introduced the accounts.They further warned that the policy could deepen economic inequality. Families capable of making the maximum yearly pretax contribution will see the greatest financial gains, whereas those unable to save will benefit the least. Using a projected annual return of 7%, the $1,000 Treasury contribution would grow to roughly $3,570 by the time a child reaches 18.","The Trump Account is a provision of US President Donald Trump's tax legislation. Every newborn born between January 1, 2025 and December 31, 2028 gets $1,000, provided their parents open an investment account. Private firms can invest the funds in the stock market, and the child gains access only when they turn 18.","https://static.toiimg.com/thumb/msid-125787990,imgsize-115258,width-400,resizemode-4/this-is-an-ai-generated-image-used-only-for-representative-purpose.jpg"
Netflix to acquire Warner Bros: Why it is a BIG deal,https://timesofindia.indiatimes.com/business/international-business/netflix-to-acquire-warner-bros-why-it-is-a-big-deal/articleshow/125790516.cms,"Massive Netflix–Warner Bros Merger Triggers Industry Panic And Global Streaming Shake-Up

From red envelopes to a global entertainment engine





Warner Bros: the house that built Hollywood





The deal in numbers – and why they matter





How this deal transforms Netflix





Stranger Things recap/ Netflix

What the deal means for Disney





""The Mandalorian"" is an exciting and breathtakingly beautiful journey for fans of the Star Wars universe. A lone Mandalorian bounty hunter is followed as he makes his way through the perilous outer reaches of the galaxy in this Disney+ series. ""The Mandalorian"" is a delightful addition to the Star Wars saga with its captivating characters, vintage Western vibes, and amazing special effects.

What it means for Paramount, NBCUniversal and others





The end of “streaming versus Hollywood”





Why this is a hinge moment for entertainment





Image via Harry Potter

Netflix was born out of the resentments of the video cassette age. Anyone who lived through the 1990s remembers the ritual: rushing to the local rental store on a Friday evening, discovering the last VHS copy was already gone and then returning the tape late on Monday morning, only to be punished with a fee that cost more than the film. Netflix emerged as a small Californian rebellion against this experience. Instead of fluorescent aisles and impatient clerks, it offered DVDs in red envelopes mailed directly to your home. Instead of rewinding tapes, you simply logged into a website and waited for the postman to arrive. It was a simple idea designed for people who wanted to escape the tyranny of Blockbuster.Two and a half decades later, that humble mail-order start-up is preparing to buy the studio that helped build modern Hollywood itself. Netflix’s planned acquisition of Warner Bros – the century-old home of Casablanca, Harry Potter, DC superheroes, The Lord of the Rings (via New Line), HBO and control of classics like The Wizard of Oz – for an enterprise value of roughly 82.7 billion dollars marks a transformative moment in entertainment history. For the first time, a company that began its life shipping DVDs is about to take ownership of a film and television library that has shaped global culture for a hundred years.This is not just a corporate transaction. It is the moment streaming becomes the centre of the entertainment universe.Netflix’s early success came from identifying a simple human truth: people hated late fees. The company replaced penalties with subscriptions and replaced return dates with unlimited rentals. But the real leap arrived in 2007, when Netflix began streaming films directly over the internet. At the time, internet video was grainy, unreliable and better suited for cat clips than cinema. Yet Netflix bet that broadband infrastructure would catch up.That bet proved correct. Streaming transformed Netflix from a quirky DVD service into the largest entertainment platform on the planet. The company expanded around the world, built an unmatched recommendation system and eventually began producing its own shows. House of Cards and Orange Is the New New Black showed that Netflix could make premium television. Stranger Things, Money Heist, Squid Game and Bridgerton made it a cultural force.Yet Netflix still faced one structural weakness. It had hits, but it did not have heritage. Unlike Disney or Warner Bros, it did not own a deep catalogue of films and shows that could be reimagined for generations, sold across formats or spun into franchises. Its library was powerful but relatively young. For a subscription business, long-lasting intellectual property becomes the anchor that holds audiences in place.If Netflix represents the story of technological disruption, Warner Bros represents the foundation of Hollywood itself. Founded in 1923, the studio introduced sound to cinema with The Jazz Singer. It gave the world Casablanca, defined the golden age of musicals with titles it now controls such as The Wizard of Oz, shaped modern rebellion with Rebel Without a Cause, reinvented horror with The Exorcist and expanded the boundaries of action cinema with The Matrix. Its New Line division shepherded The Lord of the Rings trilogy to global acclaim.Its television arm is equally influential. HBO transformed scripted entertainment by proving that cinematic storytelling could thrive on the small screen. The Sopranos, The Wire, Game of Thrones and Succession reshaped what television could be. Meanwhile, Warner’s mainstream sitcoms – Friends, The Big Bang Theory, ER and dozens more – became the comfort food of global syndication.But Warner Bros also endured repeated mergers, debt burdens and strategic upheavals. As cable television declined, the economics that once funded HBO came under strain. HBO Max, though expanding into new regions and still growing, lagged Netflix in global scale. The company found itself navigating the impossible balance between legacy networks, theatrical releases and streaming ambitions.This is the legacy Netflix is buying.But Netflix’s expansion is not being greeted with universal enthusiasm. A group of prominent filmmakers has already sent an anonymous letter to members of the US Congress warning that the acquisition could “hold a noose around the theatrical marketplace,” arguing that a Netflix-controlled Warner Bros would have the power to shrink theatrical release windows and destabilise the ecosystem that sustains thousands of industry jobs. Their note, referenced in the Variety report, describes fears that Netflix’s dominance as both a buyer and distributor could give it unprecedented leverage over exhibition chains, post-theatrical licensing and the financial health of feature filmmaking itself. The appeal urges lawmakers to subject the deal to the highest level of antitrust scrutiny, framing the merger not merely as a business story but a cultural and institutional inflection point for Hollywood.The financials make clear how monumental this transaction is. Netflix will acquire the Warner Bros studio, HBO, HBO Max and the entire film and television catalogue for an enterprise value of roughly 82.7 billion dollars and equity value of around 72 billion dollars. Shareholders will receive a mix of cash and Netflix stock valued at about 27.75 dollars per share. Netflix expects annual cost savings of two to three billion dollars by year three and forecasts that the deal will increase earnings per share by year two.Before the acquisition closes, Warner Bros Discovery will spin off its linear networks – CNN, Discovery, TLC and various factual and lifestyle channels – into a separate company. Netflix is purchasing the creative and streaming heart of the Warner empire, not the legacy cable infrastructure.This deal rivals Disney’s acquisition of 21st Century Fox in scale and easily surpasses most modern entertainment mergers. Yet the dynamic is entirely different: a digital-born platform is absorbing a traditional studio, not the other way around.The acquisition solves three long-standing problems for Netflix in one move.The first is the library gap. By acquiring Warner’s vault, Netflix finally gains a catalogue with true generational weight. DC superheroes, Harry Potter, Game of Thrones, The Matrix, Looney Tunes, HBO’s golden-age dramas and thousands of films and TV episodes become permanent Netflix assets. These are not simply shows and movies; they are narrative worlds that can be extended, rebooted and monetised for decades.The second change is theatrical power. Warner Bros owns soundstages, production facilities and distribution relationships that span the globe. Netflix’s relationship with cinemas has always been experimental and occasionally uneasy. By inheriting Warner’s infrastructure and release commitments, Netflix gains the credibility and machinery of a long-standing theatrical studio. It no longer needs to choose between being a streaming platform or a film studio. It becomes both.The third transformation concerns control. Netflix no longer depends on external studios for high-value franchises. It controls windows, renewals, merchandising and long-term franchise strategy. It can blend its vast viewer data with Warner’s storytelling and production expertise to decide which universes to expand and how to release them.In effect, Netflix stops being primarily a distributor and becomes a full-spectrum entertainment conglomerate.For years, Disney has been the only company with true franchise supremacy. Marvel, Star Wars, Pixar and Disney Animation feed into a global ecosystem of films, streaming, merchandise, parks and cruises. It has been the only studio able to dominate theatre schedules and streaming algorithms simultaneously.Netflix acquiring Warner Bros challenges that supremacy for the first time in a meaningful way. Disney and Netflix will now sit on comparable piles of narrative universes. Where Disney has Marvel, Netflix will have DC. Where Disney has Star Wars, Netflix will hold the worlds of Game of Thrones and Harry Potter. Where Disney has a robust theatrical pipeline, Netflix will now have one too.Disney remains a powerhouse, but it now competes with an entity that has both greater digital reach and an equally recognisable roster of franchises. Its task becomes maintaining cultural momentum in an environment where Netflix’s catalogue will suddenly look far deeper and far more emotionally familiar to audiences across the world.For smaller studios, the landscape becomes far more challenging. Paramount, which had aggressively pursued Warner as a way to bulk up, now finds itself exposed. Its franchises – Mission: Impossible, Top Gun, Star Trek, Nickelodeon – are valuable but not enough to compete with the consolidated libraries of Netflix–Warner or Disney. A merger or sale appears increasingly likely simply to remain viable.NBCUniversal’s Peacock also misses the chance to absorb HBO content. Sony, lacking a major streaming platform of its own, must choose whether to remain a licensing powerhouse or seek deeper alliances. In an environment dominated by scale, mid-sized players face enormous pressure either to specialise or to consolidate.From an analytical standpoint, the streaming landscape is now evolving into a three-pole system: Netflix–Warner, Disney and Amazon–MGM. Other services may continue to exist, but most will orbit these core ecosystems rather than challenge them directly.For a decade, streaming was framed as the insurgent force attacking Hollywood’s old order. Netflix was the outsider; studios were the establishment. Cable bundles, release windows and theatrical exclusivity were the system Netflix sought to disrupt.This deal erases that divide completely. When the world’s largest streaming service acquires a studio that defined Hollywood’s golden age, the categories collapse. Streaming is no longer the challenger; streaming becomes the industry’s organising principle. Theatrical releases become one element of a multi-platform strategy anchored in global subscriptions and long-term intellectual property.Hollywood’s centre shifts from geography to architecture: whoever controls the universes – and the pipeline that delivers them – controls the culture.For audiences, the benefits will appear slowly but unmistakably. More iconic films and series will live under a single subscription. HBO’s prestige slate, Warner’s classics, DC’s superheroes, Harry Potter, Game of Thrones and Netflix originals will eventually coexist on one platform. Convenience will increase, even as questions about pricing and competition intensify.For creators, the merger brings both opportunity and uncertainty. Netflix–Warner will become the world’s most powerful buyer of scripted content, capable of financing ambitious projects at scale. Yet consolidation also means fewer independent bidders for talent and a need to reconcile HBO’s creator-driven culture with Netflix’s data-driven commissioning.And for Hollywood, this is a turning point. A company built to eliminate late fees will now own the archives that define a century of storytelling. Technological disruption has merged with cinematic legacy, and the result is an entertainment ecosystem unlike anything the industry has seen.Netflix was once the outsider. With this acquisition, it becomes the custodian of one of the most important film and television libraries ever assembled. The future of entertainment will no longer be determined by who makes the most compelling story, but by who controls the universes that audiences return to year after year.Netflix wanted to escape the tyranny of the video store. It now finds itself in charge of Hollywood’s memory – and its future.","Netflix's planned acquisition of Warner Bros marks a transformative moment in entertainment history. Netflix’s early success came from identifying a simple human truth: people hated late fees. Warner Bros is the century-old home of Casablanca, Harry Potter, DC superheroes, The Lord of the Rings (via New Line), HBO.","https://static.toiimg.com/thumb/msid-125790519,imgsize-95534,width-400,resizemode-4/netflix-to-acquire-warner-bros.jpg"
Warner Bros acquisition: Netflix wins bidding war with $82.7 billion; executive deal talk next,https://timesofindia.indiatimes.com/business/international-business/warner-bros-acquisition-netflix-wins-bidding-war-with-82-7-billion-executive-deal-talk-next/articleshow/125789553.cms,"Massive Netflix–Warner Bros Merger Triggers Industry Panic And Global Streaming Shake-Up

Netflix on Friday has acquired Warner Bros. in a blockbuster $82.7 billion transaction after beating multiple bidders for the Hollywood giant’s film and TV assets, including HBO and HBO Max. The deal, valued at $27.75 per share, will take effect once WBD completes the planned spin-off of its Global Networks division, Discovery Global, expected in the third quarter of 2026.With the acquisition, Netflix will absorb iconic Warner Bros franchises such as Game of Thrones, Harry Potter, the DC Universe, The Sopranos and The Big Bang Theory, merging them with hits like Stranger Things, Money Heist and Wednesday.“Our mission has always been to entertain the world,” said Netflix co-CEO Ted Sarandos. “By combining Warner Bros.’ incredible library of shows and movies—from timeless classics like Casablanca and Citizen Kane to modern favorites like Harry Potter and Friends—with our culture-defining titles like Stranger Things, KPop Demon Hunters and Squid Game, we'll be able to do that even better.”Co-CEO Greg Peters said the deal will “improve our offering and accelerate our business for decades to come,” adding that Netflix will “strengthen the entire entertainment industry and create more value for shareholders.”WBD chief David Zaslav said the merger unites “two of the greatest storytelling companies in the world,” ensuring audiences “will continue to enjoy the world’s most resonant stories for generations to come.”Under the transaction, WBD shareholders will receive $23.25 in cash and $4.50 worth of Netflix stock per share, with the stock component subject to a collar based on Netflix’s trading price. Netflix expects to save $2-3 billion annually by year three and said the deal will be earnings accretive by year two.Both boards have unanimously approved the acquisition. Regulatory review and shareholder approval are next, followed by executive-level negotiations on integration, operational planning and leadership roles.A webcast is scheduled at 5:00am PT/8:00am ET to discuss the transaction.","Netflix has acquired Warner Bros. in a blockbuster $82.7 billion transaction. The deal, valued at $27.75 per share, will take effect once WBD completes the planned spin-off of its Global Networks division. Netflix expects to save $2-3 billion annually by year three.","https://static.toiimg.com/thumb/msid-125789577,imgsize-92682,width-400,resizemode-4/.jpg"
Tech rules clash: EU slaps €120 million fine on Elon Musk’s X; says platform misled users and blocked researchers,https://timesofindia.indiatimes.com/business/international-business/tech-rules-clash-eu-slaps-120-million-fine-on-elon-musks-x-says-platform-misled-users-and-blocked-researchers/articleshow/125789177.cms,"European Union regulators have fined Elon Musk's social media platform X 120 million euros. The penalty stems from violations of the bloc's Digital Services Act. Regulators cited issues with paid verification badges, ad transparency, and researcher access. These practices could expose users to scams and manipulation. The decision highlights the EU's commitment to user protection online.","European Union regulators have fined Elon Musk's social media platform X 120 million euros. The penalty stems from violations of the bloc's Digital Services Act. Regulators cited issues with paid verification badges, ad transparency, and researcher access. These practices could expose users to scams and manipulation.","https://static.toiimg.com/thumb/msid-125789210,imgsize-1270947,width-400,resizemode-4/-.jpg"
