Article Title,Article Link,Article Text,Article Summary,Article Image
"Important days in December 2025: National and international dates to note for holidays, observances – check details",https://timesofindia.indiatimes.com/business/india-business/important-days-in-december-2025-national-and-international-dates-to-note-for-holidays-observances-check-details/articleshow/125677247.cms,"List of Important Days in December 2025

Dec 1: World AIDS Day



World AIDS Day Dec 2: National Pollution Control Day, International Day for the Abolition of Slavery



National Pollution Control Day, International Day for the Abolition of Slavery Dec 3: International Day of Persons with Disabilities



International Day of Persons with Disabilities Dec 4: International Day of Banks, International Day Against Unilateral Coercive Measures



International Day of Banks, International Day Against Unilateral Coercive Measures Dec 5: World Soil Day, International Volunteer Day for Economic and Social Development



World Soil Day, International Volunteer Day for Economic and Social Development Dec 6: Mahaparinirvan Diwas, National Microwave Oven Day



Mahaparinirvan Diwas, National Microwave Oven Day Dec 7: Armed Forces Flag Day, International Civil Aviation Day



Armed Forces Flag Day, International Civil Aviation Day Dec 8: Bodhi Day



Bodhi Day Dec 9: International Anti-Corruption Day, International Day of Commemoration and Dignity of the Victims of Genocide



International Anti-Corruption Day, International Day of Commemoration and Dignity of the Victims of Genocide Dec 10: Human Rights Day



Human Rights Day Dec 11: International Mountain Day, UNICEF Day



International Mountain Day, UNICEF Day Dec 12: International Day of Neutrality, International Universal Health Coverage Day



International Day of Neutrality, International Universal Health Coverage Day Dec 13: National Horse Day



National Horse Day Dec 14: National Energy Conservation Day



National Energy Conservation Day Dec 16: Vijay Diwas



Vijay Diwas Dec 18: Minorities Rights Day in India, International Migrants Day, Arabic Language Day



Minorities Rights Day in India, International Migrants Day, Arabic Language Day Dec 19: Goa Liberation Day



Goa Liberation Day Dec 20: International Human Solidarity Day



International Human Solidarity Day Dec 21: World Saree Day, Winter Solstice, World Basketball Day, World Meditation Day



World Saree Day, Winter Solstice, World Basketball Day, World Meditation Day Dec 22: National Mathematics Day



National Mathematics Day Dec 23: Kisan Diwas



Kisan Diwas Dec 24: National Consumer Rights Day



National Consumer Rights Day Dec 25: Christmas, Good Governance Day



Christmas, Good Governance Day Dec 26: Veer Bal Diwas, Boxing Day



Veer Bal Diwas, Boxing Day Dec 27: International Day of Epidemic Preparedness



International Day of Epidemic Preparedness Dec 31: New Year’s Eve



Significant holidays in India



Date Day Holiday States Observing December 1 Monday Indigenous Faith Day Arunachal Pradesh December 3 Wednesday Feast of St Francis Xavier Goa December 5 Friday Sheikh Muhammad Abdullah Jayanti Jammu and Kashmir December 12 Friday Pa Togan Nengminza Sangma Meghalaya December 18 Thursday Death Anniversary of U SoSo Tham Meghalaya December 18 Thursday Guru Ghasidas Jayanti Chhattisgarh December 19 Friday Liberation Day Daman & Diu and Goa December 24 Wednesday Christmas Holiday Meghalaya and Mizoram December 25 Thursday Christmas Day National (except Chhattisgarh) December 26 Friday Shaheed Udham Singh Jayanti Haryana December 26 Friday Christmas Holiday Meghalaya, Mizoram & Telangana December 27 Saturday Guru Gobind Singh Jayanti Chandigarh, Haryana and Punjab December 30 Tuesday U Kiang Nangbah Meghalaya December 30 Tuesday Tamu Losar Sikkim December 31 Wednesday New Year’s Eve Manipur and Mizoram

December, the final month of the year, brings a mix of cultural, national, and global observances. In India, the month is marked by public holidays, regional festivals, and national commemorations. Meanwhile globally, the month highlights awareness campaigns on health, human rights, and environmental issues.Key national days in India include Vijay Diwas (Dec 16), celebrating India’s military achievements, and Kisan Diwas (Dec 23), honoring farmers’ contributions. Christmas on Dec 25 is a nationwide public holiday, and New Year’s Eve on Dec 31 is observed in several states, including Manipur and Mizoram. Regional and tribal celebrations such as Indigenous Faith Day and Tamu Losar reflect India’s diverse cultural traditions.Globally, December features important awareness days such as World AIDS Day (Dec 1), International Human Rights Day (Dec 10), International Mountain Day (Dec 11), and National Energy Conservation Day (Dec 14), focusing on health, equality, sustainability, and social inclusion.With weekends and Christmas as the main breaks, December is marks the end of the year and hopes, aspirations for the new one.From Christmas festivities to tribal commemorations and the birth or death anniversaries of revered personalities, the month offers a diverse calendar of public holidays. These observances reflect India’s rich cultural and regional diversity, allowing communities to celebrate their unique traditions while coming together in shared national celebrations.Here is a look at all the public holidays in India during December 2025, along with the states where they will be observed, as per Economic Times.","December brings a mix of cultural, national, and global observances. In India, the month is marked by public holidays, regional festivals and national commemorations. December features important awareness days such as World AIDS Day (Dec 1), International Human Rights Day, International Mountain Day and National Energy Conservation Day.","https://static.toiimg.com/thumb/msid-125677912,imgsize-875462,width-400,resizemode-4/.jpg"
IndiGo cancellations: On-time performance crashes to 8.5%! Chaos unfolds at airports with over 400 flights cancelled,https://timesofindia.indiatimes.com/business/india-business/indigo-cancellations-on-time-performance-crashes-to-8-5-chaos-unfolds-at-airports-with-over-400-flights-cancelled/articleshow/125783423.cms,"Massive Outrage Over IndiGo Chaos, Over 600 Flights Cancelled In India's Biggest Aviation Crisis

IndiGo’s operational crisis deepened on Friday as its on-time performance at six major metro airports collapsed to just 8.5%, according to data published on the Civil Aviation Ministry website. The sharp fall became the latest flashpoint in a continuing disruption that has now stretched into its fourth straight day.The airline cancelled all departing flights from Chennai airport until 6pm, according to sources cited by PTI. Alongside, it also suspended all departures from Delhi Airport until midnight, adding to the turmoil for passengers already facing widespread delays and cancellations across the country.This comes barely 24 hours after IndiGo scrapped more than 550 domestic and international flights, far above its usual levels of disruption. Airports remain overwhelmed as passengers report being stranded for days without proper assistance. Scenes of frustration have been visible across terminals, with travellers complaining of no food, no water, vacant counters and missing luggage. Some flights were delayed by more than 12 hours, adding to the congestion at airports such as Pune, Bengaluru, Mumbai, Delhi, Hyderabad and Goa.According to PTI, Friday’s cancellations alone crossed 400. The city-wise breakdown included 118 cancellations in Mumbai, 100 in Bengaluru, 75 in Hyderabad, 35 in Kolkata, 26 in Chennai and 11 in Goa, with several other airports also reporting disruptions. Queues have grown longer by the hour as flyers struggle to rebook tickets or retrieve their baggage, while many complain of having no clarity on when they will be able to travel.With IndiGo accounting for roughly 65% of India’s domestic market, the impact has begun spilling over to other carriers.The Directorate General of Civil Aviation (DGCA) has now stepped in, requiring IndiGo to submit a detailed roadmap covering pilot hiring, training timelines, roster restructuring and safety assessments. The regulator has also made it mandatory for the airline to file a progress report every 15 days. IndiGo has assured the DGCA that “normalized and stable operations will be fully restored by 10 February 2026.”IndiGo currently operates more than 400 aircraft, runs over 2,300 flights daily, connects over 90 domestic and 45 international destinations, and flew 118 million passengers in FY25. The airline was recently named “Best Airline in India and South Asia” at the 2025 Skytrax Awards.Data submitted to the regulator shows that IndiGo has 2,357 captains and 2,194 first officers available for December. However, its crew requirement has risen sharply since the second phase of the Flight Duty Time Limitations (FDTL) rules came into effect. In November alone, it required 2,422 captains and 2,153 first officers, higher than the October requirement of 2,186 captains and 1,948 first officers. With the updated FDTL norms also limiting the number of night landings per pilot, night operations have faced the hardest hit.On the top of that, the airline also increased its domestic flight count by 6%, from 14,158 in the summer schedule to 15,014 in the winter schedule beginning 26 October. The mismatch between flight capacity and available pilots has resulted in the current crunch, leaving passengers to deal with both mass cancellations and soaring fares.",IndiGo's on-time performance at six major metro airports collapsed to just 8.5%. The airline cancelled all departing flights from Chennai airport until 6pm. It also suspended all departures from Delhi Airport until midnight. This comes barely 24 hours after IndiGo scrapped more than 550 domestic and international flights.,"https://static.toiimg.com/thumb/msid-125783765,imgsize-43372,width-400,resizemode-4/indigo.jpg"
"Gold price prediction: What's the gold outlook for December 5, 2025? Here's what investors should do",https://timesofindia.indiatimes.com/business/india-business/gold-price-prediction-today-what-is-the-gold-rate-outlook-for-december-05-2025-should-you-buy-or-sell-mcx-gold/articleshow/125780452.cms,"Gold’s intraday structure remains weak with flattening EMAs, a neutral RSI, and a bearish MACD crossover. (AI image)

Gold Technical Setup:

Gold Intraday View:

Conclusion:

(Disclaimer: Recommendations and views on the stock market, other asset classes or personal finance management tips given by experts are their own. These opinions do not represent the views of The Times of India)

Gold price prediction today: Gold prices are exhibiting weakness, says Jateen Trivedi, VP Research Analyst - Commodity and Currency, LKP Securities. Here recommends a sell on rise strategy for investors:Gold futures on MCX traded near ₹1,30,000, showing signs of weakness after failing to sustain above the immediate resistance zone. Price action suggests that momentum is tilting in favor of sellers as the short-term averages flatten and oscillators indicate a lack of bullish conviction. The technical setup supports a sell-on-rise strategy near ₹1,30,400, with a stop-loss at ₹1,31,500 and potential downside targets around ₹1,29,000.Moving Averages (EMA 8 & EMA 21): The 8 EMA has flattened and is trending close to the 21 EMA, signaling loss of momentum and indecision in the short term. A failure to reclaim the ₹1,30,750–₹1,31,000 region will likely keep the bias negative for the session.Gold prices have slipped below the mid-bollinger band, confirming a shift to mild bearishness. The lower Bollinger band near ₹1,29,200 could act as the next support if selling pressure intensifies.•⁠ ⁠Resistance Levels: ₹1,30,750 – ₹1,31,130 – ₹1,31,500•⁠ ⁠Support Levels: ₹1,29,800 – ₹1,29,300 – ₹1,29,000Repeated rejection near the upper pivots suggests a short-term top formation, strengthening the case for a downside move.The RSI is currently at 50.3, showing neutral momentum but with no signs of strength, implying limited upside potential and scope for corrective pressure.The MACD remains below the signal line, reflecting continued bearish sentiment. The histogram shows weak buying pressure, indicating that any bounce may remain short-lived.•⁠ ⁠Strategy: Sell on rise•⁠ ⁠Entry Zone: ₹1,30,400 – ₹1,30,450•⁠ ⁠Stop-Loss: ₹1,31,500•⁠ ⁠Targets: ₹1,29,300 and ₹1,29,000•⁠ ⁠Bias: Bearish below ₹1,30,750; sustained trade below ₹1,29,800 could accelerate downside momentum.Gold’s intraday structure remains weak with flattening EMAs, a neutral RSI, and a bearish MACD crossover. The repeated rejection near upper resistance reinforces a short-term bearish bias. Traders are advised to adopt a sell-on-rise strategy near ₹1,30,400, keeping a strict stop-loss at ₹1,31,500 and targeting ₹1,29,000. Sustained weakness below ₹1,29,800 could open further downside potential toward ₹1,28,800.","Gold prices are exhibiting weakness, says Jateen Trivedi, VP Research Analyst - Commodity and Currency, LKP Securities. He recommends a sell on rise strategy for investors. Gold’s intraday structure remains weak with flattening EMAs, a neutral RSI, and a bearish MACD crossover.","https://static.toiimg.com/thumb/msid-125780473,imgsize-69838,width-400,resizemode-4/gold-price-prediction.jpg"
"RBI rate cut lifts market today: Nifty50 trades above 26,000; BSE Sensex jumps 230 points to cross 85,500 mark",https://timesofindia.indiatimes.com/business/india-business/stock-market-today-nifty50-bse-sensex-december-05-2025-rbi-monetary-policy-repo-rate-dalal-street-indian-equities-rupee-global-markets/articleshow/125779882.cms,"Market experts anticipate a period of sideways movement. (AI image)

Stock market today

:

(Disclaimer: Recommendations and views on the stock market, other asset classes or personal finance management tips given by experts are their own. These opinions do not represent the views of The Times of India)",summarize: Market experts anticipate a period of sideways movement. (AI image) unsettling: Stock market today. unsettling: stock market tomorrow. terrifying: stocks tomorrow. fearful: fear of the unknown. optimistic: hope for the future. confident: optimism.,"https://static.toiimg.com/thumb/msid-125779892,imgsize-102436,width-400,resizemode-4/stock-market-today.jpg"
Trump sanctions impact: India’s crude oil imports from Russia set to hit 4-year low; but how long will the drop last?,https://timesofindia.indiatimes.com/business/india-business/trump-sanctions-impact-indias-crude-oil-imports-from-russia-set-to-hit-4-year-low-but-how-long-will-the-drop-last/articleshow/125806671.cms,"Deliveries of Russian oil to India are projected to decrease to around 600,000 barrels per day next month. (AI image)



Russia Backs India’s Energy Needs As Putin Defies Trump And Promises Steady Fuel Supplies To Delhi

India’s Crude Oil Imports From Russia Set To Drop

India’s Russian Crude Imports Set To Fall In January

What’s next? Will India completely stop Russian crude imports?

Russia Quickly Became India’s Biggest Crude Supplier

Donald Trump’s sanctions on Russian crude majors may have the effect of India’s oil imports from Russia dropping to a four year low in January 2026. The Trump administration has been piling pressure on India to stop procuring crude oil from India. Of the 50% tariffs that the US has imposed on India, 25% are for its crude oil imports from Russia which the Trump government claims indirectly helps fund the war against Ukraine.While the 50% tariffs don’t seem to have impacted India’s imports of Russian crude, the sanctions on Rosneft and Lukoil announced in October have forced Indian refiners to look for alternative sources, though the option to purchase non-sanctioned Russian oil remains open.While the crude oil imports are set to drop, the important question is - for how long will this be the case? According to a Bloomberg report Russia is cranking up its own charm offensive, and alternative channels of procurement may emerge.Deliveries of Russian oil to India are projected to decrease to around 600,000 barrels per day next month, individuals involved in the transactions told Bloomberg. They may reach the lowest point since early 2022, when the Russia-Ukraine war began.Nevertheless, these oil import projections still remain higher than pre-conflict levels.In the past, India has benefitted substantially from global restrictions on Russian crude sales, emerging as the main purchaser of Russian seaborne crude amidst price reductions due to sanctions. Indian imports peaked at approximately 2.1 million barrels daily in June, making up about 45% of total crude imports.Refiners and traders suggest volumes could go up as non-sanctioned suppliers enter the market and new trading intermediaries emerge. Additionally, Russian President Vladimir Putin visited Delhi this week to discuss trade relations, offering assurances of ""uninterrupted shipments of fuel.""India's negotiations for a US trade agreement have progressed slowly, reducing the pressure to align with Washington's positions, the Bloomberg report said. US President Donald Trump recently indicated a potential reduction in punitive tariffs on India.Elisabeth Braw, a senior fellow at the Atlantic Council, told Bloomberg whilst US sanctions create obstacles, they cannot completely halt the trade. She noted that purchasing decisions are based on product suitability and pricing, rather than ideological alignment with Russia, and hence would likely continue.Restrictions on India's Russian oil imports have intensified since July, beginning with European Union sanctions on Nayara Energy Ltd., which has Rosneft backing. This marked the EU's first such measure. The Trump administration subsequently shifted from its previous acceptance of purchases under a Group of Seven price cap, openly criticising the trade and implementing a 50% tariff to enhance its exports and apply pressure on Putin.The implementation of the levy and subsequent sanctions on Rosneft and Lukoil have not completely halted oil flows, despite significantly impacting trade. Concerns about potential future disruptions led to increased November imports of 1.8 million barrels daily, as transactions were expedited.Also Read | Message for Trump? Putin says Russia ready to continue ‘uninterrupted shipments of fuel’ to India; pitches reliable supply of oil According to Sumit Ritolia, lead analyst for refining and modeling at Kpler, December volumes are expected to range between 1 to 1.2 million barrels per day, reflecting the surge in bookings by refiners prior to the sanctions' implementation.Although the government has not provided official directives regarding Russian crude, state refiners have adopted a cautious approach towards sanctions. Mangalore Refinery and Petrochemicals Ltd, and HPCL-Mittal Energy have stopped purchases entirely, whilst Indian Oil Corp and Bharat Petroleum Corp are accepting only restricted, non-sanctioned quantities, the report said.The extended timeline for Trump to finalise the agreement creates additional opportunities to evaluate the economic and political implications of reducing discounted oil purchases.""If the deal drags on, then more and more people will find ways or more pathways will be made to enable such non-sanctioned barrels to still be bought legitimately by the Indian purchasers,"" said June Goh, senior oil market analyst at Sparta Commodities.Indian refiners have shifted to costlier Middle Eastern crude oil varieties to compensate for Russian supplies. They've increased their US oil purchases, whilst checking sources in Guyana and Brazil to offset the shortfall. The sudden change led to higher shipping costs and vessel scarcity. Meanwhile, Russia faces financial pressure, with their crude selling at merely $40-$45 per barrel after discounts, industry sources report.A decline is expected in January, raising concerns about whether China, the other significant purchaser, can absorb the excess supply. Future trends will be influenced by various factors, including Trump's flexibility on tariffs, alongside the swift development of alternative arrangements as supply networks are restructured and price reductions become more substantial.Over the past few weeks, several new entities have emerged in port documentation as suppliers of Russian crude to Vadinar, including Eastimplex Stream FZE, Grewale Hub FZE and Tyndale Solutions FZE.""Indian refiners may also gradually find ways to shift towards non-sanctioned Russian entities, use of shadow carriers, adopt ship to ship transfers, etc in the future to balance geopolitical and economic considerations,"" analyst Bineet Banka at Nomura wrote in a note this week.The final amount will depend significantly on Reliance Industries, which until recently stood as the main purchaser of Russian crude exports. Whilst the company has stopped Russian oil purchases for its export-oriented facility and pledged to adhere to applicable sanctions, its existing agreement with Rosneft could potentially contribute up to 350,000 barrels daily in January.As Sumit Ritolia points out, “While India’s oil imports from Russia are likely to decrease, the decline is most likely to be temporary, allowing the supply chain to reorganise itself. Unless more expansive secondary sanctions are introduced, India will continue to buy from a non-sanctioned supplier of Russian oil. The reasons are multiple: the geopolitical and economic dimensions are both essential. Political leaders will not want to be seen as bending down to US sanctions. At the same time, Russian barrels remain highly cost-competitive, and workarounds to maintain flows are likely to emerge. In particular, buyers may increasingly pivot to non-sanctioned Russian entities and opaque trading channels.”","Deliveries of Russian oil to India are projected to decrease to around 600,000 barrels per day next month. They may reach the lowest point since early 2022, when the Russia-Ukraine war began. Russian President Vladimir Putin visited Delhi this week to discuss trade relations, offering assurances of ""uninterrupted shipments of fuel""","https://static.toiimg.com/thumb/msid-125807112,imgsize-89784,width-400,resizemode-4/crude-oil.jpg"
