Article Title,Article Link,Article Text,Article Summary,Article Image
Industrialist Ajay Piramal highlights role of designing in India's growth,https://timesofindia.indiatimes.com/business/india-business/industrialist-ajay-piramal-highlights-role-of-designing-in-indias-growth/articleshow/125808175.cms,"India's progress will depend not only on scale but how the growth is designed, industrialist and president of Anant National University Ajay Piramal said on Saturday.Speaking at the seventh convocation of the varsity, Piramal said designing has long been India's ""quiet strength,"" reflected in its crafts and problem-solving instincts.""India stands at the threshold of a remarkable transformation today. As we work towards Viksit Bharat 2047, one truth stands clear. Our country's progress will depend not only on scale and speed, but on how thoughtfully we design our growth,"" he said.Prime Minister Narendra Modi had said that the country's future will be shaped not only by policies, but by how imaginatively we design our development, Piramal noted.""It's how we transition from 'Make in India' as an aspiration to 'Design for India'. As prime minister Narendra Modi has said, we must not only manufacture in India, but also design in India -- for India and for the world,"" he added.During the ceremony, degrees were conferred on 299 students from courses such as Bachelor of Design, Bachelor of Architecture, Master of Design and MSc in Sustainability and Built Environment.Dr Sridhar Vembu, Padma Shri awardee and co-founder of Zoho Corporation, was the chief guest on this occasion.Addressing the young architects, Vembu said, ""Our cities, as they get bigger, are becoming more unlivable. It is an urban planning problem. It is a problem that only you, your generation, has to solve by applying the thinking of sustainability, design, architecture, and urban planning.""Concrete is not suitable for our climate as it gets very hot and it traps the heat. We need to build for our climatic conditions, we have to use materials that are suitable for us, like mud,"" he said.","Anant National University president Ajay Piramal said designing has long been India's ""quiet strength"" Prime Minister Narendra Modi had said that the country's future will be shaped not only by policies, but by how imaginatively we design our development.","https://static.toiimg.com/thumb/msid-125808205,imgsize-476969,width-400,resizemode-4/-.jpg"
Biocon to merge biologics arm in $5.5 billion deal,https://timesofindia.indiatimes.com/business/india-business/biocon-to-merge-biologics-arm-in-5-5-billion-deal/articleshow/125807127.cms,"Biocon will fully integrate its biosimilars arm, Biocon Biologics into the parent, in a deal valuing the unit at $5.5 billion. The move is aimed at creating a unified biopharma powerhouse, and to strengthen its global position to lead in diabetes, oncology, and immunology--therapeutic areas that together account for nearly 40% of global pharma revenues, Kiran Mazumdar-Shaw, executive chairperson, Biocon said on Saturday.Biocon will acquire the remaining stake in Biocon Biologics from Serum Institute Life Sciences (Serum), Tata Capital and Activ Pine through a share swap of 70.28 Biocon shares for every 100 Biocon Biologics shares, at a price of Rs 405.78 per Biocon share.Further, Biocon will acquire the residual stake held by Mylan (Viatris) for $815 million, split between $400 million in cash and $415 million through a share swap of 61.7 Biocon shares for every 100 Biocon Biologics shares at a price of Rs 405.78 per Biocon share.``The combined entity will offer a unique portfolio spanning biosimilars, insulins, GLP-1 peptides and complex generics, positioning Biocon among the few global players with scale in both generics and biologics. Further, we will combine the synergies in oncology and immunology with the products, in biosimilars and generics’’, she added.As the only company operating globally with both biosimilar insulins and generic versions of complex peptides, including GLP-1s, Biocon is uniquely poised to address the rapidly expanding ‘diabesity’ market, a company statement said.The board also approved raising additional capital, of up to Rs 4500 crore ($500 million) through Qualified Institutional Placement (QIP), subject to shareholder approval. The proceeds of the QIP will be largely utilised towards the cash component payable to Viatris.After the transaction and the planned fundraise, the promoters’ stake in Biocon is expected to drop to around 44.4%.Biocon Biologics chief executive Shreehas Tambe will become CEO and managing director of the combined entity post-integration, and Kedar Upadhye will be the chief financial officer. Biocon CEO Siddharth Mittal will transition to a group leadership role, the statement adds.The company had constituted a strategy committee in May 2025 to evaluate a potential merger or public listing for the biologics arm.While Biocon had previously explored a public listing for the unit, the merger unlocks higher value for the entity, executive chairperson Kiran Mazumdar Shaw told reporters in a press briefing.","Biocon will integrate its biosimilars arm, Biocon Biologics into the parent, in a deal valuing the unit at $5.5 billion. The move is aimed at creating a unified biopharma powerhouse, and to strengthen its global position to lead in diabetes, oncology, and immunology.","https://static.toiimg.com/thumb/msid-125807173,imgsize-259293,width-400,resizemode-4/.jpg"
Power as ‘currency’: Experts say data centre growth lifts demand; India poised for global leadership,https://timesofindia.indiatimes.com/business/india-business/power-as-currency-experts-say-data-centre-growth-lifts-demand-india-poised-for-global-leadership/articleshow/125805260.cms,"India’s expanding data centre and artificial intelligence ecosystem could position the country as a global leader in power trade, with experts pointing to surplus electricity capacity and rapid reforms in the power distribution sector, according to speakers at a national conference on energy and technology.Speaking at the National Conference on AI and Machine Learning based solutions in the power sector, Jitendra Srivastava, chairman and managing director of REC Limited, said the rapid rise of AI and data centres is creating a new era where electricity itself becomes a strategic asset, according to ANI.“With the exploding growth of artificial intelligence, with the exploding growth of data centres, with the sheer amount of power required to function these places...We are going to see an era when power will be the currency and we are uniquely placed with its huge potential with its already surplus status. We are poised to become world leaders. We are in a position where we can show the world that power is a tradable commodity and we can be global leaders in this,” Srivastava said.The conference brought together solution providers and power distribution companies with the aim of enabling collaboration and innovation.Shashank Mishra, Joint Secretary in the Ministry of Power, said the initiative was designed to create a common platform for developing new solutions.“Today we are bringing together solution providers and distribution companies on a single platform where they can interact and develop new solutions and ideas. We are also presenting several innovative concepts in the form of solutions, and the best among them will be awarded by the Minister of Power,” Mishra told ANI.He added that the government expects the initiative to be “a transformative” step for the sector.Highlighting ongoing reforms, Srivastava said the Ministry of Power has been driving changes under the Revamped Distribution Sector Scheme (RDSS), with smart metering forming a core pillar of the programme. He stressed that the benefits of smart meters can be fully realised only with the use of advanced analytics.“To understand the advantages of smart metering, it is essential to leverage the power of artificial intelligence and machine learning,” he said, adding that such tools can aid anti-theft measures, load forecasting and system rationalisation.According to Srivastava, the conference seeks to demonstrate how AI- and machine learning-based tools can improve consumer services, assist electricity regulators and help discoms function more efficiently.India’s energy sector has strengthened significantly in recent years, balancing rising demand with sustainability goals. Citing International Energy Agency projections, speakers noted that emerging and developing economies will account for about 85 per cent of the growth in global electricity demand over the next three years, with India playing a central role.As of June 2025, India’s total installed power capacity stood at 476 GW, while power shortages have declined sharply from 4.2 per cent in 2013-14 to 0.1 per cent in 2024-25, according to official data.",India’s data centre and artificial intelligence ecosystem could position the country as a global leader in power trade. Experts point to surplus electricity capacity and rapid reforms in the power distribution sector. The conference brought together solution providers and power distribution companies with the aim of enabling collaboration and innovation.,"https://static.toiimg.com/thumb/msid-125805261,imgsize-938198,width-400,resizemode-4/-.jpg"
"Volkswagen capex recalibration: Automaker pares 2030 investment to $186 bn; China, US headwinds grow",https://timesofindia.indiatimes.com/business/international-business/volkswagen-capex-recalibration-automaker-pares-2030-investment-to-186-bn-china-us-headwinds-grow/articleshow/125805954.cms,"Volkswagen Group plans to invest €160 billion ($186 billion) through 2030, a scaled-down outlay that reflects tightening capital allocation as Europe’s largest automaker grapples with mounting pressure in its two biggest markets — China and the United States, Reuters reported.The investment figure, announced by Volkswagen CEO Oliver Blume, is part of the company’s rolling five-year capital expenditure plan, which is updated annually. The latest commitment compares with €165 billion earmarked for 2025–2029 and €180 billion for 2024–2028, with 2024 marking the peak year for spending.Since that peak, the group — which houses brands such as Porsche and Audi — has been squeezed by higher costs and weaker margins, hit by US tariffs on imported vehicles and intensifying competition in China. The strain has been felt most acutely at Porsche, which derives nearly half of its sales from the US and China combined.Porsche recently unveiled a significant rollback of its electric vehicle strategy as profits came under pressure. Speaking to Frankfurter Allgemeine Sonntagszeitung, Blume said the focus of the latest investment plan was firmly “on Germany and Europe,” particularly in products, technology and infrastructure.Blume added that discussions on an extended savings programme at Porsche are expected to continue into 2026. He also said he does not expect Porsche to grow in China, though localising production across the wider Volkswagen group remains an option. A China-specific Porsche model could make sense at some point, he said.On Audi, Blume noted that any decision on building a manufacturing plant in the United States would depend on whether Washington offers substantial financial support.Blume, who will step down as Porsche CEO in January to concentrate fully on running Volkswagen Group, said his recent contract extension as Volkswagen chief executive until 2030 signalled continued backing from the Porsche and Piëch families as well as the German state of Lower Saxony, the company’s largest shareholders.“But it is true, of course, that shareholders have suffered losses since Porsche went public three years ago. I, too, must face up to this criticism,” he said.",Volkswagen Group plans to invest €160 billion ($186 billion) through 2030. The investment figure is part of the company’s rolling five-year capital expenditure plan. The latest commitment compares with €165 billion earmarked for 2025–2029.,"https://static.toiimg.com/thumb/msid-125805981,imgsize-298706,width-400,resizemode-4/-.jpg"
Want to invest in SpaceX? Elon Musk owned rocket-maker hints at 2026 IPO; chasing a massive $800 billion valuation,https://timesofindia.indiatimes.com/business/international-business/want-to-invest-in-spacex-elon-musk-owned-rocket-maker-hints-at-2026-ipo-chasing-a-massive-800-billion-valuation/articleshow/125799966.cms,"SpaceX is reportedly seeking an $800 billion valuation in a new secondary share sale, potentially surpassing OpenAI as the US's most valuable private company. This move comes as the company weighs a potential IPO next year, fueled by the success of its Starlink service and its crucial role in government missions.","SpaceX is reportedly seeking an $800 billion valuation in a new secondary share sale. It could surpass OpenAI as the US's most valuable private company. This move comes as the company weighs a potential IPO next year, fueled by the success of its Starlink service.","https://static.toiimg.com/thumb/msid-125800567,imgsize-116792,width-400,resizemode-4/spacex.jpg"
'Insane': How Elon Musk reacted to EU's $140m fine on X & why the platform was penalised,https://timesofindia.indiatimes.com/business/international-business/insane-how-elon-musk-reacted-to-eus-140m-fine-on-x-why-the-platform-was-penalised/articleshow/125799209.cms,"Elon Musk denounced the EU's $140 million fine on X as ""crazy"" and ""insane,"" criticizing the penalty for violating transparency rules under the Digital Services Act. Regulators cited deceptive design practices with the blue checkmark system and shortcomings in X's ad database. The ruling has drawn criticism from US officials who view it as an attack on American tech platforms.",The EU fined X $140 million for violating transparency rules under the Digital Services Act. Regulators cited deceptive design practices with the blue checkmark system and shortcomings in X's ad database. The ruling has drawn criticism from US officials who view it as an attack on American tech platforms.,"https://static.toiimg.com/thumb/msid-125799510,imgsize-34556,width-400,resizemode-4/elon-musk.jpg"
US inflation: Fed’s key gauge stays elevated in September; rate cut hopes rise despite weak spending signals,https://timesofindia.indiatimes.com/business/international-business/us-inflation-trend-feds-key-gauge-stays-elevated-in-september-rate-cut-hopes-rise-despite-weak-spending-signals/articleshow/125793070.cms,"The Federal Reserve’s preferred inflation gauge was largely unchanged in September, a development that is expected to support a widely anticipated interest rate cut at the central bank’s meeting on December 9–10. The Commerce Department said on Friday that prices rose 0.3% in September from August, matching the previous month’s increase, in a report delayed five weeks by the government shutdown.Core prices — excluding food and energy — rose 0.2%, also the same as August. On an annual basis, overall prices increased 2.8%, slightly above 2.7% in August, while core inflation eased marginally to 2.8% from 2.9%, According to AP report.Economists said the data point to muted core inflation and bolster the case for a rate cut, even though headline inflation remains above the Fed’s 2% target. They noted that President Donald Trump’s tariffs continue to put upward pressure on prices, though Fed officials argue that slow hiring, modest economic growth and subdued wage gains are likely to cool inflation in coming months.Omair Sharif, chief economist at Inflation Insights, said Friday’s report would likely reassure policymakers that core inflation remains contained.But he flagged one area of concern: a measure of services inflation that remains stubbornly high.“It hasn’t really shown any sign of slowing down,” Sharif said. “That has to be concerning for them.”The Fed faces a difficult policy choice next week. Under typical conditions, it would keep rates elevated to curb inflation. But with hiring weakening and unemployment slowly rising, it hopes that cutting rates will spur borrowing and support the economy.Consumer spending, meanwhile, rose 0.3% in September, down from 0.5% in August, signalling softer household demand. Spending appeared to strengthen over Black Friday and the following weekend; Adobe Analytics reported a 7.7% rise in online spending during the five-day holiday period.Household incomes increased 0.4% in September, the second consecutive month of solid growth.The broader economy continues to send mixed signals. Growth remains steady, but the unemployment rate has edged up to a four-year high of 4.4%. The housing market is stagnant and factories have been cutting jobs, yet heavy investment in artificial intelligence data centres has provided support.On Wednesday, payroll processor ADP said businesses shed 32,000 jobs in November, an indication that job markets may be weakening further. Economists warn that if layoffs accelerate, consumers are likely to pull back sharply on spending.The government will release its November jobs report on December 16, which FactSet expects to show a small employment gain.","Core prices — excluding food and energy — rose 0.2%, also the same as August. On an annual basis, overall prices increased 2.8%, slightly above 2.7% in August. Core inflation eased marginally to 2.9%, according to AP report.","https://static.toiimg.com/thumb/msid-125793106,imgsize-893496,width-400,resizemode-4/-.jpg"
"Wall Street today: S&P 500 inches toward record high; rate-cut bets firm as retailers rally, Netflix slips",https://timesofindia.indiatimes.com/business/international-business/wall-street-today-sp-500-inches-toward-record-high-rate-cut-bets-firm-as-retailers-rally-netflix-slips/articleshow/125791591.cms,"The US stock market edged closer to its all-time high on Friday, with Wall Street drifting toward the end of a relatively quiet week, AP reported. The S&P 500 rose 0.3% in early trade, leaving it just 0.2% below its record. The Dow Jones Industrial Average was up 46 points, or 0.1%, while the Nasdaq Composite gained 0.4%. The Russell 2000 eased 0.2% after hitting a record on Thursday.Netflix fell 2.1% after announcing a $72-billion cash-and-stock deal to acquire Warner Bros. following its split from Discovery Global. Warner Bros. Discovery shares rose 2.6%.Retailers provided the day’s biggest boost. Ulta Beauty surged 11% after posting stronger-than-expected quarterly revenue and profit, with CEO Kecia Steelman highlighting growth led by e-commerce despite financial pressures on consumers. Victoria’s Secret shares jumped 14.4% after the company reported a smaller-than-expected quarterly loss and raised its full-year sales forecast.Hewlett Packard Enterprise slid 3.9% after revenue for the quarter came in lower than analysts’ estimates, though profit exceeded expectations.This week’s subdued trade follows bouts of volatility driven by concerns over heavy AI-linked flows and uncertainty about the Federal Reserve’s interest-rate path, AP noted.Markets broadly expect the Fed to cut rates next week — its third cut this year — in a bid to support a slowing job market.Lower rates typically lift asset prices but risk adding to still-elevated inflation, which remains above the Fed’s 2% target.Treasury yields were steady, with the 10-year holding at 4.11% and the two-year edging up to 3.54%.Global markets were largely positive. Germany’s DAX rose 0.9%, South Korea’s Kospi gained 1.8%, while Japan’s Nikkei 225 fell 1.1% after data showed household spending slid 3% in October — the sharpest fall since January 2024 — amid expectations of future rate hikes by the Bank of Japan.","The S&P 500 rose 0.3% in early trade, leaving it just 0.2% below its record. The Dow Jones Industrial Average was up 46 points, or 0.1%, while the Nasdaq Composite gained 0.4%. Netflix fell 2.1% after announcing a $72-billion deal to acquire Warner Bros.","https://static.toiimg.com/thumb/msid-125791588,imgsize-994623,width-400,resizemode-4/-.jpg"
