Article Title,Article Link,Article Text,Article Summary,Article Image
"Lights, camera, contract! Netflix leads talks to buy Warner Bros Discovery with $28 per share – how much are other bidders offering?",https://timesofindia.indiatimes.com/business/international-business/lights-camera-contract-netflix-leads-talks-to-buy-warner-bros-discovery-with-28-per-share-how-much-are-other-bidders-offering/articleshow/125785649.cms,"Netflix is one step closer to pulling off one of the biggest entertainment takeovers in recent history. The streaming giant is now in exclusive negotiations to purchase Warner Bros Discovery’s film and television studios, as well as its streaming businesses, after putting forward an offer priced at $28 per share, according to a source with direct knowledge of the discussions.Warner Bros Discovery, the owner of HBO, has spent months weighing strategic options. A second round of bids arrived this week following initial proposals from Netflix, Paramount Skydance and Comcast. Reuters previously reported that Netflix submitted a mostly cash offer and ultimately surfaced as the frontrunner.At $28 per share, Netflix’s bid exceeds Warner Bros Discovery’s closing price of $24.54 on Thursday, and also tops a nearly $24 proposal made by Paramount that covered the company’s entire portfolio, including its cable channels such as CNN, TNT and TBS.The move marks another bold shift in Netflix’s strategy as it pushes beyond its core subscription business to tap additional revenue sources. Securing Warner Bros, home to franchises including Harry Potter, Game of Thrones and DC Comics, would place Netflix in control of some of the world’s most valuable entertainment properties and move it towards becoming a vertically integrated powerhouse that produces, distributes and monetises major IP on its own platforms.The company has also been extending its reach into gaming, live content and consumer experiences.Bloomberg News reported that Netflix is willing to pay a breakup fee of $5 billion if regulators block the transaction, and that the two companies could unveil a formal agreement within days, according Reuters.The possibility of the takeover has triggered industry pushback. Variety reported that a consortium of prominent film figures has called on the US Congress to intervene should Netflix’s attempt succeed, warning of a “looming economic and institutional crisis” across Hollywood.Meanwhile, CNBC said on Thursday that Paramount has accused Warner Bros of conducting a sale process that unfairly benefits Netflix over other bidders. The network cited a letter sent by the newly merged media company.""We strongly urge you to empower such a special committee comprised of directors with no potential appearance of bias or beholdenness to others whose interests may differ from those of the stockholders,"" Paramount's legal team wrote in the letter, cited by Reuters.The latest bidding follows a failed attempt earlier this year: in October, Warner Bros declined an estimated $60 billion takeover offer from Paramount for the entire business before launching a more structured sales process for its assets.","Netflix is in exclusive negotiations to purchase Warner Bros Discovery's film and television studios, as well as its streaming businesses. The streaming giant has put forward an offer priced at $28 per share. The move marks another bold shift in Netflix’s strategy as it pushes beyond its core subscription business to tap additional revenue sources.","https://static.toiimg.com/thumb/msid-125785992,imgsize-145704,width-400,resizemode-4/.jpg"
"Asian stocks today: Markets trade mixed ahead of US economic data; Kospi nears 1% gains, Nikkei sheds 700 points",https://timesofindia.indiatimes.com/business/international-business/asian-stocks-today-markets-trade-mixed-ahead-of-us-economic-data-kospi-nears-1-gains-nikkei-sheds-700-points/articleshow/125779774.cms,"Asian stocks traded mixed on Friday, following a muted pattern on Wall Street as the latest US economic data left investors with little clarity about Federal Reserve's plans for interest rate cuts nex week.Hong Kong's HSI was down 63 points or 0.24% reaching 25,872. Nikkei also trimmed its gains, falling 702 points to trade at 50,326.Meanwhile, Shanghai and Shenzhen gained 0.08% and 0.39%, reaching 3,878 and 13,057 points, respectively.In South Korea, Kospi gained 0.99% gains at 9:50 AM IST, rising to 4,068 points.Recent market gains, lifted by comments from central bank officials signalling possible monetary easing, have stalled amid mixed economic signals. Payrolls firm ADP reported that over 30,000 jobs were lost in November, reinforcing signs that the US labour market is softening.Thursday’s figures on jobless claims and layoffs were slightly better than expected, yet markets remain highly confident of a rate cut at the Fed’s Wednesday meeting, with probabilities hovering around 90%.All eyes are now on the personal consumption expenditures (PCE) index, the Fed’s preferred inflation measure, due later on Friday.Analysts expect that a below-forecast reading could strengthen hopes for additional rate reductions in 2026. Data on income and consumer spending is also set for release.Wall Street ended the session on a muted note, with the S&P 500 and Nasdaq posting small gains, while the Dow slipped marginally.Back in Asia, the focus will be on RBI's monetary policy announcement, whre the apex bank might announce a rate cut. According to a Bloomberg survey that included 44 economists, the interest rates might go down a quarter point to 5.25%.","Hong Kong's HSI was down 63 points or 0.24% reaching 25,872. Nikkei also trimmed its gains, falling 702 points to trade at 50,326. Shanghai and Shenzhen gained 0.08% and 0.39%, reaching 3,878 and 13,057 points, respectively.","https://static.toiimg.com/thumb/msid-125780591,imgsize-379136,width-400,resizemode-4/.jpg"
Five years to 18 months — is the US slashing immigrant work authorization? Here's what new USCIS work permit rules say,https://timesofindia.indiatimes.com/business/international-business/five-years-to-18-months-is-the-us-slashing-immigrant-work-authorization-heres-what-new-uscis-work-permit-rules-say/articleshow/125778167.cms,"Trump FREEZES Green Card, Citizenship Applications From THESE High-Risk Countries After DC Shooting

Vetting and screening of non-citizens will be increased: USCIS

The Trump administration has once again introduced new changes, making its immigration policy more restrictive.On Thursday, US Citizenship and Immigration Services (USCIS) updated its Policy Manual to sharply limit the length of Employment Authorization Documents (EADs) for several categories of immigrants, including refugees, asylum seekers, and applicants awaiting adjustment of status.Under the new policy, the maximum duration for initial and renewal work permits will drop from five years to 18 months for refugees, people granted asylum, those with withholding of removal, and applicants with pending cases for asylum, adjustment of status or other humanitarian relief, as per press release.The change applies to employment authorization applications filed or pending on or after December 5, 2025.USCIS said the shift is intended to increase the frequency of vetting and screening for noncitizens seeking authorization to work in the United States as part of a broader immigration enforcement push.“Reducing the maximum validity period for employment authorization will ensure that those seeking to work in the United States do not threaten public safety or promote harmful anti-American ideologies,"" Director Joseph Edlow said.He also pointed out the recent attack on National Guard and said that such incidents made vetting necessary so that the government can stop ""aliens.""After the attack on National Guard service members in our nation’s capital by an alien who was admitted into this country by the previous administration, it’s even more clear that USCIS must conduct frequent vetting of aliens,"" Edlow added.Separately, recent requirements in the “One Big Beautiful Bill Act,” signed into law July 4, 2025, will cap work authorization at one year — or the end of an individual’s parole or Temporary Protected Status (TPS) period, whichever is shorter — for immigrants paroled as refugees, those granted or applying for TPS, other parolees, and spouses of entrepreneur parole recipients. Those limits apply to any work permit applications filed or pending on or after July 22, 2025, when USCIS published a notice in the Federal Register outlining implementation.","US Citizenship and Immigration Services (USCIS) updated its Policy Manual to sharply limit the length of Employment Authorization Documents (EADs) for several categories of immigrants. The maximum duration for initial and renewal work permits will drop from five years to 18 months for refugees, people granted asylum, and applicants with pending cases for asylum, adjustment of status or other humanitarian relief.","https://static.toiimg.com/thumb/msid-125778266,imgsize-18460,width-400,resizemode-4/representative-image.jpg"
US sanctions: Washington eases curbs on Lukoil outlets outside Russia; exemption valid till April 2026,https://timesofindia.indiatimes.com/business/international-business/us-sanctions-washington-eases-curbs-on-lukoil-outlets-outside-russia-exemption-valid-till-april-2026/articleshow/125770922.cms,"A dispatch rider passes in front empty building of the Lukoil headquarter in Sofia, Bulgaria (Picture credit: AP)

'Do Not UNDERESTIMATE Russia': Jeffrey Sachs Big Message To 'DELUSIONAL' U.S. & Trump

The United States has temporarily lifted some restrictions on Lukoil-branded fuel stations operating outside Russia, allowing them to continue running despite sanctions placed on the parent company.The treasury department confirmed on Thursday that these stations — including those in the US — can keep serving customers without enabling revenue to move back to Russia, which remains under extensive American and European sanctions over its actions in Ukraine.The exemption will stay in force until 29 April 2026, reported Reuters.The relaxation marks a partial suspension of measures introduced by US President Donald Trump in October.The announcement comes in the same week US officials met Russian President Vladimir Putin in Moscow as part of efforts to advance a Washington-backed plan to end the conflict.Lukoil’s footprint outside Russia is substantial. The company operates around 200 stations across New Jersey, Pennsylvania and New York.Its Finnish subsidiary Teboil, which runs roughly 430 fuel stations, has already begun winding down operations as supplies diminish, with expectations that Lukoil will eventually sell the chain.Beyond this, the firm remains a dominant retail player in Moldova and Bulgaria and manages about 600 outlets in Turkey and over 300 in Romania.The decision to soften restrictions comes against the backdrop of wider sanctions imposed by Washington.The US placed its first major penalties on Lukoil and Rosneft, freezing all American-based assets and banning US firms from engaging with them.The companies, which together contribute around 55% of Russia’s petroleum output, were added to the Specially Designated Nationals (SDN) list.Businesses were given until 21 November to cut ties or risk secondary sanctions that could limit access to US banking, shipping and insurance services.India’s energy sector is also feeling the impact. New US sanctions on Rosneft and Lukoil have turned their crude into a “sanctioned molecule,” analysts said, as per PTI.Although India imported an average of 1.7 million barrels per day of Russian crude this year — with November expected to touch 1.8–1.9 million bpd — inflows are forecast to drop sharply to about 4,00,000 bpd in December and January.Several refiners, including Reliance Industries and HPCL-Mittal Energy, have paused purchases, with only Rosneft-backed Nayara Energy continuing supplies due to its dependence on Russian barrels.Experts say the restrictions apply specifically to designated companies, not to all Russian crude.This allows Indian buyers to legally source barrels from non-sanctioned producers such as Gazprom Neft or Surgutneftegaz, provided no blacklisted entity is involved in shipping, banking or trading.Reliance, which operates one of the world’s largest refining complexes, has already stopped using Russian crude in its export-oriented SEZ refinery to comply with upcoming EU rules.","The exemption will stay in force until 29 April 2026. The relaxation marks a partial suspension of measures introduced by US President Donald Trump in October. Lukoil’s footprint outside Russia is substantial. The company operates around 200 stations across New Jersey, Pennsylvania and New York.","https://static.toiimg.com/thumb/msid-125770998,imgsize-970230,width-400,resizemode-4/untitled-design-9.jpg"
'Been in works for long time': Prada seals $1.51 billion Versace deal; Lorenzo Bertelli takes over as executive chairman,https://timesofindia.indiatimes.com/business/international-business/been-in-works-for-long-time-prada-seals-1-51-billion-versace-deal-lorenzo-bertelli-takes-over-as-executive-chairman/articleshow/125770184.cms,"(ANI)

CNN reported that the acquisition follows an agreement reached in April, under which Prada committed to purchasing Versace for about $1.51 billion, a deal that materialised after Capri Holdings’ planned sale to Tapestry fell apart because of an antitrust challenge.Lorenzo Bertelli, the son of Prada founders Miuccia Prada and Patrizio Bertelli, is set to assume the role of executive chairman at Versace. Speaking about the extended discussions that paved the way for the deal, he said, ""There had already been contacts during the Covid period, and there were talks even before Capri's sale to Tapestry. When that deal fell through over antitrust issues, we came back and tried to speed things up. It was something that had been in the works for a long time.”With the acquisition now finalised, Versace — established in 1978 by Gianni Versace in Milan — becomes part of the group that owns both Prada and Miu Miu. Bertelli, who pushed for the acquisition, said the brand met two important criteria: it carried manageable financial risk and held strong global value.The transition comes shortly after Donatella Versace stepped aside as creative chief following 30 years in the position. She was succeeded by Dario Vitale, previously the design director at Miu Miu.","Lorenzo Bertelli, the son of Prada founders, is set to assume the role of executive chairman at Versace. The acquisition follows an agreement reached in April, under which Prada committed to purchasing Versace for about $1.51 billion.","https://static.toiimg.com/thumb/msid-125770292,imgsize-37600,width-400,resizemode-4/pic-66.jpg"
US market today: Wall Street edges higher near records; traders weigh corporate earnings and rate-cut expectations,https://timesofindia.indiatimes.com/business/international-business/us-market-today-wall-street-edges-higher-near-records-traders-weigh-corporate-earnings-and-rate-cut-expectations/articleshow/125769399.cms,"File photo (Picture credit: AP)

US stocks were largely steady on Thursday, holding close to record levels as investors assessed a mixed set of corporate results and fresh labour market indicators.The S&P 500 was up 0.1% in early trade and is now just 0.5% shy of its all-time high, reported AP.The Dow Jones Industrial Average added 99 points, or 0.2%, while the Nasdaq Composite was flat.At the opening bell, the Dow inched up 5.3 points and the S&P 500 and Nasdaq gained 0.24% and 0.31% respectively, according to Reuters.Lower-priced retailers were among the early winners. Dollar General surged 6.4% after posting stronger-than-expected quarterly profit as more shoppers visited its stores, while Five Below rose 0.8% after beating earnings forecasts and issuing upbeat guidance for the holiday season.Salesforce also inched up 0.7%, delivering a profit that topped expectations although its revenue fell slightly short.As per news agency AP, CEO Marc Benioff said the company was “uniquely positioned for this new era” of AI.Kroger, meanwhile, slipped 3.8% after its quarterly revenue fell below estimates. Snowflake plunged 8.6% despite beating profit and revenue forecasts, with UBS analysts noting the pressure that followed its previous blockbuster quarter, according to AP.Growth in its key product revenue segment also slowed.Market sentiment has been shaped heavily by expectations of a Federal Reserve rate cut next week — which would be the third this year — as policymakers look to support a cooling job market.Investors favour lower rates because they tend to lift asset prices, though easing too soon could reignite inflation.Fresh US labour market data released on Thursday offered mixed signals.Jobless claims fell to their lowest level in more than three years, and layoff announcements dropped sharply from October’s surge, according to figures cited by AP.The encouraging data nudged the 10-year Treasury yield up to 4.08% from 4.06%.Global markets were mixed, with European shares rising modestly and Asia showing a split trend. Japan’s Nikkei 225 jumped 2.3%, while South Korea’s Kospi slipped 0.2%.","The S&P 500 was up 0.1% in early trade and is just 0.5% shy of its all-time high. The Dow Jones Industrial Average added 99 points, or 0.2%, while the Nasdaq Composite was flat. Lower-priced retailers were among the early winners.","https://static.toiimg.com/thumb/msid-125769448,imgsize-1652235,width-400,resizemode-4/untitled-design-7.jpg"
"Turbulent times: Airbus struggles with setbacks across fleet; Boeing stages comeback, exposes industry contrast",https://timesofindia.indiatimes.com/business/international-business/turbulent-times-airbus-struggles-with-setbacks-across-fleet-boeing-stages-comeback-exposes-industry-contrast/articleshow/125764526.cms,"ANI file photo

IndiGo Crisis: Inside Pilot Shortage, Rule Change and Winter Delays Behind Over 200 Cancellations

Airbus has been grappling with a fresh wave of setbacks, highlighting the mounting strain on its sprawling but fragile supply chain.The past week offered a stark reminder that the planemaker is not immune to the production troubles affecting the wider aviation industry, where supply shortages and labour gaps persist even years after the pandemic ended.Early Wednesday, the planemaker was forced to cut its long-standing aircraft delivery target for the year after discovering that a lesser-known Spanish supplier had provided out-of-specification aircraft panels, a blow that highlighted how vulnerable the €155-billion ($181-billion) manufacturer remains to disruptions among smaller vendors.Last Friday, Airbus issued an urgent directive for a software update across approximately 6,000 A320 aircraft, its flagship fleet, after identifying a potential fault in the interface between onboard computers and the flight-control system.Three days later, Airbus revealed a quality issue involving metal panels used in the fuselage of the same jet, triggering the need for detailed inspections of more than 600 aircraft already in service or at various stages of production.“The pressures of quarterly results, sometimes the pressures of competition, probably the quality drops a little bit,” Tony Fernandes, founder of AirAsia, was quoted as saying by Bloomberg.“It’s a good warning for everybody.”The one-two setback this week rattled investors, leading to Airbus’s worst trading day since April.The contrast was especially stark as Boeing, buoyed by a renewed optimism over its financial recovery, posted its strongest stock gains in months.On Tuesday, Boeing offered a series of upbeat forecasts, from increased deliveries of its 737 and 787 jets next year to a long-awaited return to positive cash flow after years of heavy outflows. Investors welcomed the outlook, sending the US plane maker's shares up by as much as 10 per cent, as cited by Bloomberg.Boeing has been slowly pulling itself out of a years-long crisis that began in late 2018 with the first of two fatal crashes, deepened during the Covid-19 pandemic, and worsened again in early 2024 when lapses in workmanship led to another near-disaster mid-flight.The situation was compounded further late last year, when a debilitating strike brought production to a standstill for weeks and drained the company’s resources.Since then, however, the storied US manufacturer has staged a steady comeback under new CEO Kelly Ortberg, who has overhauled management and set a sharper operational direction. Boeing has also benefited from strong backing from the White House, with the US president frequently leveraging aircraft orders in global negotiations and trade discussions.Airbus’ recent setbacks are still unlikely to reach the scale of Boeing’s turmoil last year. The company has already resolved the software issue over the weekend, minimising operational disruptions, and says most of the fuselage panels under inspection are expected to be compliant.However, the revised delivery timeline will leave some airlines waiting even longer for their aircraft, even as carriers rush to upgrade their fleets to keep pace with surging global travel demand.With China’s bid to challenge the long-standing duopoly still in its early stages, the fortunes of Airbus and Boeing remain tightly intertwined.Now, as Airbus targets a monthly production rate of 75 A320-family aircraft by 2027 and Boeing boosts output of its bestselling 737, both manufacturers face the same pressure: scaling up while preserving quality and ensuring that a fragile global supply chain can support their ambitions.","Airbus has been grappling with a fresh wave of setbacks, highlighting the mounting strain on its sprawling but fragile supply chain. The past week offered a stark reminder that the planemaker is not immune to the production troubles affecting the wider aviation industry. Boeing, buoyed by a renewed optimism over its financial recovery, posted its strongest stock gains in months.","https://static.toiimg.com/thumb/msid-125764587,imgsize-187327,width-400,resizemode-4/ani-file-photo.jpg"
1.14 lakh startups generate more than 12 lakh jobs in India: Finance ministry,https://timesofindia.indiatimes.com/business/startups/trend-tracking/1-14-lakh-startups-generate-more-than-12-lakh-jobs-in-india-finance-ministry/articleshow/107262154.cms,"Finance Ministry

NEW DELHI: More than 1.14 lakh startups in India have created over 12 lakh jobs so far, the finance ministry said in its latest review of the Indian economy.In the report titled, ‘The Indian Economy: A Review January 2024’, the Department of Economic Affairs said that the 1.14 lakh startups recognised by the government under the 'Startup India initiative’ created more than 12 lakh jobs (as of October 2023).The state-owned e-commerce platform Open Network for Digital Commerce (ONDC) clocked more than 63 lakh transactions till November 2023, the document read.Despite facing global challenges in 2023 like valuation issues, few IPOs, regulatory changes and macroeconomic and geopolitical trends, India remains the third largest tech start-up ecosystem globally, with over 950 tech startups founded last year.The cumulative funding for more than 31,000 tech start ups has exceeded $70 billion (from 2019 to 2023), according to a recent report by Nasscom in collaboration with Zinnov.“In 2023, despite facing global economic and regulatory challenges, Indian tech startups have prioritised the imperative of enhancing their business fundamentals, driving profitability and growth,” said Debjani Ghosh, President, Nasscom.“The proliferation of tech startups in tier 2 and 3 cities marks the ecosystem's resilience,” she added.Navigating 2024, tech startup founders expect to continue the revenue growth path with measured steps focusing on optimising expenditure and maximising profitability for B2B tech startups.Investments in deeptech will continue an upward trend in 2024. With generative AI (GenAI) acceleration, 70 per cent of start-up founders are embedding artificial intelligence (AI) in their solutions.As funding becomes scarce for the Indian startup ecosystem in general, the explosion of Artificial Intelligence (AI) has given a new lease of life to entrepreneurs and founders in the country, as the Centre extends support to the sector.","The state-owned e-commerce platform Open Network for Digital Commerce clocked more than 63 lakh transactions till November 2023. India remains the third largest tech start-up ecosystem globally, with over 950 tech startups founded last year. The cumulative funding for more than 31,000 tech start ups has exceeded $70 billion.","https://static.toiimg.com/thumb/msid-107262111,imgsize-64556,width-400,resizemode-4/107262111.jpg"
