Article Title,Article Link,Article Text,Article Summary,Article Image
"'Wo log chitr to lagate rahe lekin ...': BJP's Manoj Tiwari slams AAP amid Ambedkar, Bhagat Singh photo controversy",https://timesofindia.indiatimes.com/india/wo-log-chitr-to-lagate-rahe-lekin-bjps-manoj-tiwari-slams-aap-amid-ambedkar-bhagat-singh-photo-controversy/articleshow/118544610.cms,"Manoj Tiwari (ANI file photo)

AYODHYA: Following allegations by the Aam Aadmi Party (AAP) that the Bharatiya Janata Party (BJP)-led government in Delhi removed pictures of Dr Babasaheb Bhimrao Ambedkar and Bhagat Singh from the Chief Minister's office, BJP MP Manoj Tiwari said that AAP had ruined Delhi over the past 11 years and now have no other way except to spread confusion.""These (AAP) are the people who ruined Delhi in the last 11 years. Now, they have no other way except to spread confusion, but Delhi is not going to be confused. We are the people who follow the path of Babasaheb Ambedkar and Bhagat Singh ji,"" Tiwari told ANI.""Wo log chitr to lagate rahe lekin charitra nahi tha unmein (Those people kept putting up pictures but they did not have character)"" the BJP MP added.On Monday, AAP National Convenor Arvind Kejriwal claimed the new BJP-led government had hurt millions of BR Ambedkar followers by removing a photograph of the country's first Law Minister from the office of the Delhi Chief Minister.In his X post, the former Delhi chief minister wrote, ""The new BJP government of Delhi removed Babasaheb's photo and put up the photo of Prime Minister Modi. This is not right. This has hurt millions of followers of Babasaheb"".The AAP supremo further requested the BJP not to remove Ambedkar's photo, saying, ""I have a request to BJP. You can put the photo of the Prime Minister but do not remove the photo of Babasaheb. Let his photo remain there.""Former Delhi Chief Minister and Leader of Opposition in the Delhi Assembly, Atishi, accused the BJP of having an anti-Dalit and anti-Sikh mentality.Atishi in a post on X said, ""BJP has shown its true anti-Dalit and anti-Sikh face. Photos of Babasaheb Bhim Rao Ambedkar and Shaheed-e-Azam Bhagat Singh have been removed from the Chief Minister's Office of Delhi Legislative Assembly.""However, the Delhi unit of the Bharatiya Janata Party refuted the Aam Aadmi Party's claims and showed that Delhi Chief Minister Rekha Gupta's chambers do indeed have portraits of Babasaheb Ambedkar and Bhagat Singh, despite the Opposition alleging the opposite.The Delhi BJP 's X post posted pictures of the Delhi CM's chambers. It read, ""The chambers of the Chief Minister of Delhi, @gupta_rekha and all the ministers are adorned with the pictures of revered Mahatma Gandhi, Babasaheb Bhimrao Ambedkar, Bhagat Singh, the President and the Prime Minister.""",BJP MP Manoj Tiwari said that AAP had ruined Delhi over the past 11 years and now have no other way except to spread confusion. Arvind Kejriwal claimed the new BJP-led government had hurt millions of BR Ambedkar followers by removing a photograph of the country's first Law Minister.,"https://static.toiimg.com/thumb/msid-118544673,imgsize-31216,width-400,resizemode-4/118544673.jpg"
Magnitude 5.1 earthquake strikes Bay of Bengal,https://timesofindia.indiatimes.com/india/magnitude-5-1-earthquake-strikes-bay-of-bengal/articleshow/118543210.cms,"NEW DELHI: A magnitude 5.1 earthquake struck the Bay of Bengal early on Tuesday, according to the National Center for Seismology . The tremor occurred at 06:10 AM IST at a depth of 91 km, with its epicentre located at latitude 19.52°N and longitude 88.55°E.There were no immediate reports of damage or tsunami warnings.More details awaited.","A magnitude 5.1 earthquake struck the Bay of Bengal early on Tuesday. The tremor occurred at a depth of 91 km, with its epicentre located at latitude 19.52°N and longitude 88.55°E. No immediate reports of damage or tsunami warnings.","https://static.toiimg.com/thumb/msid-118543214,imgsize-827099,width-400,resizemode-4/118543214.jpg"
Well near Sambhal masjid on public land: UP to SC,https://timesofindia.indiatimes.com/india/well-near-sambhal-masjid-on-public-land-up-to-sc/articleshow/118543157.cms,"NEW DELHI: UP govt has informed the Supreme Court that the disputed ""private well"" near the Mughal-era Jama Masjid mosque in Sambhal was situated on public land. A status report was filed before a bench comprising Chief Justice Sanjiv Khanna and Justice Sanjay Kumar following a Jan 10 direction of SC.""The petitioners are attempting to create private rights over a public well. The subject well is part of the 19 wells that are being revived by the district administration for inter alia, rainwater harvesting, water recharge and use by all communities"" the report said.The report stated that the well, locally known as ""dharani varah koop"", was situated near and not inside the disputed religious site , and had no connection with the mosque.""Even the disputed religious site is situated on public land. It is submitted that the well is a public well and is not situated anywhere inside the mosque/disputed religious site. In fact, there is no access to the subject well from inside the mosque,"" it added.The state administration formed a three-member committee comprising the SDM Sambhal, area officer, Sambhal and the executive officer, municipal council, Sambhal, to examine the status of the well in question.The Uttar Pradesh govt said the petitioner failed to disclose there was a well within the boundary walls of the mosque known locally as ""yagna koop"".The committee, in a spot inspection, found that the well was situated outside the mosque boundary wall, the report said. ""The petitioner has annexed misleading photographs attempting to show that the subject well is located inside its premises..It was also found during the inspection that this well was in use since time immemorial by persons of all communities.","UP govt has informed the Supreme Court that the disputed ""private well"" near the Mughal-era Jama Masjid mosque in Sambhal was situated on public land. A status report was filed before a bench comprising Chief Justice Sanjiv Khanna and Justice Sanjay Kumar.","https://static.toiimg.com/thumb/msid-118543164,imgsize-731636,width-400,resizemode-4/118543164.jpg"
Europe ready to 'step up' on def spending: Macron,https://timesofindia.indiatimes.com/india/europe-ready-to-step-up-on-def-spending-macron/articleshow/118542285.cms,"French President Macron told President Trump Monday that Europe is ready to ""step up"" defence spending but said he hoped for ""strong"" US involvement in securing any peace settlement in Ukraine. Macron said he and Trump would discuss ""long-lasting peace"" in Ukraine but that Kyiv ""must be involved"" in talks to end the war. He said some European countries would be ready to have peacekeepers in Ukraine as a security guarantee after a peace treaty was signed, although they would not be sent to the front line.","French President Macron says Europe is ready to ""step up"" defence spending. But he hopes for ""strong"" US involvement in securing any peace settlement in Ukraine. He said some European countries would be ready to have peacekeepers in Ukraine as a security guarantee after a peace treaty was signed.","https://static.toiimg.com/thumb/msid-118542321,imgsize-691663,width-400,resizemode-4/118542321.jpg"
"Can't free Katara case lifer after 20-year term, Delhi government tells SC",https://timesofindia.indiatimes.com/india/cant-free-katara-case-lifer-after-20-year-term-delhi-government-tells-sc/articleshow/118542041.cms,"SC: 20-year jail terms would become meaningless if state takes such stand

NEW DELHI: Supreme Court Monday took exception to Delhi govt's stand that a convict, sentenced to life imprisonment with 20 years of jail term without remission , could not be released even after completion of the period.A bench of Justices Abhay S Oka and Ujjal Bhuyan expressed surprise over the oral submission made by the Delhi govt counsel in the case of convict Sukhdev Yadav alisa Pehalwan in the Nitish Katara murder case and asked that it be said on oath in an affidavit. It said the govt's stand might amount to contempt of the court's order which awarded a 20-year jail term.How can a govt take such a stand? Twenty-year jail terms would become meaningless. The court had said 20-year imprisonment and now the state is saying he cannot be released even after 20 years,"" the bench said.The court was hearing a plea by Sukhdev Yadav alias Pehalwan who was sentenced to life imprisonment with a caveat that it shall be 20 years of actual imprisonment without consideration of remission. He was convicted in the 2002 Nitish Katara murder case and had filed a petition seeking furlough. As his jail term is about to get over in a few weeks, the court sought the state's response on when he could be released from jail.Senior advocate Aparajita Singh, appearing for Nitish's mother Neelam Katara, said it was a life sentence with 20 years without remission which meant that the convict could be eligible for remission after 20 years.The bench, however, was not convinced and disapproved of the state govt's stand on the issue relating to freedom. ""This is the concept of liberty for the state? We will deal with it. Let your home secretary take a stand on oath after taking legal opinion. If needed we can haul up your home secretary,"" the bench said.On Oct 3, 2016, Supreme Court had awarded 25-year jail term without any benefit of remission to Vikas Yadav and his cousin Vishal for their role in the kidnapping and killing of Nitish Katara. Co-convict Sukhdev Yadav was handed down a 20-year jail term in the case.Earlier, Delhi high court, while upholding the life imprisonment awarded to Vikas and Vishal Yadav by the trial court, had specified a 30-year sentence, without any remission, to the two. It had awarded 25-year jail term to Sukhdev Yadav.All three were convicted and sentenced for kidnapping Nitish from a marriage party on the night of Feb 16, 2002, and killing him for his alleged affair with Bharti Yadav, Vikas's sister. Bharti is the daughter of Uttar Pradesh politician D P Yadav who is in jail in connection with another murder case.","Supreme Court took exception to Delhi govt's stand that a convict, sentenced to life imprisonment with 20 years of jail term without remission, could not be released. Justices Abhay S Oka and Ujjal Bhuyan expressed surprise over the oral submission made by the Delhi government. It said the govt’s stand might amount to contempt of the court's order which awarded a 20-year jail term.","https://static.toiimg.com/thumb/msid-118542070,imgsize-1638046,width-400,resizemode-4/118542070.jpg"
"DTC losses mounted by Rs 35,000 crore in 6 years: CAG",https://timesofindia.indiatimes.com/india/dtc-losses-mounted-by-rs-35k-crore-in-6-years-cag/articleshow/118541905.cms,"DTC losses mounted by Rs 35k crore in 6 years: CAG (Pic credit: PTI)

CAG points out deficient route planning by DTC

NEW DELHI: The Comptroller and Auditor General (CAG) has stated that Delhi Transport Corporation 's cumulative losses soared from Rs 25,300 crore in 2015-16 to nearly 60,750 crore in 2021-22 as it was weighed down by dwindling fleet, with 45% of buses being overage and prone to high levels of breakdown, resulting in below-par fleet utilisation.In the long overdue report, expected to be tabled in assembly by the new BJP govt on Tuesday, the auditor pointed to multiple lapses, including the transport utility's inability to augment its fleet, sources told TOI. This is the first of 14 reports that the AAP govt had refused to share in the assembly.The primary reason for the losses was DTC fares remaining unchanged since 2009, sources said, with the Delhi govt refusing to pay heed to multiple requests. The burden further went up as women were given free bus rides. The auditor also pointed to the absence of any business plan and there was no roadmap to check the bleeding and to ensure its financial viability , said sources who have seen the report.The skeletal DTC fleet, with broken down buses part of commuters' daily experience, turned into a political issue, with BJP and Congress repeatedly talking up AAP chief Arvind Kejriwal's 2015 promise to boost the fleet by 10,000.In 2007, Delhi High Court had ordered that DTC should have a fleet of 11,000 buses. However, five years later, the Delhi cabinet pegged the number at 5,500. The CAG report is learnt to have pointed out that at the end of March 2022, DTC had a fleet of 3,937 buses, of which 1,770 were overage. The low-floor buses were more than 10 years old and were due to be phased out by the end of next month.Although there was a shortage of 1,740 buses, except the addition of 300 buses in 2022, procurement was not done despite Rs 233 crore being available. It did not avail of central assistance of another Rs 49 crore under FAME-I scheme, which CAG attributed to indecision and lack of clarity on specifications. A delay in the finalisation of 300 electric buses under FAME-II resulted in the contract period being reduced from 12 years to 10 years.An ageing fleet meant that DTC could not achieve operational efficiency compared to the national average. Besides, breakdowns ranged between 2.9 and 4.5 for every 10,000 km of operations, which was seen to be very high in comparison to other state transport corporations as well as cluster buses run by private operators on contract.CAG pointed out that the performance of cluster buses was much better than that of the DTC fleet on each operational parameter, despite both operating in similar circumstances.The federal auditor also faulted DTC for deficient route planning with the state utility operating on 468 routes or 57% of the total 814 routes. ""The corporation was unable to recover its operational cost in any of the routes operated by it. As a result, it suffered losses of Rs 14,199 crore on operations during 2015-22,"" a source said.While losses soared, the Delhi govt provided a revenue grant of Rs 13,381 crore between 2015 and 2022, which left a gap of Rs 818 crore. Further, DTC did not sign an MoU with the Delhi transport department setting physical and financial targets.Further, CAG is learnt to have pulled up DTC for not implementing an automatic fare collection system and having CCTV surveillance system that remained incomplete even nine years after the project was initiated.","Delhi Transport Corporation's losses soared from Rs 25,300 crore in 2015-16 to nearly 60,750 crore in 2021-22. The primary reason for the losses was DTC fares remaining unchanged since 2009. 45% of buses were overage and prone to high levels of breakdown, resulting in below-par fleet utilisation.","https://static.toiimg.com/thumb/msid-118541989,imgsize-1137775,width-400,resizemode-4/118541989.jpg"
Government report exposed BJP's USAID 'lies': Congress,https://timesofindia.indiatimes.com/india/government-report-exposed-bjps-usaid-lies-congress/articleshow/118540764.cms,"Amid ongoing row over USAID funding, Congress Monday claimed Union finance ministry has ""thoroughly exposed"" BJP's ""lies"" with its annual report for 2023-24 stating the US agency is currently implementing seven projects in collaboration with Indian govt and none of them has anything to do with voter turnout. Congress' Jairam Ramesh said, ""None other than Union finance ministry has thoroughly exposed the lies of the PM and his 'jhooth brigade', including his dapper external affairs minister."" ""Not a single of the seven projects has to do with voter turnout. All of them are with and through Union govt,"" he said.","Congress claims Union finance ministry has ""thoroughly exposed"" BJP's ""lies"" US agency is currently implementing seven projects in collaboration with Indian govt. Congress' Jairam Ramesh said, ""None other than Union finance Ministry has thoroughly exposed the lies of the PM and his 'jhooth brigade'","https://static.toiimg.com/thumb/msid-47529300,imgsize-110164,width-400,resizemode-4/47529300.jpg"
AAP government has left 'entire exchequer empty': Delhi CM Rekha Gupta,https://timesofindia.indiatimes.com/india/aap-government-has-left-entire-exchequer-empty-delhi-cm-rekha-gupta/articleshow/118514484.cms,"Delhi CM Rekha Gupta (Pic credit: ANI)

Poll What Is Most Important for the Success of the Current Assembly Session? Advancing Development Projects Ensuring Financial Accountability

Will focus on making Delhi a 'viksit rajdhani': Sachdeva

NEW DELHI: CM Rekha Gupta said Sunday the previous AAP dispensation left the state coffers ""empty"", but assured that the BJP govt was ""committed"" to rolling out the Rs 2,500-per month honorarium scheme for eligible women.Addressing a joint press meet with Delhi BJP chief Virendra Sachdeva after a legislative party huddle, Gupta said several rounds of meetings had been held with govt officials on the issue in the past four days since she took over.""The condition the previous govt left for us... when we sit with officers to review the financial status... the entire govt exchequer is found empty,"" Gupta said, while replying to a question on preparations to implement the women's aid scheme. ""But giving the money to women is a routine work we have to do. We will surely implement the scheme with detailed planning. It's our commitment. We will do it 1,000%,"" the CM said.According to an estimate, after excluding taxpayers, govt servants and beneficiaries of other state welfare schemes, around 38 lakh women above 18 will be eligible for assistance under this scheme. The govt may need over Rs 11,000 crore annually for this.Giving a monthly honorarium of Rs 2,500 per month to women in Delhi under the ' Mahila Samriddhi Yojana ' was one of the prominent electoral promises made by BJP in the run-up to the assembly polls.The Delhi CM said the first day of the Delhi assembly session on Monday will see the election of Speaker and Deputy Speaker followed by the newly-elected legislators taking oath. She added that the three-day assembly session will focus on discussions about development projects. ""The most important aspect of the session, as we committed, will be the laying of the pending CAG reports in the house and the previous govt must now answer the people of Delhi for the misuse of their hard-earned money,"" Gupta said, adding that all commitments made by BJP will be fulfilled.On former CM Atishi's statement that her govt followed the procedure and forwarded the CAG reports to the lieutenant governor for approval before tabling them in the house, Sachdeva said the AAP dispensation was in a habit of ""peddling lies."" ""They should be ready to reply (on CAG reports),"" he added. The assembly session is starting Monday and will continue till Thursday.Sachdeva also said that the BJP govt in the next five years will focus on making Delhi a ""viksit rajdhani"" (developed capital). ""All MLAs discussed in the meeting on how to take forward the developmental works in their respective constituencies. Our govt will complete all the projects and fulfil the expectations of the people. AAP's attempts to defame the BJP by spreading lies will be countered by the work of our legislators,"" the Delhi BJP president said.","Delhi CM Rekha Gupta says previous AAP dispensation left state coffers ""empty"" But she assured that the BJP govt was ""committed"" to rolling out the Rs 2,500-per month honorarium scheme for eligible women. The assembly session is starting Monday and will continue till Thursday.","https://static.toiimg.com/thumb/msid-118514549,imgsize-1084313,width-400,resizemode-4/118514549.jpg"
Zodiac Signs That Can Identify Snakes in Human Form,https://timesofindia.indiatimes.com/astrology/zodiacs-astrology/zodiac-signs-that-can-identify-snakes-in-human-form/articleshow/118499058.cms,"Image Source: Freepik

Here we are going to explore the zodiac signs which are best at identifying toxic people so let's check them out:

Leo

Scorpio

Virgo

Cancer





Aquarius

According to astrology, every sign of the zodiac has distinct personality traits and intuitive skills that affect how they view and engage with the world. Certain zodiac signs are particularly adept at seeing dishonesty, manipulation, or hidden agendas that is described as spotting ""snakes in human form"" because of their enhanced emotional intelligence, analytical skills, and intuition.The Sun-ruled sign of Leo is renowned for its self-assurance, leadership, and protectiveness. Despite their propensity for devotion and respect, Leos are able to recognize dishonesty and disloyalty in others thanks to their intuition. Strong feelings of loyalty and treachery. When someone crosses limits, they can tell right away. Leos are watchful for dangers and defend those in their immediate social group. Their audacity enables them to face dishonest people head-on.Most people agree that Scorpio is the most observant and intuitive sign of the zodiac. Scorpios, who are ruled by Mars, the planet of change, strength, and the subconscious, are naturally able to see past appearances and unearth buried realities. They are able to read tiny emotional clues because they possess exceptional emotional intelligence. They are skilled at exposing lies because of their investigative nature. Even before any treachery has place, they are able to detect when someone's energy is off. Scorpios are able to swiftly break off poisonous people, safeguarding their mental stability and tranquility.Mercury-ruled Virgos are renowned for their keen analytical abilities and painstaking attention to detail. They can easily spot contradictions and covert intentions because of their logical attitude. They are outstanding at identifying behavioral patterns and irregularities. They are able to analyze discussions and spot dishonesty because to their rational thinking. They are naturally skeptical, which makes them vigilant about any dangers. Because of their acute observational abilities and critical thinking, Virgos are frequently able to identify manipulative people.The Moon rules Cancer, a sign known for its emotional intelligence and keen intuition. They are skilled at spotting manipulative behavior because they can readily perceive the intentions and feelings of others.They are sensitive to emotional dishonesty because of their nurturing nature. They are able to detect whether someone is acting strangely or dishonestly. Cancers are aware of hidden dangers because of their strong protective instinct. Before any emotional harm happens, Cancers can avoid poisonous people thanks to their emotional intelligence.Saturn is the ruler of Aquarius zodiac sign, which is renowned for its sharp mind and original ideas. Because of their keen senses, Aquarians are able to spot dishonesty. They are able to recognize discrepancies because of their analytical, logical thinking. They have a keen sense of observation and are able to identify odd patterns of behavior. Aquarians are naturally skeptical of trickery and flimsy charm. They are able to evaluate events rationally since they are detached from emotional drama.","According to astrology, every sign of the zodiac has distinct personality traits and intuitive skills that affect how they view and engage with the world. Certain zodiac signs are particularly adept at seeing dishonesty, manipulation, or hidden agendas because of their enhanced emotional intelligence, analytical skills, and intuition.","https://static.toiimg.com/thumb/msid-118499185,imgsize-70956,width-400,resizemode-4/118499185.jpg"
