Article Title,Article Link,Article Text,Article Summary,Article Image
"Despite 33% quota, women's representation still low: President Murmu",https://timesofindia.indiatimes.com/india/despite-33-quota-womens-representation-still-low-president-murmu/articleshow/125598872.cms,"President Murmu, V P Radhakrishnan and PM Modi read the Preamble during Constitution Day celebrations at Samvidhan Sadan Wednesday



PM Modi Pens Powerful Letter On Duties And Democracy, Reflects On His Constitutional Journey

NEW DELHi: President Droupadi Murmu on Wednesday said women representation in judiciary, legislature and executive continues to be low despite Parliament amending the Constitution to enact Women's Reservation Act in 2023 to reserve one-third of seats for women in Lok Sabha and state assemblies.""Nari Shakti Vandan Adhiniyam is a historic step towards empowering women and a homage to all women who took part in the Constituent Assembly to frame the Constitution. But we continue to lag in giving women adequate representation in judiciary, legislature and executive,"" Murmu said at the Constitution Day celebrations organised by Supreme Court, which has only one woman among 33 judges.Speaking in the presence of CJI Surya Kant and law minister Arjun Ram Meghwal, the President said taking steps to give adequate representation to women in all three wings of governance will require a change of mindset. It was SCBA president Vikas Singh who mentioned extremely low representation of women in judiciary - 13% in HCs and 35% in trial courts.She said annual commemoration of the Constitution's adoption on Nov 26, 1949, is often marked by speeches made by dignitaries. ""Have we ever looked back and assessed in the last 75 years how much we have progressed in achieving the constitutional goals of justice, equality, liberty and fraternity for every citizen? If not, can we do it in the next 24 years when we will be celebrating the centenary of the adoption of the Constitution? That is the question, not only for the judiciary, legislature or executive, but for everyone.Addressing another Constitution Day event in Central Hall of old Parliament building or Samvidhan Sadan, Murmu described the Constitution as the bedrock of ""our national pride and national identity"", and as a guiding text for taking India forward with a ""nationalist mindset by abandoning the colonial mindset"".In front of an audience that included Vice-President C P Radhakrishnan, PM Narendra Modi, Lok Sabha Speaker Om Birla, opposition leaders of Rajya Sabha and Lok Sabha, Mallikarjun Kharge and Rahul Gandhi, respectively, and members of both Houses of Parliament, Murmu cited implementation of legislations related to the criminal justice system as an example of the effort to shun the colonial mindset.Murmu also said that by repealing the provisions of Article 370, an obstacle that had been hindering the country's inclusive political integration was removed.At the function in SC, Murmu praised CJI's renewed focus on mediation and termed it a big step to reduce litigation.CJI Kant said when it comes to justice delivery system, there is still a disquieting gap between constitutional vision and the experience of many, especially the marginalised section of population for whom the access to justice remains elusive because of exorbitant cost of litigation, language of courts, distance and delay. Promising to improve the justice delivery system on all these fronts, the CJI said, ""The time is also ripe for us to reinforce predictability in our judicial approach. ""","President Droupadi Murmu said women representation in judiciary, legislature and executive continues to be low. Parliament amending the Constitution to enact Women's Reservation Act in 2023 to reserve one-third of seats for women in Lok Sabha and state assemblies. Murmu: Constitution is the bedrock of ""our national pride and national identity""","https://static.toiimg.com/thumb/msid-125599054,imgsize-1412569,width-400,resizemode-4/article-3.jpg"
"From Poonch madrassa, Omar Abdullah says it’s unpatriotic to spread ‘propaganda against religious education institutions’",https://timesofindia.indiatimes.com/india/from-poonch-madrassa-omar-abdullah-says-its-unpatriotic-to-spread-propaganda-against-religious-education-institutions/articleshow/125596812.cms,"(File pic)

'Islamophobia': Pak Meltdown Over Ayodhya Event Despite Its Own Poor Record of Minority Persecution

SRINAGAR/JAMMU: On Constitution Day, Jammu and Kashmir chief minister Omar Abdullah and lieutenant governor Manoj Sinha, speaking at separate functions on Wednesday, called for upholding the values enshrined in the Constitution and uphold the rights of citizens. However, while Omar expressed concern that religious educational institutions were being unfairly targeted, Sinha asserted that the “practice of rewarding separatism” had stopped after provisions of the Constitution were made fully applicable to J&K in 2019.Addressing students and faculty at the 50th annual celebration of Jamia Zia-ul-Uloom, a madrassa in Jammu’s Poonch district, Omar said “propaganda and lies” were being spread against Muslim religious institutions in many parts of the country. This was unpatriotic, he added.As the programme began with the national anthem, patriotic songs and Constitutional Day pledges, the CM said, “I wish those people who spread venom against religious educational institutions through social media and the press had been here today to witness this programme. They claim that the institutions like Zia-ul-Uloom teach nothing except communalism, and only impart religious education.But you can see that along with religious studies, they teach science, mathematics and all other subjects. ”On social media, “lies are spread that these institutions promote anti-national sentiment”, where one could see here that the reality was completely different, he said.Omar said symbolic observation of Constitution Day meant nothing if its ideals were not followed. “Today, we observed Constitution Day. It does not mean we remember the Constitution just for one hour; it means we must uphold it every day. The Preamble guarantees equal rights for every religion, equal democratic rights and equality before law for all. But, we are passing through a phase where even education is being given a religious colour, where statements are made that a Muslim shouldn’t study in a medical college or that non-Hindus shouldn’t be admitted in a medical college,” the CM said.He was referring to objections raised by BJP, VHP and Bajrang Dal over the admission of Muslim students, mostly from Kashmir, to the Shri Mata Vaishno Devi Medical College in Katra. The row erupted after only eight Hindu students from Jammu made it to the first MBBS batch of 50. The admissions were based on the NEET merit list.Omar said Zia-ul-Uloom has always supported the govt and had always helped during natural disasters. During Operation Sindoor, shells fired from Pakistan Occupied Kashmir hit the madrassa on May 7, killing a teacher and wounding three students.LG Sinha, speaking at a function held in Jammu to celebrate 75 years of the adoption of the Constitution, said that after a long wait of 67 years, all provisions of the Constitution were fully implemented in J&K, ending discrimination and injustice. He was referring to the abrogation of Article 370, which granted a special status to J&K, in August 2019.“Those who say what was achieved over the past five years, I want to tell them that the practice of rewarding separatists and torturing patriots has been stopped completely,” the LG said. “Now, J&K is moving ahead guided by ideals of equity, social and economic justice as enshrined in the Constitution by Baba Saheb Dr Bhim Rao Ambedkar.”",Jammu and Kashmir chief minister Omar Abdullah and lieutenant governor Manoj Sinha spoke at separate functions on Wednesday. Omar expressed concern that religious educational institutions were being unfairly targeted. Sinha asserted that the “practice of rewarding separatism’ had stopped after provisions of the Constitution were made fully applicable to J&K in 2019.,"https://static.toiimg.com/thumb/msid-125596850,imgsize-877138,width-400,resizemode-4/article-1.jpg"
CEC Gyanesh Kumar to take chairship of IIDEA for 2026 in December,https://timesofindia.indiatimes.com/india/cec-gyanesh-kumar-to-take-chairship-of-iidea-for-2026/articleshow/125595960.cms,"EC To Launch SIR in 12 States and UTs in Phase 2, CEC Gyanesh Kumar Says Zero Complaints in Bihar

NEW DELHI: Chief election commissioner (CEC) Gyanesh Kumar will on December 3 take up chairship of the International Institute for Democracy and Electoral Assistance (IIDEA) for the year 2026 in Stockholm, reflecting a “global recognition of the Election Commission’s standing as one of the world’s most credible and innovative election management bodies (EMBs),” as per EC.IIDEA is an intergovernmental organisation created in February 1995, with India as a founding member, to support sustainable democracy worldwide. It has, over the past three decades, evolved into a key global convenor for EMBs, constitutional experts, political institutions and democratic practitioners from across continents. It currently comprises 35 member countries including Australia, France, Germany, Indonesia, Mauritius, South Africa, Chile and Sweden, with the US and Japan acting as observer states. Electoral processes and electoral research are among its focus areas. IIDEA through its council of member states annually elects a chair and two vice-chairs. Its present chairship is held by Switzerland and will now pass on to India.As Chair, Kumar will be presiding over all council meetings through 2026. EC in a statement on Wednesday said the CEC “will leverage the country’s unmatched experience of conducting the world’s largest elections to shape IIDEA’s global agenda”.Ironically, the international appreciation and IIDEA leadership for the CEC comes against the backdrop of constant attacks faced by him and EC from the opposition parties here, on the electoral roll health and the special intensive revision (SIR) exercise.“The collaboration (between EC and IIDEA) will strengthen knowledge-sharing, reinforce professional networks among EMBs, and support evidence-based global electoral reforms,” the poll panel underlined on Wednesday.It added that “Kumar will leverage the country’s unmatched experience of conducting the world’s largest elections to shape IIDEA’s global agenda”.According to EC, India, with the world’s largest electorate of 1 billion and well-documented, transparent electoral processes, will share its best practices with EMBs from across the world, in the coming year.Joint programmes, workshops, and research collaborations between ECI-run India International Institute of Democracy and Election Management (IIIDEM) and IIDEA will further enhance global readiness to respond to challenges such as disinformation, electoral violence, and erosion of voter trust, said the commission.","Chief election commissioner (CEC) Gyanesh Kumar will take up chairship of the International Institute for Democracy and Electoral Assistance (IIDEA) for the year 2026. IIDEA is an intergovernmental organisation created in February 1995, with India as a founding member, to support sustainable democracy worldwide.","https://static.toiimg.com/thumb/msid-125595971,imgsize-68362,width-400,resizemode-4/election-commission.jpg"
'One of India’s most important institutions': Om Birla lauds UPSC,https://timesofindia.indiatimes.com/india/embodies-transparency-and-impartiality-om-birla-lauds-upsc-calls-it-one-of-indias-most-important-institutions/articleshow/125595752.cms,"Lok Sabha speaker Om Birla (File photo)

NEW DELHI: Lok Sabha Speaker Om Birla on Wednesday hailed the Union Public Service Commission ( UPSC ), which is celebrating its centenary, as “one of the most important institutions in India’s democratic and administrative framework that has, in its hundred-year journey, embodied transparency, impartiality, confidentiality, and accountability”.Birla, while delivering the keynote address at UPSC’s two-day ‘Shatabdi Sammelan’ here, lauded the institution’s ability to adapt to changing times, citing the reforms in examination systems, promotion methods, and digital adoption as examples of its progressive spirit.Highlighting the inclusive nature of UPSC’s processes, the Speaker said, “Candidates from every region, language, and socio-economic background participate in this examination with complete faith in its fairness. That trust is the greatest testimony to UPSC’s credibility.”Junior minister for personnel Jitendra Singh , ‘guest of honour’ at the event, also hailed UPSC as the “guardian of India’s steel frame of governance”, saying it has stood tall as a pillar of integrity, fairness and transparency through the country’s pre and post-Independence era.Speaking in the presence of UPSC chairman Ajay Kumar, Singh recalled Sardar Vallabhbhai Patel’s description of the civil services as the “steel frame of India” and said, “it is the UPSC that has lived up to the responsibility of being the guardian of this steel frame.”Applauding UPSC’s continuous evolution, Singh drew attention to several recent initiatives that reflect the commission’s forward-looking approach. He especially commended UPSC’s ‘Pratibha Setu’ portal, which seeks to create new opportunities for candidates who have cleared all the Civil Services Examination stages but did not make it to final list of recommended candidates, by connecting them with private sector and institutional openings. He termed the move “an innovative bridge between talent and opportunity”.Singh emphasised UPSC’s larger role beyond recruitment, which covers framing and updating service rules, reviewing administrative practices, and setting ethical standards for public service.“The architects of Viksit Bharat @2047 will emerge from this very institution that has trained generations of India’s finest civil servants,” he remarked.",Lok Sabha Speaker Om Birla hailed the Union Public Service Commission ( UPSC) as ‘one of the most important institutions in India’s democratic and administrative framework’ He was delivering keynote address at UPSC's two-day ‘Shatabdi Sammelan’,"https://static.toiimg.com/thumb/msid-125595729,imgsize-26168,width-400,resizemode-4/om-birla.jpg"
India Gate protest: Six protesters send to three-day police custody,https://timesofindia.indiatimes.com/india/india-gate-protest-six-protesters-send-to-three-day-police-custody/articleshow/125595763.cms,"Delhi Air Pollution Protest At India Gate Turns Violent Amid ‘Madvi Hidma Amar Rahe’ Slogans

NEW DELHI: A Delhi court on Wednesday sent six persons, to three-day police custody after a protest against air pollution at the India Gate turned violent on Sunday.The police alleged that 10 police personnel were allegedly attacked with pepper spray during the protest over poor air quality. The police also told the court that they are probing naxal links as the protesters raised pro-naxal slogans.DCP (New Delhi) Devesh Mahla, appearing before Judicial Magistrate First Class Aridaman Singh Cheema of Patiala House Courts seeking seven days of police custody of the six accused said that Madvi Hidma (dead Maoist commander) killed 76 CRPF personnel and the accused were raising slogans for him""Some of the accused persons blocked Man Singh Road on November 9. There is an FIR in that regard as well. So, it won't be right to say this is the first time they're involved,"" said the police officer.Total 23 students were arrested and two FIRs were lodged.Meanwhile, alleging torture in police custody, the accused have moved bail applications, which will be heard after three days.The FIRs were lodged under charges related to assault, obstruction of public servants and outraging the modesty of women of the Bharatiya Nyaya Sanhita.The prosecution told the court that Radical Students Union (RSU) is a banned organisation which it was the frontal organisation and the accused have praised them on social media""Free speech is allowed but there are restrictions to free speech. We found three pepper sprays. We need to send mobile phones for examination at FSL,"" said the police officer.While 17 protesters were arrested in connection to the FIR lodged at Parliament Street police station, six were arrested in the case registered at Kartavya Path police station.Those named in the FIR include atleast seven Delhi University students – six reportedly associated with the Bhagat Singh Chhatra Ekta Manch (BSCEM) and one with Himkhand, an environmental research and action collective.Opposing the prosecution's submissions, counsel for the accused told the court that none of them were a part of any banned organisation and the allegations are vague, misleading.""Slogans can be anti-establishment but these can't be a ground for police custody. There are bruise marks on these students,"" said the counsel.""Only in the trial can we see bona fide intention. Investigation will have to take place,"" the court said in this.","A Delhi court on Wednesday sent six persons, to three-day police custody after a protest against air pollution at the India Gate turned violent on Sunday. The police alleged that 10 police personnel were allegedly attacked with pepper spray during the protest over poor air quality. Total 23 students were arrested and two FIRs were lodged.","https://static.toiimg.com/thumb/msid-125595783,imgsize-907454,width-400,resizemode-4/.jpg"
CBI arrests key accused Abul Hossen Molla in Sandeshkhali attack case,https://timesofindia.indiatimes.com/india/cbi-arrests-key-accused-abul-hossen-molla-in-sandeshkhali-attack-case/articleshow/125595030.cms,"KOLKATA: The Central Bureau of Investigation's Anti-Corruption Branch (ACB) in Kolkata has arrested Abul Hossen Molla, also known as Duronto, from South 24 Parganas district in West Bengal. He was taken into custody on Wednesday evening.According to officials, Molla was allegedly involved in the mob attack on Enforcement Directorate (ED) officials in the Sandeshkhali area in January 2024.He had been absconding for months and had consistently evaded multiple notices issued by the CBI to join the investigation.A competent court had also issued a Non-Bailable Warrant (NBW) against him after he failed to appear and remained underground.CBI officials confirmed that the accused is being produced before the court today. Further investigation into the Sandeshkhali attack case is underway.Meanwhile, Sandeshkhali, a village in West Bengal's North 24 Parganas district, had been in a political storm after villagers, mostly women, came out on the streets against the ruling TMC and its strongman Shahjahan, accusing him and his aides of ""land-grab and sexual assault"" under coercion.He was later arrested. Both the BJP and Trinamool Congress have been levelling charges against each other over Sandeshkhali.Earlier, the Calcutta High Court directed a court-monitored investigation by the CBI into the alleged cases of sexual assault and land grabbing in Sandeshkhali. The women of Sandeshkhali in the North 24 Parganas district came out on the streets earlier against the ruling TMC and Shahjahan, accusing the strongman and his aides of perpetrating gross excesses and atrocities on them while also gobbling up their land. Multiple women on the island charged Shajahan and his aides of ""land-grab and sexual assault"" under coercion.","Abul Hossen Molla, also known as Duronto, was taken into custody on Wednesday evening. Molla was allegedly involved in the mob attack on Enforcement Directorate (ED) officials in the Sandeshkhali area in January 2024. He had been absconding for months and had consistently evaded multiple notices issued by the CBI.","https://static.toiimg.com/thumb/msid-125595115,imgsize-1432559,width-400,resizemode-4/cbi-arrests-abul-hossen-molla.jpg"
India wants to further strengthen ties with US on joint fight against narcotics: MEA,https://timesofindia.indiatimes.com/india/india-wants-to-further-strengthen-ties-with-us-on-joint-fight-against-narcotics-mea/articleshow/125594989.cms,"“Being Examined”: MEA On Dhaka’S Request To Extradite Sheikh Hasina

NEW DELHI: The operational cooperation between India and the US in the area of counter-narcotics has ""surged"" in the last several years, and New Delhi wants to further strengthen the joint fight against narcotics, the MEA said on Wednesday.At his weekly media briefing, external affairs ministry spokesperson Randhir Jaiswal, in response to a query, said joint operations have been conducted which have dismantled major trans-national networks.The MEA spokesperson said the fight against narcotics was a ""very good"" area of cooperation, which could see further strengthening in the future.The cooperation has been given a further push with the launch of the India-US Counternarcotics Working Group in 2020.And, the fifth meeting of the happened last year in October, where both sides adopted several measures to strengthen their fight against common challenges, Jaiswal said. The preparation for the sixth meeting is underway, he said.""We have a strong mechanism of sharing information between the US and India, and these have resulted in key seizures and arrests,"" the MEA spokesperson added.India has a ""very strong collaboration, and not just strong collaboration, institutional collaboration with the United States, and these are based on long-standing agreements that we have between the two countries,"" he said.And, operational cooperation between the two countries has ""surged in the last several years, with significant two-way interdictions, and coordinated enforcement"". PTI","The operational cooperation between India and the US in the area of counter- narcotics has ""surged"" in the last several years. New Delhi wants to further strengthen the joint fight against narcotics, the MEA said on Wednesday. The cooperation has been given a further push with the launch of the India-US Counternarcotics Working Group in 2020.","https://static.toiimg.com/thumb/msid-125595060,imgsize-609706,width-400,resizemode-4/.jpg"
Punjab CM Mann bats for strategic tie up with Japan,https://timesofindia.indiatimes.com/india/punjab-cm-mann-bats-for-strategic-tie-up-with-japan/articleshow/125594558.cms,"Punjab CM Bhagwant Mann

Indo-Pacific Needs ‘Strategic Anchors’, Says Jaishankar As India-Japan Pact Gains Urgency

CHANDIGARH: Punjab chief minister Bhagwant Mann on Wednesday stressed on strategic partnership with Japan across key sectors such as advanced manufacturing, mobility, electronics, food processing, renewable energy, and global services.Mann virtually held a detailed deliberation with a high-level delegation from Japan, comprising representatives of the Embassy of Japan and leading Japanese companies operating across India, such as Panasonic, Sumitomo, Nippon, NEC, Toyota, and others.The interaction was a key part of Punjab's outreach in the run-up to the Sixth Progressive Punjab Investors' Summit, scheduled for March 13-15, 2026, in Mohali, according to an official statement.Mann said Punjab is a land known for courage, resilience, hard work, entrepreneurship, creativity, and a strong sense of community. He said that Punjab has always played a major role in the country's development, especially in making the country self-reliant in food production.Today, Punjab is moving forward with a renewed vision to become a leading centre for modern industry, technology, and global collaboration, he stated.Mann emphasized Punjab's strong and growing ties with Japanese industry and extended a warm invitation to Japanese companies to be part of Punjab's next phase of industrial transformation.He said Punjab and Japan share values of trust, discipline, and long-term partnership. Japanese companies in Punjab have already demonstrated strong success in the state, he added.Extending a red-carpet welcome to Japanese companies to explore the new possibilities emerging in the state, the CM said advanced manufacturing, mobility, electronics, food processing, renewable energy, and global services are shaping the future of Punjab.He said these are the core areas where Japan's strengths and Punjab's aspirations align naturally, adding he called upon the investors to join the state at the 6th Progressive Punjab Investors' Summit.Mann said the summit will showcase Punjab's progress, bring together leading industrial players, and present new opportunities for partnership and collaboration.",Punjab chief minister Bhagwant Mann stressed on strategic partnership with Japan. Mann virtually held a detailed deliberation with a high-level delegation from Japan. The interaction was a key part of Punjab's outreach in the run-up to the Sixth Progressive Punjab Investors' Summit.,"https://static.toiimg.com/thumb/msid-125594580,imgsize-994736,width-400,resizemode-4/punjab-cm-bhagwant-mann.jpg"
