Article Title,Article Link,Article Text,Article Summary,Article Image
"Toll on under expansion 2-lane highways to be halved, partially opened e-ways to be on par with NHs",https://timesofindia.indiatimes.com/india/toll-on-under-expansion-2-lane-highways-to-be-halved-partially-opened-e-ways-to-be-on-par-with-nhs/articleshow/126297492.cms,"NEW DELHI: In a relief for highway commuters, toll on under expansion stretches — from two-lane to four-lane — will soon be halved during the construction period and the user fee on partially opened expressways such as Delhi-Mumbai and Amritsar-Jamnagar will be same as that of other NHs. At present, the toll on expressways is 1.25 times of other NH stretches.TOI has learnt that the finance ministry has given the green light to the two proposals from the road transport and highways ministry. The latter had proposed to halve toll during expansion of 10-metre-wide two-lane highways with paved shoulders to four-lane highways since commuters don’t get the desired service as the width of road gets reduced available while construction is underway.Currently, during expansion of a two-lane highway to four lanes, the toll charged is around 60% of the normal NH toll. With the concurrence of the finance ministry to the proposal, soon user fee will drop to 30% of normal toll during the construction phase. The finance ministry has asked the highways ministry to monitor and ensure strict enforcement of penalties on contractors for missing timeline in such widening projects.Officials said that while giving the go ahead for bringing toll rates on partially opened expressways on par with other NHs, the finance ministry said such relief should be for one year or till the expressway is fully operational, whichever is earlier. The highways ministry had submitted that vehicles, particularly heavy commercial vehicles, were not using expressways for higher toll rates.The finance ministry has said a decision on continuing this relaxation beyond one year may be taken based on actual uptake of traffic on such expressways. It has also asked the highways ministry to impose penalties on contractors for delay in completion of works.","The user fee on partially opened expressways such as Delhi-Mumbai and Amritsar- Jamnagar will be same as that of other NHs. At present, the toll on expressways is 1.25 times of otherNH stretches.","https://static.toiimg.com/thumb/msid-126297624,imgsize-877064,width-400,resizemode-4/-.jpg"
'Shah Rukh Khan is a traitor': BJP targets KKR owner over picking Bangladeshi cricketer Mustafizur Rahman; Congress defends him,https://timesofindia.indiatimes.com/india/shah-rukh-khan-is-a-traitor-bjp-targets-kkr-owner-over-picking-bangladeshi-cricketer-mustafizur-rahman-congress-defends-him/articleshow/126297210.cms,"Shah Rukh Khan, Mustafizur Rahman

BJP Leader Attacks Shah Rukh Khan Over KKR's Bangladeshi Cricketer Amid Hindu Lynching in Bangladesh

.

NEW DELHI: Hindu religious leaders and BJP figures have launched sharp attacks on Bollywood actor Shah Rukh Khan over his IPL team Kolkata Knight Riders (KKR) selecting Bangladeshi cricketer Mustafizur Rahman , while the Congress has stepped in to defend the actor, calling the remarks against him an attack on India’s pluralism.The first public criticism came from Hindu spiritual leader Devkinandan Thakur, who questioned KKR’s decision in the backdrop of reported violence against Hindu minorities in Bangladesh. Speaking to ANI, Thakur said the KKR management should remove the Bangladeshi player. He demanded that the money paid to the cricketer be given to families of Hindu victims as an apology.""The management of KKR, their boss, should remove that cricketer (Mustafizur Rahman). Rs 9.2 crore that they are giving to that cricketer, that money should be given as an apology to the relatives of the Hindu children if they are in India, so that at least they can know that their feelings are with the Hindus,"" Thakur said.Spiritual leader Jagadguru Swami Rambhadracharya went on to questioned Khan’s character and called hhim a traitor.""He (Shah Rukh Khan) is not a hero. Shah Rukh Khan does not have a character.His actions have been those of a traitor,"" Rambhadracharya said.Soon after, BJP leader Sangeet Som called Shah Rukh Khan a “traitor” and accused him of investing money in a player from a country he claimed was “working against India”. Som said Mustafizur Rahman would not be allowed to play in the IPL.""The way Hindus are being persecuted in Bangladesh, women and girls are being raped, their homes are being burned, and anti-India slogans are being chanted there. Despite all this, traitors like Shah Rukh Khan, I'm calling him a traitor because everything he has is given by India, given by the people of India, but where do they invest this money? They invest it in players from a country that is working against India. I want to tell people like Shah Rukh Khan that they will not succeed. At any cost, they will not be able to get Mustafizur Rahman to play here. Rahman won't be able to step outside the airport,"" Som told ANI.The response from Congress followed soon after. MP Manickam Tagore condemned the remarks against Khan, calling them an attack on India’s pluralism. In a post on X, Tagore said hatred could not define nationalism and criticised the RSS for spreading division.""Calling Superstar Shah Rukh Khan a 'traitor' is an attack on India's pluralism. Hate cannot define nationalism. RSS must stop poisoning society.""The attacks come amid a series of violent incidents targeting members of the Hindu community in Bangladesh. Last month, two Hindu youths were lynched in separate incidents. Dipu Chandra Das, a garment factory worker in Mymensingh district, was beaten to death over alleged blasphemy charges on December 18, after which his body was reportedly hanged and set on fire.",Hindu religious leaders and BJP figures have launched sharp attacks on Bollywood actor Shah Rukh Khan over his IPL team Kolkata Knight Riders. Hindu spiritual leader Devkinandan Thakur questioned KKR’s decision in the backdrop of reported violence against Hindu minorities in Bangladesh. BJP leader Sangeet Som accused Khan of investing money in a player from a country he claimed was “working against India”,"https://static.toiimg.com/thumb/msid-126297357,imgsize-40920,width-400,resizemode-4/1280720-2026-01-02t082510940.jpg"
1st Vande Bharat sleeper to connect Guwahati to Howrah,https://timesofindia.indiatimes.com/india/1st-vande-bharat-sleeper-to-connect-guwahati-to-howrah/articleshow/126296347.cms,"Vande Bharat sleeper

180 Kmph While You Sleep! India's Latest Vande Bharat Sleeper Marks New Era. Check Fares, Features

NEW DELHI: PM Narendra Modi will flag off the country's first Vande Bharat Sleeper train between Guwahati and Howrah later this month, barely months before the assembly polls in Assam and West Bengal. The train, marking a major upgrade in overnight train travel running at 120-130 kmph, will also reduce the travel time between two eastern capitals by more than three hours.Railway minister Ashwini Vaishnaw announced the first route of the indigenously built modern train that has a design speed of 180 kmph. PM is likely to visit Assam and West Bengal in the third week of this month. Responding to a question on the reason for choosing the route connecting two poll-bound states, Vaishnaw said the decision is part of PM's thrust on development in east and northeast India under the ""purvodaya"" scheme.The minister said that in the next six months eight more such trains catering to 1,200-1,500 km routes will be rolled out and by December this number will reach 12. ""From next year onwards, production will be ramped up rapidly as the entire supply chain will be in place by then,"" he added.Giving details of the first service, he said it will run six days a week and the one-way fare will be Rs 2,300 for 3AC, Rs 3,000 for 2AC and Rs 3,600 for 1AC travel.He added for the first time, the national transporter has decided to have a fixed rate of fare for each class of travel in these trains - Rs 2.4, Rs 3.1 and Rs 3.8 per km for third, second and first AC, meaning there will be no dynamic pricing. ""You will see several reforms in railways in 2026. This is one of them,"" Vaishnaw said. While passengers originating from Guwahati will be served Asamese cuisine, those starting from Kolkata will get Bengali food.On the special features of the train, Vaishnaw said the riding comfort can be compared with best trains across the globe and the AC system ensures there is adequate oxygen content in air to ensure passengers face no discomfort.Vaishnaw also gave details of progress made in fencing of tracks, upgradation of around 79% network and upgradation in the Over Head Equipment (OHE), the system of overhead cables, masts, and insulators that supplies high-voltage electricity to power electric trains, enabling trains to run at a higher speed. He added that with the expansion of railway infrastructure, they are hopeful of running more trains and they are hopeful of ending waitlisted tickets in some sectors in the next 2-3 years.","PM Narendra Modi will flag off the country's first Vande Bharat Sleeper train between Guwahati and Howrah later this month. The train will also reduce the travel time between two eastern capitals by more than three hours. In the next six months eight more such trains catering to 1,200-1,500 km routes will be rolled out.","https://static.toiimg.com/thumb/msid-126296394,imgsize-101952,width-400,resizemode-4/vande-bharat-sleeper.jpg"
Gold stripped from Sabarimala through organised op: SIT,https://timesofindia.indiatimes.com/india/gold-stripped-from-sabarimala-through-organised-op-sit/articleshow/126296336.cms,"Sabarimala temple

THIRUVANANTHAPURAM/THRISSUR: Gold embedded in sacred structures of Sabarimala temple in central Kerala was allegedly stripped, diverted and converted through a planned operation involving temple officials, intermediaries and private jewellers, a state-appointed SIT told a vigilance court.In a report seeking police custody of key accused, SIT said gold-plated copper sheets forming part of the sanctum sanctorum were removed in 2019 under the pretext of repairs, chemically stripped of gold at a private Chennai workshop and returned with fresh plating to conceal the loss.According to investigators, ornamental panels depicting 10 incarnations of Lord Vishnu, zodiac symbols, the sanctum door lintel and the prabhamandalam (an arch behind the idol) were falsely described as ordinary copper sheets to secure their removal, causing unlawful loss to Travancore Devaswom Board, which manages the temple.SIT alleged criminal breach of trust, saying extracted gold was neither reported to devaswom authorities nor returned to temple treasury but treated as personal property. Arrests have been made and accused remanded in judicial custody, with SIT telling court interrogation in custody was essential to trace remaining gold and establish full chain of responsibility.SIT named former TDB president A Padmakumar, devaswom commissioner N Vasu, Sabarimala executive officer Sudheesh Kumar, administrative officer Murari Babu and others, along with Chennai-based Smart Creations CEO Pankaj Bhandari and Ballari-based jeweller Roddam Pandu Rangaiah Naga Govardhan. Prime accused Unnikrishnan Potti was also produced before court.","Gold embedded in sacred structures of Sabarimala temple in central Kerala was allegedly stripped, diverted and converted. The operation involved temple officials, intermediaries and private jewellers, a state-appointed SIT told a vigilance court. SIT alleged criminal breach of trust, saying extracted gold was neither reported to devaswom authorities nor returned to temple treasury.","https://static.toiimg.com/thumb/msid-126296337,imgsize-243314,width-400,resizemode-4/kerala-sabarimala-temple-gold-plating-row-vigilance-report-exposes-unnikrishnan-potti39s-dubious-dealings-financial-irregularities.jpg"
'Mandir-masjid' issues do not sway elections: Dilip Ghosh,https://timesofindia.indiatimes.com/india/mandir-masjid-issues-do-not-sway-elections-dilip-ghosh/articleshow/126296307.cms,"Dilip Ghosh (File photo)

Shantanu Gupta Explains Ram Mandir Controversy & Rajnath Singh On Congress And Babri Masjid

Modi, Shah, Nadda in

Bengal this month

KOLKATA: Former Bengal BJP chief Dilip Ghosh escalated tensions within the party after Wednesday's meeting with Union minister Amit Shah , questioning the electoral utility of ""mandir-masjid politics"" and taking veiled digs at ""recent entrants"" to the state unit.""Mandir-masjid issues do not impact poll results,"" Ghosh said Thursday, citing BJP's loss in Faizabad LS constituency in 2024 despite Ram Mandir in Ayodhya. He said it would be ""wrong to assume"" Bengal CM Mamata Banerjee could win 2026 assembly polls by building temples.Without naming anyone, Ghosh said, ""Everyone is a worker in BJP. Recent entrants have to prove their identity."" The remark was widely read as a swipe at politicians who joined from TMC before 2021 assembly polls.Ghosh met state BJP president Samik Bhattacharya and sought permission to campaign for three days in Kharagpur from Saturday, saying he wanted to contest his home seat in 2026 assembly polls. He also spoke openly about being sidelined: ""Baseless, agenda-driven theories were floated and I was isolated. I have told the central brass this. I am not afraid of getting lost. I have faith in them.""PM Narendra Modi will likely hold a rally in north Bengal in the third week of Jan and Union home minister Amit Shah is expected to visit Kolkata by the end of the month. Union minister and BJP former chief JP Nadda is also scheduled to visit the city on Jan 8, said sources.","Dilip Ghosh questions electoral utility of ""mandir-masjid politics"" Former Bengal BJP chief takes veiled digs at ""recent entrants"" to state unit. Ghosh met state BJP president Samik Bhattacharya and sought permission to campaign for three days in Kharagpur from Saturday.","https://static.toiimg.com/thumb/msid-126296303,imgsize-98472,width-400,resizemode-4/quotwill-do-whatever-work-the-party-gives-mequot-dilip-ghosh-returns-to-active-role-as-bjp-steps-up-bengal-poll-push.jpg"
'Padmaavat' protests: Court refuses to permit Gujarat govt to withdraw case against 19 Karni Sena activists,https://timesofindia.indiatimes.com/india/padmavat-protests-court-refuses-to-permit-gujarat-govt-to-withdraw-case-against-19-karni-sena-activists/articleshow/126296214.cms,"Gujarat govt's plea rejected

Accused not criminals but youth high on emotions: Court

AHMEDABAD: A sessions court refused to permit Gujarat govt to withdraw a criminal case against 19 Karni Sena activists, who were booked for vandalising a mall, torching vehicles and damaging property during their protest against the release of the film 'Padmavat' in 2018.The court said the alleged offence was committed ""to achieve personal interest and to maintain dominance of a particular community, ignoring the public interest"". It noted that the accused caused damage to the tune of Rs 16.4 lakh during the rioting. tnnKarni Sena's candle march on Jan 23, 2018, in protest against the movie event took a violent turn, with 19 participants being booked for rioting, unlawful assembly, arson, and criminal conspiracy under provisions of IPC, section 3(1) of Damages to Public Property Act and section 135(1) of Gujarat Police Act. After investigation, police filed a chargesheet and the case has been pending in a sessions court since 2019.The state govt first requested a JMFC court to allow it to withdraw the case under CrPC section 321, but the request was refused in 2022. It then approached the Ahmedabad (rural) sessions court and submitted that the decision to withdraw prosecution was based only on the interest of the public at large, and would be helpful in the administration of justice.The accused are not criminals but younsters who acted in the heat of passion and were high on emotions, it argued.However, additional sessions judge Hardik Shah said court can't permit withdrawal of prosecution merely because state govt issued an order to the public prosecutor. The court said the prosecutor did not apply his mind or express his opinion on the issue.","19 Karni Sena activists were booked for vandalising a mall, torching vehicles and damaging property during their protest against the release of the film 'Padmavat' in 2018. Court said alleged offence was committed ""to achieve personal interest and to maintain dominance of a particular community, ignoring the public interest""","https://static.toiimg.com/thumb/msid-126296220,imgsize-74462,width-400,resizemode-4/court-rejects-govt-plea-to-drop-charges-against-karni-sena-men.jpg"
India vs New Zealand ODI 2026 squad announcement - All you need to know,https://timesofindia.indiatimes.com/sports/cricket/india-vs-new-zealand/india-vs-new-zealand-odi-2026-squad-announcement-virat-kohli-rohit-sharma-all-you-need-to-know/articleshow/126226780.cms,"Virat Kohli and Rohit Sharma (AFP Photo)

India T20 World Cup squad: In search of ideal combination, Agarkar & Co. drop Shubman Gill

Ind vs NZ ODI 2026 squad announcement: All you need to know



New Zealand's ODI squad vs India

India vs New Zealand T20Is: Squads



India

New

Zealand

India vs New Zealand - Full ODI Schedule

Date Venue Time Sun, Jan 11, 2026 Vadodara, BCA Stadium, Kotambi 1:30 PM IST Wed, Jan 14, 2026 Rajkot, Niranjan Shah Stadium, Khandheri 1:30 PM IST Sun, Jan 18, 2026 Indore, Holkar Cricket Stadium 1:30 PM IST

India vs New Zealand - Full T20I Schedule

Date Venue Time Wed, Jan 21, 2026 Nagpur, Vidarbha Cricket Association Stadium 7:00 PM IST Fri, Jan 23, 2026 Raipur, Shaheed Veer Narayan Singh International Stadium 7:00 PM IST Sun, Jan 25, 2026 Guwahati, Barsapara Cricket Stadium 7:00 PM IST Wed, Jan 28, 2026 Visakhapatnam, ACA-VDCA Cricket Stadium 7:00 PM IST Sat, Jan 31, 2026 Thiruvananthapuram, Greenfield International Stadium 7:00 PM IST

NEW DELHI: India are set to host New Zealand for a high-profile eight-match limited-overs series beginning on January 11. The tour will feature three One-Day Internationals and five Twenty20 Internationals, with matches scheduled across multiple venues in the country through January 31.The series comes at a crucial juncture, with several senior players returning to the ODI format and the T20 side looking to fine-tune combinations ahead of the ICC T20 World Cup 2026, which gets underway on February 7 in India and Sri Lanka.The ODI leg of the series is expected to draw significant attention, particularly with stalwarts Virat Kohli and Rohit Sharma making their anticipated return to the 50-over format after the South Africa series.Meanwhile, the T20Is will act as a final testing phase for Suryakumar Yadav-led Indian side as they prepare for their T20 World Cup title defence.While the BCCI has already announced the T20I squad for the New Zealand series, the ODI squad is yet to be named.The BCCI selection committee is likely to hold an online meeting around January 3 or 4 to finalise the ODI squad for the home series against New Zealand.New Zealand have already announced their T20I and ODI squads for India series.Michael Bracewell (C), Adi Ashok, Kristian Clarke, Josh Clarkson, Devon Conway, Zak Foulkes, Mitch Hay, Kyle Jamieson, Nick Kelly, Jayden Lennox, Daryl Mitchell, Henry Nicholls, Glenn Phillips, Michael Rae, Will Young: Suryakumar Yadav (C), Abhishek Sharma, Sanju Samson, Tilak Varma, Hardik Pandya, Shivam Dube, Axar Patel, Rinku Singh, Jasprit Bumrah, Harshit Rana, Arshdeep Singh, Kuldeep Yadav, Varun Chakaravarthy, Washington Sundar, Ishan Kishan: Mitchell Santner (C), Michael Bracewell, Mark Chapman, Devon Conway, Jacob Duffy, Zak Foulkes, Matt Henry, Kyle Jamieson, Bevon Jacobs, Daryl Mitchell, James Neesham, Glenn Phillips, Rachin Ravindra, Tim Robinson, Ish Sodhi","India set to host New Zealand for a high-profile limited-overs series beginning on January 11. The tour will feature three One-Day Internationals and five Twenty20 Internationals. The series comes at a crucial juncture, with several senior players returning to the ODI format and the T20 side looking to fine-tune combinations.","https://static.toiimg.com/thumb/msid-126227028,imgsize-56544,width-400,resizemode-4/virat-rohit-2912-afp.jpg"
