Article Title,Article Link,Article Text,Article Summary,Article Image
"Smelling of liquor, AI pilot detained at Vancouver airport on X'mas eve before operating Delhi flight",https://timesofindia.indiatimes.com/india/smelling-of-liquor-ai-pilot-detained-at-vancouver-airport-on-xmas-eve-before-operating-delhi-flight/articleshow/126281228.cms,"File photo

Also read:

NEW DELHI: Getting into the Yuletide spirit could prove expensive for an Air India pilot who was to operate a Vancouver-Delhi (via Vienna) flight on Dec 23, 2025. A staffer at Vancouver duty free either saw him inadvertently sipping wine being offered at this festive time or found him smelling of liquor while he was buying a bottle. She reported this Boeing 777 pilot to the Canadian authorities who conducted a breath analyser test on him which he flunked and then he was detained.Luckily for passengers, Air India managed to quickly find a replacement. The ultra long haul, to be operated by four pilots or two sets (one captain and a co-pilot in each set) in turns, supposed to leave at 3 pm local time did so with just a two-hour delay. The aircraft then landed in Vienna from where another set of crew operated it to Delhi.“AI has taken a very stern view of this matter. The pilot was flown to Delhi a couple of days later and is being probed. The issue has been reported to the Directorate General of Civil Aviation (DGCA), which is also examining the same,” said people in the know.While some sources say the pilot had inadvertently sipped an alcoholic drink at the airport and a staffer at duty free saw him doing so, others said he smelled of alcohol when buying a bottle.It is not yet known which of the two really happened, staffer reported the matter to Canadian authorities who then used CCTV footage to find out the pilot in question was to operate with flight. They managed to trace him to the AI aircraft.In a statement, AI said: “AI 186 from Vancouver to Delhi on Dec 23, 2025, experienced a last-minute delay after one of the cockpit crew members was offloaded prior to departure. Canadian authorities raised concerns regarding the pilot’s fitness for duty, following which the crew member was taken for further inquiry. In accordance with safety protocols, an alternate pilot was rostered to operate the flight, resulting in the delay. ”""Air India regrets the inconvenience caused to its passengers and is fully cooperating with the local authorities. The pilot has been taken off flying duties during the process of enquiry. Air India maintains a zero-tolerance policy towards any violation of applicable rules and regulations. Pending the outcome of the investigation, any confirmed violation will attract strict disciplinary action in line with company policy. Safety remains Air India’s highest priority at all times,” the airline statement added.Pilots operating international sectors usually do not have pre-flight breath analyser (BA) tests and the same is conducted on arrival as liquor is available on board these flights. This is to ensure they have not taken a sip or two during the flight. On domestic flights, pre-flights BA tests are conducted as alcohol is not served/sold on flights within India.While rules don’t mandate this, AI on its own has enforced a policy of conducting random pre-flight BA at international stations. The airline frequently keeps sending its doctors on international flights who then conduct these checks on pilots who are to operate the return flight to India.Pilots are surprised at this case. ""Forget drinking, we don’t even use after shaves, perfumes, mouth wash or homeopathic medicines some hours before operating a flight. There have been multiple instances of teetotallers failing BA tests because of the alcohol in their breath because of using toiletries with alcoholic content. We look for these items without any alcohol, except homeopathic medicines where possibly there’s no option,” said a captain. The reason: Failing BA test thrice means losing flying license.","A staffer at Vancouver duty free either saw him inadvertently sipping wine being offered at this festive time or found him smelling of liquor while he was buying a bottle. She reported this Boeing 777 pilot to the Canadian authorities who conducted a breath analyser test on him which he flunked and then he was detained.Luckily for passengers, Air India managed to quickly find a replacement.","https://static.toiimg.com/thumb/msid-126281235,imgsize-360839,width-400,resizemode-4/.jpg"
"India, Pakistan exchange list of nuclear installations: All about the 1988 agreement; what purpose does it serve — explained",https://timesofindia.indiatimes.com/india/india-pakistan-exchange-list-of-nuclear-installations-all-about-the-1988-agreement-what-purpose-does-it-serve-explained/articleshow/126285321.cms,"India’s Backyard In Flux: Nepal's Gen Z Revolt To Pakistan's Court Chaos Shakes South Asia In 2025

What the agreement says

Why the annual exchange matters

Historical context

Limits of the agreement

NEW DELHI: India and Pakistan on Thursday exchanged, through diplomatic channels, the list of nuclear installations and facilities covered under the Agreement on the Prohibition of Attack against Nuclear Installations and Facilities, the ministry of external affairs said.The exchange took place simultaneously in New Delhi and Islamabad, in keeping with the provisions of the bilateral agreement that governs the protection of nuclear infrastructure in both countries.According to the MEA, the agreement requires India and Pakistan to inform each other of the nuclear installations and facilities covered under the pact on 1 January of every calendar year. Thursday’s exchange marked the 35th consecutive exchange of such lists, with the first taking place on 1 January 1992.The annual exchange has continued uninterrupted for over three decades, even during periods of heightened political and military tension between the two neighbours.The Agreement on the Prohibition of Attack against Nuclear Installations and Facilities was signed on 31 December 1988 and entered into force on 27 January 1991, following the exchange of instruments of ratification by both sides.Under the agreement, both India and Pakistan commit themselves to refrain from undertaking, encouraging or participating in any action aimed at causing destruction of, or damage to, nuclear installations or facilities in the other country.The scope of the agreement is broad. Nuclear installations and facilities covered under the pact include nuclear power plants, research reactors, fuel fabrication units, uranium enrichment facilities, isotope separation plants, reprocessing units and sites storing significant quantities of radioactive material, whether fresh or irradiated.The agreement also specifies that both countries must exchange information on the locations of these facilities, typically in the form of latitude and longitude coordinates, once every year.The annual exchange of lists is designed to reduce the risk of accidental, miscalculated or deliberate attacks on sensitive nuclear infrastructure during periods of conflict or crisis.By formally identifying protected sites, the agreement seeks to prevent scenarios in which conventional military operations could inadvertently escalate into a nuclear crisis. An attack on a nuclear installation, even with conventional weapons, could have catastrophic humanitarian, environmental and strategic consequences.Security analysts view the exchange as a confidence-building measure that helps maintain a minimum level of predictability between two nuclear-armed neighbours with a long history of conflict.Notably, the exchange has continued even during times of strained relations, including after major crises such as the Kargil conflict, the 2001–02 military standoff, the 2016 Uri attack and the 2019 Pulwama attack and Balakot air strikes.When the agreement was negotiated in the late 1980s, both India and Pakistan were moving steadily towards overt nuclear capability, though neither had yet conducted nuclear tests. Concerns over pre-emptive strikes on nuclear facilities, particularly in the context of regional instability, were central to the discussions.The agreement was one of the earliest formal nuclear confidence-building measures between the two countries and predated their 1998 nuclear tests, after which both openly declared themselves nuclear weapon states.Since entering into force in 1991, the agreement has remained intact despite the absence of progress on broader nuclear arms control or risk-reduction mechanisms in South Asia.While the pact prohibits attacks on nuclear installations and facilities, it does not restrict the development, deployment or use of nuclear weapons themselves. Nor does it include verification mechanisms beyond the annual exchange of lists.The agreement also does not cover missile bases, command and control centres or other strategic military assets linked to nuclear weapons.Even so, diplomats and experts argue that the continued observance of the agreement reflects a shared recognition of the dangers posed by attacks on nuclear infrastructure.More than three decades after it came into force, the agreement remains one of the few enduring pillars of nuclear risk reduction between India and Pakistan.In an environment marked by limited dialogue and recurring tensions, the uninterrupted annual exchange of nuclear installation lists serves as a reminder that both sides continue to acknowledge the need to prevent catastrophic escalation.For now, the routine exchange remains a rare example of sustained institutional cooperation between the two countries in the nuclear domain.","The exchange took place simultaneously in New Delhi and Islamabad. The agreement requires India and Pakistan to inform each other of the nuclear installations and facilities covered under the pact on 1 January of every calendar year. The annual exchange has continued uninterrupted for over three decades, even during periods of heightened political and military tension.","https://static.toiimg.com/thumb/msid-126285389,imgsize-1364220,width-400,resizemode-4/representative-ai-image.jpg"
"Pilot found tipsy in Vancouver, act by Jan 26: Canada to Air India",https://timesofindia.indiatimes.com/india/pilot-found-tipsy-in-vancouver-act-by-jan-26-canada-to-air-india/articleshow/126293952.cms,"Air India

NEW DELHI: Canada has told Air India that one of its pilots was found tipsy just before operating a flight on Dec 23, 2025, violating the country's laws, and that the airline should investigate the case and inform it of action taken by Jan 26, 2026.Transport Canada sent this communication to AI a day after the pilot failed the breathalyser (BA) test and asked it to take ""corrective action"" under its safety management system ""to prevent any such recurrence"". This was first reported by TOI on Jan 1.Taking a serious view of the matter, AI has sought details of the BA test from Canada, including the level of alcohol found in the test, and has informed DGCA.""We were advised by the Royal Canadian Mounted Police (RCMP) that Captain *** reported for duty on Air India Fight AI 186 on Dec 23, 2025, while under the influence of alcohol, and unfit for duty. Two BA tests conducted by the RCMP at Vancouver International Airport confirmed this after he was advised to leave the aircraft. This incident indicates a contravention of Canadian Aviation Regulations by the operator (AI) and the crew member. .. as well as conditions outlined in Air India's Foreign Air Operator Certificate (FAOC 1946) issued by Transport Canada Civil Aviation (TCCA). It is likely that enforcement action will be pursued by the RCMP, and by TCCA,"" says a Dec 24 letter from Transport Canada to AI.One of the conditions in AI's FAOC violated is that ""foreign air operator shall conduct a safe operation"". The letter adds: “In light of this, we request Air India to: conduct a thorough review and investigation under your safety management system and p rovide details of corrective actions taken to prevent any such recurrence. Please submit your response by Jan 26, 2026, outlining your findings and measures implemented and/or undertaken,” it adds.Due to closure of Pakistan airspace after Operation Sindoor, AI North America ultra long hauls now make a midway fuelling stop. AI 186 was to be operated by two sets of pilots - a captain and co-pilot in each set - from Vancouver to Vienna. From the Austrian capital, another set would have flown it to Delhi.""This pilot, who had a layover in Vienna, was reportedly buying alcohol from Vancouver Duty Free... The pilot was boarding from Canada and alighting in Austria, both foreign stations where most probably no BA checks would have been conducted. However a staffer at duty free smelt alcohol on his breath and informed police. Using CCTV, the police traced him to the AI flight ,"" said sources.Pilots don't have alcohol at least 12 hours before flying. ""In case someone has not been able to do so, they should refuse to operate a flight on medical grounds. Refusing the flight will save your job, your licence, and your career,"" said a senior captain.In a statement on Wednesday, AI had said: ""AI 186 from Vancouver to Delhi on Dec 23, 2025 experienced a last-minute delay after one of the cockpit crew members was offloaded prior to departure. Canadian authorities raised concerns regarding the pilot's fitness for duty, following which the crew member was taken for further inquiry.""""Air India regrets the inconvenience caused to its passengers and is fully cooperating with the local authorities. The pilot has been taken off flying duties during the process of enquiry. Air India maintains a zero-tolerance policy towards any violation of applicable rules and regulations. Pending the outcome of the investigation, any confirmed violation will attract strict disciplinary action in line with company policy. Safety remains Air India’s highest priority at all times,” the airline statement had added.","Transport Canada sent this communication to AI a day after the pilot failed the breathalyser (BA) test. Air India has sought details of the BA test from Canada, including the level of alcohol found in the test, and has informed DGCA. The pilot has been taken off flying duties during the process of enquiry.","https://static.toiimg.com/thumb/msid-126293988,imgsize-721570,width-400,resizemode-4/air-india.jpg"
Pakistan-based terror handler’s property attached in Poonch,https://timesofindia.indiatimes.com/india/pak-based-terror-handlers-property-in-poonch-attached/articleshow/126292799.cms,"Representational image

Security Forces Launch Cordon-And-Search Operations In Kishtwar, Doda and Poonch

JAMMU: In a major offensive against cross-border terrorism and its support networks, Jammu and Kashmir Police have attached property of a Pakistan-based terror handler under the Unlawful Activities Prevention Act. Rafiq Nai is the launch commander of banned terror outfit Tahreek-ul-Mujahideen / Jammu Kashmir Ghaznavi Force.“The accused is actively involved in supervision of narcotics and weapons smuggling, facilitation of infiltration of trained terrorists, and revival of terrorist activities in the Poonch-Rajouri sector,” a police spokesperson said on Thursday. Rafiq, a “designated individual terrorist”, is wanted in multiple serious criminal cases, he added.The attached property is an agricultural land worth about Rs 10 lakh at Nar village in Poonch district’s Mendhar tehsil. The police action is part of a “sustained strategy to dismantle the financial, logistical, and support infrastructure of terrorist networks, and to ensure that individuals involved in anti-national and terror-related activities are deprived of their resources,” the spokesperson said.",Rafiq Nai is the launch commander of banned terror outfit Tahreek-ul-Mujahideen / Jammu Kashmir Ghaznavi Force. The attached property is an agricultural land worth about Rs 10 lakh at Nar village in Poonch district’s Mendhar tehsil.,"https://static.toiimg.com/thumb/msid-126292819,imgsize-119864,width-400,resizemode-4/budgam-dec-28-ani-heavy-contingents-of-jampk-police-and-crpf-have-been-deploye.jpg"
"J&K govt will discuss Kashmiri shawl sellers’ harassment with states concerned, says NC",https://timesofindia.indiatimes.com/india/jk-govt-will-discuss-kashmiri-shawl-sellers-harassment-with-states-concerned-says-nc/articleshow/126292736.cms,"NC chief Farooq Abdullah (File photo)

Army Trains Village Defence Guards In J&K In Automatic Rifles, Self-Defence | Watch

SRINAGAR: National Conference on Thursday expressed concern over the alleged assaults on Kashmiri shawl sellers in different parts of the country and said the Jammu and Kashmir government would take up the issue with the state governments concerned.NC chief Farooq Abdullah said, “It is unfortunate that some people want to impose a Hitler-like system in this country. Nazism has ended, and I am hopeful that this kind of extremism will also come to an end.”Abdullah praised the Central government for sending external affairs minister S Jaishankar to Bangladesh to represent India at the funeral of former PM Khaleda Zia.NC spokesperson Tanvir Sadiq said the Union home ministry has already taken strong note of the alleged attacks on Kashmiri shawl sellers.Jammu and Kashmir Students Association said it has written to home minister Amit Shah , seeking urgent “intervention over the alarming and continued rise in incidents of intimidation, harassment, and targeted violence against Kashmiri students and traditional shawl vendors” in Himachal Pradesh.","NC chief Farooq Abdullah said, “It is unfortunate that some people want to impose a Hitler-like system in this country. Nazism has ended, and I am hopeful that this kind of extremism will also come to an end”","https://static.toiimg.com/thumb/msid-126292727,imgsize-54456,width-400,resizemode-4/farooq-abdullah.jpg"
Combing op in Poonch after drone drops ‘IED’ along LoC,https://timesofindia.indiatimes.com/india/combing-op-in-poonch-after-drone-drops-ied-along-loc/articleshow/126292885.cms,"Representative Image

Security Forces Launch Cordon-And-Search Operations In Kishtwar, Doda and Poonch

JAMMU: Security forces on Thursday launched a combing operation along LoC in Jammu and Kashmir ’s Poonch district after a drone reportedly dropped an IED and weapons between Rangar Nallah and Poonch River in Chakkan da Bagh belt of Khari village early in the morning.“Searches conducted by Army, special operations group, and local police led to the recovery of a bag carrying dozens of ammunition rounds and a yellow tiffin box suspected to be an IED,” a police source said.",A drone reportedly dropped an IED and weapons between Rangar Nallah and Poonch River in Chakkan da Bagh belt of Khari village early in the morning. Security forces launched a combing operation along LoC in Jammu and Kashmir ’s Poonsch district.,"https://static.toiimg.com/thumb/msid-126292869,imgsize-65268,width-400,resizemode-4/operation-bihali-army-j-k-police-neutralise-1-terrorist-in-udhampur39s-basantgarh.jpg"
"'Industrialist' scripts Rs 6,200 crore swindle with 60 shell firms",https://timesofindia.indiatimes.com/india/industrialist-scripts-rs-6200-crore-swindle-with-60-shell-firms/articleshow/126278759.cms,"Enforcement Directorate

NEW DELHI: A Kolkata-based businessman weaved a web of 60 shell companies with drivers, house-keeping staff, office boys, junior staff and relatives as directors and created a fictitious turnover of thousands of crores in iron & steel manufacturing, all on paper with no real business activity involved, and swindled a consortium of govt banks of more than Rs 6,200 crore, with the head of one of the lead banks playing accessory.The scam was scripted by Sanjay Sureka, who created dozens of shell entities and with the help of S K Goel, then CMD of Uco Bank, managed to get loans of Rs 6,200 crore. ""Against loans of over Rs 6,200 crore, the company's liquidation value barely reached Rs 600 crore, and assets sold so far have realised only Rs 434 crore,"" ED has said in its investigation report.The entire operation was unearthed with Goel's arrest by ED on May 16 at his residence in New Delhi. The agency later identified properties worth over Rs 106 crore associated with family members and aides and attached them. Sureka and his associates were arrested in Dec 2024, as the agency started probing money laundering based on a CBI FIR against them.According to an ED investigation report, at the centre of this scam was Concast Steel & Power Ltd (CSPL) - once a flagship iron & steel group with plants across West Bengal, Odisha and Andhra Pradesh - which was taken over by Sureka in 2008.Sureka conjured up the shell entities and with the help of Goel, who served as CMD of Uco Bank between 2007-2010, managed to get a total of Rs 6,200 crore in loans without interest and penalty.This money was laundered by the accused and quid pro quo to Goel was transferred in the name of shell companies that purchased properties on the bank CMD's behalf with the ownership of these firms later being transferred to Goel's family members.""It is a case study in how an entire financial ecosystem can be manipulated through fake turnover, circular transactions and system-wide blind spots, ultimately leaving public sector banks poorer by more than Rs 6,210.7 crore, excluding interest,"" a senior official said.The official further said 60 shell companies sprang up under the directorship of drivers, office boys and junior staff to help Sureka justify massive flows of funds.ED's investigation unearthed fake sales, purchases and transport billings where CSPL ""pretended to buy and sell iron and steel products"" with associated entities, backed by forged invoices, ledger entries, and transport documents. ""Fake transportation receipts were prepared to show trucks carrying goods between factories and shell companies, even though no truck ever moved, no goods were loaded, and no delivery was made. Yet on paper, CSPL looked like a bustling, high-volume operation with continuous production and sales,"" a source said.The probe further revealed that neither sale proceeds nor payments for purchases were made through banks, 99% of the transactions were merely book entries. Yet, during the entire operation lasting several years, it did not raise any alarm bells in the banks, which continued lending.""This meant Concast was essentially selling to itself and then realising these payments through accounting fiction. By 2017, the deception hit its peak - 99% of all sales to these entities were settled through book adjustments, not a single real rupee flowed in through the banking system,"" sources said.Purchases tell the same story. Over 50% of all raw material sourcing came from the same web of related-party entities. And just like sales, almost 90% of payments to these ""suppliers"" were made through internal adjustments - no real cash outflow, no genuine material movement, just rotating entries to manufacture expenses, inflate working capital needs, and justify massive fund withdrawals, the probe report said.","The scam was scripted by Sanjay Sureka, who created dozens of shell entities. With the help of S K Goel, then CMD of Uco Bank, Sureka managed to get loans of Rs 6,200 crore. The entire operation was unearthed with Goel's arrest by ED on May 16.","https://static.toiimg.com/thumb/msid-126278760,imgsize-72484,width-400,resizemode-4/ed.jpg"
BSF nabs Bangladeshi national near border; hands him over to police,https://timesofindia.indiatimes.com/india/bsf-nabs-bangladeshi-near-border-hands-over-to-police/articleshow/126292925.cms,BSF nabs Bangladeshi national near border; hands him over to police,BSF nabs Bangladeshi national near border; hands him over to police. BSF says he was acting in self-defence when he was nabbed near border. He has been charged with trespassing and is being held in custody.,"https://static.toiimg.com/thumb/msid-126292918,imgsize-206452,width-400,resizemode-4/bsf-patrols-border-in-jammu-amid-high-alert.jpg"
