Article Title,Article Link,Article Text,Article Summary,Article Image
Row over praise for rivals: Should Congress be wary of Shashi Tharoor?,https://timesofindia.indiatimes.com/india/row-over-praise-for-rivals-should-congress-be-wary-of-shashi-tharoor/articleshow/118537166.cms,"Shashi Tharoor

NEW DELHI: Shashi Tharoor is no pushover in politics. And the Congress knows that. In October 2022, the former UN dilpomat-turned politician surprised many in the Congress when he announced to contest elections for the post of Congress president against Mallikarjun Kharge - who was the ""nominee"" of the Gandhis. Tharoor fought the elections against all odds with little support from any one in the party and managed to get 1,072 votes against Kharge's 7,897.Tharoor, who then already had the rebel tag around him as a member of G-23 (group of Congress leaders who had written a letter to Sonia Gandhi seeking reforms in the party), braved the risk of being labeled an open dissident to put forth his views on reviving the Congress - which had been on a constant decline since its shocking defeat in 2014. He batted for decentralising authority and empowering the grassroots office-bearers of the party.The former UN diplomat-turned-politician, who has won four consecutive Lok Sabha elections from Thiruvananthapuram, has once again challenged the Congress leadership with his praise for party's political rivals - both at the national and the state level.The Congress MP, who has never been afraid to speak his mind, was once again under fire for his comments praising Prime Minister Narendra Modi's visit to the United States and his thumbs up to entrepreneurial growth in Kerala under the LDF government.As expected, the Congress pushback was strong and immediate. But Tharoor, in keeping with his combative style, instead of taking a step back took digs at the party leadership with a cryptic social media which said ""it is a folly to be wise."" The message was loud and clear - the Thiruvananthapuram MP was once again ready to fight the battle within the party.Tharoor, who was reportedly unhappy over being sidelined in the party - both at the national and the state level, had a one-to-one closed-door meeting with Rahul Gandhi and later claimed that the conversation was ""very good"" though he did not divulge any details.The Kerala Congress leader however remained defiant about his article praising the Left Front government and said he was happy that it had ‘done some good' as it had opened a scope for discussion on the issue.According to reports, Tharoor in a yet to be telecast podcast has said that he is ready to explore other options if the Congress did not need his services.What may worry the Congress that this time around there are some voices of support for the embattled leader. Echoing the sentiments of Tharoor, another senior party leader Rashid Alvi, said there was a need to bring senior and ground-connected politicians into Congress mainstream.""Congress party has many senior, seasoned, and ground-connected politicians. We should bring them into the mainstream of the party. This will make Congress stronger. If we do not bring these experienced individuals into the mainstream, it will harm the party,"" Alvi said.This is not the first time that Alvi has given a message to the party leadership. Recently when Congress contested the Delhi elections with full vengeance against Arvind Kejriwal and played a key role in AAP's defeat, Alvi had then spoken against the leadership decision to divide votes and help the BJP in process.And while Alvi was diplomatic in his attack, Sanjay Jha, former Congress spokesperson, who was pushed out of the party following airing his differences, was more direct in his attack. Sanjay Jha wrote an open post on X addressed to Rahul Gandhi explaining why he needed to bell the cat.""I am writing to you publicly here because no one within the Congress is probably going to tell you this. So as usual, let me bell the cat. Leadership ( corporate or political or any other) is about having difficult conversations. It is about trouble-shooting. It is not about living in denial; problems have to be addressed, they cannot be wished away,"" he wrote.Advising Rahul Gandhi to set the house in order, Sanjay Jha said ""We need to the hit the nail on the head going forward, but right now, we seem to be hitting our head on the nail.""Clearly, the Congress leadership in general and Rahul Gandhi in particular need to ensure that the party does not lose another popular leader because of the differences within.",The former UN diplomat-turned-politician has won four consecutive Lok Sabha elections from Thiruvananthapuram. The Congress MP was once again under fire for his comments praising Prime Minister Narendra Modi's visit to the United States. The Kerala Congress leader remained defiant about his article praising the Left Front government.,"https://static.toiimg.com/thumb/msid-118537440,imgsize-715094,width-400,resizemode-4/118537440.jpg"
"Ahead of Bihar polls, PM Modi reaches out to tillers with PM-Kisan",https://timesofindia.indiatimes.com/india/ahead-of-bihar-polls-pm-modi-reaches-out-to-tillers-with-pm-kisan/articleshow/118540269.cms,"BHAGALPUR/PATNA: Reaffirming his commitment to farmers' welfare, Prime Minister Narendra Modi disbursed on Monday financial assistance of over Rs 22,000 crore to farmers across the country while releasing the 19th instalment of the PM Kisan Samman Nidhi (PM-Kisan) scheme at the Kisan Samman Ceremony in Bhagalpur. He also launched several development projects.""There are around 75 lakh farmer families from Bihar who were beneficiaries of the PM-Kisan scheme... Around Rs 1,600 crore was credited directly into the bank accounts of Bihar farmers ,"" he said.More than 9.8 crore farmers, including 2.4 crore female farmers, benefited from the 19th instalment, receiving financial aid without the involvement of any middlemen.Asserting that farmers would not have received these benefits if his govt had not been elected, Modi said since the scheme's inception six years ago approximately Rs 3.7 lakh crore had been directly transferred into farmers' accounts. He added that small farmers, who previously struggled to access government schemes, were now receiving rightful support.Modi criticised past govts, stating that intermediaries used to exploit small farmers. ""Under my leadership, and that of CM Nitish Kumar, this will not be allowed to happen,"" he said. Contrasting his administration with previous ones, he said the amount his govt had transferred directly to farmers far exceeded the agricultural budgets of past govts. ""Such efforts can only be undertaken by a govt committed to farmers' welfare, not by corrupt entities,"" he said.Modi announced the Centre's achievement in establishing 10,000 farmer producer organisations (FPOs), a target now reached. ""I am happy that Bihar is witnessing the establishment of the 10,000th FPO. This FPO, registered in Khagaria district, focuses on maize, banana and paddy,"" he said.","Prime Minister Narendra Modi disbursed financial assistance of over Rs 22,000 crore to farmers across the country. More than 9.8 crore farmers, including 2.4 crore female farmers, benefited from the 19th instalment. Modi said farmers would not have received these benefits if his govt had not been elected.","https://static.toiimg.com/thumb/msid-118540287,imgsize-1246717,width-400,resizemode-4/118540287.jpg"
"French firm levels graft charges against MMRDA, seeks diplomatic intervention",https://timesofindia.indiatimes.com/india/french-firm-levels-graft-charges-against-mmrda-seeks-diplomatic-intervention/articleshow/118540145.cms,"French firm levels graft charges against MMRDA, seeks diplomatic intervention

MUMBAI: French engineering giant Systra, which has designed and overseen the metro construction in Mumbai, has levelled allegations of corruption against senior officials of the planning agency, Mumbai Metropolitan Region Development Authority (MMRDA), accusing them of seeking ""undue favours"" and delaying payments. Complaints, which have been communicated to the govt, include pressuring the firm to inflate orders to contractors, stalling approvals for key staff and imposing arbitrary penalties.Systra sought diplomatic intervention. In a letter dated Nov 12, 2024, the French embassy asked Rupinder Singh, resident commissioner of Maharashtra in Delhi, to intervene for the firm, which cited ""severe harassment and challenges"" while working as general consultant on MMRDA projects.CM Devendra Fadnavis said the complaint had not reached him but he would speak to chief secretary Sujata Saunik. ""Transparency is at the core of our administration. We will ensure it is restored at any cost,"" Fadnavis told TOI.In its response, MMRDA called the allegations ""baseless"" and ""a deliberate attempt to malign"" the reputation of the agency and its personnel.Systra's complaint routed through the embassy highlighted its record in executing rail and metro projects in India and said, ""Since August 2023, Systra has been facing severe problems in its daily operations, escalating to the suspension of its payments due in January 2024.""It requested that the matter be ""studied in depth"" and left it in the hands of the resident commissioner ""to resolve the situation."" It said, ""Systra is keen to work together with MMRDA for mutual benefit in an atmosphere of peace and cooperation, without external pressure.""Systra said the trouble began in Aug 2023 following a leadership shake-up at MMRDA. As general consultant for Mumbai's Metro lines 5, 6, 7A, 9, 10, and 12, and detailed design provider for lines 2A, 7, and associated depots, the company alleges that MMRDA officials began pressing for monetary benefits, which were thinly veiled as demands from higher-ups.Systra claimed ""favours"" were sought on the pretext that the ""MC (metropolitan commissioner)"" was demanding it. Systra said it informed the authority that the company ""shall not be able to do the same"".Reacting to the allegations, MMRDA said a detailed report was sought from the department concerned and submitted to govt for consideration. The report revealed multiple contractual and regulatory violations by Systra, extending beyond the initial cost overruns of 4.27% to 10% in fees, it said.MMRDA said it has issued a termination notice to Systra for various violations, including security concerns and operational lapses. ""It is important to note that the present matter pertains to a commercial dispute,"" it said. ""Unfortunately, Systra appears to be attempting to escalate this into an issue between a foreign country and an agency of the government of Maharashtra, which is not an appropriate practice.""Systra's general manager for Mumbai, Arun Mishra, said, ""We cannot comment as the matter is sub judice."" Systra has approached Bombay high court over the issue.Between Jan and Feb 2024, Systra alleges that MMRDA issued payment suspension notices, citing supposed deficiencies in already-resolved issues on line 5 (Thane-Bhiwandi-Kalyan), 9 (Dahisar-Mira-Bhayander), 7A (Gundavli-Airport), and line 6 (Lokhandwala to Vikhroli). Additionally, MMRDA issued notices changing the scope of contractual work, alleging deficiencies in civil and systems contracts for line 10 (Gaimukh-Shivaji Chowk) and 12 (Kalyan-Taloja), issues that had already been resolved, it said.Systra said the payment suspension was lifted for lines 6, 5, 9, and 7A (systems) in June 2024 following the company's response. However, the freeze continues for lines 5, 9, and 7A (civil), with Rs 30 crore still unpaid. Systra also alleges MMRDA attempted to pressure the firm into approving inflated orders for a contractor on line 9. It said, ""Since we are not obliging... we believe MMRDA is continuing the suspension of payments for general consultant services for lines 5, 9, and 7A (civil). From what we understand, MMRDA is taking further steps to terminate the general consultant services for these contracts.""It claims similar pressure tactics are being applied to DB E&C, a German consultancy handling the general consultant contract for line 4. Systra and DB E&C are consortium partners for lines 10 and 12. Systra said MMRDA has stopped making payments on these projects, including the ones where suspension notices were revoked. Compounding the issue, Systra says MMRDA has stalled approvals for key staff, imposed arbitrary penalties, and demanded certifications for payments to minor contractors hired directly by the agency.","French firm levels graft charges against MMRDA, seeks diplomatic intervention. Complaints include pressuring firm to inflate orders to contractors, stalling approvals for key staff and imposing arbitrary penalties. MMRDA called the allegations ""baseless"" and ""a deliberate attempt to malign"" the reputation of the agency and its personnel.","https://static.toiimg.com/thumb/msid-118540152,imgsize-1244083,width-400,resizemode-4/118540152.jpg"
"Jamiat trust justifies 'halal' certification for tulsi water, water bottles",https://timesofindia.indiatimes.com/india/jamiat-trust-justifies-halal-certification-for-tulsi-water-water-bottles/articleshow/118539316.cms,"Jamiat trust justifies ‘halal’ cert for tulsi water, water bottles

NEW DELHI: Facing allegations from Centre that ""lakhs of crores of rupees"" were being collected through issuance of halal certification for various products, including cement, iron bars, bottles, etc, Jamiat Ulama-i-Hind Halal Trust told SC Monday that govt's statement in court ""was completely incorrect, vexatious and scandalous"".In an affidavit filed in SC to counter Centre's allegation, the trust said it had never given certification to cement and iron bars and pleaded the court to seek explanation from Centre on what basis it had made the statement. It also said its annual collection is close to only Rs 2.1 crore, out of which Rs 59.2 lakh is paid as tax. It, however, justified halal certification for lipstick, tulsi water , biscuit, water bottle, etc, saying it is done to ensure that animal fat, bones or any other component has not been used in their manufacturing.Referring to Centre's statement during court hearing on Jan 20, the affidavit said, ""It is submitted that statements of Centre are completely incorrect, vexatious and scandalous. The statements are without any basis, inconsistent with the record and the pleadings sworn on oath by public officials submitted before this court. The instructing officer of govt has shown irresponsible behaviour while instructing the solicitor general to make such statements. This court may direct govt for disclosure of the fact as to which officer instructed the SG to make such statement before this court as these statements have caused serious prejudice to the concept of halal; which is considered to be one of the basic requirements of behaviour and lifestyle of a very large community of our country.""Centre had told court that 'halal' certification was not confined to food items but it was done for all sorts of products, even cement & iron bars have to be halal-certified.Responding to allegations, the trust said, ""It is submitted that the petitioner has not issued any halal certification to iron bars or cement. Govt is hereby put to strict proof for producing such certification having been granted to any of such manufacturing. However, there are few, predominantly, steel and cement manufacturing companies which produce materials to be used in preserving or protecting edible materials, like tin plates/food cans (for packaging) and are interested in doing their export for their material benefit. When it comes to making exports outside India, the importing establishments from outside India, place conditions on exporting companies that the said materials be halal certified.""The trust said halal certification is a serious issue of religious belief and practice of a large section of Indian citizenry and the same is protected under Article 25 and 26 of the Constitution and it is also related to international trade and commerce.""It is further submitted that halal certification, mostly, if not all, are consumer driven. In the process as to whether this certification is required or not, there is no role to be played by the certifying agency. It is a business decision of manufacturing companies to opt for such certifications because consumers, who want to consume certain products, necessarily want such certifications,"" it said.","Jamiat Ulama-i-Hind Halal Trust says it has never given certification to cement and iron bars. It also said its annual collection is close to only Rs 2.1 crore, out of which Rs 59.2 lakh is paid as tax. It justified halal certification for lipstick, tulsi water, biscuit, water bottle, etc.","https://static.toiimg.com/thumb/msid-118539383,imgsize-595558,width-400,resizemode-4/118539383.jpg"
"Billionaire’s daughter Vasundhara Oswal on Ugandan ordeal: ‘Male officer threw me in van; denied food, water’",https://timesofindia.indiatimes.com/india/billionaires-daughter-vasundhara-oswal-on-ugandan-ordeal-male-officer-threw-me-in-van-denied-food-water/articleshow/118503387.cms,"Vasundhara Oswal was detained in a cell after providing a statement and was asked to pay USD 30,000 and surrender her passport as part of a police bond

A case built on lies

Indian-origin billionaire’s daughter Vasundhara Oswal narrates shocking ordeal in Uganda jail

Arrested without a warrant, thrown into a van

Denied legal rights, trapped in the system

From petty crimes to murderers’ block

'They wanted money'

Seeking justice

NEW DELHI: Vasundhara Oswal , daughter of Indian-origin billionaire Pankaj Oswal , has broken her silence on her three-week nightmare behind bars in Uganda. Falsely accused of kidnapping and murdering her father’s former employee, she endured prison conditions that she calls a “gross violation of human rights.”The 26-year-old was arrested on October 1, 2024, over the alleged abduction of Mukesh Menaria , a former employee of Pankaj Oswal. However, the case crumbled when Menaria was found alive in Tanzania just days later.Despite this, Vasundhara remained imprisoned for weeks. Speaking to PTI on Friday, she recalled the horrors she faced, ""I was detained for five days, then thrown in prison for two weeks. I wasn’t allowed to shower, and they denied me food and water. My parents had to bribe police officers just to get me basic necessities.”At one point, she was reportedly denied access to a washroom as punishment.According to Vasundhara, Ugandan police raided her premises without a warrant and took her away under false pretenses. ""When I asked them to present a search warrant, they said, ‘We are in Uganda, we can do anything. You’re not in Europe anymore,’” she alleged.She claimed a male officer physically forced her into a police van when she refused to comply immediately.Forced to give a statement without a criminal lawyer, Vasundhara said she was made to pay $30,000 and surrender her passport for a police bond—yet she was still thrown back in her cell. Even after obtaining an unconditional release order from the courts, she was illegally detained for another 72 hours.Shockingly, instead of dismissing the case after Menaria was found alive on October 10, authorities kept her in prison and even escalated her charges from kidnapping to attempted murder.Initially housed in a facility for petty criminals, Vasundhara was later moved to a prison for convicted murderers and human traffickers. She spent two weeks in Nakasongola prison , fearing for her life.After weeks of legal battles, she secured bail on October 21, but her ordeal was far from over. Her passport was only returned on December 10, and the case was not dismissed until December 19.Vasundhara alleges that corrupt officials kept the charges alive even after Menaria was found, reducing them later to a misdemeanor confinement charge—all in an attempt to extort more money.""This was done to keep something over our heads and squeeze more money from my family,"" she said.Now free, Vasundhara wants the Ugandan government to be held accountable for what she calls an unjust persecution. ""This is up to the Ugandan government to correct its mistakes. We have invested in their country for years, and this is how they treat us?"" she said.As she reviews legal options, her case has raised global concerns over police corruption and human rights violations in Uganda.","Vasundhara Oswal was arrested on October 1, 2024, over the alleged abduction of Mukesh Menaria, a former employee of Pankaj Oswal. The 26-year-old was detained in a cell after providing a statement and was asked to pay USD 30,000 and surrender her passport as part of a police bond.","https://static.toiimg.com/thumb/msid-118503420,imgsize-58392,width-400,resizemode-4/118503420.jpg"
"With vultures and pigs reference, Yogi Adityanath targets opposition over Maha Kumbh criticism",https://timesofindia.indiatimes.com/india/with-vultures-and-pigs-reference-yogi-adityanath-targets-opposition-over-maha-kumbh-criticism/articleshow/118534606.cms,"NEW DELHI: Uttar Pradesh chief minsiter Yogi Adityanath once again hit out at the opposition over Maha Kumbh criticism. Using the examples of pigs and vultures, the chief minister described Kumbh as a place where people found exactly what they sought.""Vultures got dead bodies. Pigs got filth... whereas sensitive people got a beautiful picture of relationships, traders got business, devotees got clean arrangements,"" he said.In a strong-worded criticism, Yogi Adityanath said, ""These so-called secular scholars, who remain silent over hundreds of deaths during the Hajj due to mismanagement, are the same ones who criticize the grandeur of the Maha Kumbh. Despite their repeated attempts to malign and sabotage the event, millions of devotees took a holy dip, defying their negativity and, in essence, rubbing salt into their wounds.""""Even after the unfortunate incident during the Maha Kumbh, the faith and enthusiasm of the pilgrims prevailed. Braving various hardships, they reached Prayagraj, took the holy dip, and returned with joy,"" the CM added while referring to the stampede.In a direct attack on Akhilesh the CM said, ""We did not play with the religious sentiments of people, unlike Samajwadi party , their CM did not have the time to monitor Kumbh and see its arrangements and therefore, he made, a non-sanatani, in-charge of Kumbh.""","Yogi Adityanath hits out at the opposition over Maha Kumbh criticism. Uses the examples of pigs and vultures, the chief minister described KumbH as a place where people found exactly what they sought. In a direct attack on Akhilesh the CM said, ""We did not play with the religious sentiments of people, unlike Samajwadi party""","https://static.toiimg.com/thumb/msid-118534614,imgsize-1180461,width-400,resizemode-4/118534614.jpg"
"Post-RGK, West Bengal CM Mamata Banerjee hikes doctors’ stipends by up to Rs25,000",https://timesofindia.indiatimes.com/india/post-rgk-west-bengal-cm-mamata-banerjee-hikes-doctors-stipends-by-up-to-rs25000/articleshow/118540333.cms,"KOLKATA: CM Mamata Banerjee on Monday announced a slew of benefits for doctors, while outlining her administration's expectations from them, at her first conclave with health professionals since the August 2024 rape-murder of an RG Kar junior doctor.Banerjee, who addressed around 4,000 healthcare workers at the Dhanadhanya Auditorium, announced significant hikes - ranging from Rs 10,000 to Rs 25,000 - for junior and senior resident doctors as well as specialists working at state-run hospitals. She also increased the private-practice distance cap from 20 km to 30 km for state service doctors (they can now conduct private practice up to 30 km from their workplace) and, in another significant decision, scrapped the suspension of seven Midnapore Medical College junior doctors (which followed the death of a young mother after a Caesarean delivery).The CM also outlined her expectations from the community: doctors should spend at least the required eight hours at their workplace and seniors should not leave patient care, including Caesarean deliveries, to junior doctors. Doctors should not have any ""political colour""; they should rise above politics and have ""only one colour (humanity)"", she said.Monday's meet, organised by the grievance cell set up by the state in the wake of the RG Kar crime and the public protests that followed it, was Banerjee's first with a general body of doctors following the August 9 incident (though she has met agitating doctors as well as other small groups of doctors in the interim). Her 40-minute speech started with a reference to the RG Kar crime: ""I extend my condolences to the family of the sister who was killed. We demand proper punishment. Our government has passed the Aparajita Bill but it is pending (with Rashtrapati Bhavan). I give the responsibility to my brothers (so that such incidents are not repeated); you protect our sisters. Sisters, too, should protect their brothers.""","Banerjee announced significant hikes - ranging from Rs 10,000 to Rs 25,000 - for junior and senior resident doctors as well as specialists working at state-run hospitals. She also increased the private-practice distance cap from 20 km to 30 km for state service doctors. In another significant decision, she scrapped the suspension of seven Midnapore Medical College junior doctors.","https://static.toiimg.com/thumb/msid-118540345,imgsize-901752,width-400,resizemode-4/118540345.jpg"
