Article Title,Article Link,Article Text,Article Summary,Article Image
"Stock market crash today: BSE Sensex ends 857 points down; Nifty50 below 22,550",https://timesofindia.indiatimes.com/business/india-business/stock-market-today-bse-sensex-nifty50-february-24-2025-dalal-street-indian-equities-global-markets/articleshow/118518878.cms,"Revival of FII investment in India will happen when economic growth and corporate earnings revive, says V K Vijayakumar of Geojit Financial Services. (AI image)

Why BSE Sensex, Nifty50 crashed today

1) Consumer Confidence Declines in US

2) Economic Growth and Inflation Concerns

3) Markets Await Inflation Report

4) Ongoing Foreign Investment Outflow

Stock market crash today: BSE Sensex and Nifty50, the Indian equity benchmark indices, tanked in trade on Monday. While BSE Sensex crashed 900 points, Nifty50 went below 22,550 intraday. BSE Sensex ended the day at 74,454.41, down 857 points or 1.14%. Nifty50 ended at 22,552.50, down 243 points or 1.07%.American consumer confidence hit its lowest point in 15 months during February, with inflation expectations rising amidst worries regarding President Donald Trump's proposed tariff policies, as indicated by recent data.Asian markets largely declined, following the negative performance on Wall Street from Friday, driven by growth-related concerns.Shares of Zomato, HCL Tech, TCS, Tech Mahindra, HDFC Bank, and IndusInd Bank started lower, whilst Sun Pharma, Maruti, M&M, Bajaj Finserv, and Nestle India registered initial gains.In sectoral performance, the Nifty IT index fell by 1.8%, with LTTS, Persistent Systems, and Coforge leading the decline. Additionally, Nifty Financial Services, Media, Metal, PSU Bank, Realty, and Consumer Durables indices all opened more than 1% lower.Global markets retreated following an unexpected reduction in US services activity, influenced by tariff concerns and rising costs. Reports indicated the White House was urging Mexico to implement tariffs on Chinese goods.American consumer confidence decreased significantly in February, reaching its lowest point in 15 months as inflation outlook increased. The University of Michigan's Consumer Sentiment Index reduced to 64.7 from 71.7 in January, below analysts' forecasts. Citizens voiced worries about how President Donald Trump's tariff policies might affect their spending capacity.The US faces worries about concurrent economic slowdown and rising inflation, creating market uncertainty. This situation affects export-focused industries, including Indian IT, whilst making emerging markets less desirable for international investors, who might prefer secure investments like US dollar and treasury bonds.The Nifty IT index fell 1.8% today, with LTTS, Persistent Systems, and Coforge showing losses.Investors remain cautious before Friday's release of the Federal Reserve's main core inflation indicator. Analysts expect the figure to decrease to 2.6% from 2.8%, though tariff-related concerns might overshadow these results.Further complexity arises as nine Fed officials are due to speak this week, likely maintaining a prudent approach regarding interest rate reductions.Foreign portfolio investors have withdrawn Rs 1,01,737 crore net from Indian equities in 2025 to date (Friday closing), as per NSDL figures.""The market is facing headwinds from relentless FII selling and global uncertainties relating to Trump tariffs,"" said Dr. V K Vijayakumar, Chief Investment Strategist at Geojit Financial Services.","BSE Sensex and Nifty50, the Indian equity benchmark indices, tanked in trade on Monday. While BSE Sensex crashed 900 points, N50 went below 22,550 intraday. American consumer confidence hit its lowest point in 15 months during February, with inflation expectations rising.","https://static.toiimg.com/thumb/msid-118519071,imgsize-110862,width-400,resizemode-4/118519071.jpg"
Chennai Water Safety: Govt rejects IIT Madras findings,https://timesofindia.indiatimes.com/city/chennai/chennai-water-safe-govt-rejects-iit-madras-findings/articleshow/118511457.cms,"Chennai: Rejecting IIT Madras' findings, govt asserted that Chennai's drinking water sources, including lakes, are free from ‘forever chemicals' PFAS (per- and polyfluoroalkyl substances).A state pollution control board study across 40 locations, including Chembarambakkam lake, Adyar river, and Buckingham Canal, found PFAS levels below the quantification threshold. Govt maintained that industries near waterbodies follow strict waste discharge policies, though some samples collected between Napier Bridge and Tondiarpet contained fluoride, iron, and chloride. On the outskirts and southern part of the city, sewage mixing was detected, and steps are being taken to address it.IIT-M's study reported PFAS levels between 23 and 136 ng/L about 400 times higher than advisory limits of 0.004-0.02 ng/L. NGT principal bench in New Delhi, taking suo motu cognizance, directed TN and Central Pollution Control Board (CPCB) to hold a detailed examination.PFAS are synthetic chemicals, commonly found in non-stick cookware, upholstery, industrial materials, and food packaging. Their presence in drinking water has been linked to serious health risks, including liver damage, low infant birth weights, hormonal imbalances, fertility issues, immune system suppression, and even cancer.While Tamil Nadu has asserted that its water is safe, CPCB informed NGT that only a limited number of studies on forever chemicals have been conducted in India. Based on past research, CPCB noted a significant rise in perfluorooctanoic acid (PFOA) and perfluorooctane sulfonic acid (PFOS) levels in water samples from south India. CPCB attributed this increase to a shift in industrial production from developed nations to countries such as China and India, following the US environmental protection agency's (EPA) phase-out initiative under the stewardship programme a voluntary agreement with manufacturers to reduce and eliminate PFAS use.The tribunal noted that while Bureau of Indian Standards has yet to set drinking water standards for PFAS, this does not absolve CPCB and the Union environment ministry from establishing compliance norms under Water Act, 1974. It has added the ministry as a respondent in the case, which is scheduled for a hearing on April 29.","State pollution control board study across 40 locations, including Chembarambakkam lake, Adyar river, and Buckingham Canal, found PFAS levels below the quantification threshold. Govt maintained that industries near waterbodies follow strict waste discharge policies. Some samples collected between Napier Bridge and Tondiarpet contained fluoride, iron, and chloride.","https://static.toiimg.com/thumb/msid-118511453,imgsize-45506,width-400,height-225,resizemode-72/118511453.jpg"
"Deported by US to Panama, 12 illegal migrants reach India",https://timesofindia.indiatimes.com/india/deported-by-us-to-panama-12-illegal-migrants-reach-india/articleshow/118512020.cms,"A police official escorts an immigrant woman, wearing mask, deported from the United States, who was among those who arrived in a US military plane a few weeks ago in Amritsar (Pic credit: AP)

(With inputs from Yudhvir Rana in Amritsar)

NEW DELHI/AMRITSAR: A batch of 12 illegal Indian immigrants deported from the US to Panama arrived Sunday in Delhi via Istanbul on a Turkish Airlines flight, making them the first group to be sent back without restraints since three American military aircraft brought 332 deportees to Amritsar within a fortnight this month.The 12 deportees are said to be among 50 undocumented Indian nationals who reportedly arrived in Panama recently. Panama has been assisting the US in its deportation efforts.According to local media reports, the UN-affiliated International Organisation for Migration helped purchase plane tickets for people of various nationalities whose citizenship was confirmed, 17 of them Indians. More deportees from the group are expected next week once MEA verifies their nationality.Deportation from Panama is being carried out under the Regional Assisted Voluntary Return Programme , an IOM protection and support response to facilitate the dignified, safe, regular and orderly return, as well as voluntary and based on an informed decision, of migrants to their countries of origin.Four men from Punjab in the latest batch took a connecting IndiGo flight from Delhi to Amritsar.Airport authorities in the city were informed in advance about the arrival of Patiala resident Jatinder Singh, Maninder Dutt of Jalandhar, and Jugraj Singh and Harpreet Singh from Gurdaspur, but it wasn't immediately clear whether they came unescorted all the way from Panama.Official sources said after the mandatory debriefing that Jatinder, 34, paid a travel agent from Patiala Rs 52 lakh to help him enter the US through a route criss-crossing Guyana, Brazil, Bolivia, Peru, Colombia, Panama, Costa Rica, Honduras, Guatemala, and Mexico.Maninder, 21, put his faith and Rs 42 lakh in the hands of a Delhi-based illegal immigration agent, who then sent him on a perilous journey through Spain, Salvador, Guatemala, and Mexico. Jugraj and Harpreet, both 30, paid Rs 38 lakh each to an agent from Batala and reached the US via Nicaragua.Punjab NRI minister Kuldeep Singh Dhaliwal said the state govt had registered cases against 15 travel agents based on complaints from natives of the state who were deported from the US this month. Of these, three agents have been arrested, while police have been raiding offices and homes in search of the absconding 12.Sources said the deportees who arrived on Sunday told authorities they intended to file cases against the travel agents who duped them only if there was a chance of getting their money back.The first US military flight that arrived on Feb 5 brought 104 deportees, with both men and women handcuffed and their feet shackled. The second flight, carrying 119 deportees, arrived on Feb 15. The third flight, with 112 deportees, landed on Feb 16, this time with only the men in shackles.",Four men from Punjab in the latest batch took a connecting IndiGo flight from Delhi to Amritsar. The 12 deportees are said to be among 50 undocumented Indian nationals who reportedly arrived in Panama recently. Panama has been assisting the US in its deportation efforts.,"https://static.toiimg.com/thumb/msid-118512068,imgsize-1156995,width-400,resizemode-4/118512068.jpg"
India skips vote on Ukraine resolutions as US faces setback in UNGA,https://timesofindia.indiatimes.com/india/india-skips-vote-on-ukraine-resolutions-as-us-faces-setback-in-unga/articleshow/118539238.cms,"The UN Security Council votes on Feb 24, 2025, at the United Nations headquarters. (Pic credit: AP)

Europe-backed resolution seeks withdrawal of Russian troops

Amid high drama at the UN over the 2 resolutions that were brought in the UN General Assembly on the third anniversary of the Russia-Ukraine war – one by the US and other by Ukraine and Europe – India abstained from voting on both. Both resolutions were adopted with 93 votes in favour, as EU members seemed to prevail over the Americans in mustering support from the 193-member body for comprehensive peace and for Ukraine’s sovereignty and territorial integrity.The voting for the US effort, which sought a swift end to the conflict, was more dramatic as the US itself abstained from voting on a resolution it had sponsored.This was because the European countries managed to successfully introduce amendments in the text. India, which maintains that it is not neutral but on the side of peace, was expected to vote in favour but the amendments meant that Indian too had to abstain.India was also among the 65 countries that abstained from voting on the Europe-backed resolution that called for just and lasting peace, and also immediate withdrawal of Russian forces from Ukraine. This was in line with its earlier abstentions in the Assembly on resolutions condemning Russia.India officially continues to maintain that it wants both parties involved to restart the dialogue and diplomacy process to resolve the conflict. The Trump administration has been engaging directly with Russia to end the war, keeping both EU and Ukraine out.While the defeat in the General Assembly is a setback for the US, it will look to make up for it in the Security Council, hoping that France and UK will not veto it. Both countries have not used their veto power for decades. The voting was expected to take place later in the day. With effectively just one paragraph, the US resolution seeks lasting, and not just and lasting, peace and calls for a swift end to the conflict between the 2 countries. If approved, it will be the first real resolution to be adopted by the Council on the issue since the beginning of the war. The only 1 adopted so far was days after the Russian invasion of Ukraine for a special emergency session in the Assembly on Ukraine.EU member states had sought 3 amendments in the US draft resolution, including replacing “Russia-Ukraine conflict” with “the full-scale invasion of Ukraine by the Russian Federation”.It also called for reaffirming the UN’s commitment to Ukraine’s sovereignty, independence, and territorial integrity within its internationally recognised borders, including its territorial waters. The third was a mention of “just, lasting and comprehensive” peace and not just lasting peace. Russia’s amendment for addressing the “root causes” of the conflict was rejected.","India abstained from voting on the 2 resolutions brought in the UN General Assembly on the third anniversary of the Russia-Ukraine war. Both resolutions were adopted with 93 votes in favour, as EU members seemed to prevail over the Americans in mustering support from the 193-member body for comprehensive peace.","https://static.toiimg.com/thumb/msid-118542550,imgsize-1314893,width-400,resizemode-4/118542550.jpg"
"CPM says PM Modi government not fascist; CPI, Congress hit out",https://timesofindia.indiatimes.com/india/cpm-says-pm-modi-government-not-fascist-cpi-congress-hit-out/articleshow/118540557.cms,"File photo of PM Modi (Pic credit: ANI)

KOZHIKODE: A detailed note from CPM to its state units explaining why its draft political resolution for the 24th party congress does not say ""Modi govt is fascist or neo-fascist"" or characterise ""the Indian state as a neo-fascist state"" has accentuated fault lines in Left Front, with CPI demanding that its ally correct its stand.""What we are pinpointing is that after 10 years of continuous rule by BJP, which is the political wing of RSS, there was a consolidation of political power in the hands of BJP-RSS, and this is resulting in the manifestation of neo-fascist characteristics,"" states the note.It explains that the ""characteristics"" referred to in the draft political resolution for the April congress implies ""features or trends"" but not explicitly a neo-fascist govt or state. ""The political resolution is talking about the danger of Hindutva-corporate authoritarianism going towards neo-fascism if BJP-RSS are not fought back and halted.""Unlike CPI and CPI (ML), both fiercely antagonistic towards the Sangh, CPM has all along taken an admittedly nuanced stand, with multiple political resolutions stating that the ""authoritarian and Hindutva communal attacks display emerging fascist trends"" (22nd party congress) and that the Modi govt was carrying out the ""fascist agenda of RSS"" (23rd party congress).Congress reacted sharply to the note while CPI said it couldn't understand the ""haste"" to cushion the fascist labelling of the Modi govt.""Fascist ideology teaches how religion and faith can be used for political gain and the BJP govt is implementing these in practice,"" CPI state secretary Binoy Viswam said.Leader of the opposition V D Satheesan of Congress said the CPM's assessment was part of its decision to ""align with Modi and work in subservience to the Sangh"". He told reporters in Malappuram that the ""CPM discovery"" wasn't a surprise, exposing its ""secret relationship with BJP for years"".""CPM in Kerala has always compromised with fascism and the Sangh. The new document is an attempt to somehow hold on to it and survive,"" he said, adding that politburo members from Kerala led the initiative to draft such a document.CPM central committee member A K Balan said in Thiruvananthapuram that the CPM never assessed the Modi govt as fascist in its original form.","Draft political resolution for 24th party congress does not say ""Modi govt is fascist or neo-fascist"" CPM has all along taken an admittedly nuanced stand, with multiple political resolutions stating that the ""authoritarian and Hindutva communal attacks display emerging fascist trends""","https://static.toiimg.com/thumb/msid-118540558,imgsize-1148543,width-400,resizemode-4/118540558.jpg"
'Get the house in order': Sanjay Jha's open letter to Rahul Gandhi amid Shashi Tharoor's growing rift with leadership,https://timesofindia.indiatimes.com/india/get-the-house-in-order-sanjay-jhas-open-letter-to-rahul-gandhi-amid-shashi-tharoors-growing-rift-with-leadership/articleshow/118536030.cms,"NEW DELHI: Former Congress spokesperson Sanjay Jha on Monday wrote an open post for Rahul Gandhi on X, asking him to ""get the house in order"" amid reports of Shashi Tharoor's rift with the party.""Dear Rahul Gandhi, I am writing to you publicly here because no one within the Congress is probably going to tell you this. So as usual, let me bell the cat,"" he wrote.""Leadership ( corporate or political or any other) is about having difficult conversations. It is about trouble-shooting. It is not about living in denial; problems have to be addressed, they cannot be wished away.""You and I both know that Shashi (Tharoor) is an outstanding parliamentarian. He is probably among the only few in the country to whom the cliché, “He needs no introduction” truly applies. It is therefore disappointing that once again a great asset of the party is being forced to talk to the media to get his message through to you or the Congress leadership. Almost five years to the date, I was compelled to write an article in a national newspaper when facing a similar predicament. No problem is intractable; the key question is do we have the will to solve them in everyone’s interest? And that too quickly,"" he said in the post.""The Congress must be focused on taking on the BJP, but a prerequisite for that is to first get the house in order. This cannot become an ongoing unresolved challenge for years as it paralyses the energy and drive of the Congress workers and supporters. A challenger party has to be swift, desperate, risk-taking, hungry and on a constant prowl. It cannot be business as usual, for sure. We need to the hit the nail on the head going forward, but right now, we seem to be hitting our head on the nail,"" Jha wrote.Four-time Congress MP Tharoor appears to be growing increasingly disillusioned with the party, following what he perceives as a continued sidelining by the high command.His recent public criticism of a leadership vacuum in Kerala Congress and a meeting with Lok Sabha leader of opposition Rahul Gandhi to discuss his role in the party have fuelled speculation about his future within the organisation.","Former Congress spokesperson Sanjay Jha wrote an open post for Rahul Gandhi on X. He asked him to ""get the house in order"" amid reports of Shashi Tharoor's rift with the party. Jha: ""Leadership ( corporate or political or any other) is about having difficult conversations""","https://static.toiimg.com/thumb/msid-118536091,imgsize-951154,width-400,resizemode-4/118536091.jpg"
"Tipsy-turvy: Drunk UP groom garlands bride’s bestie, arrested",https://timesofindia.indiatimes.com/india/tipsy-turvy-drunk-up-groom-garlands-brides-bestie-arrested/articleshow/118540335.cms,"Medical examination confirms groom was drunk; booked under Dowry Act

BAREILLY: A drunk groom 's misstep at his own wedding in UP - in which he mistakenly garlanded his bride's best friend - set off a series of mishaps, ending with his arrest and the bride calling off the marriage.It started as Indian weddings often do - with a delay. The groom, Ravindra Kumar, 26, was late, and when he arrived, he didn't seem to be in a hurry, lingering with his friends, catching up over drinks.The 500-odd guests at a house in Naughwa Bhagwantpur village in Bareilly stayed in their seats as the bride waited. The garland-exchanging ceremony - one of those formalities that takes only a moment - was about to begin. Then, Kumar turned to the wrong woman. It was just a second. A miscalculation. But in that brief pause, before anyone could intervene, he placed the ceremonial garland over the bride's best friend.As confusion rippled through the crowd, he took the garland off and placed it around the neck of a male friend beside her. Then, to perhaps maintain a certain symmetry, he garlanded an elderly guest as well. There are moments when silence is more telling than noise. The wedding guests did not react immediately. They watched. The bride, Radha Devi, 21, did not. She slapped him and walked away. It had taken months of preparation.Omkar Verma, the bride's brother, said the family had spent over Rs 10 lakh on the wedding. He had his own theory for why things had gone wrong. ""They were unhappy with the dowry gifts. Maybe this was their way of humiliating us,"" he told TOI. ""And then we find out that he isn't even a farmer as his family told us-he's a truck driver.""At 4am, a complaint was filed at Kularia police station. By morning, the wedding was off, and Kumar was in police custody. By noon, he had apologised. His family suggested the wedding should go on. Radha refused.Circle officer Harsh Modi-used to break-ins and thefts but less accustomed to cases of misdirected garlanding-kept his summary brief. ""The groom was intoxicated. He misbehaved. His medical examination confirmed he was drunk. He was booked under sections of the Dowry Act.""","Ravindra Kumar, 26, mistakenly garlanded his bride's best friend. The bride, Radha Devi, 21, slapped him and walked away. Medical examination confirms groom was drunk; booked under Dowry Act. By morning, the wedding was off and Kumar was in police custody.","https://static.toiimg.com/thumb/msid-118540342,imgsize-858056,width-400,resizemode-4/118540342.jpg"
