Article Title,Article Link,Article Text,Article Summary,Article Image
"Murugha mutt seer, 2 others acquitted in Pocso case",https://timesofindia.indiatimes.com/india/murugha-mutt-seer-2-others-acquitted-in-pocso-case/articleshow/125602876.cms,"Representative image

BENGALURU: A local court in Chitradurga on Wednesday acquitted Murugha Mutt seer Shivamurthy Murugha Sharanaru and two others in a Pocso case registered in Aug 2022. The seer, however, faces another Pocso case filed on Oct 13, 2022, in which Karnataka HC has stayed the investigation.Two girls from a hostel run by the mutt had alleged in Aug 2022 that the seer had raped them. Five persons - including a minor boy - were named as accused. The seer was arrested on Sept 1.The court also acquitted hostel warden Rashmi and hostel manager Parame Shivaiah. Reading his one-line order, district and sessions judge Gangadharappa Channabasappa Hadapad announced, ""All acquitted.""In Davanagere, the seer declined to comment. The seer's counsel said: ""We have to see the order copy to get more clarity on the grounds of acquittal and other details. We will address the media in a day or two,"" he said. The special public prosecutor said the state will appeal the verdict in HC.",Murugha Mutt seer Shivamurthy Murugha Sharanaru and two others acquitted. Two girls from a hostel run by the mutt had alleged in Aug 2022 that the seer had raped them. Five persons - including a minor boy - were named as accused. The seer was arrested on Sept 1.,"https://static.toiimg.com/thumb/msid-125602881,imgsize-744366,width-400,resizemode-4/court-order_ians.jpg"
Judges of 6 nations form SC global bench,https://timesofindia.indiatimes.com/india/judges-of-6-nations-form-sc-global-bench/articleshow/125602824.cms,"NEW DELHI: For the first time, Supreme Court on Wednesday assembled a global bench as chief justices and the most senior judges of six countries joined CJI Surya Kant and Justice Joymalya Bagchi to watch first-hand how the highest court in India conducts its proceedings.Chief justices and judges from foreign countries sitting as guests on the dais in the CJI's courtroom is an old tradition. But never had the chief justices of so many countries partnered - even though they did not participate in adjudication - the CJI-led bench.On the bench were Chief Justice of Bhutan Lyonpo Norbu Tshering, who did his LLB from Delhi University's Campus Law Centre, Chief Justice and President of Kenyan Supreme Court Martha Koome, Mauritius Chief Justice Bibi Rehana Mungly-Gulbul, Sri Lankan Chief Justice P Padman Surasena, most senior judge of Malaysian Federal Court Justice Tan Sri Datuk Nallini Pathmanathan and most senior judge of Nepal Supreme Court Justice Sapana Pradhan Malla.After proceedings that included adjudication of bail to an academician accused of sexual harassment and the Andhra Pradesh liquor case, CJI Kant said it was a historic moment for Supreme Court of India to witness assembling of so many legal luminaries. Solicitor general Tushar Mehta welcomed them on behalf of govt and senior advocates Kapil Sibal and Rakesh Dwivedi extended courtesies on behalf of advocates.CJ Koome said the Kenyan SC looked up to the constitutional interpretations of the Indian SC.CJ Tshering said the basic structure doctrine evolved by the SC of India continued to be a guiding principle. ""I have never seen so many advocates in a courtroom,"" he added.CJ Surasena said while Supreme Court at Madras was established in 1800, the Sri lankan SC was set up in 1801, and since then, the two countries have followed the same legal system. Justice Malla said she was privileged to be part of the global bench and her Malaysian counterpart, Justice Pathmanathan, said her country's highest court followed rulings and fundamentals of jurisprudence developed by the SC.",Chief justices and most senior judges of six countries joined CJI Surya Kant and Justice Joymalya Bagchi. Chief justices and judges from foreign countries sitting as guests on the dais in the CJI's courtroom is an old tradition. But never had the chief justices of so many countries partnered - even though they did not participate in adjudication.,"https://static.toiimg.com/thumb/msid-125602830,imgsize-804301,width-400,resizemode-4/.jpg"
'Only halal meat on trains': NHRC takes up issue,https://timesofindia.indiatimes.com/india/only-halal-meat-on-trains-nhrc-takes-up-issue/articleshow/125602809.cms,"NEW DELHI: NHRC has issued a notice to railways on a complaint alleging that ""only halal-processed meat"" is served in non-vegetarian meals which creates an ""unfair discrimination"" and amounts to ""violations of human rights"".It is further alleged in the complaint that the practice in trains excludes people from Hindu Dalit communities, who traditionally work in the meat trade and therefore harms their livelihood rights and equal opportunities.The complainant has also alleged that Hindu and Sikh passengers do not get food options that match their religious beliefs, affecting their freedom of choice."," NHRC has issued a notice to railways on a complaint alleging that ""only halal- processed meat"" is served in non-vegetarian meals. It is further alleged that the practice in trains excludes people from Hindu Dalit communities, who traditionally work in the meat trade.","https://static.toiimg.com/thumb/msid-125602817,imgsize-1113380,width-400,resizemode-4/.jpg"
Treating Pakistan's Ayodhya remark with contempt it deserves: India,https://timesofindia.indiatimes.com/india/treating-pakistans-ayodhya-remark-with-contempt-it-deserves-india/articleshow/125602793.cms,"'No Moral Standing': India Slams Pakistan's Rant On Ayodhya Event, Calls Out Bigotry And Repression

NEW DELHI: India on Wednesday slammed Pakistan for its comments on the flag-hoisting event in Ayodhya, saying that instead of delivering hypocritical homilies, Pakistan would do better to turn its gaze inwards and focus on its own abysmal human rights record.Pakistan had earlier expressed deep concern over the event and called it a ""deliberate attempt to erode Muslim cultural and religious heritage under the influence of majoritarian Hindutva ideology"".""We have seen the reported remarks and reject them with the contempt they deserve,"" said MEA spokesperson Randhir Jaiswal. ""As a country with a deeply stained record of bigotry, repression, and systemic mistreatment of its minorities, Pakistan has no moral standing to lecture others,"" he added.PM Narendra Modi hoisted the flag on Tuesday saying that the ""wounds and pain"" of centuries were healing as a 500-year-old resolve was finally being fulfilled with the formal completion of the Ram temple in Ayodhya.In an official statement, Pakistan had also sought international intervention to safeguard Islamic heritage.","Pakistan had earlier expressed deep concern over the event and called it a ""deliberate attempt to erode Muslim cultural and religious heritage under the influence of majoritarian Hindutva ideology"" ""We have seen the reported remarks and reject them with the contempt they deserve,"" said MEA spokesperson Randhir Jaiswal.","https://static.toiimg.com/thumb/msid-125602802,imgsize-822761,width-400,resizemode-4/.jpg"
Voiding our own orders will weaken court's authority: SC,https://timesofindia.indiatimes.com/india/voiding-our-own-orders-will-weaken-courts-authority-sc/articleshow/125602727.cms,"NEW DELHI: Supreme Court on Wednesday turned its critical gaze on its own functioning. On the growing trend of benches overturning orders of earlier ones within days or months of them being pronounced - such as on the menace of dog bites, retrospective environmental clearance, Bhushan Steel Ltd's insolvency and the ban on fire crackers - the apex court observed ""painfully"" that the practice would ""undermine this court's authority"".In another instance, though it was done through a curative petition filed against SC's 2021 verdict on the dispute between Delhi Metro Rail Corporation (DMRC) and Reliance Infrastructure's Delhi Airport Metro Express Private Ltd (DAMEPL), the court had overruled the judgment last year, quashing the Rs 7,687-crore award in favour of DAMEPL.A bench of Justices Dipankar Datta and Augustine George Masih said that public confidence in the judiciary would be undermined if cases were reopened and special benches set up to re-hear them at the behest of parties aggrieved by the verdicts.Quoting Justice Robert Jackson, it said, ""We are not final because we are infallible, but we are infallible only because we are final.""""In the recent past, we have rather painfully observed a growing trend in this court (of which we too are an indispensable part) of verdicts pronounced by judges, whether still in office or not and irrespective of the time lapse since the pronouncement, being overturned by succeeding benches or specially constituted benches at the behest of some party aggrieved by the verdicts prior in point of time.To us, the object of Article 141 of the Constitution seems to be this: the pronouncement of a verdict by a bench on a particular issue of law (arising out of the facts involved) should settle the controversy, being final, and has to be followed by all courts as law declared by SC,"" the bench said.It said that if a verdict was allowed to be reopened, the very purpose of enacting Article 141 (law declared by SC is binding) would stand defeated. The court passed the order while hearing a plea seeking relaxation of bail conditions for an accused who was directed not to leave Kolkata during trial of a murder case. The court noted that he had filed an application after the retirement of the apex court judge who had imposed the condition, and dismissed his plea.The bench held that judicial discipline, propriety and comity demanded that a succeeding bench of different judges defers to the view expressed by the earlier bench, unless there was something so grossly erroneous on the face of the record or palpably wrong that it necessitated a relook in exercise of inherent jurisdiction either through a review or curative petition. ""...As judges of this court, we are alive to the position that overturning a prior verdict by a later verdict does not necessarily mean that justice is better served,"" the bench said.""However, with an over looming sense of dissatisfaction and remorse, we propose not to walk that path. While it is true that in a case of the present nature - where an issue of a citizen's right to move freely throughout the territory of India is involved - the principle of finality may not be applied strictly against the party whose right has been so restricted, but the antecedent facts in the light whereof the restriction is imposed assume significance and must, of necessity, bear serious thought. Any restrictive order of the nature under consideration has to be and must be premised on some worthy reason,"" the bench said.","Supreme Court turned its critical gaze on its own functioning. Observed ""painfully"" that the practice would ""undermine this court's authority"" Justices Dipankar Datta and Augustine George Masih said that public confidence in the judiciary would be undermined if cases were reopened.","https://static.toiimg.com/thumb/msid-125602732,imgsize-804301,width-400,resizemode-4/.jpg"
"SC segregates SIR pleas, seeks responses from poll panel, Kerala, Bengal and Tamil Nadu",https://timesofindia.indiatimes.com/india/sc-segregates-sir-pleas-seeks-responses-from-poll-panel-kerala-bengal-and-tn/articleshow/125602701.cms,"EC To Launch SIR in 12 States and UTs in Phase 2, CEC Gyanesh Kumar Says Zero Complaints in Bihar

NEW DELHI: Segregating petitions challenging the Special Intensive Revision (SIR) of electoral rolls in West Bengal, Tamil Nadu and Kerala from the challenge to the constitutional validity of the pan-India SIR, Supreme Court on Wednesday sought responses from EC, state ECs and state govts while posting these pleas for hearing on different dates.For the Election Commission senior advocate Rakesh Dwivedi told a bench of CJI Surya Kant and Justice Joymalya Bagchi that EC and Kerala State Election Commission were working in close coordination and face no problem in conducting SIR and local body elections simultaneously. The state govt has no locus standi to challenge simultaneous conduct of these two exercises.Dwivedi said over 99% of voter enumeration forms have already been distributed and over 50% of them have been digitised. The bench asked EC to file a status report on the process by Monday and posted a bunch of petitions related to the Kerala SIR for further hearing on Dec 3.On the Tamil Nadu SIR, while DMK opposed it, AIADMK supported EC's decision to carry out the revision of electoral roll. SC asked EC to file a composite affidavit on the bunch of petitions related to the state SIR and posted these for hearing on Dec 4.On the West Bengal SIR, SC issued notice on a TMC MP's plea and asked EC, state EC and Mamata Banerjee govt to file their responses by Monday and posted the bunch of petitions for hearing on Dec 9. The SIR exercise is scheduled to conclude on Dec 4. The bench said, ""If we find something irregular, then we can direct the EC to correct it even if the deadline has passed.""","Supreme Court seeks responses from EC, state ECs and state govts. Segregating petitions challenging the Special Intensive Revision (SIR) of electoral rolls in West Bengal, Tamil Nadu and Kerala from the challenge to the constitutional validity of the pan-India SIR.","https://static.toiimg.com/thumb/msid-125602707,imgsize-804301,width-400,resizemode-4/.jpg"
"Ahead of Maharashtra local polls, it’s Sena vs BJP over ‘poaching’ issues",https://timesofindia.indiatimes.com/india/ahead-of-maharashtra-local-polls-its-sena-vs-bjp-over-poaching-issues/articleshow/125602671.cms,"CHHATRAPATI SAMBHAJINAGAR: Amid rising tensions between the two constituents of the governing alliance in Maharashtra over alleged poaching of functionaries ahead of the upcoming local body polls, Shiv Sena minister Sanjay Shirsat has launched a scathing attack on Rajya Sabha MP Ashok Chavan of BJP At a rally at Bhokar in Nanded district Tuesday night, Shirsat alleged Chavan had accumulated excessive wealth. “I wonder if Ashokrao eats bhakri (kind of a thick chapati) or currency notes. Why does Ashokrao need so much money?” Shirsat said.He also targeted Chavan’s late father, former CM Shankarrao Chavan. “He used to claim Nanded would be transformed into London. I have visited Nanded multiple times. Forget the city, even Bhokar, his own hometown, remains in a bad shape to this day,” the social justice minister said.Shirsat accused Chavan of mismanagement in urban planning, alleging that public roads were marked at the cost of open spaces & official layouts.Chavan dismissed the comments as “irresponsible”. Speaking to the media in Nanded, the former CM said, “He has come here during the polls merely to pass time and divide votes. There is no basis for his comments, and such language does not suit a person holding a responsible post.”Earlier, Sena MLC Hemant Patil had blamed Chavan for the breakdown of the alliance ahead of local polls. Chavan is also facing attacks from his arch-rival Pratap Patil Chikhalikar, the NCP MLA from Loha.",Shiv Sena minister Sanjay Shirsat has launched a scathing attack on Rajya Sabha MP Ashok Chavan of BJP. Chavan is also facing attacks from his arch-rival Pratap Patil Chikhalikar.,"https://static.toiimg.com/thumb/msid-125602683,imgsize-806490,width-400,resizemode-4/.jpg"
"MP university campus turns battleground: Students torch vehicles, attack chancellor’s bungalow amid jaundice outbreak claim",https://timesofindia.indiatimes.com/city/bhopal/mp-university-campus-turns-battleground-students-torch-vehicles-attack-chancellors-bungalow-amid-jaundice-outbreak-claim/articleshow/125577435.cms,"BHOPAL: A midnight protest at VIT University in Sehore district on the Indore–Bhopal Highway turned into large-scale violence late on Tuesday, with angry students allegedly torching multiple vehicles and damaging campus property. Videos of burning vehicles and students shouting slogans have gone viral on social media.The unrest began after several students—estimated to be around two dozen—fell ill with suspected jaundice. Students claimed the university ignored repeated complaints about deteriorating hygiene and food quality.Many students said they had been forced to purchase bottled mineral water at their own expense for several days because of poor water quality in hostels.Tension reportedly rose when faculty members allegedly assaulted protesting students. As the agitation grew, large groups of students gathered in open areas of the campus around midnight, chanting slogans and demanding immediate action.According to sources, two cars, a bus, an ambulance and several motorbikes were set on fire, and furious students vandalised parts of the chancellor’s bungalow. Visuals show flames rising high as students look on, record videos, and continue shouting slogans.Activists from the ABVP later reached the campus. Police teams from Sehore and nearby areas were deployed to control the situation and prevent further violence.Despite the scale of the protest and serious reports of illness, neither the VIT administration nor district authorities have issued an official statement. Repeated attempts to contact university representatives went unanswered.Police said they are verifying the cause of the illnesses, investigating allegations of assault, and assessing the damage. Further action will be taken once the inquiry is completed.",A midnight protest at VIT University turned into large-scale violence late on Tuesday. Angry students allegedly torched multiple vehicles and damaged campus property. Videos of burning vehicles and students shouting slogans have gone viral on social media. Unrest began after several students fell ill with suspected jaundice.,"https://static.toiimg.com/thumb/msid-125577572,imgsize-626049,width-400,height-225,resizemode-72/violence-erupts-at-vit-university-as-students-fall-ill-with-suspected-jaundice-alleging-poor-hygiene-and-food-quality.jpg"
Wedding postponed: Smriti Mandhana removes marriage posts after father and fiancé Palash Muchhal hospitalised,https://timesofindia.indiatimes.com/sports/cricket/news/wedding-postponed-smriti-mandhana-removes-marriage-posts-after-father-and-fianc-palash-muchhal-hospitalised/articleshow/125539513.cms,"Smriti Mandhana removes marriage posts

Smriti Mandhana & Palash Muchhal’s Haldi Ceremony Begins!

NEW DELHI: Indian women's cricket team vice-captain Smriti Mandhana has removed all wedding-related posts from her Instagram. This development coincides with her father Shriniwas and fiancé Palash Mucchal's hospitalisation, though Palash has since been discharged in recovering in Mumbai.The deletion includes her proposal video and wedding-related contents. Her teammates Jemimah Rodrigues and Shreyanka Patil have also removed the announcement video from their official social media platforms.Recent days have seen intense monitoring of ODI World Cup -winner Mandhana's social media activity, particularly concerning her wedding and its subsequent postponement. While all wedding posts, engagement announcements, reels, and the proposal videos have been removed, her earlier casual photos with fiance Palash remain on her official Instagram handle.The removal of the engagement video by Jemimah Rodrigues has further intensified discussions among followers. The hospitalisation of both Mandhana's father and Palash Mucchal has caused concern among their supporters.The family has confirmed that Mr Mandhana's condition is stable and under observation.Smriti's manager Tuhin Mishra has officially announced the cancellation of yesterday's ceremony, with no confirmation on when the festivities will resume.""Today in the morning, when he was having breakfast, Smriti Mandana's father, Mr. Srinivas Mandhana, got unwell. We waited for a while. We thought that maybe it's normal, he will be fine. But he was getting worse. So we thought, let's not take any risk, so we called an ambulance and took him to the hospital. Now he is under observation,"" Mishra stated on Sunday.""You know Smriti is very close to her father. She decided that until her father gets well, this marriage, which was supposed to happen today, is indefinitely postponed. Now he is under observation, and the doctor has said that he will have to stay in the hospital. And until he gets well, because we are also in shock, and we want him to recover soon.""The situation escalated further when reports emerged that groom-to-be Palash Muchhal had also been hospitalised in Sangli due to emotional stress caused by the sudden illness of Smriti’s father. Palash has since returned to Mumbai and is “resting and recovering,” according to his mother, Amita Muchhal.She explained how deeply attached he is to Shrinivas Mandhana, describing that Palash himself insisted the wedding be halted until Smriti’s father was fully stable. Amita recounted the frightening moments, revealing that Palash’s condition required medical attention, including an IV drip and ECG tests, though all results came back normal. “Smriti and Palash both are in distress… Palash dreamt of coming home with his bride, but the family had no choice but to postpone the wedding,” she said.The couple and their families have requested privacy while they focus on Srinivas Mandhana's recovery.The wedding was scheduled for November 23 in Sangli, Maharashtra.The celebration was planned to be an intimate affair with close family members and fans in attendance. Several members of the Women's World Cup-winning Indian cricket team were present during the wedding celebrations.",Indian women's cricket team vice-captain Smriti Mandhana has removed all wedding-related posts from her Instagram. This development coincides with her father Shriniwas and fiancé Palash Mucchal's hospitalisation. Her teammates Jemimah Rodrigues and Shreyanka Patil have also removed the announcement video.,"https://static.toiimg.com/thumb/msid-125539764,imgsize-42594,width-400,resizemode-4/smriti-mandhana-removes-marriage-posts.jpg"
'We are one nation': Arunachal woman Pema Wang Thongdok's unity post after Shanghai harassment; hits back at trolls,https://timesofindia.indiatimes.com/city/delhi/we-are-one-nation-arunachal-woman-pema-wang-thongdoks-unity-post-after-shanghai-harassment-hits-back-at-trolls/articleshow/125580318.cms,"Pema Wang Thongdok (File Photo)

Experts Analyse India-China Diplomatic Row After Shanghai Airport Incident

What happened in Shanghai

NEW DELHI: Pema Wang Thongdok has hit back at online trolls after facing alleged harassment by Chinese authorities at Shanghai’s Pudong International Airport, using the incident to call for national unity.Thongdok, who was travelling from London to Japan with a transit stop in Shanghai on 21 November, said immigration officials refused to recognise her Indian passport because her birthplace was listed as Arunachal Pradesh.In a post on social media platform 'X', Thongdok thanked those who supported her and clarified that she does not engage with trolls.""I would like to thank everyone speaking in support of this diplomatic issue and while I’m new here & not active on X it’s because I have a very high profile full-time position working in the financial services and don’t have idle time to answer trollers! The right people get it.""""And the ones who don’t get it are clearly not people I would engage with anyway! I don’t even live in India so any action that Indian govt takes will be for the benefit & pride of my fellow Indians and Arunachalis living here, not mine. We are one nation; we stand for one another,"" she added further.On November 21st, she alleged that officers declared her passport “invalid,” blocked her from boarding her onward flight despite holding a valid Japanese visa, denied her access to food and basic facilities, and repeatedly mocked her, suggesting she apply for a Chinese passport.She further claimed that China Eastern Airlines staff forced her to buy a fresh ticket before returning her passport, leading to financial losses from missed flights and hotel bookings. Consular intervention eventually allowed her to leave the airport late that night and continue her journey.",Pema Wang Thongdok has hit back at online trolls after facing alleged harassment by Chinese authorities at Shanghai’s Pudong International Airport. She was travelling from London to Japan with a transit stop in Shanghai on 21 November. She said immigration officials refused to recognise her Indian passport because her birthplace was listed as Arunachal Pradesh.,"https://static.toiimg.com/thumb/msid-125580820,imgsize-15436,width-400,height-225,resizemode-72/-.jpg"
