Article Title,Article Link,Article Text,Article Summary,Article Image
"Like commercial vehicles, soon private vehicles need to get fitness test done at automated testing stations",https://timesofindia.indiatimes.com/india/like-commercial-vehicles-soon-private-vehicles-need-to-get-fitness-test-done-at-automated-testing-stations/articleshow/126275967.cms,"Representational photo

NEW DELHI: Soon all private vehicles like cars and bikes will have to get their fitness and pollution tests done at automated test stations (ATS) for renewal of registration as it is in the case of commercial vehicles. The ATS or the inspecting officer will also need to upload at least a 10 seconds geotagged video of the vehicle at the time of fitness test before issuing any certificate.The road transport ministry has proposed key changes in the Central Motor Vehicles Rules, including this, through a draft notification to prevent the malpractice of vehicle owners managing to get fitness certificates even without visiting ATS or other testing centres. This also gains significance in the light of increasing concern over air pollution and fitness of vehicles.Fitness certificate is mandatory for renewal of registration of private vehicles after attaining 15 years, and subsequently, in every five years.As per the draft notification, private vehicles, like commercial ones, will need to visit ATS, where these are established, for fitness tests. At present, there are over 160 ATS operational across the country.To ensure that the certificates are issued after carrying out genuine tests, the draft notification says that “the renewal of a certificate of fitness shall be made only after uploading at least a 10 seconds geotagged video of the vehicle at the time of fitness test, capturing the vehicle from front, rear, right side and left side ensuring clear visibility of the registration number plate, chassis number, engine number and features of the vehicle” by an authorised testing station or inspecting officer after carrying out the specified tests.In a bid to avoid vehicle owners using legal provisions to apply for multiple re-tests after vehicles fail to pass the fitness test, the proposed norms say that if a vehicle is not declared as ‘fit’ within 180 days from the first date of vehicle declared as ‘unfit’ the vehicle shall be categorised as ‘End of Life Vehicle (ELV)’ and flagged in the Vahan database as ‘ELV’.Officials said till now people used to get the timeline extended by simply submitting fees just days before the expiry of 180 days. “That won’t be possible any more. They need to get the fitness certificate within 180 days from the day the first test found the vehicle as unfit. Enough safeguards have been put in place to ensure that any ATS doesn’t give incorrect test result,” said an official.",The road transport ministry has proposed key changes in the Central Motor Vehicles Rules. The ATS or the inspecting officer will also need to upload at least a 10 seconds geotagged video of the vehicle at the time of fitness test before issuing any certificate.,"https://static.toiimg.com/thumb/msid-126275951,imgsize-24168,width-400,resizemode-4/screenshot-2025-12-31-223432.jpg"
"ED attaches UK-based high-value property located near Buckingham Palace in Rs 1,400 crore bank fraud case",https://timesofindia.indiatimes.com/india/ed-attaches-uk-based-high-value-property-located-near-buckingham-palace-in-rs-1400-crore-bank-fraud-case/articleshow/126270981.cms,"ED attaches UK-based high-value property located near Buckingham Palace in Rs 1,400 crore bank fraud case

NEW DELHI: The Enforcement Directorate (ED) has attached a United Kingdom-based high-value property located near Buckingham Palace in a Rs 1,400 crore bank fraud case, the agency said on Wednesday.The property, valued at approximately Rs 150 crore, is being held under the beneficial ownership of businessman Nitin Shambhukumar Kasliwal and his family members. Kasliwal, former Chairman and Managing Director of S Kumars Nationwide Limited, is accused of defrauding a consortium of Indian banks by Rs 1,400 crore, according to multiple First Information Reports.ED's Indore sub-zonal office issued the Provisional Attachment Order (PAO) on December 30, 2025, to attach the high-value property.The move comes a week after the ED, during the course of investigation, conducted searches under section 17 of the Prevention of Money Laundering Act (PMLA), 2002, on December 23 and seized various incriminating records along with digital devices in the case.Officials in the ED said a detailed analysis of the seized material revealed that ""Kasliwal had established a complex network of trusts and companies in multiple offshore tax havens, including the British Virgin Islands (BVI), Jersey, and Switzerland.""""The investigation uncovered that Nitin Kasliwal had set up a trust named Catherine Trust (formerly Surya Trust), in which he and his family members were the primary beneficiaries. This trust controlled a company based in Jersey and the British Virgin Islands, 'Catherine Property Holding Limited (CPHL)', which in turn held ownership of the said high-value immovable property in London,"" the agency said in a statement.During the course of investigation, ED has found that ""Kasliwal, through S Kumars Nationwide Limited, cheated the consortium of banks to the tune of Rs. 1400 crore and also diverted the funds outside India in the guise of foreign investments and thereafter acquired immovable assets outside India which were concealed through a complex structure of private trust and companies in foreign jurisdictions.""","The property, valued at approximately Rs 150 crore, is being held under the beneficial ownership of businessman Nitin Shambhukumar Kasliwal and his family members. The move comes a week after the ED conducted searches under section 17 of the Prevention of Money Laundering Act (PMLA), 2002, on December 23.","https://static.toiimg.com/thumb/msid-126272164,imgsize-38718,width-400,resizemode-4/ed-attaches-uk-based-high-value-property-located-near-buckingham-palace-in-rs-1400-crore-bank-fraud-case.jpg"
Changes to 'Dhurandhar' by filmmakers: I&B ministry,https://timesofindia.indiatimes.com/india/ib-ministry-denies-directing-edits-to-dhurandhar-says-changes-proposed-by-makers/articleshow/126289371.cms,"Movie poster

NEW DELHI: The Information and broadcasting ministry on Thursday denied reports claiming that it had directed edits to Hindi film 'Dhurandhar', asserting that no instructions were issued by govt to mute words or revise dialogues. Responding to reports that the Ranveer Singh-starrer's theatrical cut was altered following its intervention, the ministry said, ""No directions were issued by the ministry in this matter.""Clarifying the certification process, it said the changes under scrutiny were initiated by the filmmakers. ""Changes in the revised version were proposed by the applicants/producers and are being examined by CBFC under the routine certification process prescribed in Cinematograph Act and Rules,"" it said.It explained that any revisions permitted were strictly in line with established norms. ""The revisions were permitted in accordance with CBFC guidelines, which require that visuals or words contemptuous of racial, religious or other groups are not presented. The process was carried out as per Rule 31 of the amended Cinematograph Act,"" the statement said.",No instructions were issued by govt to mute words or revise dialogues. Ranveer Singh-starrer's theatrical cut was altered following its intervention. Changes in the revised version were proposed by the applicants/producers and are being examined by CBFC.,"https://static.toiimg.com/thumb/msid-126289365,imgsize-837829,width-400,resizemode-4/article-91.jpg"
NMC clears 171 additional PG seats for 2025-26 academic year,https://timesofindia.indiatimes.com/india/nmc-clears-171-additional-pg-seats-for-2025-26-academic-year/articleshow/126293938.cms,"Representational image

NEW DELHI: Medical aspirants seeking postgraduate admissions will get a wider choice this year after the National Medical Commission (NMC) approved 171 additional PG seats across medical colleges and directed counselling authorities to include them without waiting for formal permissions.According to a public notice, the 171 additional seats span key clinical and diagnostic specialties, including general medicine, general surgery, anaesthesiology, obstetrics and gynaecology, paediatrics, radiology, dermatology, emergency medicine, psychiatry, orthopaedics, respiratory medicine and pathology.Colleges across multiple states - including Uttar Pradesh, Maharashtra, Tamil Nadu, Gujarat, Odisha, Rajasthan, Andhra Pradesh, Arunachal Pradesh, West Bengal, Chhattisgarh and Haryana - have received additional seats under the appeal process.In a notice issued on Dec 31, 2025, NMC's Medical Assessment and Rating Board said postgraduate seats granted by the First Appeal Committee for the 2025-26 academic year will be treated as valid for the counselling process. Counselling authorities have been told they need not wait for letters of permission (LoPs) from individual institutions to proceed.The additional seats were approved after medical colleges challenged earlier MARB decisions under provisions of NMC Act, 2019.These appeals were examined by the First Appeal Committee in meetings held on Dec 22 and 23, following which extra seats were sanctioned.The commission clarified that the list uploaded on the NMC website would itself serve as the valid document for counselling, ensuring that eligible PG seats are not lost due to administrative delays. Formal LoPs for the newly sanctioned seats, it said, will be issued shortly.Officials said the move is aimed at maximising seat utilisation while retaining regulatory oversight through the appeal mechanism. State medical education departments and counselling authorities have been instructed to act on the decision immediately.For thousands of PG aspirants, the approval offers additional opportunities at a time when competition for postgraduate medical seats remains intense.","The National Medical Commission (NMC) approved 171 additional PG seats across medical colleges. Counselling authorities have been told they need not wait for letters of permission (LoPs) from individual institutions. The additional seats were approved after medical colleges challenged earlier MARB decisions under provisions of NMC Act, 2019.","https://static.toiimg.com/thumb/msid-126293936,imgsize-922492,width-400,resizemode-4/delhi-amp-trichy-doctors-indian-conduits-of-kidney-racket-sit.jpg"
India saved its tigers. Now big cats are running out of room,https://timesofindia.indiatimes.com/india/india-saved-its-tigers-now-big-cats-are-running-out-of-room/articleshow/126281013.cms,"A tigress with her cub

Where Tigers Get Caught Between Faith And Tourism | I Witness

Testing human tolerance

In early 2025, a motion-sensor camera high on the hills of Purulia district, West Bengal, blinked to life. The image it captured was unremarkable in isolation: the grainy silhouette of a tiger crossing scrubland. But for residents and forest officials, it was extraordinary. Purulia had never yielded a tiger sighting before. No camera traps, no spoor, no local memory of the big cat. The photograph was more than a record; it was a signal - that the landscape had begun to shift in ways people were only beginning to comprehend.Within weeks, researchers traced the animal's path through a series of camera traps: March 2024 in Chhattisgarh's Balrampur forest division; summer sightings in Jharkhand's Palamau Tiger Reserve; and by January 2025, in Bengal's Purulia and Jhargram. The tiger had wandered roughly 500 km through human-dominated terrain, crossing administrative and ecological boundaries in search of space.The tiger's journey is not an anomaly. It is part of a pattern. India's wild tiger population, once on the brink of collapse, has surged from 1,411 in 2006 to approximately 3,682 in the latest estimate - almost 75% of the world's wild tiger population. This rebound, often hailed as a conservation landmark, is the centrepiece of Project Tiger's story.Conservationists and forest staff took pride in the numbers, even as they now grapple with the consequences of unprecedented success.Scientists at the Wildlife Institute of India (WII) estimate that nearly 30% of these 3,682 tigers - more than 1,100 animals - now roam outside notified tiger reserves, sharpening the challenge of coexistence. WII director GS Bhardwaj told TOI that a dedicated Tiger Outside Tiger Reserves (TOTR) project has already been initiated from 2025, with the focus on conserving both tigers and people. The project targets forest divisions that host dispersing tigers, aims to mitigate human-tiger conflict linked to TOTR, and envisages strengthening protection regimes beyond reserve boundaries.But there is a paradox embedded in that success: Project Tiger became ""a little too successful"", as an expert said. As core reserves fill, tigers disperse farther - into buffers, across states and into human landscapes, fuelled by instinct, not intention. Tigers are inherently territorial; adults typically range across tens to hundreds of square km depending on prey and habitat. Studies in Indian landscapes have shown female home ranges between 30 and 64 sq km, with males sometimes exceeding 170 sq km. The average, even in prey-rich forests, often approaches 90 sq km.Bhardwaj said WII has advised all states to strengthen wildlife protection outside tiger reserves and carry out intensive monitoring of tigers moving beyond them, so that encounters do not escalate into human casualties or retaliatory killings.In the central Indian landscape - the broad swath of forests, hills and plateaus that includes Madhya Pradesh, Chhattisgarh and surrounding states - pressure is particularly acute. Bandhavgarh Tiger Reserve, for instance, has one of the highest tiger densities in the country. A state-level review found territorial fights to be a major cause of death among tigers there between 2021 and 2023, reflecting intense competition for space and mates. With older males holding core territories, younger animals are pushed into buffer zones and near villages, raising the frequency of conflict. Bandhavgarh registers more than 2,000 cattle kills annually - a stark indicator of how tigers are pressed against the edges of ecological and social boundaries.Not all reserves exhibit the same degree of crowding though. In Uttarakhand, Corbett and Rajaji tiger reserves are approaching saturation, but nearly half of India's reserves remain below what scientists describe as their ecological capacity. Forest officials in the state have reported that Corbett can support about 20 tigers per 100 sq km, while eastern Rajaji's capacity is around 14 per 100 sq km - figures that help explain why animals increasingly stray outside protected areas.As tigers move beyond core forests, their presence ripples through local communities in palpable ways. In early 2025, in several villages in Uttar Pradesh's Pilibhit region, a prowling tiger caused schools to be closed. Children stayed home. ""Exams are coming,"" said a Class 5 student from Khalispur had then said, ""but we haven't even completed the syllabus."" Teachers refused to hold evening sessions. Parents stopped letting children walk alone. Tigers in Pilibhit often establish temporary bases in sugarcane fields, drawn by wild boars that feed on the sweet crop. Boars attract tigers. Sugarcane draws both. And between them lies the village.Elsewhere, the consequences have turned fatal. In Gadchiroli district of eastern Maharashtra, tiger numbers grew from zero to nearly 30 in five years - a startling shift in a landscape long considered tiger-scarce. With 12,000 sq km of forest, it appears generous on paper. But in practice, only about 7,000 sq km in two forest divisions is occupied. Human settlements, encroachments, and patchy prey base have constrained the actual carrying capacity. In 2024, 25 villagers died in tiger attacks across the Wadsa and Gadchiroli divisions. Two problem tigers were captured. A tigress was spared because she had cubs. Though technically capable of holding far more - by some estimates, up to 300 tigers - Gadchiroli cannot even accommodate 25 without triggering conflict.In one forest-fringe home in Jharkhand, a tiger entered a family's hut, settled on a wooden cot, and waited. The family, stunned, watched in silence from a corner of the room. The tiger had wandered far from mapped territory. Its entry was a mistake. Its departure, hours later, was quiet. Nobody was hurt. The event became a story of awe and fear.These tigers are no longer sentinels of wilderness. They are migrants. Monarchs in exile. Each one a ghost of ecological success, walking into fields, hamlets and homes - not out of aggression, but because the forests behind them are full.In some landscapes, officials speak of ""social carrying capacity"" - not how many tigers the habitat can sustain, but how many human communities are willing to tolerate. In parts of Uttarakhand, tiger-inflicted fatalities have surpassed leopard attacks for the first time in years. In response, village volunteers called Bagh Mitras have been trained to monitor tiger movement and alert forest departments. Some report sightings through mobile apps. Others simply listen for silence - the kind that descends before a tiger appears.Translocation - moving tigers from dense parks to underpopulated reserves - has been tried. Odisha attempted it in 2018, without success. Intra-state efforts show more promise, but officials now lean toward corridor consolidation. Movement is safer when it's natural. But for that, corridors must exist - not just on policy maps, but on the ground.In the Terai Arc, at least 10 critical corridors are under threat from habitat loss and development. In central India, linear infrastructure - railways, highways, power lines - cuts across migration routes. And yet, some reserves offer hope. In Tadoba, tiger density rose 30% over a decade, with buffer populations expanding as prey base improved. In Sundarbans, the reserve is being expanded by more than 1,000 sq km to create space for 101 tigers now crowding its mangrove heartland.India now has more than 50 tiger reserves. Some are full. Others still hold ecological potential, if prey can be restored. The key lies not just in creating new habitat, but in connecting the old - allowing dispersing tigers to move without triggering conflict.Perhaps the tiger today is not just an emblem of wilderness, but a kind of refugee of success - displaced by recovery. The Purulia tiger's trek is both a biometric trail and a metaphor. It is the story of a tiger with nowhere to go, walking east until the land gave way to politics and fear.In the empty classrooms of Pilibhit, in the living room of a Jharkhand family, in the cattle sheds of Bandhavgarh, and in the forests of Gadchiroli now marked by claw and memory, India's national animal is no longer confined to the forest. The tiger has returned. The question is - where can it stay?","India's wild tiger population has surged from 1,411 in 2006 to approximately 3,682 in the latest estimate. As core reserves fill, tigers disperse farther - into buffers, across states and into human landscapes. Tigers are inherently territorial; adults typically range across tens to hundreds of square km depending on prey and habitat.","https://static.toiimg.com/thumb/msid-126281010,imgsize-111780,width-400,resizemode-4/tiger-project-ntca.jpg"
