Article Title,Article Link,Article Text,Article Summary,Article Image
"Cyclone ‘Senyar’ alert: IMD sounds heavy rainfall alert for several Tamil Nadu districts, schools closed in Rameswaram; key points",https://timesofindia.indiatimes.com/city/chennai/cyclone-senyar-alert-imd-sounds-heavy-rainfall-alert-for-several-tamil-nadu-districts-schools-closed-in-rameswaram-key-points/articleshow/125581734.cms,"Tamil Nadu braces for heavy rains as Cyclone Senyar is set to form over the Bay of Bengal

Cyclone Montha: Army, NDRF On Alert As Twin Cyclonic Systems Build Up In Arabian Sea & Bay Of Bengal

Also Read:

CHENNAI: Several north and delta districts of Tamil Nadu, including Chennai, are bracing for heavy to very heavy rainfall as the season’s second cyclonic storm is expected to develop over the Bay of Bengal by November 27. Once formed, the system will be named Cyclone Senyar, a name given by the UAE meaning lion.The India Meteorological Department (IMD) has warned of extremely wet conditions across the state over the next two-three days. Very heavy rainfall of 12–20cm is likely in three delta districts on November 28, seven districts including Chennai on November 29, and Tiruvallur on November 30.In view of the worsening weather, authorities in Rameswaram have declared a holiday for schools on Wednesday. IMD officials said the twin weather systems — Cyclone Senyar over the Strait of Malacca and a well-marked low-pressure area over the southwest Bay of Bengal — will influence rainfall intensity and movement in the coming days.* Cyclone Senyar forms over the Strait of Malacca and adjoining Northeast Indonesia after intensifying from a deep depression; centered at 5.0°N, 98.0°E at 5:30 am on Nov 26.* The cyclone is 100km east of Kuta Makmur (Indonesia), 260km WSW of George Town (Malaysia), 600km ESE of Nancowry, and 740km SE of Car Nicobar.* It will maintain cyclonic storm intensity for 24 hours, cross the Indonesia coast today (Nov 26), then move west-southwest before recurving eastwards over the next 48 hours.* A well-marked low-pressure area persists over the southwest Bay of Bengal, Southeast Sri Lanka & Equatorial Indian Ocean, likely to intensify into a depression within 24 hours.* IMD forecasts formation of a cyclonic storm in the Bay of Bengal by Nov 27, expected to enhance rainfall over Tamil Nadu.Heavy rain warning* Nov 28: Heavy to very heavy rain in three delta districts* Nov 29: Very heavy rain in seven districts, including Chennai* Nov 30: Warning for Tiruvallur* Schools shut in Rameswaram on Wednesday due to persistent rain.* Authorities urge residents in vulnerable coastal regions to stay updated on weather advisories.","The India Meteorological Department (IMD) has warned of extremely wet conditions across the state over the next two-three days. Very heavy rainfall of 12–20cm is likely in three delta districts on November 28, seven districts including Chennai on November 29, and Tiruvallur on November 30. Authorities in Rameswaram have declared a holiday for schools on Wednesday.","https://static.toiimg.com/thumb/msid-125581754,imgsize-850393,width-400,height-225,resizemode-72/tamil-nadu-braces-for-heavy-rains-as-cyclone-senyar-is-set-to-form-over-the-bay-of-bengal.jpg"
'DK Shivakumar will be CM soon': Karnataka Congress MLA says 'he's 200% sure',https://timesofindia.indiatimes.com/city/bengaluru/dk-shivakumar-will-be-cm-soon-karnataka-congress-mla-says-hes-200-sure/articleshow/125577337.cms,"Karnataka deputy CM DK Shivakumar

'All 140 MLAs Are Mine': DK Shivakumar Amid Karnataka CM Speculation; Siddaramaiah Responds

BENGALURU: Ramanagara MLA Iqbal Hussain reiterated his confidence that the deputy chief minister would eventually take charge, declaring he was ""200 per cent"" sure DK Shivakumar will become the next chief minister.""I always stand by that statement… 200 per cent, he will become the CM soon. The high command will decide. As our leader (Shivakumar) said, the transfer of power is a secret deal among five to six party leaders, and those five to six people will decide,"" he said.A group of Karnataka Congress legislators who travelled to New Delhi to meet senior party leaders said on Tuesday that the high command would take a final call on the demand to elevate DK Shivakumar as the next chief minister.The visit comes amid mounting speculation over a possible change of leadership, with the Congress government completing the halfway mark of its five-year term on 20 November.According to party insiders, six MLAs seen as close to Shivakumar flew to the capital on Sunday night for discussions with central leaders. More legislators are expected to follow.Last week, around ten MLAs had also met Congress president Mallikarjun Kharge.Magadi MLA H C Balakrishna stressed that the decision on who should lead the government rests entirely with the central leadership, but urged them to settle the uncertainty.""We went to discuss with the high command to clear the confusion because a final decision is needed. Who becomes CM is not important; the current situation is detrimental to the Congress party. The high command should intervene and put an end to this,"" he said, declining to say whether Mr Shivakumar’s elevation had specifically been discussed.Others used the Delhi meetings to push for younger leaders and fresh faces to be considered during the proposed cabinet reshuffle . Maddur MLA K M Uday said they had received positive signals from the leadership.He said senior MLAs had also urged the high command to end the “confusion” surrounding the leadership issue, adding that a decision was expected soon.Responding to reports that MLAs loyal to him had travelled to Delhi seeking his elevation, Shivakumar distanced himself from the lobbying efforts.""I have not called or spoken to any of them. I am not asking why they went. I don't need to,"" he told reporters, adding that they might have gone in search of ministerial roles.",Karnataka Congress legislators meet senior party leaders in New Delhi. They say the high command will take a final call on the demand to elevate DK Shivakumar as the next chief minister. Six MLAs seen as close to Shivak Kumar flew to the capital on Sunday night for discussions with central leaders.,"https://static.toiimg.com/thumb/msid-125577356,imgsize-1064162,width-400,height-225,resizemode-72/karnataka-deputy-cm-dk-shivakumar.jpg"
"Explained: How new labour laws could hit your take-home salary, increase your provident fund & gratuity contributions",https://timesofindia.indiatimes.com/business/india-business/explained-how-new-labour-laws-could-hit-your-take-home-salary-increase-your-provident-fund-gratuity-contributions/articleshow/125515961.cms,"Currently, PF contributions are set at 12% of the basic salary. (AI image)



.

Explained: How new labour laws could hit your take-home salary, increase your provident fund & gratuity contributions

New Labour Codes: Why will your take home pay go down?

Mandatory retirement contributions, including provident fund and gratuity payments, are set to rise following the implementation of the Code on Wages.

and payments, are set to rise following the implementation of the Code on Wages. The new regulation requires that an employee's basic salary must constitute at least 50% of their total CTC, or meet the government-specified percentage.

This adjustment will lead to higher contributions as both PF and gratuity calculations are based on an individual’s basic pay .

. Whilst this change ensures enhanced retirement benefits for workers, it also means reduced take-home pay, as the increased contributions will come from the existing CTC.

The regulation concerning basic salary aims to stop organisations from intentionally maintaining low basic salary whilst increasing allowances to reduce their obligations towards retirement benefits and gratuity.

Currently, PF contributions are set at 12% of the basic salary, whilst gratuity payments are determined by the final basic pay and tenure at an organisation.

New labour Codes: Impact on Take-Home Salary

.

New Labour Codes: Top points to know

.

New labour codes 2025: In a significant move, the government has notified the new labour laws that may require companies to ensure that the basic salary makes up at least 50% of the total cost-to-company (CTC). This could potentially prompt changes in how pay packages are structured. As a result, for many employees, take-home pay could come down over time as contributions to retirement savings are likely to rise.With the new labour codes, the Narendra Modi government has unified 29 labour-related central laws into four extensive Labour Codes: the Code on Wages (2019), Industrial Relations Code (2020), Code on Social Security (2020), and Occupational Safety, Health and Working Conditions (OSHWC) Code (2020). Starting November 21, 2025, these Codes seek to simplify regulatory compliance, enhance worker safeguards, and modernise India's workforce regulations in accordance with contemporary economic conditions.The Code on Wages became operational on Friday, with the government expected to announce detailed rules within the next 45 days. Companies will need to restructure their salary frameworks to comply with these new regulations.According to experts, employees might receive reduced take-home pay under the new rules, as both provident fund and gratuity contributions would increase within the existing CTC framework.""The new labour codes unify the definition of 'wages' under the Code on Wages and Social Security. This would mean better retirement security through higher gratuity and provident fund but a possible dip in take-home pay if employers restructure allowances downward to offset costs,"" Suchita Dutta, executive director of the Indian Staffing Federation was quoted as saying by ET.The standardisation of wage definitions across labour codes ensures uniformity in computing social security benefits.""Wages now include basic pay, dearness allowance and retaining allowance; 50% of the total remuneration (or such percentage as may be notified) shall be added back to compute wages, ensuring consistency in calculating gratuity, pension and social security benefits,"" explains Anjali Malhotra, partner at professional services firm Nangia Group.According to Puneet Gupta, partner, People Advisory Services at EY India, the implementation of labour codes could result in increased gratuity payments since calculations will be based on ""wages"", encompassing basic salary and all allowances, excluding HRA and conveyance allowance.The new labour codes introduce universal minimum wages for all employees across organised and unorganised sectors, replacing the earlier system that covered only about 30% of workers.A statutory floor wage will be set by the government based on minimum living standards, and no state can fix wages below this benchmark.A uniform definition of wages now applies, where basic pay, dearness allowance, and retaining allowance together must account for at least 50% of total remuneration.The codes mandate gender equality, prohibiting discrimination in hiring, wages, or employment terms for similar work, along with universal wage payment coverage that ensures timely payments and prevents unauthorised deductions for employees earning up to ₹24,000 per month. Overtime compensation must be paid at twice the normal rate.Several compliance and enforcement reforms are included as well. Decriminalisation of offences replaces imprisonment with monetary penalties for first-time violations, and compounding of offences allows certain fines to be settled without prosecution.The threshold for government approval of lay-offs, retrenchment, or closure has increased from 100 to 300 workers, with states allowed to raise it further.Work-from-home is formally recognised in services sectors based on mutual agreement, while dispute resolution will be handled by two-member tribunals for faster outcomes.A mandatory 14-day strike notice aims to prevent sudden disruptions and includes mass casual leave within the definition of a strike.The codes extend social protections to new categories, requiring aggregators to contribute 1–2% of annual turnover towards gig and platform workers’ social security (capped at 5% of their payments).Fixed-term employees become eligible for gratuity after just one year of continuous service instead of five.The inspector-cum-facilitator system introduces randomised, technology-driven inspections to reduce harassment and improve transparency. Compliance is simplified through digitisation of records, as well as a streamlined one license, one registration, one return system.Employers must issue formal appointment letters detailing job roles, wages, and social security.The codes also expand labour flexibility and reduce burdens on small units.Night shifts for women are permitted in all establishments with their consent and safety measures. Contract labour rules include an all-India licence valid for five years.Factory thresholds have been raised to 20 workers for units using power and 40 for those without, reducing compliance requirements for smaller factories.Finally, working hours remain capped at 8 hours per day and 48 hours per week, with flexible weekly structures allowed through mutual consent.","Mandatory retirement contributions, including provident fund and gratuity payments, are set to rise following the implementation of the Code on Wages. The new regulation requires that an employee's basic salary must constitute at least 50% of their total CTC, or meet the government-specified percentage.","https://static.toiimg.com/thumb/msid-125516988,imgsize-41896,width-400,resizemode-4/new-labour-code-impact.jpg"
EC empowered to conduct SIR; we will fix flaws if needed: SC,https://timesofindia.indiatimes.com/india/ec-empowered-to-conduct-sir-we-will-fix-flaws-if-needed-sc/articleshow/125602065.cms,"EC To Launch SIR in 12 States and UTs in Phase 2, CEC Gyanesh Kumar Says Zero Complaints in Bihar

CJI cites Bihar, says no impact on ground

NEW DELHI: Supreme Court on Wednesday emphatically said the Election Commission is statutorily and constitutionally empowered to conduct the pan-India Special Intensive Revision (SIR) of electoral rolls and that it would not stall the process, while assuring that it would order corrective measures, if any irregularities were brought to its notice.CJI Surya Kant and Justice Joymalya Bagchi rejected arguments questioning the justification of SIR, with the former saying not a single objection was filed against the updation of electoral rolls after the process was fine-tuned at the apex court's instance.Appearing for RJD MP Manoj Jha, senior advocate Kapil Sibal commenced arguments questioning SIR's constitutional validity, saying there are millions of illiterate people who can't fill voter enumeration forms, which have become a tool for exclusion.""Why should a voter be asked to fill an enumeration form at all? Who is EC to determine whether a person is an Indian citizen or not? Aadhaar card mentions the place of residence and date of birth, which should be enough for persons above 18 years to get enrolled as voters if they give a self-declaration that they are Indian citizens,"" Sibal argued.CJI Kant said, ""Sibal, you have experience of contesting elections in Delhi, where many people do not vote.But in rural areas, elections are a festival. There, everyone is concerned about their votes. A maximum number of people participate, and everyone knows who a resident of the village is.""Senior advocate Kapil Sibal said such an exercise had never been conducted in India because the ethos of our 'Poorna Swaraj' mantra from the freedom struggle days was inclusionary, not exclusionary. Justice Bagchi said, ""It is a matter of record that in 2012 and 2014, the number of voters exceeded the total adult population. Is it not necessary to correct the electoral roll? If EC has a doubt about someone's citizenship, is it not entitled to inquire about it? If EC carries out an aggressive revision of the electoral roll, there will be deletions. ""CJI Kant said the SIR of Bihar's electoral rolls was a prime example. ""Initially, the court was told that crores of voters are being deleted. We issued certain directions to streamline the process. Eventually, what happened? Among the deletions from the voter list were those found to have died or migrated outside. No one filed an objection. We did not find any impact on the ground level,"" he said.The bench's observations led Sibal to switch from highlighting the ill-impact of SIR to focus on questioning its constitutional validity. ""The process must be inclusive and the burden of proving citizenship cannot be fastened on the voters. If there is a doubtful voter, his/her case should be referred to the competent authority to determine the citizenship issue. A booth level officer (BLO) has no right to inquire into the citizenship of a voter,"" he said. Arguments would continue Thursday.",Supreme Court emphatically said the Election Commission is statutorily and constitutionally empowered to conduct the pan-India Special Intensive Revision (SIR) of electoral rolls. Chief Justice Surya Kant and Justice Joymalya Bagchi rejected arguments questioning the justification of SIR.,"https://static.toiimg.com/thumb/msid-125602077,imgsize-1578508,width-400,resizemode-4/.jpg"
2 crore Aadhaar numbers of deceased deactivated in national clean-up,https://timesofindia.indiatimes.com/india/2-crore-aadhaar-numbers-of-deceased-deactivated-in-national-clean-up/articleshow/125602357.cms,"NEW DELHI: The Unique Identification Authority of India ( UIDAI ) has deactivated over two crore Aadhaar numbers belonging to deceased individuals as part of a nationwide clean-up drive to strengthen the accuracy and reliability of the Aadhaar database.Officials said the exercise is aimed at preventing identity fraud and ensuring that govt benefits linked to Aadhaar are accessed only by eligible beneficiaries. According to UIDAI, the deactivation process draws on data sourced from the Registrar General of India (RGI), state and Union Territory administrations, the public distribution system, the National Social Assistance Programme and other departments that maintain death-registration records.UIDAI emphasises that Aadhaar numbers are never reassigned, even after the holder's death, making timely deactivation crucial to avoid potential misuse - such as unauthorised withdrawals, fraudulent benefit claims or impersonation. ""Ensuring the database remains current is essential for the integrity of Aadhaar-linked services,"" an official said.To make the process easier for families, UIDAI earlier this year launched a digital facility on the myAadhaar portal.","Officials said the exercise is aimed at preventing identity fraud and ensuring that govt benefits linked to Aadhaar are accessed only by eligible beneficiaries. The deactivation process draws on data sourced from the Registrar General of India (RGI), state and Union Territory administrations, the public distribution system.","https://static.toiimg.com/thumb/msid-125602364,imgsize-645714,width-400,resizemode-4/.jpg"
'Delhi's AQI improving': GRAP-3 measures revoked; stage 1 and 2 to remain in force,https://timesofindia.indiatimes.com/india/delhis-aqi-improving-grap-measures-under-stage-3-revoked-stage-1-and-2-to-remain-in-force/articleshow/125591542.cms,"Air pollution in Delhi

Delhi Air Pollution Protest At India Gate Turns Violent Amid ‘Madvi Hidma Amar Rahe’ Slogans

(With agency inputs)

NEW DELHI: The Commission for Air Quality Management’s (CAQM) sub-committee on Wednesday revoked stage 3 measures under the Graded Response Action Plan (GRAP), citing a ""steady improvement"" in Delhi’s air quality over the past three days.However, the panel clarified that restrictions under stages 1 and 2 will be intensified and continue to remain in force until further orders.""The AQI of Delhi has been improving since last 3 days and has been recorded 327 today. Further, the forecast by IMD/IITM predicts the AQI to remain in 'very poor' category in the coming days,"" the sub-committee said in its order.""The sub-committee, accordingly, decided to revoke its orders dated November 11, for invoking actions under stage 3 ('severe' air quality) schedule of GRAP (modified on November 21), with immediate effect. Actions under stage-1 and 2, shall, however, remain invoked,"" it added.The panel further stated that it will keep a “close watch” on the air quality situation and issue further directions, if and when required.The national capital has been battling “very poor” air for nearly two weeks. At 7 am on Wednesday, AQI levels hovered between 348 and 377 across key locations — 358 at India Gate, 363 in the Ghazipur area, 348 near AIIMS and 377 in Bawana.According to the Central Pollution Control Board (CPCB), an AQI of 301–400 falls in the “very poor” category, while anything above 400 is classified as “severe.”",The Commission for Air Quality Management’s (CAQM) sub-committee on Wednesday revoked stage 3 measures under the Graded Response Action Plan. The panel clarified that restrictions under stages 1 and 2 will be intensified and continue to remain in force until further orders.,"https://static.toiimg.com/thumb/msid-125591760,imgsize-530904,width-400,resizemode-4/delhi-air-pollution.jpg"
NMC rejects Vaishno Devi med college request to place all its MBBS seats under all-India quota,https://timesofindia.indiatimes.com/india/nmc-rejects-vaishno-devi-med-college-request-to-place-all-its-mbbs-seats-under-all-india-quota/articleshow/125602507.cms,"Representative image

NEW DELHI: National Medical Commission (NMC) has turned down a proposal from Shri Mata Vaishno Devi Institute of Medical Excellence (SMVDIME), Katra, seeking to place 100% of its 50 MBBS seats under the All-India Quota (AIQ) through the Medical Counselling Committee (MCC).An NMC official said the commission did not approve the request as it would go against policy. Such decisions require broader consultation with states and stakeholders, and existing regulations cannot be amended for a single institution. Under current rules, 85% of MBBS seats are reserved for the state quota and 15% for the All-India Quota. ""This is not just about SMVDIME. Any change will have to be worked out with all states and stakeholders on board,"" the official said.The proposal may be placed before the board for further deliberation if needed, but the commission has declined it for now.The SMVDIME proposal comes at a time when the institution has found itself at the centre of controversy. Several Hindu organisations, including Sanatan Dharam Sabha and Vishwa Hindu Parishad, have protested over 43 out of the first batch of 50 MBBS students reportedly being from a particular community.The groups hold that since the institute is funded by devotees of Shri Mata Vaishno Devi, it should attract students from across the country rather than just one community or region.""As of now, 100% of candidates are from the state,"" an official confirmed, adding the college was seeking all-India quota allocation to widen the pool for intake of students.On Sept 8 last year, SMVDIME - located at the base camp of the Shri Mata Vaishno Devi shrine - was sanctioned 50 MBBS seats, paving the way for admissions to its first batch in the 2025-26 academic session.The institute began functioning in Nov last year from the administrative block of the Shri Mata Vaishno Devi University.","Shri Mata Vaishno Devi Institute of Medical Excellence sought to place 100% of its 50 MBBS seats under the All-India Quota (AIQ) National Medical Commission (NMC) has turned down the proposal. Under current rules, 85% of MB BS seats are reserved for the state quota and 15% for the All India Quota. Several Hindu organisations have protested over 43 out of the first batch of 50 students reportedly being from a particular community.","https://static.toiimg.com/thumb/msid-125602515,imgsize-469249,width-400,resizemode-4/doctor_ians.jpg"
