Article Title,Article Link,Article Text,Article Summary,Article Image
'Need real oxygen of friends and family': Sweden NRI says loneliness abroad worse than AQI back home; claims every place has a cost,https://timesofindia.indiatimes.com/india/need-real-oxygen-of-friends-and-family-sweden-nri-says-loneliness-abroad-worse-than-aqi-back-home-claims-every-place-has-a-cost/articleshow/125581526.cms,"Picture source: Ankur Tyagi's website

Delhi Air Pollution Protest At India Gate Turns Violent Amid ‘Madvi Hidma Amar Rahe’ Slogans

An Indian man living in Sweden has gone viral after saying he is returning to Delhi because, despite Europe’s clean air and smooth systems, life in India is emotionally easier.Ankur Tyagi wrote on X on Monday that people often assume Europe means clean air, good roads and smooth systems, but the reality of building a life there is very different.His post came as a response to another user who said they understood why many people want to leave India, citing low talent density, high real estate prices, pollution, corruption and high taxes.""You do everything alone. You cook, clean, manage bills, raise your kid and fight the silence that hits you every single winter,"" Ankur said.He said friends are polite but distant and community is rare, unlike India where there is chaos but also constant human contact.He says, ""Community is rare. Back home, you fight corruption and chaos but at least you have people around you. In West problems are different and they cut deeper in ways you can’t explain unless you’ve lived it.""Ankur said he is returning to Delhi on 5 December despite the city’s pollution levels. “Every place has a cost. Most of us are just learning which costs we can survive. I’m coming to Delhi on 5 December,” he said, adding he needed “some real oxygen now of friends and family.See you soon, India,” he signed off.Also read: ‘Felt like a burden’: NRI couple says shift from US to India brought ‘peace of mind’ — viral video The man has been living in Sweden since 2021. His post, which received over 63,000 views and strong reactions.One person from Paris wrote that they agreed with him completely, saying that every place has pros and cons but they would still choose India. They said that if India cleaned up its cities, many people would return.Another person said productive Europeans themselves were leaving Europe because of limits on growth. A third user shared that people who move young can integrate more easily, but those who arrive later often struggle with language and identity.Someone else warned him to be prepared for Delhi’s pollution, sharing how a colleague fell sick for a week after flying in from Kerala’s clean air.Recently, a viral Instagram video also showed a US-based couple explaining why they were moving back to India after 17 years abroad. The woman said motherhood, short maternity leave and rising healthcare costs in the US made life very stressful. She said India offered faster medical care, easier access to doctors and stronger family support.","Ankur Tyagi wrote on X that people often assume Europe means clean air, good roads and smooth systems. He said friends are polite but distant and community is rare, unlike India where there is chaos but also constant human contact. His post, which received over 63,000 views and strong reactions, went viral.","https://static.toiimg.com/thumb/msid-125582606,imgsize-75890,width-400,resizemode-4/screenshot-2025-11-26-123141.jpg"
PM Modi & RSS reading Preamble a victory for founding fathers: Congress,https://timesofindia.indiatimes.com/india/pm-modi-rss-reading-preamble-a-victory-for-founding-fathers-congress/articleshow/125602184.cms,"File photo



PM Modi Pens Powerful Letter On Duties And Democracy, Reflects On His Constitutional Journey

NEW DELHI: Claiming RSS had opposed the newly adopted Constitution by burning the effigy of B R Ambedkar at a rally in Ramlila Maidan in 1949, Congress president Mallikarjun Kharge said PM Narendra Modi and RSS offering flowers to Ambedkar and reading the Preamble mark the biggest victory for the founding fathers of the republic.""Today Modi lectures us on colonisation, but they belong to an ideology that boycotted the freedom struggle and sided with the British,"" he said, adding, ""People know BJP and RSS are destroying the Constitution, and their show of respect for it is a sham.""As it participated in the Constitution Day celebrations, Congress also held a nationwide protest - ""samvidhan bachao divas"" - to highlight ""the growing attack on the Constitution marked by systematic vote theft, abuse of institutions, dubious-SIR driven attempts to distort the electoral rolls"". The protest was held in all the districts, the party said.Kharge said secularism, harmony and equality became India's identity because of the Constitution, but ""that identity is now under a serious threat"". He added, ""Today, there is an urgent need to safeguard the fundamental principles of the Constitution - justice, equality, liberty, fraternity, secularism and socialism.""Leader of opposition in Lok Sabha Rahul Gandhi said the Constitution represents a sacred promise of equality and justice to every citizen, irrespective of religion, caste, region, language or social status. ""Let us pledge that we will not allow any attack on the Constitution. It is my duty to protect the Constitution, and I will be the first to oppose any assault on it,"" he said.","Congress president Mallikarjun Kharge said PM Narendra Modi and RSS offering flowers to Ambedkar and reading the Preamble mark the biggest victory for the founding fathers. Congress also held a nationwide protest - ""samvidhan bachao divas"" - to highlight ""the growing attack on the Constitution""","https://static.toiimg.com/thumb/msid-125602193,imgsize-487598,width-400,resizemode-4/.jpg"
"At PM Modi-Putin meet, India to seek 5 more S-400 squadrons",https://timesofindia.indiatimes.com/india/at-modi-putin-meet-india-to-seek-5-more-s-400-squadrons/articleshow/125598457.cms,"Modi-Putin Bonhomie STUNS Trump; India To Make SJ-100 Aircraft With U.S.-Sanctioned Russian Firm

NEW DELHI: India's plan to acquire another five squadrons of the S-400 Triumf air defence systems as well as a large number of its surface-to-air missiles for already inducted systems, which performed exceedingly well during Operation Sindoor, are likely to figure in discussions during the Modi-Putin summit here on Dec 5.However, India is yet to take a call on acquiring two-three squadrons of the Russian fifth-generation Sukhoi-57 fighter, which Moscow is aggressively hawking vis-a-vis the American F-35 Lightning-II jets, top sources told TOI on Tuesday.""There is a case for IAF to induct two-three squadrons of fifth-generation fighters as a stopgap measure till the indigenous stealth AMCA (advanced medium combat aircraft) becomes ready for induction by 2035 or so. But no decision has been made on the Sukhoi-57, F-35 or any other choice,"" a source said.Meanwhile, the PM-led cabinet committee on security (CCS) is set to approve the Rs 63,000 crore upgrade of the first lot of 84 Sukhoi-30MKI fighters - IAF has 259 such Russian-origin jets - with advanced radars, avionics, longer-range weapons and multi-sensor fusion to ensure they are capable of air combat for another 30 years. ""While the upgrade will be carried out indigenously, Russia will have some role in it,"" another source said.India has been trying to strike a balance between its long-standing arms supplier Russia and the increasingly transactional US under the Trump administration that wants to punish countries for buying Russian oil and arms.Several defence deals are in the pipeline with the US, which has already bagged Indian contracts worth $26 billion over the last 15 years. After the over $1 billion (Rs 8,900 crore) deal with US major General Electric for another 113 GE-F404 engines to power Tejas Mark-1A fighters was inked earlier this month, CCS on Wednesday cleared a Rs 7,000 crore ""follow-on support package"" for the 24 American MH-60R Seahawk helicopters being inducted by Navy for Rs 15,157 crore.On the Russian front, Moscow has assured New Delhi it will deliver by Nov 2026 the remaining two of the original five S-400 squadrons, ordered for $5.4 billion (Rs 40,000 crore) in 2018, after a long delay due to the Ukraine war.IAF is keeping its fingers crossed. Defence ministry has also approved the Rs 10,000 crore procurement of a large number of S-400 missiles - with interception ranges of 120, 200, 250 and 380km - to replenish stocks used during the hostilities with Pakistan as well as build reserves, as was earlier reported by TOI.""While IAF has asked for five more S-400 squadrons, defence ministry has already approved a comprehensive annual maintenance contract for the systems. Russia will set up an MRO (maintenance, repair and overhaul) facility in India for them,"" the source said.Describing S-400 as a ""gamechanger"" during Op Sindoor, IAF chief Air Chief Marshal A P Singh recently said it had shot down ""at least five high-tech Pakistani fighters in the F-16 and JF-17-class"" in the ""longest kill ever achieved"" at a distance of 314km.",India is yet to take a call on acquiring two-three squadrons of the Russian fifth-generation Sukhoi-57 fighter. Moscow is aggressively hawking vis-a-vis the American F-35 Lightning-II jets. India has been trying to strike a balance between its long-standing arms supplier Russia and the increasingly transactional US under the Trump administration.,"https://static.toiimg.com/thumb/msid-125598579,imgsize-743093,width-400,resizemode-4/.jpg"
'Country with stained record of bigotry': India rejects Pak's Ram Temple remark; asks it to 'turn its gaze inwards',https://timesofindia.indiatimes.com/india/reject-them-with-contempt-they-deserve-india-on-paks-ram-temple-remark-calls-out-its-bigotry-record/articleshow/125590629.cms,"'No Moral Standing': India Slams Pakistan's Rant On Ayodhya Event, Calls Out Bigotry And Repression

NEW DELHI: India on Wednesday dismissed Pakistan’s comments on Prime Minister Narendra Modi’s participation at the Ram temple ceremony in Ayodhya, with ""the contempt they deserve”.The sharp response came a day after Pakistan’s foreign office issued a statement objecting to the flag-hosting ceremony at the Ram temple on Tuesday. The statement alleged a growing threat to religious minorities in India and claimed Muslim heritage sites were at risk from Hindu extremists.Minitry of external affairs termed the remarks politically motivated and unacceptable, holding that Pakistan has no locus standi on India’s internal matters. The MEA said Pakistan’s statements reflect a habitual pattern of interference and are aimed at provoking communal narratives.MEA Spokesperson Randhir Jaiswal said, ""We have seen the reported remarks and reject them with the contempt they deserve. As a country with a deeply stained record of bigotry, repression, and systemic mistreatment of its minorities, Pakistan has no moral standing to lecture others. Rather than delivering hypocritical homilies, Pakistan would do better to turn its gaze inwards and focus on its own abysmal human rights record.On Tuesday, Prime Minister Narendra Modi hoisted the dharma dhwaja atop the spire of Shri Ram Janmbhoomi Temple, marking the completion of the temple structure. Addressing the gathering, he said the flag symbolised civilisational resurgence and declared, “This sacred flag will stand as a testament that truth ultimately triumphs over falsehood.”The Prime Minister said democracy was deeply rooted in India’s civilisational fabric and highlighted the government’s commitment to inclusive development. He said, “Ram does not discriminate, and the government is also moving forward with the same spirit,” urging citizens to uphold unity as the nation moves toward Viksit Bharat.Calling the ceremony the fulfilment of a 500 year old resolve, Modi said longstanding wounds were beginning to heal and described Ayodhya as a rising centre where spirituality and modernity would converge. Recounting the moment of the flag installation, he said, “The process started at 11:40 PM. I pressed the button, and the flag was installed at 11:50. The entire process took 4 minutes.”PM Modi held a roadshow in Ayodhya, where crowds lined the streets to welcome him. He later visited Saptmandir, Sheshavtar Mandir, Mata Annapurna Mandir and performed Darshan and Pooja at the Ram Lalla Garbha Grah.",Pakistan's foreign office issued a statement objecting to the flag-hosting ceremony at the Ram temple on Tuesday. The statement alleged a growing threat to religious minorities in India and claimed Muslim heritage sites were at risk from Hindu extremists. The MEA said Pakistan’s statements reflect a habitual pattern of interference and are aimed at provoking communal narratives.,"https://static.toiimg.com/thumb/msid-125591048,imgsize-1038876,width-400,resizemode-4/pm-modi-at-ayodhya-ram-temple-flag-ceremony-pti-photo.jpg"
"Threat from AI-generated deepfakes: If all can be faked, how do you know what’s real?",https://timesofindia.indiatimes.com/india/threat-from-ai-generated-deepfakes-if-all-can-be-faked-how-do-you-know-whats-real/articleshow/125541544.cms,".

Deepfake Shock: Nirmala Sitharaman Reveals Fake Videos Of Herself Online, Warns Of AI’s Dark Side

Armour up with TOI to fight deepening threat of deepfakes





In a world where seeing is no longer believing, India is facing a new digital menace: AI-generated deepfakes.These hyper-realistic videos and audio clips don’t just distort reality. They manipulate public perception, spread misinformation and undermine trust in democracy itself.With 85.5 per cent of Indian households owning at least one smartphone, mobile phones have become India’s bank, classroom and television, making citizens more vulnerable to digital deception.During the 2024 elections, for instance, satirical deepfakes became a campaign tool of sorts. Apart from resurrecting dead leaders, it featured clips such as one that featured PM Narendra Modi dancing the garba with women and Kamal Nath dissing a popular welfare scheme.Though investigations and arrests followed, such videos blur the line between fact and fiction, risking the distortion of voter opinion and the integrity of the democratic process.Cybersecurity experts warn AI is also becoming a key tool in cybercrime: 80 per cent phishing campaigns in 2024 involved AI, with deepfakes exploited for scams.“When you can fake images, audio, and video, how do you know if a real video is real? Suddenly, everything is in question,” said Hany Farid, professor at the University of California, Berkeley, in a TOI interview last year about the worrying rise in AI misuse.The deepfake threat extends beyond politics. Recently, finance minister Nirmala Sitharaman highlighted the misuse of AI to clone voices and produce fake videos impersonating her, warning of potential financial scams and the erosion of public trust. “I have seen several deepfake videos of myself being circulated online, manipulated to mislead citizens and distort facts,” Sitharaman said in Mumbai. “Criminals are using AI to mimic voices, clone identities, and create lifelike videos,” she added.Given that over 97% of India’s urban youth aged 15 to 29 owns a smartphone, the impact of such misinformation on a generation is worrying, say observers. “Deepfakes began in 2016. Back then, it was a joke. But the technology has only gotten better. Earlier, there were photoshopped face swaps. Now there are lipsync fakes,” said Prof. Farid, warning that the tech has become more refined, raising the risk of harassment of women through the use of non-consensual sexual imagery.In Nov 2023, actress Rashmika Mandanna became a victim of a viral deepfake video that superimposed her face on to compromising content, sparking widespread outrage. “The very term ‘deepfake’ comes from a Reddit user who in the early days of this technology used it to create porn,” said Farid, calling the new term ‘Generative AI’ clever “rebranding” by the male-dominated tech industry.As AI evolves, India must strengthen legal frameworks, enhance digital literacy, and bring together minds across sectors to ensure safety, say experts. “We need to label everything as real or not real,” said Farid, “We need real disclosures.” To combat the deepening threat of deep fakes, TOI has already started armouring up. Watch out for our ‘Don’t Get Scammed’ stories to stay informed and aware. After all, as Farid puts it, “if you don’t know what’s real, how will you know what’s false”?","AI-generated videos and audio clips don’t just distort reality. They manipulate public perception, spread misinformation and undermine trust in democracy itself. 85.5 per cent of Indian households owning at least one smartphone. 80 per cent phishing campaigns in 2024 involved AI, with deepfakes exploited for scams.","https://static.toiimg.com/thumb/msid-125541547,imgsize-73729,width-400,resizemode-4/.jpg"
"Bihar battle won, now prep for Bengal & Tamil Nadu: Amit Shah to party workers",https://timesofindia.indiatimes.com/india/bihar-battle-won-now-prep-for-bengal-tamil-nadu-amit-shah-to-party-workers/articleshow/125602253.cms,"File photo

Mamata Banerjee Warns BJP With Nation-Shaking Threat As SIR Battle Erupts In Bengal Ahead Of Polls

The Bihar win is the triumph of NDA's unity and resolve, he said at a dinner meeting at BJP chief J P Nadda's residence to felicitate party members from different states who were deployed in the Bihar campaign.Sources said Shah also heartily praised JDU members and emphasised that people have supported the ""Modi-Nitish jodi"" wholeheartedly. All five NDA partners fought the poll battle like five Pandavas, he said.""We do not have to stop. Party workers should be ready for Bengal and Tamil Nadu elections,"" he said, stressing that the outcome in Bihar is an endorsement of people's love and trust for PM Modi's leadership.Party members from other states are meant to strengthen the organisational machinery for polls and should not compete for credit, he said, adding that only the Bihar unit has the right to claim credit. Shah said that with their hard work, BJP workers made the Bihar result historic, heaping praise on them.","The Bihar win is the triumph of NDA's unity and resolve, he said at a dinner meeting at BJP chief J P Nadda's residence. Shah also heartily praised JDU members and emphasised that people have supported the ""Modi-Nitish jodi"" wholeheartedly.","https://static.toiimg.com/thumb/msid-125602262,imgsize-800292,width-400,resizemode-4/article-10.jpg"
"Let's balance rights and duties, PM urges citizens on Constitution Day",https://timesofindia.indiatimes.com/india/lets-balance-rights-and-duties-pm-urges-citizens-on-constitution-day/articleshow/125602038.cms,"PM Modi Pens Powerful Letter On Duties And Democracy, Reflects On His Constitutional Journey

Constitution gives us rights, reminds us of our duties: PM

NEW DELHI: PM Narendra Modi marked Constitution Day on Wednesday by urging citizens to never miss out on their constitutional right to vote and renewed his pitch for balancing rights with duties.PM Modi has often emphasised that while the issue of people's rights has received attention, the Constitution's similar focus on their duties was overlooked. He cited a host of stalwarts, including Mahatma Gandhi, to underscore the primacy of duties for social and economic progress.As the country moves forward to realising the dream of a developed India, people must always place their duties towards the nation foremost in their minds, he said.In a letter to citizens on Constitution Day, which was announced by his government in 2015, PM Modi suggested that people organise special events on November 26 to mark the coming-of-age of youngsters in schools and colleges to celebrate first-time voters.First-time voters will make them feel that they are also active participants in the process of nation-building, PM Modi said. ""It is our duty to never miss the opportunity to vote in national, state and local elections where we are registered,"" the PM said. His remarks came amid high turnouts in recent polls and the ongoing SIR of electoral roll drive in several states and UTs.With Congress leading the charge against his govt for allegedly weakening constitutional values, Modi in his letter took a swipe at the party for not celebrating the 60th anniversary of the Constitution's adoption in 2010 in a befitting manner. Sadly, he said, the occasion did not receive the due national attention. However, the then Gujarat govt headed by him had organised a 'Samvidhan Gaurav Yatra', he added.PM Modi credited the Constitution for enabling someone like him from a disadvantaged background to serve as the head of a govt continuously for over 24 years, which includes his stint as Gujarat CM from Oct 2001.The 150th birth anniversary of Sardar Vallabhbhai Patel and Birsa Munda this year marks the occasion as special, he said, asserting it was the country's first home minister's inspiration and courage of conviction that guided his govt in repealing Article 370 and 35(A) and ensuring the Constitution is now fully implemented in J&K.He noted that he had bowed and touched the steps of Parliament when he entered it for the first time in 2014 and had touched the Constitution with his forehead on his re-election in 2019 as a mark of reverence, and paid tributes to Constituent Assembly chairman Rajendra Prasad and its drafting committee chair BR Ambedkar. Modi also attended a programme at Samvidhan Sadan, where President Murmu addressed a gathering to mark the day.On X, he said, ""While it (Constitution) empowers us with rights, it also reminds us of our duties as citizens, which we should always try to fulfil. These duties are the foundation of a strong democracy. Let us reiterate our commitment to strengthening Constitutional values through our actions.""","PM Modi has often emphasised that while the issue of people's rights has received attention, the Constitution's focus on their duties was overlooked. He cited a host of stalwarts, including Mahatma Gandhi, to underscore the primacy of duties for social and economic progress.","https://static.toiimg.com/thumb/msid-125602039,imgsize-992801,width-400,resizemode-4/.jpg"
