Article Title,Article Link,Article Text,Article Summary,Article Image
Rat-hole miners arrive to assist in rescue of 8 workers after tunnel collapse in Telangana: What we know so far,https://timesofindia.indiatimes.com/india/rat-hole-miners-arrive-to-assist-in-rescue-of-8-workers-after-tunnel-collapse-in-telangana-what-we-know-so-far/articleshow/118537616.cms,"The view of tunnel after it collapsed in Telangana

More than 48 hours, still 8 people trapped after tunnel collapsed

Chances of survival very, very remote: Telangana minister Krishna Rao

'Gush of water increased and loose soil also started falling off': Survivor

Six teams of rat miners have arrived in Telangana's Nagarkurnool to assist in the ongoing rescue operation for the Srisailam Left Bank Canal collapse (SLBC), where eight workers are trapped.Firoz Qureshi, a member of rat miner's team, said that a total 6 more teams set to join their 6 teams who already arrived for the rescue of 8 more people, who are trapped after the tunnel collapsed.""I have come from Delhi, our whole team has come from Delhi, Collector has called us here. 6 of us have come here and 6 more will be coming, we are a team of 12 people. In Uttarakhand, we had rescued 41 labourers...till now, we have not received much information. As of now, we have been told that we need to go along with NDRF and SDRF teams. It will be difficult to say something until we see the situation there,"" he added.These Rat miners were previously involved in the successful rescue mission during the Uttarkashi tunnel collapse in Uttarakhand that occurred on October 31 last year.A miner from the team discussed the difficulties ahead, noting that the presence of water in the tunnel and the considerable distance would present significant obstacles during the rescue operation. Nevertheless, he remained optimistic about their chances of success."" We have come from Delhi...we will go inside along with the NDRF and SDRF teams. We will be able to say something when we see the situation inside...our 12-member team rescued the labourers when an incident took place in Uttarakhand during Diwali...we took part in the last 26-hour operation...that situation was different from here...there is difficulty as the distance where the incident has happened is 14 km from entrance point and because of water as well...it might take some time, but we hope that we will succeed,"" one of the members of the Rat miners team.The survival prospects appear grim for the eight individuals who have been trapped for more than two days in the SLBC tunnel following its partial collapse. The rescue teams continue their tireless efforts to reach them. The Indian Army, Navy, NDRF, and other agencies have faced significant challenges in their rescue attempts, having to work through dense muck, intertwined iron rods, and cement blocks.The accident occurred at the Srisailam Left Bank Canal (SLBC) project in Telangana's Nagarkurnool district on Saturday morning.A substantial rescue force comprising 584 skilled personnel from the Army, Navy, Singareni Collieries, and other agencies, alongside central and state disaster response teams, has conducted seven tunnel inspections. Official sources confirm that gas cutters are being used continuously to cut through the metal obstructions.The rescue operation also employed sniffer dogs to locate the trapped individuals. However, their progress was hindered by water accumulation in the tunnel.The chances of survival of the eight persons who remain trapped in the SLBC tunnel after a partial collapse two days ago are ""very remote,"" though every effort is being made to reach them, Telangana Minister Jupally Krishna Rao said on Monday.""To be honest, the chances of their survival are very, very, very, very remote. Because, I myself went up to the end, almost just 50 meters short (of the mishap site).When we took photographs, the end (of the tunnel) was visible. And out of the 9 meter diameter (of the tunnel)--almost 30 feet, out of that 30 feet, mud has piled up up to 25 feet"", he said.""When we shouted their names also, there was no response...so, there is no chance at all,"" he said.During the ongoing rescue mission for the eight trapped personnel, survivors of the incident remained hopeful for their colleagues' safe return whilst recounting the harrowing events they witnessed.Nirmal Sahu, a worker from Jharkhand, described how on February 22 morning, they encountered a sudden increase in water flow inside the tunnel, accompanied by falling loose soil. He told PTI videos that whilst some workers managed to escape after recognising the imminent danger, eight individuals remained trapped inside.Obi Sahu, who is related to one of the trapped workers, Sandeep Sahu, mentioned that several workers sustained minor injuries whilst fleeing from the tunnel.","Six teams of rat miners have arrived in Telangana's Nagarkurnool to assist in the ongoing rescue operation for the Srisailam Left Bank Canal collapse (SLBC), where eight workers are trapped. A total of 6 more teams set to join their 6 teams who already arrived for the rescue of 8 more people, who are trapped after the tunnel collapsed. The chances of survival of the eight persons who remain trapped in the SLBC tunnel after a partial collapse two days ago are ""very remote,"" though every effort is being made to reach them.","https://static.toiimg.com/thumb/msid-118538233,imgsize-34672,width-400,resizemode-4/118538233.jpg"
"PM Modi hails Isro's century in rocket launches, urges people to dedicate a 'Day for Science'",https://timesofindia.indiatimes.com/india/pm-modi-hails-isros-century-in-rocket-launches-urges-people-to-dedicate-a-day-for-science/articleshow/118515674.cms,"NEW DELHI: PM Narendra Modi, during the 119th episode of his monthly radio programme ' Mann Ki Baat ' on Sunday, hailed Isro, saying it has hit the century in space. On Jan 29, India witnessed Isro's 100th rocket launch when GSLV-F15 rocket launched navigation satellite NVS-02. He urged people to observe National Science Day by spending “One Day as a Scientist”, which he said will foster curiosity among children and youth about science.On the country’s space sector achievements, Modi said, “Champions Trophy is going on these days and there is an atmosphere of cricket for everyone. We all know the thrill of a century in cricket. But today, I am not going to talk about cricket, rather I will talk about the wonderful century that India has made in space. Last month, the country was a witness to Isro's 100th rocket launch. This is not just a number, but it shows our resolve to achieve ever-new heights in space science. Our space journey started in a very normal manner. There were challenges in every step, but our scientists continued moving forward achieving victory over them.”“With time, the list of our achievements in space flights continues to grow longer. Be it building a launch vehicle, success of Chandrayaan, Mangalyaan and Aditya L1 or carrying out the unprecedented mission of sending 104 satellites into space in one go with one rocket. The ambit of Isro's success has been quite large. In the past 10 years, around 460 satellites have been launched, in which many satellites of other countries are also included,"" the PM said.On growing women’s power in the industry, Modi said, “The participation of women power has been continuously rising in the space sector. I feel very happy seeing that today the space sector has become a favourite of the youth. For our youth who want to do something thrilling and exciting in their life, the space sector is becoming an excellent option for them.""Speaking about National Science Day 2025, which will be celebrated on Feb 28, the PM said that the interest and passion of youth in science matters a lot. ""You try to spend one day as a scientist. You must visit places like a research lab, planetarium or space centre that day. This will increase your curiosity about science. Like space and science, India is rapidly making its mark in another field. That is AI (Artificial intelligence). I went to Paris to take part in an AI summit. There, people lauded India's strides in the field of AI,"" PM Modi said.He also mentioned a teacher from Telangana, Thodasam Kailash, who is harnessing AI technology in digital song and music to help preserve the tribal languages, including Kolami. His tracks are being liked a lot by the tribal people. ""People of India are second to none in adopting and using new technologies,"" he said.","PM Narendra Modi hailed Isro, saying it has hit the century in space. On Jan 29, India witnessed Isro's 100th rocket launch when GSLV-F15 rocket launched navigation satellite NVS-02. He urged people to observe National Science Day by spending ‘One Day as a Scientist’","https://static.toiimg.com/thumb/msid-118515764,imgsize-1023730,width-400,resizemode-4/118515764.jpg"
"The day isn’t far when Kashmir will be free of guns, Amit Shah tells kids from UT",https://timesofindia.indiatimes.com/india/the-day-isnt-far-when-kashmir-will-be-free-of-guns-amit-shah-tells-kids-from-ut/articleshow/118540212.cms,"NEW DELHI: The day is not far when nobody in Jammu and Kashmir will possess a weapon, dispensing with the need for armed forces to be deployed within the Union Territory and ensuring that their role is limited to guarding the frontiers, home minister Amit Shah on Monday told young children from Jammu and Kashmir visiting Delhi as part of ‘Watan ko Jano’ (Know Your Country) programme.Telling the visiting school children, some as young as eight years of age and some travelling out of their home/UT for the first time ever, that every part of the country belongs to them as much as J&K does, Shah asked them to ensure that they do not abandon their studies mid-way as “opportunities await you across the country”. “You should grab these opportunities. J&K is peaceful even now but you should make sure that the peace is permanent,” he said while exhorting the children to carry back the message of peace and development that they have witnessed in rest of the country during the ‘Watan ko Jano’ tour, to their family, friends, neighbours and village in J&K.Around 250 children from J&K visited Jaipur and Delhi as part of the tour aimed at familiarising them with the social and cultural diversities of the country and bringing about an emotional connect among them. “We got a chance to visit the Hawa Mahal and enjoyed the non-Kashmiri cuisine in Jaipur,” Samriti Balraj from Reasi replied when asked by Shah about her experience. “Get your parents to visit next,” he promptly advised.Stating that he sincerely believes that “no govt can maintain peace in J&K as only its children can”, the home minister asked the young J&K visitors to convince their parents and neighbourhood that the entire country belongs to them and that terrorism should be replaced with peaceful co-existence “that is witnessed in the other parts of the country”. To make sure that his message was understood by the children, the home minister gave the analogy of a house with several rooms, saying that states/UTs are like rooms that make India and that Kashmir is one such room. “Like you visit all rooms in your house, you must familiarise with the other states/UTs as well,” he said, even persuading them jokingly to fight with their parents to plan their next family vacation outside J&K.Stating that J&K had witnessed a major change in the last 10 years, with civilian deaths down by 80% and a big push to development, infrastructure and industry, Shah said he was still not satisfied as he firmly believes that not a single Kashmiri youth should die. “Fifteen years ago there were no religious processions like tazia, schools were facing shutdowns and cinema halls were closed. In the past 10 years, roads, bridges, hospitals and educational institutions came up...we empowered the grassroots with the panchayati raj system. Stone-pelting, bomb attacks and terrorism were controlled and school shutdowns became a thing of the past...Development follows when there is peace..You should tell your family and friends that terrorism will not lead you anywhere,” he said.",Around 250 children from J&K visited Jaipur and Delhi as part of the tour aimed at familiarising them with the social and cultural diversities of the country. ‘Watan ko Jano’ (Know Your Country) programme is aimed at bringing about an emotional connect among them.,"https://static.toiimg.com/thumb/msid-118540219,imgsize-1144546,width-400,resizemode-4/118540219.jpg"
Congress backing 'covert interference' to hurt democracy: BJP,https://timesofindia.indiatimes.com/india/congress-backing-covert-interference-to-hurt-democracy-bjp/articleshow/118540708.cms,"This is a representational image

NEW DELHI: BJP on Monday accused Congress of defending ""covert interference"" by foreign donors seeking to destabilise India's democracy, after the opposition party cited a finance ministry report on USAID-funded projects in India to claim that it has thoroughly exposed govt's ""lies"".BJP IT department head Amit Malviya claimed the desperation of Congress and its ecosystem to deflect from the controversial USAID funding routed through various ""George Soros-linked fronts and a labyrinth of NGO structures to meddle with India's electoral process is a dead giveaway"". ""It is now obvious who the beneficiaries are,"" he said on X.He said USAID projects are official govt-to-govt partnerships, transparently executed as externally aided projects. Centre simply channels these funds to states for development, which is well within the framework of cooperative federalism, Malviya added.The projects cited in the finance ministry's 2023-24 report trace their origins back to 2010-11, Malviya said, adding that this is not new as even the 2014-15 report confirms the same.He said the question is why Congress is defending ""covert interference"" by foreign donors and organisations linked to Soros and which seek to destabilise Indian democracy under the guise of philanthropy.""India's sovereignty is not up for sale. Let us drop the selective amnesia and political theatrics. Facts matter. India's governance will not be dictated by foreign agents masquerading as benefactors,"" Malviya said.For financial year 2023-24, an obligation of $97 million was made by USAID under the seven projects, the finance ministry report said. During the year, no funding was made for enhancing voter turnout but to projects related to agriculture and food security programme; water, sanitation & hygiene (WASH); renewable energy; disaster management and health.","BJP accused Congress of defending ""covert interference"" by foreign donors seeking to destabilise India's democracy. Opposition party cited a finance ministry report on USAID-funded projects in India to claim that it has thoroughly exposed govt's ""lies""","https://static.toiimg.com/thumb/msid-118540738,imgsize-902970,width-400,resizemode-4/118540738.jpg"
"Rape survivor seeks police help, gets raped by Karnataka cop",https://timesofindia.indiatimes.com/india/rape-survivor-seeks-police-help-gets-raped-by-karnataka-cop/articleshow/118540605.cms,"BENGALURU: A police constable in his late 30s has been arrested for allegedly raping a minor who sought assistance after being raped by her neighbour on the pretext of marriage.""In Dec last year, the girl and her mother approached Bommanahalli Police , alleging that the neighbour had been harassing the teen for marriage. The girl hadn't revealed anything about the neighbour raping her and her mother said she didn't know about the same. The cop, who discovered that the neighbour had established physical relations with the girl, befriended her and took her to a hotel room. There, he gave her beer laced with sleeping pills and raped her. He threatened her saying he had recorded the act on his cell phone and would upload it on social media if she dared to file a police complaint against him,"" an investigating officer said.The girl later informed her mother about both sexual assaults. Her mother then filed a police complaint against the accused duo on Feb 13, based on which an FIR was registered under Pocso Act . The neighbour was arrested the same day.Police said the accused constable was married and had a minor son. He had fled the city soon after the FIR was registered and was arrested a few days later.","A police constable in his late 30s has been arrested for allegedly raping a minor. The girl sought assistance after being raped by her neighbour on the pretext of marriage. The cop, who discovered that the neighbour had established physical relations with the girl, befriended her and took her to a hotel room.","https://static.toiimg.com/thumb/msid-118540626,imgsize-627950,width-400,resizemode-4/118540626.jpg"
New CEC to chair meet on modern poll management,https://timesofindia.indiatimes.com/india/new-cec-to-chair-meet-on-modern-poll-management/articleshow/118540537.cms,"New CEC to chair meet on modern poll management

NEW DELHI: The Election Commission is set to reflect on issues related to modern election management , including an enabling IT architecture and enhancement of its social media outreach, at a conference with chief electoral officers (CEOs) of all states and UTs here from March 4-5.This is the first event to be chaired by newly appointed chief election commissioner Gyanesh Kumar . In a first, the EC has instructed every CEO to nominate a district election officer and an electoral registration officer to participate in the conference.""As statutory authorities, CEOs, DEOs and EROs are important functionaries at the state, district and assembly constituency levels,"" the EC said in a statement on Monday.To be held at the India International Institute of Democracy & Election Management, the two-day conference will serve as a platform for election officials of states and UTs for brainstorming and learning from each other's experiences.The first day of the conference will witness discussions on key areas of modern election management, including IT architecture, effective communication, enhancing social media outreach and statutory role of different functionaries in the electoral processes. On the second day, CEOs of states and UTs will present their respective action plan on thematic discussions from Day 1.",The Election Commission is set to reflect on issues related to modern election management. This is the first event to be chaired by newly appointed chief election commissioner Gyanesh Kumar. The two-day conference will serve as a platform for election officials of states and UTs.,"https://static.toiimg.com/thumb/msid-118540545,imgsize-920239,width-400,resizemode-4/118540545.jpg"
"PM Modi's Monday: Breakfast in MP, lunch in Bihar and dinner in Assam",https://timesofindia.indiatimes.com/india/pm-modis-monday-breakfast-in-mp-lunch-in-bihar-and-dinner-in-assam/articleshow/118540325.cms,"PM Modi's Monday: Breakfast in MP, lunch in Bihar and dinner in Assam (Pic credit: ANI)

The weeks following Delhi polls were supposed to be a lean season politically, with no Parliament session and no electoral battles looming. But not so for PM Narendra Modi who swung by three states on Monday - having breakfast in Madhya Pradesh , lunch in Bihar and dinner in Assam. The PM started his day inaugurating the Global Investor Summit in MP, where he pitched the state as an attractive investment destination, while asserting that the world was optimistic about India.By afternoon he reached Bhagalpur, in what was seen as Modi's first public address in the run-up to state elections later this year. He released 22,000 crore of PM-Kisan funds to 9.8 crore farmers across the country. He then hopped on to his aircraft and reached Guwahati on a two-day visit. In the evening, he witnessed the Jhumoir dance performance with nearly 9,000 dancers and drummers who played the traditional 'Dhomsa'.","PM Narendra Modi swung by three states on Monday - having breakfast in Madhya Pradesh, lunch in Bihar and dinner in Assam. He released 22,000 crore of PM- Kisan funds to 9.8 crore farmers across the country. He then hopped on to his aircraft and reached Guwahati on a two-day visit.","https://static.toiimg.com/thumb/msid-118540327,imgsize-1479737,width-400,resizemode-4/118540327.jpg"
PM Modi picks 10 heavyweights to lead fight against obesity,https://timesofindia.indiatimes.com/india/pm-modi-picks-10-heavyweights-to-lead-fight-against-obesity/articleshow/118540309.cms,"NEW DELHI: PM Modi on Monday nominated 10 persons from different walks of life, including J&K CM Omar Abdullah, businessman Anand Mahindra and actor Mohanlal, to help fight obesity, a day after he exhorted people to take measures to curb the health menace.""I would like to nominate the following to help strengthen the fight against obesity and spread awareness on reducing edible oil consumption in food. I request them to nominate 10 people each so that our movement gets bigger,"" Modi wrote on X.Olympians shooter Manu Bhaker and weightlifter Mirabai Chanu, Infosys co-founder Nandan Nilekani, actor R Madhavan, singer Shreya Ghoshal, philanthropist and Rajya Sabha MP Sudha Murty and Bhojpuri singer-actor Nirahua were the other personalities nominated by the PM.Making a strong pitch for fighting obesity, Modi in his ' Mann Ki Baat ' broadcast on Sunday urged people to use less oil in food and pass on the challenge of reducing oil intake by 10% to 10 others.Omar, who said he was happy to join PM's campaign, also nominated 10 persons to join it. They are Biocon managing director Kiran Mazumdar Shaw, businessman Sajjan Jindal, actor Deepika Padukone, former tennis player Sania Mirza, ex-cricketer Irfan Pathan, MP Supriya Sule and former wushu player Kuldeep Handoo.Mahindra Group chairman Anand Mahindra said to achieve mission of a 'Viksit Bharat' by 2047, ""we not only need a strong economy, but a healthy population as well"".""Making small changes like using even 10% less cooking oil can build up to big contributions; be it to your well-being, to your wallet, or to a healthier world,"" Mahindra posted on X. He nominated actors Anil Kapoor and Gul Panag, Zerodha co-founder Nikhil Kamath, India's first chess grandmaster Vishwanathan Anand, and ace badminton player P V Sindhu to take forward the campaign.Nilekani said apart from a range of health-related benefits, reduced use of edible oil will also strengthen the nation's economy by cutting dependence on imports and saving valuable resources. ""In addition to dietary changes, I have also incorporated daily exercise to keep obesity and related issues in check,"" he said.Nilekani nominated industrialist Harsh Goenka, chef Ritu Dalmia, Myntra founder Mukesh Bansal, and Kotak Mahindra Bank director Uday Kotak, among others, for the campaign.Sudha Murthy nominated fellow parliamentarian & former Olympian P T Usha, ex-cricketers Anil Kumble and Venkatesh Prasad, former top cop and governor Kiran Bedi and author Amish Tripathi, among others.Weightlifter Mirabai Chanu, who won silver at 2021 Tokyo Olympics, wrote on X, ""Making small changes to our daily lives can result in a huge transformation all over the country and help us move towards achieving our dream of making a fit India.""","J&K CM Omar Abdullah, businessman Anand Mahindra and actor Mohanlal also nominated. Infosys co-founder Nandan Nilekani, actor R Madhavan, singer Shreya Ghoshal, philanthropist and Rajya Sabha MP Sudha Murty and Bhojpuri singer-actor Nirahua were the other personalities nominated by the PM.","https://static.toiimg.com/thumb/msid-118540313,imgsize-1181022,width-400,resizemode-4/118540313.jpg"
