Article Title,Article Link,Article Text,Article Summary,Article Image
Asia Cup: Does Shubman Gill warrant a spot in India's T20 setup?,https://timesofindia.indiatimes.com/sports/cricket/asia-cup/asia-cup-does-shubman-gill-warrant-a-spot-in-indias-t20-setup/articleshow/123321062.cms,"Shubman Gill (PTI Photo)

IND vs ENG: Shubman Gill on Oval thriller, Siraj's spell, and missing Rishabh Pant and Jasprit Bumrah

Go Beyond The Boundary with our YouTube channel.

Gill can bat, but can he go bang-bang?

India's Shubman Gill (PTI Photo/Kamal Kishore)

Gill is in the slow lane



Shubman Gill (PTI Photo/Kamal Kishore)

If it ain’t broke, don’t Gill it

NEW DELHI: Before Shubman Gill took flight to England for the recently concluded Anderson-Tendulkar Trophy, there were some doubts, rather apprehensions: whether Gill would be successful as a Test batter in English conditions or if he would prove to be a good captain.Gill answered them - perfectly. He scored 754 runs in five Tests, putting on an exhibition while also proving that he is more than capable of leading the team -- his composure during The Oval Test serves as a fitting example.With the Asia Cup and T20 World Cup the next big events, both to be played in the shortest format of the sport, there have been talks about not only bringing Gill back in the T20 side but also giving him the role of vice captain, as a precursor to succeed Suryakumar Yadav at some point.It is argued, in favour of Gill, that the Board of Control for Cricket in India (BCCI) has always had a tradition of all-format captains and not the split captaincy, as is the case now.Also related is the rationale of brand value and commerce. After the retirement of Virat Kohli and Rohit Sharma, two superstars of Indian cricket over the last decade and a half, there is an urge to build the next-gen ""brand"" of Indian Cricket.That Gill has become a major brand and favourite for broadcasters is a fact that not many would deny.While there is no question of Gill's place in One Day Internationals (ODIs), and he could even be the heir to Rohit as the leader of the side; to bring him into the T20 side, currently, however, would appear to be a forced decision rather than a natural one.By any measure, Shubman Gill is a decent T20 player. In 21 T20Is, Gill has scored 578 runs at an average of 30.42. He has also scored them at a strike rate of 139.27.While Gill is a generational batter with a sound technique, he is not a ""hitter"". A batter is someone who tries to score runs with less risk and build their innings. While the hitter is someone who tries to score as many runs on every ball as possible, playing high-risk shots.In T20s, where the value of runs scored quickly is more valuable than preserving wickets, teams across the world have been prioritising ""hitters"" over ""batters"".The Indian team took a long time to adopt this approach, but after the 2024 T20 World Cup, they are the ones spearheading it. The role of anchors - a category appropriate for Gill - has become redundant in modern T20s.In 2021 the percentage of balls attacked by Indian batters was 28.82 per innings, it almost doubled and went up to 43.84 per innings in 2024. Moreover, the number of attacking runs per innings also increased to 138.85 in 2024 from 98.64 in 2021.Gill's scoring rate of 139.27 is by no means bad. However, the current Indian top-order scores sit at a much higher strike rate.Playing what coach Gautam Gambhir described as ""high-risk, high-reward cricket"", Abhishek Sharma scores at an unreal strike rate of 193.84, his partner-in-crime Sanju Samson strikes at 152.38. While the new number three Tilak Varma scores at 155.07, Surya thrashes opposition bowling at 167.07.After the 2024 T20 World Cup, India’s top three batters have scored at a combined strike rate of 173.1. If Gill’s seven innings at 129.2 are removed from that period, the figure rises to 181.3.Moreover, in the eight innings where he faced 15 or more balls in all T20Is, only thrice has Shubman Gill scored the runs at or over the strike rate of 160. In comparison, Abhishek Sharma has faced more than 15 balls in six innings so far and in five of them, he has struck at 200 or above.While Tilak Varma scored at over 160 strike rate in six out of 15 innings in which he faced 15 or more balls, Suryakumar Yadav hit the ball at over 160 strike rate in 24 out of 40 such innings. Only Sanju Samson falls behind a bit in this context, but even he has scored at an above 160 strike rate in three out of five occasions where he faced 15 or more balls since the start of 2024.The current Indian T20 side is well settled and is reaping results, having won 14 of the 17 matches after the 2024 World Cup. Much of that success comes from an all-out attacking approach by the top-order that matches the demands of modern T20 cricket. Gill’s style of play does not match this template.Since the 2024 World Cup, the new group of hitters and the team management have taken the attacking game to another level. In this short period, India have scored three of their fastest T20I hundreds.If the team management wants a backup opener for Abhishek and Sanju, the right option could be Yashasvi Jaiswal, who has scored at 170.00 in the six matches he has played after the 2024 World Cup.ALSO READ: Devil lies in action: What makes Jasprit Bumrah injury-prone - why his workload management is crucial Indian cricket took far too long to realise that T20 is a game of ""hitters"". It took too long to realise and implement the theory that in T20 games, a specialist T20 batter is far better than an all-format batter who plays an anchor role.That change has finally created a team that can truly represent a country with the world’s most competitive T20 league. Forcing Gill into the T20 side at this moment would be less about cricketing needs and more about fitting a ""star"" into a system that is already firing without him.","Gill scored 754 runs in five Tests, putting on an exhibition while also proving that he is more than capable of leading the team. In 21 T20Is, Gill has scored 578 runs at an average of 30.42 and a strike rate of 139.27. Gill is a generational batter with a sound technique, but he is not a ""hitter""","https://static.toiimg.com/thumb/msid-123321199,imgsize-43876,width-400,resizemode-4/123321199.jpg"
Cricket: Bob Simpson dies at 89 - who was the legendary Australian?,https://timesofindia.indiatimes.com/sports/cricket/news/cricket-bob-simpson-dies-at-89-who-was-the-legendary-australian/articleshow/123328488.cms,"Bob Simpson (X)

Go Beyond The Boundary with our YouTube channel. SUBSCRIBE NOW!

Poll What do you think was Bob Simpson's greatest achievement as a cricketer? Leading Australia to the 1987 World Cup Returning from retirement at age 41 Scoring nearly 5,000 Test runs Transforming the team as a full-time coach

Australian cricket has lost one of its great figures with the passing of former captain and coach Bob Simpson at the age of 89. Cricket Australia confirmed the news on Saturday.Simpson was a central figure in the game for decades. He played 62 Tests for Australia between 1957 and 1978, scoring 4,869 runs at an impressive average of 46.81 while also taking 71 wickets. As captain, he led his country in 39 Tests and guided them to 12 victories.In one of the most remarkable chapters of his career, Simpson returned from retirement at the age of 41 to captain a depleted Australian side during the challenging years of World Series Cricket.After hanging up his boots, Simpson went on to become Australia’s first full-time coach. He took charge of a struggling team that had gone four years without a Test series win and turned them into a dominant force.Under his leadership, Australia lifted the 1987 World Cup, won four Ashes series and finally claimed the Frank Worrell Trophy in 1995, ending a 17-year wait for success against the West Indies.Simpson stepped down after the 1996 World Cup but continued to serve Australian cricket as a national selector. His contributions were formally recognised in 2013 when he was inducted into the ICC Cricket Hall of Fame.Bob Simpson’s impact went far beyond numbers. He was a leader, a teacher and a pioneer who helped shape the modern Australian team into the powerhouse it became.","Bob Simpson has passed away at the age of 89. Simpson played 62 Tests for Australia between 1957 and 1978. He scored nearly 5,000 Test runs and took 71 wickets. As captain, he led his country to 12 victories in 39 Tests. As a full- time coach, he turned Australia into a dominant force.","https://static.toiimg.com/thumb/msid-123328526,imgsize-787771,width-400,resizemode-4/123328526.jpg"
'Best batter we’ve ever produced': Stuart Broad names England’s finest — and it’s not Joe Root,https://timesofindia.indiatimes.com/sports/cricket/news/best-batter-weve-ever-produced-stuart-broad-names-englands-finest-and-its-not-joe-root/articleshow/123328210.cms,"Stuart Broad made a massive comment on who the best batter England has ever produced is (Photo by Gareth Copley/Getty Images)

Go Beyond The Boundary with our YouTube channel. SUBSCRIBE NOW!

Poll Is Harry Brook the best batter England has ever produced? Yes, absolutely! No, they've produced better players.

Former England fast bowler Stuart Broad has lavished praise on Harry Brook after the batter produced an audacious six in The Hundred. Brook, playing for Northern Superchargers, stunned Headingley with a remarkable shot off his very first ball, prompting Broad to call him potentially “the best batter we’ve ever produced. ”“He might just be the best batter we’ve ever produced you know, Harry Brook. Big shout so I don’t say it lightly,” Broad wrote in a post on X, reacting to the moment that has since gone viral.The incident unfolded right after Michael Pepper’s dismissal when Brook walked in to face Tim Southee. The New Zealand pacer delivered a slower ball on a length outside off, and Brook initially shaped for a reverse hit. At the last moment, though, he changed plans, crouched low, and scooped the ball over wicketkeeper Joe Clarke for six. The shot not only cleared the boundary with surprising ease but also sent Brook tumbling to the ground after connecting.Fans on social media described the strike as “outrageous,” in disbelief at how Brook managed to generate such power while improvising mid-shot. The unconventional stroke added to the growing list of unconventional yet effective shots from the England batter, who has built a reputation for the same.Brook’s innings (an unbeaten 31 from 14 balls) helped the Northern Superchargers post 193 for 5, a total that proved too steep for Birmingham Phoenix as they secured a comfortable 36-run win. The 25-year-old’s ability to conjure unthinkable shots under pressure has already been on display in international cricket, including a viral acrobatic six during the Test series against India.Broad’s post on Brook adds another layer to Brook’s growing stature and the praise he's received, highlighting the excitement around the batter.","Former England fast bowler Stuart Broad has lavished praise on Harry Brook after the batter produced an audacious six in The Hundred. Brook, playing for Northern Superchargers, stunned Headingley with a remarkable shot off his very first ball. The 25-year-old’s ability to conjure unthinkable shots under pressure has already been on display in international cricket.","https://static.toiimg.com/thumb/msid-123328431,imgsize-105004,width-400,resizemode-4/123328431.jpg"
Watch: Liverpool game paused by racist incident at Anfield - fan removed by police,https://timesofindia.indiatimes.com/sports/football/top-stories/watch-liverpool-game-paused-by-racist-incident-at-anfield-fan-removed-by-police/articleshow/123328487.cms,"A Liverpool supporter has a heated moment with Antonie Semenyo during the Liverpool vs Bournemouth game (Image via X/Screengrabs)

Go Beyond The Boundary with our YouTube channel. SUBSCRIBE NOW!

Referee Anthony Taylor in discussion with Liverpool players and manager Arne Slot after Bournemouth plater Antoine Semenyo reported racist abuse from the crowd (Photo by Michael Steele/Getty Images)

Poll Do you believe that the Premier League is doing enough to combat racism in football? Yes, they are taking strong actions No, more needs to be done

The Premier League’s first game of the season was marred by an incident of racist abuse directed at Bournemouth winger Antoine Semenyo during the match against Liverpool at Anfield. Play was halted in the 28th minute after Semenyo reported the abuse, with referee Anthony Taylor speaking to both managers, Arne Slot and Andoni Iraola, before the game resumed.Merseyside Police confirmed that a 47-year-old man was identified and ejected from the stadium following the allegation. “Police said an investigation is underway after the man's identity was confirmed and he was removed from the ground,” the force stated.The reaction on the pitch and in the dugout was one of disappointment and frustration. Bournemouth captain Adam Smith called the incident “unacceptable,” while head coach Iraola said, “It’s a big shame, most of the news will be about this thing. Obviously, it is something that is still a big problem, not just in football. From the Liverpool side, they have identified this person,” as quoted by Sky Sports.The Premier League confirmed the case will be taken further under its anti-discrimination protocol.“Tonight’s match between Liverpool Football Club and AFC Bournemouth was temporarily paused during the first half after a report of discriminatory abuse from the crowd, directed at Bournemouth’s Antoine Semenyo,” it said in a statement.“The incident at Anfield will now be fully investigated. We offer our full support to the player and both clubs. Racism has no place in our game, or anywhere in society.”Liverpool are expected to impose strict sanctions once investigations are complete. Clubs in the past have banned offenders for racial abuse, and a similar punishment could be enforced in this case.Clips on social media show a fan in a wheelchair engaged in a heated conversation with Semenyo as he came towards the touchline to take a throw-in. There is yet to be official communication on whether it was the man in question that was guilty of making racist abuse. Clips of the same have gone viral on social media.",Bournemouth winger Antoine Semenyo reported racist abuse from the crowd. Merseyside Police confirmed that a 47-year-old man was identified and ejected from the stadium following the allegation. The Premier League confirmed the case will be taken further under its anti-discrimination protocol.,"https://static.toiimg.com/thumb/msid-123328498,imgsize-43648,width-400,resizemode-4/123328498.jpg"
'He'll be around for a long time because ... ': Ravi Shastri certain that Shubman Gill will not be replaced for years to come after England heroics,https://timesofindia.indiatimes.com/sports/cricket/india-tour-of-england/hell-be-around-for-a-long-time-because-ravi-shastri-certain-that-shubman-gill-will-not-be-replaced-for-years-to-come-after-england-heroics/articleshow/123315452.cms,"Ravi Shastri supports Shubman Gill as a vital player for India, and sees him playing a huge role for years to come. Gill, at 25, had an outstanding series against England. He scored 754 runs, averaging 75.40, with four centuries. Gill also secured the ICC Men’s Player of the Month award for July 2025. Shastri praises Gill's temperament and elegant batting style.","Shubman Gill scored 754 runs, averaging 75.40, with four centuries against England. Gill also secured the ICC Men’s Player of the Month award for July 2025. Shastri praises Gill's temperament and elegant batting style.","https://static.toiimg.com/thumb/msid-123315462,imgsize-119808,width-400,resizemode-4/123315462.jpg"
Cincinnati Open: Jannik Sinner annihilates Felix Auger-Aliassime to reach semi-finals,https://timesofindia.indiatimes.com/sports/tennis/top-stories/cincinnati-open-jannik-sinner-annihilates-felix-auger-aliassime-to-reach-semi-finals/articleshow/123315516.cms,"Italy's Jannik Sinner (AP Photo/Kin Cheung)

Go Beyond The Boundary with our YouTube channel. SUBSCRIBE NOW!

Poll Will Jannik Sinner win the Cincinnati Open? Yes No

World number one Jannik Sinner continued his dominant hardcourt run by defeating Felix Auger-Aliassime 6-0, 6-2 in the ATP-WTA Cincinnati Open quarter-finals on Thursday, marking his 25th consecutive hardcourt match victory. The Italian champion, who turns 24 on Saturday, dispatched his opponent in just 71 minutes to secure his eighth straight win at this event and 30th victory of the season.Sinner, competing in his first tournament since winning Wimbledon, will face either French qualifier Terence Atmane or Danish seventh seed Holger Rune in the semifinals.""I felt great on the court today, you could see that,"" Sinner said. ""But every day can be different. Let's see what I can do in the semis.""""I served well today, that was the key for me,"" Sinner added. ""I had a small drop in the second set and I'm happy that I broke back. He moves and serves well, he's difficult to play.""Auger-Aliassime struggled throughout the match, losing the first set in under 30 minutes with three double-faults in the final game. Despite breaking Sinner's serve early in the second set, he ultimately succumbed with his eighth double fault on match point.Fifth-seeded Ben Shelton advanced to the quarter-finals by defeating Jiri Lehecka 6-4, 6-4, securing the victory with back-to-back aces.""I'm hungry, I'm in a good rhythm and the body feels good,"" said Shelton, who will next face third-seeded Alexander Zverev, who has won all three of their previous encounters.In women's action, second-seeded Coco Gauff progressed to the quarter-finals with a 6-2, 6-4 victory over Lucia Bronzetti.""I could have maybe made some more first serves in that second set, but overall, I had a lot of aces and unreturnables,"" said Gauff, the 2023 Cincinnati and US Open champion. ""I'm happy considering where (my serve) was last week. I'm always trying to get better, but also just trying to take the little wins along the way.""""I'm just trying to be happy with where I'm at now, but still doing the things I need to do to improve,"" Gauff added.The American star secured her quarter-final spot by breaking Bronzetti's serve in the final game, as the 61st-ranked Italian hit long after 79 minutes of play.Gauff will face seventh seed Jasmine Paolini, who defeated 2024 Wimbledon champion Barbora Krejcikova 6-1, 6-2. Krejcikova received treatment for a left foot issue during the second set, which visibly affected her movement.""She's a great player and can do anything she wants with the ball,"" Paolini said. ""But I don't think she was at 100% today.""Paolini, who reached both the Roland Garros and Wimbledon finals in 2024, dominated the match by winning seven consecutive games to build a 4-0 lead in the second set. The quarter-final matchup against Gauff will be their second meeting in Cincinnati, with Gauff having won their previous encounter two years ago en route to her title.","World number one Jannik Sinner defeated Felix Auger-Aliassime 6-0, 6-2 in the ATP-WTA Cincinnati Open quarter-finals on Thursday. The Italian champion, who turns 24 on Saturday, dispatched his opponent in just 71 minutes to secure his eighth straight win at this event and 30th victory of the season. Sinner will face either French qualifier Terence Atmane or Danish seventh seed Holger Rune in the semifinals.","https://static.toiimg.com/thumb/msid-123315552,imgsize-56876,width-400,resizemode-4/123315552.jpg"
What is Arjun Tendulkar’s net worth - Here’s how much he earns from cricket,https://timesofindia.indiatimes.com/sports/cricket/news/what-is-arjun-tendulkars-net-worth-heres-how-much-he-earns-from-cricket/articleshow/123297998.cms,"Go Beyond The Boundary with our YouTube channel. SUBSCRIBE NOW!

Poll What do you think about Arjun Tendulkar's engagement? Excited for the couple! Too young for marriage. It's a private matter.

Arjun Tendulkar's cricketing sojourn

NEW DELHI: Young cricketer Arjun Tendulkar, son of cricket legend Sachin Tendulkar , is engaged to Saaniya Chandhok in a private ceremony attended by close family and friends on Wednesday.The 25-year-old all-rounder plays for Goa in domestic cricket and represents Mumbai Indians in the Indian Premier League (IPL).Arjun’s net worth is estimated at ₹22 crore, with most of his income coming from the cash-rich IPL. He was signed by Mumbai Indians in 2021 for ₹20 lakh and retained in 2022 for ₹30 lakh. He has earned ₹1.4 crore from the league over five seasons.In domestic cricket, he earns around ₹10 lakh annually from the Ranji Trophy , Vijay Hazare Trophy, and Syed Mushtaq Ali Trophy - India's three premier domestic cricket tournaments — about 25% of his yearly income of ₹50 lakh. The rest comes largely from his IPL contract.He lives with his parents in a 6,000 sq ft luxury home in Mumbai, bought by Sachin Tendulkar in 2007 for ₹39 crore and now valued at about ₹100 crore. The multi-storey property includes landscaped gardens, a terrace, and two basements.The Tendulkars also own an apartment near Lord’s Cricket Ground in London, where Arjun trains during summer visits.Arjun Tendulkar made his senior debut for Mumbai in the 2020–21 Syed Mushtaq Ali Trophy before moving to Goa for more playing opportunities.In the 2022–23 Ranji Trophy, he scored a maiden first-class century against Rajasthan.Known for his swing bowling and useful batting, he made his IPL debut in 2023, claiming key wickets and showing promise as a dependable all-round option.He has played 17 first-class matches and picked up 37 wickets, and has also scored 532 runs. In List A, he has taken 25 wickets in 18 games and has 27 wickets in 24 T20s.In the IPL, he has played only five games and has three wickets to his name.",Arjun Tendulkar engaged to Saaniya Chandhok in a private ceremony. The 25-year- old all-rounder plays for Goa in domestic cricket and represents Mumbai Indians in the Indian Premier League (IPL) His net worth is estimated at ₹22 crore.,"https://static.toiimg.com/thumb/msid-123298073,imgsize-25182,width-400,resizemode-4/123298073.jpg"
"'We can beat India, we can beat any team': England Women head coach unfazed by ODI and T20I series defeats",https://timesofindia.indiatimes.com/sports/cricket/news/we-can-beat-india-we-can-beat-any-team-england-women-head-coach-unfazed-by-odi-and-t20i-series-defeats/articleshow/123315724.cms,"India captain Harmanpreet Kaur and team mates celebrate their 2-1 series win after the 3rd Women's ODI vs England. The visitors also won the T20I series 3-2 (Photo by Stu Forster/Getty Images)

Go Beyond The Boundary with our YouTube channel. SUBSCRIBE NOW!

India skipper Harmanpreet Kaur under pressure ahead of ICC Women's ODI World Cup 2025?

Poll How confident are you in England women's team's ability to perform well in the upcoming World Cup? Very confident Neutral Not confident

England women’s head coach Charlotte Edwards remains confident her side can beat any opposition at the upcoming 50-over World Cup despite back-to-back series defeats to India.India claimed the T20I series 3-2 and the ODI series 2-1, handing Edwards her first losses since taking charge earlier this summer. England were missing senior players, with Heather Knight unavailable and skipper Nat Sciver-Brunt sidelined for the final two T20s due to injury. The defeats also sparked questions over the team’s fielding and handling of high-pressure moments.Speaking on a BBC podcast, Edwards dismissed suggestions that the results served as a setback. “It wasn't a reality check. We know we can beat India,” she said. “We are going into a World Cup where we know if we play our best, we can beat any team.”Edwards said the contests against India offered exactly the kind of challenge her side needed. “We were massively challenged and that's how we want women's cricket to be,” she added.The World Cup will be held from 30 September to 2 November in India and Sri Lanka, with each of the eight teams playing one another once before the top four advance to the semi-finals.Former India captain Mithali Raj also shared a message backing the side. She said India, if they manage to seize key moments during the tournament starting on September 30. The responsibility will fall on the shoulders of Harmanpreet Kaur, Jemimah Rodrigues, Deepti Sharma, and Smriti Mandhana, with the younger players like Kranti Goud also expected to make waves at the tournament.","England women's head coach Charlotte Edwards remains confident her side can beat any opposition at the upcoming 50-over World Cup. India claimed the T20I series 3-2 and the ODI series 2-1, handing Edwards her first losses since taking charge earlier this summer. Edwards dismissed suggestions that the results served as a setback.","https://static.toiimg.com/thumb/msid-123315735,imgsize-189364,width-400,resizemode-4/123315735.jpg"
