Article Title,Article Link,Article Text,Article Summary,Article Image
"'In Pakistan people would have said, 'throw him out'': Basit Ali praises 14-year-old Vaibhav Suryavanshi",https://timesofindia.indiatimes.com/sports/cricket/ipl/top-stories/in-pakistan-people-would-have-said-throw-him-out-basit-ali-praises-14-year-old-vaibhav-suryavanshi/articleshow/120491728.cms,"Vaibhav Suryavanshi

Go Beyond The Boundary with our YouTube channel.

Poll What impressed you the most about Vaibhav Suryavanshi's IPL debut? His potential as a future star in IPL His bold approach and first-ball six

IPL: How will GT, LSG, DC, PBKS, RR fare? Greenstone Lobo predicts

Vaibhav Suryavanshi , at 14 years and 23 days old, became the youngest IPL debutant when Rajasthan Royals introduced him as an impact player during their chase against Lucknow Super Giants in Jaipur last Saturday.Despite his impressive 34 runs off 20 balls, including a first-ball six off Shardul Thakur, the Royals faced a narrow two-run defeat.The young talent was acquired by Rajasthan Royals for Rs 1.1 crore during last year's mega auction in Saudi Arabia. He had previously performed well for the Indian U-19 team, scoring 176 runs at an average of 44 in the U-19 Asia Cup last year.Suryavanshi broke the previous record held by Prayas Ray Barman, who debuted at 16 years and 157 days for Royal Challengers Bengaluru against Sunrisers Hyderabad in 2022.Former Pakistani player Basit Ali praised Suryavanshi's bold approach: ""The 14-year-old kid, Vaibhav Suryavanshi. The way he smashed that first ball for six, it's a huge deal. Imagine what would have happened had he gotten out trying to hit the first ball for six? What would people have said? In Pakistan, people would have said, throw him out. But this is how confidence is given, which later pays off.""Ali also commended the IPL's talent pool this season: ""The class of IPL – when I call it No. 1, my Pakistan brothers feel bad. But all they do is waste their hands and time. Look at the immense pool of talent, this season alone. Nehal Wadhera, Priyansh Arya, Abdul Samad, Ashwani Kumar. I want to see Mayank Yadav in particular. I am eagerly waiting for him to be match fit. I really want to see his bowling.""","Vaibhav Suryavanshi made his IPL debut for Rajasthan Royals last Saturday. He scored 34 runs off 20 balls, including a first-ball six off Shardul Thakur. The 14-year-old broke the previous record held by Prayas Ray Barman, who debuted at 16 years and 157 days in 2022.","https://static.toiimg.com/thumb/msid-120491878,imgsize-46950,width-400,resizemode-4/Vaibhav-Suryavanshi.jpg"
"IPL 2025: How Ayush Mhatre, the latest Virar 'special' was made",https://timesofindia.indiatimes.com/sports/cricket/ipl/top-stories/ipl-2025-how-ayush-mhatre-the-latest-virar-special-was-made/articleshow/120491399.cms,"Mumbai, Apr 20 (ANI): Chennai Super Kings' Ayush Mhatre plays a shot during the IPL 2025 match against Mumbai Indians, at Wankhede Stadium in Mumbai on Sunday. (ANI Photo)

Mumbai:

Go Beyond The Boundary with our YouTube channel.

Poll What aspect of Ayush Mhatre's game impressed you the most in his debut match? His calmness and composure under pressure His aggressive batting and quick scoring

We need to be more proactive all the way through: Stephen Fleming

Poll What do you think about Ayush Mhatre's potential as a cricketer? He will be a future star It's too early to tell He needs more experience He has great potential

There is an old video of Mumbai and Chennai Super Kings ' new wonderkid, Ayush Mhatre , doing the rounds. In the video, which has gone viral now, Ayush, a toddler back then, is asked about his age: ""Six,"" he replies. Where do you stay, the interviewer asks him. ""Virar,"" he responds in a squeaky voice. “Isn’t it far from here (Churchgate). How do you commute?” he is asked. ""Train,"" he replies, before asserting: ""I want to be a batsman.""Subsequently, Ayush's grandfather (maternal) Laxmikant Anand Naik is asked why he has brought a six-year-old kid for learning cricket lessons at the Dilip Vengsarkar Cricket Academy: ""I wanted to bring him here as I saw his talent. Whether he becomes something is up to his luck, it's my duty to provide him with an opportunity. The whole world knows about Vengsarkar. I thought that he will learn cricket under his tutelage.""Indeed, there are similarities that Mhatre, the latest Mumbai cricket sensation, shares with the city's last two explosive batting talents: Prithvi Shaw-like Prithvi he belongs to Mumbai's furthest -suburb called Virar (it’s the last station on the western line), and Yashasvi Jaiswal (he too has trained at Vengsarkar's academy at the Oval maidan at Churchgate).Astonishing people about his cricketing skills from a young age is something that Ayush began doing almost a decade earlier. ""He was actually just five when that video was shot. As a five-year-old, he played a match with the leather cricket ball with kids who were at least 12-years old. Vengsarkar sir gave him a lot of exposure at such a young age. Eventually, he had to leave Vengsarkar sir's academy after three years as there was too much travelling involved, getting up at 5am and going from Virar to Churchgate. At the age of 10, he joined the MIG Cricket Club, where he trains under Prashant Shetty and Sachin Koli. Both Vengsarkar and MIG CC didn’t charge him a rupee for coaching. At the age of 13, he played for Sainath Sports Club (in Virar), who boldly played him in 'A' division tournaments in Mumbai. After the exposure that he got there, he didn't look back. Even today, he plays for Sainath SC. This journey hasn’t been easy. So many people have supported him,"" Ayush's father Yogesh Mhahtre a banker, told TOI, still pinching himself that his son, playing for a team captained by the iconic MS Dhoni, blasted an eye-catching 15-ball 32, which included four sixes and two fours against Mumbai Indians to win the hearts of the packed crowd at the Wankhede Stadium, millions watching on telly and former cricketing greats like Sunil Gavaskar and Ravi Shastri in the commentary.""I don't have words to describe my emotions. He's always been a fearless batsman. He just looks to enjoy himself in the middle, doesn't think too much, or takes pressure. As a parent, I was a bit nervous about his IPL debut yesterday..there’s is so much noise, crowd, music..he has never played in such an atmosphere before. However, he seemed to be cool and clear about what he needed and wanted to do! He's someone who'll play for the team, not himself. Even on his first-class debut (in the Irani Cup clash against Rest of India at Lucknow in Oct last year), he charged on the front foot and smashed Mukesh Kumar for a four, despite Mumbai having been reduced to six for two on Day One. He's not someone who will play for his place in the side. He doesn't play for milestones like 50s or 100s.I've also told him: 'If you get out on 90, then also I'll feel proud about you. making a century is in God's hands, don't run after milestones. Just follow your passion,' I've told him,"" Mhatre senior said.""I'm so proud that he is playing for CSK under a legend like MS Dhoni, who has achieved everything in the game. He can learn so much from him. He's really enjoying the environment at CSK. They have made him feel so relaxed, and not someone playing in his debut IPL season. I hope he continues this approach, provides happiness to everyone and goes on to play for India eventually. This is just the start, an important step,"" the proud father added.Mhatre's childhood hero is Indian captain Rohit Sharma , who smashed 76 not out off 45 balls to seal MI's nine-wicket win on Sunday night, in the process taking the young man the value of finishing the job after the initial assault. ""He started playing cricket after watching Rohit bat. You can see in his batting style that he idolises Rohit. When I spoke to him last night, Ayush was more happy and proud about chatting with Rohit yesterday than his own smashing IPL, CSK and T20 debut,"" Yogesh said.A solid supporter of Mhatre till now has been India's T20 captain Suryakumar Yadav , not surprising since in recent times, quite a few youngsters, including Abhishek Sharma, have credited SKY for the role he has played in encouraging them. ""Surya has always supported him at every point. He keeps talking to Ayush, sends him encouraging messages boosting his morale. Even yesterday, Surya gifted him a bat, something which he keeps doing,"" Yogesh revealed. ""I think that Ayush has more bats of Surya than Surya himself,"" he said in jest.Showering praise on Mhatre, Mumbai chief selector Sanjay Patil told TOI: ""His improvisation and timing were superb last night. He has tremendous talent. The best thing about him is that his temperament is very good. This was his IPL debut, but he had no nerves. He doesn’t take stress, and I saw that during his debut at the Irani Cup also last year. He needs to improve his conversation rate, but I can understand since it was just his first match. He will only get better with great players like Rohit Sharma and Suryakumar Yadav around to guide him. I saw how quickly he learnt a few things from Mumbai captain Ajinkya Rahane and Shreyas Iyer during the Ranji Trophy.""""I think he definitely has the potential to go and play for India. I only regret that I couldn't play him against Jammu & Kashmir in a Ranji Trophy match last season, because all our senior India players were available for that match,"" he added.After he scored 176 against Maharashtra at BKC in the Ranji Trophy, Mhatre was signed up by SG, who sponsor his cricketing kit and provide him with bats. if he keeps smashing the ball like that, expect more such deals to come the Virat lad's way.","Ayush Mhatre made his IPL debut for Chennai Super Kings against Mumbai Indians on Sunday. He hit 32 runs in 15 balls, including four sixes and two fours. He has been training at Dilip Vengsarkar's academy since he was five-years-old.","https://static.toiimg.com/thumb/msid-120491625,imgsize-146508,width-400,resizemode-4/Mumbai-Apr-20-ANI-Chennai-Super-Kings-Ayush-Mhatre-plays-a-shot-during-the-.jpg"
Pope Francis Death: Serie A postpones matches as Italian football mourns Pope Francis’ death,https://timesofindia.indiatimes.com/sports/football/top-stories/serie-a-postpones-matches-as-italian-football-mourns-pope-francis-death/articleshow/120483138.cms,"File Pic: Pope Francis playing with a football. (AP Photo)

Go Beyond The Boundary with our YouTube channel.

Poll Do you agree with the decision to postpone Serie A matches following the passing of Pope Francis? No, the matches should go on as scheduled. Yes, it's a respectful gesture.

Following the passing of Pope Francis at the age of 88 on Monday, Italy’s Serie A has postponed four fixtures that were set to be played on the same day.The matches affected include Torino vs. Udinese, Cagliari vs. Fiorentina, Lazio vs. Genoa, and Parma vs. Juventus. New dates for these games have yet to be announced.Rescheduling these fixtures could prove difficult, given the congested calendar and potential clashes with Champions League semi-final commitments.The postponements extend beyond Serie A, with Italy’s football federation (FIGC) confirming that all matches across the professional and amateur levels — including youth leagues — scheduled for Monday will also be delayed.In a statement, the FIGC described the Pope as “an example of Christian charity and dignity in suffering, always close to the world of football.”The Vatican confirmed that Pope Francis, a known football enthusiast, passed away on Monday at the age of 88.","Four Serie A fixtures have been postponed following the passing of Pope Francis. The matches affected include Torino vs. Udinese, Cagliari vs. Fiorentina, Lazio vs. Genoa, and Parma vs. Juventus. The postponements extend beyond Serie A, with all matches across the professional and amateur levels — including youth leagues — scheduled for Monday will also be delayed.","https://static.toiimg.com/thumb/msid-120483300,imgsize-1033661,width-400,resizemode-4/Pope-Francis.jpg"
"Premier League: Trent Alexander-Arnold fires Liverpool to brink of title, Leicester relegated",https://timesofindia.indiatimes.com/sports/football/top-stories/premier-league-alexander-arnold-fires-liverpool-to-brink-of-title-leicester-relegated/articleshow/120461792.cms,"Trent Alexander-Arnold scored the winner for Liverpool against Leicester City. (Reuters)

Man Utd misery

Bombay Sport Exchange Episode 1: Interview with Sanjog Gupta, CEO (Sports) at JioStar

Trent Alexander-Arnold fired Liverpool to the brink of the Premier League title as his late strike sealed a 1-0 win that relegated Leicester after Arsenal's 4-0 rout of Ipswich delayed the leaders' coronation on Sunday.Arne Slot's side could have clinched a record-equalling 20th English title with a combination of an Arsenal loss and a victory at the King Power Stadium.Go Beyond The Boundary with our YouTube channel. SUBSCRIBE NOW! Liverpool fulfilled their half of the equation, but second-placed Arsenal were not so obliging earlier in the afternoon.The Gunners' stroll at Portman Road meant Liverpool kicked off still needing six points from their last six games to seal a first title since 2020.Thanks to Alexander-Arnold's match-winning contribution after coming off the bench, Liverpool are 13 points clear of Arsenal with five games left for both teams.The Reds will seal the title if Arsenal lose at home to Crystal Palace on Wednesday or if they beat Tottenham at Anfield on April 27.It looked like being a frustrating day for Liverpool as second-bottom Leicester kept them at bay despite a host of chances for the visitors.Slot's men finally made the breakthrough in the 76th minute when Alexander-Arnold lashed home the rebound from close-range after Mohamed Salah and Diogo Jota both hit the crossbar.With speculation mounting that Alexander-Arnold will join Real Madrid when his contract expires at the end of the season, it was notable that the England right-back embarked on a wild celebration of his winner.Alexander-Arnold earned a booking for ripping off his shirt and planting it on the corner flag after he sprinted to 3,000 jubilant Liverpool fans in one corner of the King Power.""It took us a long time and, of course, a great moment for Trent after working so hard to come back. To score the goal that makes a lot of difference is very special,"" Slot said.""It's never hard to dream (of the title) but you see we are really focused on playing Tottenham.""Liverpool's title celebration is only a matter of time but Leicester will spend next season in the Championship after their woeful one-year stay in the top tier came to an end with a 23rd defeat in 33 league games.Fresh from a famous victory over Real Madrid on Wednesday to reach the Champions League semi-finals for the first time since 2009, Arsenal ensured Liverpool would not be able to start their party this weekend.Mikel Arteta made only three changes from the 2-1 win in the Spanish capital and was rewarded with a dominant display to kill the game off inside half an hour.""All we can do is delay that moment (Liverpool win the league) from our side to earn the right to finish as high as possible,"" Arteta said.Leandro Trossard was one of those recalled by Arteta and prodded in his eighth goal of the season to open the scoring.A flowing move saw Bukayo Saka's cross flicked by Mikel Merino into the path of Gabriel Martinelli to finish to double the Gunners lead.Moments later, Saka was chopped down by an awful challenge from Leif Davis that saw the Ipswich left-back shown a straight red card.Trossard fired in his second after a well-worked corner before Ethan Nwaneri's deflected effort rounded off the scoring.Defeat realistically ends third-bottom Ipswich's hope of maintaining their Premier League status as they are 15 points adrift of safety with five games remaining and have a significantly poorer goal difference than West Ham.Chelsea needed two late goals at Fulham to revive their chances of Champions League football next season with a dramatic 2-1 victory.Alex Iwobi opened the scoring on 20 minutes and Chelsea were meandering towards a damaging defeat until 19-year-old substitute Tyrique George fired in a snap shot from the edge of the box on 83 minutes.Pedro Neto then completed the comeback with a stunning strike in stoppage-time to secure Chelsea's sixth win in their last 17 league games.Fifth-placed Chelsea moved above Nottingham Forest, who travel to Tottenham on Monday. Manchester United succumbed to an eighth home league defeat of the season as Wolves won 1-0 at Old Trafford.Pablo Sarabia curled in a brilliant free-kick 13 minutes from time to hand United a club record 15th league loss this term.Wolves' fifth consecutive Premier League win lifts Vitor Pereira's side up to 15th and level on points with United, who stay 14th on goal difference.",Trent Alexander-Arnold scores winner as Liverpool beat Leicester 1-0. Arsenal thrash Ipswich 4-0 to extend lead at the top to 13 points. Chelsea come from behind to beat Fulham 2-1. Manchester United lose 15th league game of the season.,"https://static.toiimg.com/thumb/msid-120461942,imgsize-72830,width-400,resizemode-4/Leicester-Liverpool-Reuters.jpg"
"Premier League: Manchester City boost top five bid, Southampton snatch late leveller",https://timesofindia.indiatimes.com/sports/football/top-stories/premier-league-manchester-city-boost-top-five-bid-southampton-snatch-late-leveller/articleshow/120439110.cms,"Manchester City's Mateo Kovacic celebrates scoring during the English Premier League match against Everton at Goodison Park,. (PA via AP)

Go Beyond The Boundary with our YouTube channel.

Saints consolation

Manchester City bolstered their bid to qualify for the Champions League with a dramatic 2-0 win at Everton , while Southampton 's last-gasp equaliser at West Ham ensured they will not have sole possession of the lowest points total in Premier League history.City were heading towards a damaging draw before Nico O'Reilly's 84th minute strike put them on course for a vital victory that was sealed by Mateo Kovacic's goal in the final seconds.Pep Guardiola's side climb to fourth place, four points ahead of sixth-placed Chelsea, who face Fulham on Sunday in their game in hand.Fifth-placed Nottingham Forest , who travel to Tottenham on Monday, are one point adrift of City.At a stage of the season when they are usually embroiled in a battle to win the title, City -- champions in six of the previous seven campaigns -- have been reduced to scrapping for a Champions League berth after a dismal season.They remain on course to achieve their bare minimum target after a hard-fought success on Merseyside.In the 84th minute, Matheus Nunes's low cross into the six-yard box was met by the 20-year-old O'Reilly, who got in front of Michael Keane to poke home from close range.O'Reilly has emerged as an unlikely hero for City after the Manchester-born midfielder scored last week in the win against Crystal Palace and netted twice against Plymouth in the FA Cup.Kovacic wrapped up City's victory on their last visit to Goodison Park before Everton move to a new stadium next season.The Croatian guided Ilkay Gundogan's pass into the bottom corner to give City a third win from their last four league games.""To win here at Goodison Park, where Liverpool and Arsenal couldn't, is massively important,"" Guardiola said.""Now it is in our hands. Three games at home, two away and hopefully we can achieve this big success to qualify for the Champions League.""Relegated Southampton rescued a 1-1 draw at West Ham to guarantee they won't have the indignity of being the lone club with the Premier League's worst ever points tally.Jarrod Bowen struck for the Hammers in the 47th minute, holding off Ryan Manning before lashing a fierce finish past Aaron Ramsdale.But Lesley Ugochukwu equalised three minutes into second half stoppage-time as he lashed past Alphonse Areola.Bottom of the table Southampton are now on 11 points -- the same number Derby managed in 2007-08 -- and have five games left to leave the Rams with the lowest total ever recorded in the Premier League.Brentford beat 10-man Brighton 4-2 to damage the Seagulls' prospects of qualifying for Europe with their first home win since December.Thomas Frank's side took a ninth minute lead when Lewis Keane-Potter's precise pass through the heart of the Brighton defence picked out Bryan Mbeumo and he confidently slotted homeDanny Welbeck hauled Brighton level in first half stoppage-time with a powerful header from Mats Wieffer's cross.Mbeumo restored Brentford's advantage three minutes after half-time, his strike taking a hefty deflection off Brighton defender Lewis Dunk on its way past Bart Verbruggen.Yoane Wissa bagged Brentford's third in the 58th minute, running onto Mbeumo's pass and finishing with the help of a deflection off Jan Paul van Hecke.Brighton striker Joao Pedro was sent off in the 61st minute for a needless kick at Nathan Collins.Japan forward Kaoru Mitoma reduced the deficit in the 81st minute, but Christian Norgaard headed home in stoppage-time to end Brighton's hopes of a late escape.Crystal Palace held on for a 0-0 draw against Bournemouth despite playing half the match with 10 men.Palace were reduced to 10 men just before half-time at Selhurst Park when Chris Richards was sent off for a second booking after the defender fouled Justin Kluivert.Third-placed Newcastle will look to step up their Champions League qualification surge when they travel to Aston Villa in Saturday's late game.",Manchester City beat Everton 2-0 in English Premier League. Nico O'Reilly scores 84th minute winner at Goodison Park. Brentford beat 10-man Brighton 4-2 to damage Seagulls' European hopes. Southampton salvage 1-1 draw at West Ham to stay bottom of table.,"https://static.toiimg.com/thumb/msid-120439882,imgsize-134142,width-400,resizemode-4/Britain-Soccer-Premier-League.jpg"
La Liga: Barcelona stage epic comeback from 1-3 down to extend lead at top,https://timesofindia.indiatimes.com/sports/football/top-stories/la-liga-barcelona-stage-epic-comeback-from-1-3-down-to-extend-lead-at-top/articleshow/120438582.cms,"Barcelona players celebrate after their come-from-behind win against Celta Vigo in La Liga. (AP)

Go Beyond The Boundary with our YouTube channel.

Barcelona staged a remarkable comeback to defeat Celta Vigo 4-3 at home on Saturday, extending their La Liga lead to seven points over Real Madrid. After trailing 3-1 with less than 30 minutes remaining, Barcelona's Dani Olmo and Raphinha , who scored twice including a 98th-minute penalty, secured the crucial victory.Barcelona took an early lead through Ferran Torres in the 12th minute, who scored from the edge of the box after finding space in Celta's defence.Celta Vigo responded quickly, with Borja Iglesias equalising three minutes later. Pablo Duran's cross found Iglesias, who scored into an empty net after goalkeeper Wojciech Szczesny failed to intercept.Barcelona's attempts to regain the lead saw Raphinha sending a free-kick over the bar and Robert Lewandowski missing the target. Szczesny made important saves from Ilaix Moriba and Iker Losada at the other end.Iglesias put Celta ahead early in the second half, capitalizing on Frenkie de Jong's error to score past Szczesny. He later completed his hat-trick after being set up by Sergio Carreira, taking advantage of Barcelona's high defensive line.""This is football, we really wanted to win, maybe we weren't at our best but the response from the team, and the fans pushed us on... we deserved it,"" Olmo told DAZN. ""These are three points that take us closer to our objective, they're important and we have to continue.""Barcelona coach Hansi Flick had initially rested 17-year-old Lamine Yamal for the first time in 2025 but brought him on after Iglesias' third goal.The comeback began when Raphinha assisted Olmo, who beat goalkeeper Vicente Guaita. Raphinha then scored himself, heading in Yamal's cross from the right.Celta missed a chance to secure the win when Oscar Mingueza headed wide from close range in the 90th minute.The decisive moment came in the 96th minute when VAR review led to a penalty after Yoel Lago fouled Olmo. With Lewandowski substituted, Raphinha converted the spot-kick into the top-right corner.""It's a bittersweet feeling... we scored three, which few teams can do here, but it feels bad,"" said Celta's Duran. ""We have to be proud of our team, we came here with personality, played well, had a good plan and carried it out -- but for small details it got away from us.""The victory maintains Barcelona's strong position in the title race, with Real Madrid set to face Athletic Bilbao on Sunday and a Clasico matchup scheduled for May.Celta Vigo, currently seventh in La Liga and competing for European qualification, showed attacking prowess throughout the match despite the eventual defeat.","Barcelona come from behind to defeat Celta Vigo 4-3 in La Liga. Borja Iglesias, Raphinha and Dani Olmo scored the goals for Barcelona. The victory extends Barcelona's lead over Real Madrid to seven points. Real Madrid face Athletic Bilbao on Sunday.","https://static.toiimg.com/thumb/msid-120438785,imgsize-98468,width-400,resizemode-4/Raphinha-leads-Barcelonas-4-3-comeback-win-over-Celta-Vigo.jpg"
