Article Title,Article Link,Article Text,Article Summary,Article Image
BCCI taken to court over IPL robot dog,https://timesofindia.indiatimes.com/sports/cricket/ipl/top-stories/bcci-taken-to-court-over-ipl-robot-dog/articleshow/120785033.cms,"IPL robotic dog Champak

Go Beyond The Boundary with our YouTube channel.

New Delhi: The Board of Control for Cricket in India ’s ( BCCI ) move to name its AI-driven robot dog ‘ Champak ’ has led to it being dragged to court over alleged trademark infringement issues by a renowned children’s magazine of the same name.The Delhi High Court heard the suit on Wednesday and sought the stand of the cricketing body, even as it declined to issue any interim stay. Justice Saurabh Banerjee observed that “Champak was an existing brand name since eternity” while asking the BCCI to file its written statement in response to the plea within four weeks.Further hearing will be on July 9 on the plea filed by Delhi Press Patra Prakashan Pvt Ltd , which has been publishing ‘Champak’ magazine since 1968.The publisher claimed that the commercial usage of the name amounts to dilution of the publication’s registered trademark and has tarnished its image. However, the court remarked that the publication failed to show the existence of a commercial gain in using the name, as it was adopted after an online poll.During the hearing, the judge also pointed out that even cricketer Virat Kohli’s nickname is ‘Chiku’, which is also one of the popular characters in Champak magazine.Senior advocate J Sai Deepak, who appeared for BCCI, opposed the plea, saying Champak was the name of a flower and people associated the robotic dog with a character of a TV series.",The Delhi High Court heard the suit on Wednesday and sought the stand of the cricketing body. Delhi Press Patra Prakashan Pvt Ltd has been publishing ‘Champak’ magazine since 1968. The publisher claimed that the commercial usage of the name amounts to dilution of the publication’s registered trademark.,"https://static.toiimg.com/thumb/msid-120785021,imgsize-65232,width-400,resizemode-4/Champak-IPL-2025-robot-dog.jpg"
IPL 2025 Points Table: Latest standings after RR vs MI match at Sawai Mansingh Stadium in Jaipur,https://timesofindia.indiatimes.com/sports/cricket/ipl/top-stories/ipl-2025-points-table-latest-standings-after-rr-vs-mi-match-at-sawai-mansingh-stadium-in-jaipur/articleshow/120800831.cms,"Mumbai Indians dominated Rajasthan Royals, securing a 100-run victory and topping the IPL 2025 points table with a strong NRR. This win significantly boosted MI's playoff chances while simultaneously eliminating Rajasthan Royals from contention. Royal Challengers Bengaluru, Punjab Kings, and Gujarat Titans remain strong contenders, setting the stage for a fierce battle for the top spots.","Mumbai Indians beat Rajasthan Royals by 100 runs to top the IPL 2025 points table. Royal Challengers Bengaluru, Punjab Kings, and Gujarat Titans remain strong contenders for the top spots. This win significantly boosted MI's playoff chances while simultaneously eliminating Rajas Than Royals from contention.","https://static.toiimg.com/thumb/msid-120800821,imgsize-47250,width-400,resizemode-4/Riyan-Pandya-01015-IPL.jpg"
IPL 2025: Shreyas Iyer reborn for the T20 stage,https://timesofindia.indiatimes.com/sports/cricket/ipl/ipl-2025-shreyas-iyer-reborn-for-the-t20-stage/articleshow/120809910.cms,"Shreyas Iyer, leading Punjab Kings, is showcasing exceptional form in the IPL, potentially marking his best season yet. His impressive 72-run innings against CSK highlighted his evolved approach, blending calculated assessment with aggressive hitting. Ricky Ponting praised Iyer's growth, noting technical adjustments and enhanced understanding of game situations, fueling his case for a national team comeback.","Shreyas Iyer's 72-run innings against CSK highlighted his evolved approach, blending calculated assessment with aggressive hitting. Ricky Ponting praised his growth, noting technical adjustments and enhanced understanding of game situations, fueling his case for a national team comeback.","https://static.toiimg.com/thumb/msid-120809983,imgsize-38786,width-400,resizemode-4/Shreyas-Iyer.jpg"
"Gareth Southgate turns cricket fan, attends Rajasthan Royals vs Mumbai Indians IPL 2025 match",https://timesofindia.indiatimes.com/sports/cricket/ipl/top-stories/gareth-southgate-turns-cricket-fan-attends-rajasthan-royals-vs-mumbai-indians-ipl-2025-match/articleshow/120799036.cms,"Image credit: BCCI/IPL

Go Beyond The Boundary with our YouTube channel. SUBSCRIBE NOW!

Sachin Tendulkar at 52: Power, Pride, and a Nation’s Pulse

NEW DELHI: Former England manager Gareth Southgate was in attendance at the Sawai Mansingh Stadium in Jaipur on Thursday, watching the IPL 2025 clash between Rajasthan Royals and Mumbai Indians Southgate, who stepped down as England manager in 2024, was spotted sporting Rajasthan Royals’ special pink jersey during the match.Put into bat by Rajasthan Royals, Mumbai Indians posted a formidable 217/2, riding on fluent half-centuries from Ryan Rickelton and Rohit Sharma Also See: IPL Live Score Rickelton smashed 61 off 38 balls (7 fours, 3 sixes), while Rohit struck a composed 53 off 36 (9 fours).The pair added 116 runs in just 11.5 overs, laying a strong platform for MI.Skipper Hardik Pandya and Suryakumar Yadav then unleashed brutal cameos — both scoring 48 off 23 — to finish the innings with a flourish.","Former England manager Gareth Southgate was in attendance at the Sawai Mansingh Stadium in Jaipur on Thursday. Southgate, who stepped down as England manager in 2024, was spotted sporting Rajasthan Royals’ special pink jersey. Mumbai Indians posted a formidable 217/2, riding on fluent half-centuries from Ryan Rickelton and Rohit Sharma.","https://static.toiimg.com/thumb/msid-120799032,imgsize-31360,width-400,resizemode-4/Gareth-Southgate-0105-IPL.jpg"
'RCB invested in me when no one else did': Suyash Sharma on IPL comeback,https://timesofindia.indiatimes.com/sports/cricket/ipl/top-stories/rcb-invested-in-me-when-no-one-else-did-suyash-sharma-on-ipl-comeback/articleshow/120797598.cms,"Suyash Sharma

Go Beyond The Boundary with our YouTube channel. SUBSCRIBE NOW!

What went wrong with CSK in IPL 2025

Young cricketer Suyash Sharma , speaking on RCB Bold Diaries, shared his journey to IPL , including his recovery from a major surgery supported by Royal Challengers Bengaluru, his debut experiences, and his aspirations for the upcoming match against Chennai Super Kings on May 1. The 21-year-old detailed his path from playing under-25 cricket to making it to the IPL, highlighting RCB's role in his medical treatment in London.Sharma expressed gratitude for RCB's support during his recovery from hernia surgery in London, where he received care from team physiotherapist James Pipey.""RCB sent me to London for my surgery. There I met James Pipey (RCB Team Physio). He and his family treated me like family. I had three hernias. To be honest, I didn't expect to play the first match. I was told I would play three or four matches later because it was a big surgery. But Pipey and his family took care of me. I'm very thankful that I'm in this franchise. I'm fit now. I had been suffering from pain for the past two years. I was used to playing in pain. The problem is that if you're playing for India or a franchise, then you can manage. When I wasn't playing, I had this injury, but I didn't even know it. I went to a physiotherapist but it was very difficult. RCB showed me a lot of faith. They invested in me. I'm very happy with my surgery. The path I'm on now, I wasn't on before. Whatever happens, happens for the best.""The young spinner recalled his journey to the IPL, highlighting his persistence through multiple trials and eventual selection.""I had never played in a proper tournament before the IPL. I had only played Under-25. I spent six or seven years in trials but was never picked. Every time I visited my parents, they would ask when I'd get a chance in the IPL. But my mum and dad never doubted me. They could see how hard I was working. After the Under-25s, I went for IPL trials. At that time, my googly was very sharp. I think I took eight wickets out of ten in one match, it was a KKR ( Kolkata Knight Riders ) practice match, and even the wicket-keeper was getting beat. That's when I was picked. My father was in hospital then. He cried when he heard. No one expected me to play IPL so soon.""Sharma shared his experience of making his IPL debut against RCB.Quiz: Who's that IPL player? ""My debut was against RCB. There was a lot of pressure. I had never even been to watch a match before. I'd never seen so many people in a crowd. The atmosphere was crazy. I went straight into the game. Until you actually bowl in a match, you don't know what it's like. I can't describe what I was feeling. My mind was blank. But I tried to do what I had always done. After the first over, everything settled down. I could see the crowd, feel the moment. I always knew I'd play in the IPL, 101 per cent. But I didn't think it would happen this soon. I was 19. I thought I'd debut at 24 or 26. I always believed in myself. When you work hard, God helps you.""He detailed his mental preparation during his recovery period and his approach to bowling.""Before the IPL, I was on bed rest for three months. I only started bowling two weeks before the tournament. But during those three months, I visualised everything. I kept thinking about my bowling all day. I would run affirmations in my head. I'd plan each ball: first I'll bowl like this, then like that. I think all of that really helped. I worked on my run-up too. My run-up is my bowling. If you keep something in your mind long enough, when the time comes to do it, you feel prepared. You just think, 'I've done this before. I'll do it again.' I just had to recreate it in the match.""Sharma acknowledged his family's support, particularly after losing his father to cancer.""My mum was my teacher. My dad had a factory. Two years back, I lost my father. He was suffering from cancer. He passed away in hospital while I was just starting to get noticed. My family has always supported me, whether I played for the state or not. They've been my backbone throughout. They never doubted me, because they saw my hard work every day.""The young cricketer expressed his singular goal for the season: ""I have only one goal that we win this year and lift the cup. This is my only goal right now.""",Suyash Sharma made his IPL debut against Royal Challengers Bengaluru. The 21-year-old spinner detailed his path from playing under-25 cricket to making it to the IPL. Sharma expressed gratitude for RCB's support during his recovery from hernia surgery in London.,"https://static.toiimg.com/thumb/msid-120797663,imgsize-18908,width-400,resizemode-4/No-one-expected-me-to-play-IPL-so-soon-RCBs-Suyash-Sharma-reflects-on-his-challenging-journey.jpg"
Transgender women banned from women's football in England: Impact of Supreme Court ruling,https://timesofindia.indiatimes.com/sports/football/top-stories/transgender-women-banned-from-womens-soccer-in-england-impact-of-supreme-court-ruling/articleshow/120795259.cms,"FCampaigners take part in a rally organised by trans rights groups, trade unions, and community organisations following the Supreme Court ruling on the definition of a woman in equalities law, at Parliament Square, central London, Saturday April 19, 2025. (AP Photo/Alastair Grant,)

Go Beyond The Boundary with our YouTube channel. SUBSCRIBE NOW!

What went wrong with CSK in IPL 2025

The Football Association announced Thursday that transgender women will be banned from playing in women's football teams in England, following a recent UK Supreme Court ruling that defined women as those born biologically female. This decision changes the previous rules that allowed transgender athletes to participate in women's football if they maintained reduced testosterone levels.The Scottish Football Association implemented a similar ban last week, marking a significant shift in UK football policies.The Supreme Court ruling, issued two weeks ago, has broader implications beyond sports. The Equality and Human Rights Commission stated that transgender women would be excluded from women's toilets, hospital wards, and sports teams.The decision has generated mixed reactions, with support from feminist groups and opposition from trans-rights advocates who warn of negative impacts on daily life.""We understand that this will be difficult for people who simply want to play the game they love in the gender by which they identify, and we are contacting the registered transgender women currently playing to explain the changes and how they can continue to stay involved in the game,"" the FA stated.The FA explained that while their policy aimed to make football accessible to everyone, they would make changes based on developments in law, science, or grassroots football operations.Quiz: Who's that IPL player? The new policy will take effect on June 1, though the exact number of players affected remains unclear.The ban comes after England's governing body reviewed its previous policy that allowed transgender women to participate in women's football teams if they demonstrated reduced testosterone levels.","The Football Association announced Thursday that transgender women will be banned from playing in women's football teams in England. The ban comes after a recent UK Supreme Court ruling that defined women as those born biologically female. The new policy will take effect on June 1, though the exact number of players affected remains unclear.","https://static.toiimg.com/thumb/msid-120795321,imgsize-107950,width-400,resizemode-4/Transgender-women-soccer-players-to-be-banned-from-English-womens-teams.jpg"
UEFA Champions League: Barcelona and Inter Milan battle to a thrilling 3-3 draw in semi-final first leg,https://timesofindia.indiatimes.com/sports/football/top-stories/uefa-champions-league-barcelona-and-inter-milan-battle-to-a-thrilling-3-3-draw-in-semi-final-first-leg/articleshow/120782076.cms,"Barcelona's Lamine Yamal (C) is challenged by Inter Milan players (in white) during the Champions League semi-final first leg at the Lluis Companys Olympic Stadium in Barcelona. (AP)

Go Beyond The Boundary with our YouTube channel.

🔴 Barcelona vs Inter (3-3) Extended Highlights | Champions League Semi Final 2025

Poll Who was the standout player in the Barcelona vs Inter Milan match? Ferran Torres Denzel Dumfries Marcus Thuram Lamine Yamal

Barcelona and Inter Milan played out an exhilarating 3-3 draw in their Champions League semi-final first leg at Olympic stadium on Wednesday, with 16-year-old Lamine Yamal delivering a standout performance. The match featured six goals, including the fastest-ever Champions League semi-final goal scored by Marcus Thuram after just 30 seconds.Inter Milan took an early lead through Thuram's clever back-heel finish after Inigo Martinez slipped at a crucial moment, allowing the French striker to convert Denzel Dumfries' low cross.Dumfries extended Inter's lead with an acrobatic finish from Francesco Acerbi's headed corner, putting the 2023 runners-up in a commanding position.Yamal, making his 100th appearance for Barcelona, responded with a brilliant solo goal, becoming the youngest player to score in a Champions League semi-final. He dribbled past multiple defenders before placing a perfect shot off the left post.Ferran Torres equalised for Barcelona after 38 minutes, converting Raphinha's header across goal from Pedri's delivery into the area.The second half saw both teams continue their attacking prowess. Dumfries restored Inter's lead with a header that deflected in off Dani Olmo.Barcelona quickly leveled again when Raphinha's powerful shot hit the crossbar and went in off goalkeeper Yann Sommer's head for an own goal.""Letting in that many goals is unacceptable, but we also have to give Inter credit, they did very well. The important thing is we leave with a result where everything can happen,"" said Raphinha.""After three defeats in a row we saw the real Inter tonight, we played with heart and I'm proud,"" Dumfries told Amazon Prime Video.""Yamal is a phenomenon of the kind born every 50 years,"" said impressed Inter coach Simone Inzaghi.Both teams suffered injury setbacks during the match. Barcelona's Jules Kounde left before halftime, while Inter captain Lautaro Martinez also departed due to injury, with Inzaghi expressing doubts about his availability for the return leg.Inter's Henrikh Mkhitaryan had a goal disallowed for a tight offside decision, later saying he would think about it ""maybe for the rest of my life."" Yamal hit the woodwork again as both teams pushed for a winner.""We will have our chance in Milan. This is our goal, we will fight for it,"" said Barcelona coach Hansi Flick.The second leg is scheduled for next Tuesday in Milan, with the winner advancing to face either Paris Saint-Germain or Arsenal in the final at Munich on May 31.","Barcelona and Inter Milan played out an exhilarating 3-3 draw in their Champions League semi-final first leg at Olympic stadium on Wednesday. 16-year-old Lamine Yamal delivered a standout performance. The match featured six goals, including the fastest-ever Champions League Semi-final goal scored by Marcus Thuram after just 30 seconds.","https://static.toiimg.com/thumb/msid-120782197,imgsize-136440,width-400,resizemode-4/Barcelona-teenager-Yamal-praised-by-friend-and-foe-for-performance-against-Inter-Milan.jpg"
"Premier League opens Mumbai office, reinforces long-term commitment to Indian football",https://timesofindia.indiatimes.com/sports/football/epl/top-stories/premier-league-opens-mumbai-office-reinforces-long-term-commitment-to-indian-football/articleshow/120765252.cms,"Premier League office in Mumbai (Pic credit: EPL India)

Go Beyond The Boundary with our YouTube channel.

In a major step to deepen its engagement with Indian fans and support the growth of football across the country, the English Premier League announced the opening of its new office in Mumbai on Wednesday. This marks the latest expansion of the League’s global footprint and its enduring association with India’s burgeoning football community.The Mumbai office aims to bolster the Premier League's efforts to grow the sport at both grassroots and elite levels, while also enhancing connections with fans and stakeholders in the region. The office will serve as a hub for collaboration with local authorities, the Indian Super League (ISL), and governing bodies, helping to further integrate the Premier League’s programs and initiatives within India’s footballing ecosystem.Premier League Chief Executive Richard Masters underscored the importance of this move. “We and our clubs have a fantastic and knowledgeable fanbase in India, and we know football continues to grow in popularity. We are proud of our longstanding commitment to India, having worked to deliver community football programmes for 18 years and, more recently, our partnership with the Indian Super League,” he said. “Opening this office marks a significant milestone for the Premier League. It will allow us to operate more effectively locally as we build on our existing work to establish more ways to strengthen our relationship with fans, JioStar and other partners.”The Premier League’s connection with India began in 2007 through the Premier Skills initiative, in partnership with the British Council. Over the past 18 years, the program has trained more than 7,300 coaches and referees across 18 Indian states, positively impacting over 124,000 young people. At the elite level, the League’s alliance with the ISL since 2014 has resulted in meaningful collaboration in areas such as youth development, coaching standards, and referee training.Additionally, the Next Gen Cup — an elite youth tournament co-hosted with the ISL and Reliance Foundation — continues to foster top-level talent. The sixth edition of the event is set to take place in Mumbai in May 2025, featuring U19 teams from both Premier League clubs and ISL academies.This marks the fourth international office for the Premier League, after successful launches in Singapore (2019), New York (2023), and Beijing (2024), as the League continues to globalise its fan engagement and development initiatives.","The EPL has opened a new office in Mumbai. The office will serve as a hub for collaboration with local authorities, the Indian Super League (ISL), and governing bodies. This marks the fourth international office for the Premier League, after successful launches in Singapore (2019), New York (2023), and Beijing (2024)","https://static.toiimg.com/thumb/msid-120765242,imgsize-37096,width-400,resizemode-4/EPL.jpg"
Indian men's football team to face better-ranked Thailand ahead of AFC Asian Cup 2027 Qualifiers,https://timesofindia.indiatimes.com/sports/football/top-stories/indian-mens-football-team-to-face-better-ranked-thailand-ahead-of-afc-asian-cup-2027-qualifiers/articleshow/120762006.cms,"Team India (@IndianFootball on X)

NEW DELHI: The Indian national men's football team is set to play a friendly match against Thailand, a team ranked higher in FIFA standings, at Thammasat Stadium on June 4, as confirmed by the AIFF on Wednesday.This match forms part of India's preparation for their AFC Asian Cup 2027 Qualifiers Final Round fixture against Hong Kong-China on June 10.The FIFA Rankings place India at 127th position, whilst Thailand hold the 99th spot.In their previous 26 encounters, Thailand's Changsuek have secured 12 victories compared to India's seven wins, with seven matches ending in draws.The Indian squad will commence their preparation with a training camp in Kolkata from May 18, before travelling to Thailand by May 29.Following the friendly match, the team will proceed to Hong Kong for acclimatisation and training ahead of their Asian Cup qualification match.The other teams in Group C comprise Bangladesh and Singapore.Currently, all teams in the group have accumulated one point each, following India's scoreless draw with Bangladesh in Shillong and a similar result between Singapore and Hong Kong in Singapore on March 25.","The Indian national men's football team is set to play a friendly match against Thailand. The FIFA Rankings place India at 127th position, whilst Thailand hold the 99th spot. The Indian squad will commence their preparation with a training camp in Kolkata from May 18, before travelling to Thailand by May 29.","https://static.toiimg.com/thumb/msid-120762936,imgsize-378074,width-400,resizemode-4/EDS-THIRD-PARTY-IMAGE-In-this-image-released-by-IndianFootball-via-X-on-Ma-.jpg"
