Article Title,Article Link,Article Text,Article Summary,Article Image
"'Rajasthan ka Jadeja': The making of Manav Suthar, India's newest left-arm spin hope",https://timesofindia.indiatimes.com/sports/cricket/india-vs-afghanistan/rajasthan-ka-jadeja-the-making-of-manav-suthar-indias-newest-left-arm-spin-hope/articleshow/131576482.cms,"Manav Suthar (Photo by BCCI)

Rahul Dravid ’s Advice

Manav Suthar with coach Dheeraj Sharma (Special Arrangements)

Manav Suthar with coach Dheeraj Sharma (Special Arrangements)

Shubman Gill ’s Backing

Manav Suthar (Photo by BCCI)

Clever like Ravindra Jadeja



Next Ravindra Jadeja?

Poll Which quality do you think is crucial for a successful Test cricketer? Consistency Mental toughness







NEW DELHI: Test whites with his name on the back and spikes neatly laid out in his room, Manav Suthar was ready for the biggest day of his cricketing career. Just an hour before his Test debut, he picked up the phone and called his coach, Dheeraj Sharma, who had been waiting for his student's call.""Sapna poora ho gya sir. Apna best karunga,"" Suthar told Dheeraj on the morning of his debut.Not wanting to keep him for long before the game, Dheeraj kept the conversation brief.""Beta, sab kuch wahi hai, bas platform bada hai. Bas ye soch ke rakhna. Apne skills pe khelna, bas, baaki sab achha hoga.""Soon after, Suthar walked into the ground, received India Test cap No. 319 from Kuldeep Yadav and was greeted with hugs and congratulations from teammates and support staff.And what followed was a dream start. With bat, he scored a brisk 28 off 41, including dancing down the track for two maximums.After India declared at 564/8, Suthar struck in his very first over in Test cricket and then controlled the innings with remarkable discipline.Suthar finished day two with outstanding figures of 3/21 from 15.5 overs as India tightened their grip on the contest.Long before Suthar earned his maiden India call-up and eventual India debut, he had already caught the attention of one of the game's greatest minds: Rahul Dravid.According to his coach Dheeraj, Dravid was well aware of Suthar's all-round abilities, particularly his batting, but repeatedly advised him to prioritise his bowling if he wanted to build a long-term future in the game.""He used to regularly interact with Rahul Dravid. Dravid would often guide him during his India A and Under-19 days. He knew Manav's abilities well.He would tell him, 'You can always manage with your batting, but focus on your bowling and maximise it as much as you can',"" Dheeraj told Timesofindia.com.While many young cricketers divide their attention between formats, Suthar chose to invest heavily in red-ball cricket.""In white-ball cricket, there are five players ready to replace you. In Test cricket, the options are fewer. If a player gets injured in white-ball cricket, a replacement is immediately available. The competition is extremely high,"" the coach explained.""Manav has been training with the red ball for the last six to seven years. The main objective was clear: if he wanted to play for India, he first had to become a strong Test cricketer.Around six years ago, he made a conscious decision to focus on red-ball cricket. Most of the cricket he played was with the red ball, and his focus remained firmly on Test cricket,"" Dheeraj added.Suthar first made headlines during the 2022-23 Ranji Trophy season when he emerged as Rajasthan's leading wicket-taker, claiming 39 wickets in just six matches.His performances for India A further strengthened his case. During the unofficial Test series against Australia A, Suthar finished among the leading wicket-takers and produced a memorable five-wicket haul, returning figures of 5/107.He also impressed during the 2023 ACC Emerging Teams Asia Cup.In 29 first-class matches, Suthar has picked up 129 wickets, while also representing Rajasthan in 25 List A games and 29 T20 matches.Suthar's rise has also been aided by the faith shown in him by Gujarat Titans captain Shubman Gill. The left-arm spinner was picked up by the franchise for Rs 20 lakh at the IPL 2024 Auction and was retained for the 2025 and 2026 seasons.According to the coach, Suthar spent countless hours bowling to Gill in the nets, and the skipper too preferred facing him during practice sessions.""Shubman has supported him immensely. He made sure Manav bowled a lot to him in the nets and always encouraged him. The biggest thing is mindset.“When you play alongside cricketers of that level, your thinking also starts operating at that level, and that helps you perform better. Playing with top players in the IPL and around the Indian team teaches you how to handle pressure situations,"" Dheeraj said.Suthar was only 14 years old when he first walked into Dheeraj's coaching setup at the SK Bihani Cricket Academy in Sri Ganganagar, Rajasthan.When the coach asked him what he wanted to become, the teenager had a straightforward answer: ‘a batter’.But after watching him closely in training sessions, Dheeraj realised there was something special about the youngster's bowling.The coach even padded up himself and asked Suthar to bowl at him. A few deliveries were enough to convince him that the youngster possessed rare attributes as a spinner.""Agar lamba khelna hai to bowling pe jyada dhyan dena padega,"" Dheeraj told him.""Initially, he saw himself primarily as a batter, but I sensed potential in his bowling. Gradually, he realised that he could become even better as a bowler and started working seriously on his basics,"" the coach recalled.Dheeraj believes one of Suthar's biggest strengths is his intelligence as a bowler and the variety he possesses.""He is a very clever bowler and has tremendous variety. He bowls with good aggression as well. When conditions offer assistance, he can bring the ball back in sharply.His seam movement and drift are excellent. His arm ball is a major weapon, and both his top-spinner and conventional spin deliveries are very effective,"" he said.With Ravindra Jadeja entering the latter phase of his career and India constantly searching for the next generation of spin-bowling all-rounders, comparisons are inevitable.However, Dheeraj is cautious about placing such expectations on his student.""People call him Rajasthan's Jadeja. The journey ahead is still very long, but he has enormous potential. For now, red-ball cricket remains his top priority,"" the coach signed off.","Manav Suthar made his Test debut for India against Sri Lanka. The spinner struck in his very first over in Test cricket. He finished day two with outstanding figures of 3/21 from 15.5 overs. With bat, he scored a brisk 28 off 41, including dancing down the track.","https://static.toiimg.com/thumb/msid-131576540,imgsize-42722,width-400,height-225,resizemode-4/manav-suthar-photo-by-bcci.jpg"
‘He deserves his place’: AB de Villiers backs selectors' bold call on Vaibhav Sooryavanshi,https://timesofindia.indiatimes.com/sports/cricket/news/he-deserves-his-place-ab-de-villiers-backs-selectors-bold-call-on-vaibhav-sooryavanshi/articleshow/131580846.cms,"Vaibhav Sooryavanshi (Image credit: ICC)

‘No doubt Sooryavanshi's got the talent’









NEW DELHI: South African batting legend AB de Villiers has thrown his weight behind India's decision to hand teenage sensation Vaibhav Sooryavanshi his maiden international call-up, describing the selectors' move as both ""the right call"" and a ""brave decision"".The 15-year-old made history on Saturday when he was named in India's squads for the tours of Ireland and England and the Asian Games, becoming the youngest player ever selected for the national side and eclipsing the mark set by Sachin Tendulkar in 1989.Speaking at an event in Mumbai, de Villiers said the selectors deserved credit for resisting the temptation to opt for experience.""It's definitely the right call from the selectors. So well done to them for making the brave decision. It would have been easy to say that he's still too young and he's not ready, and go for more experience. He's broken down that door, and he deserves his place in the Indian T20 team, so I'm happy for him,"" the former South African captain said.While de Villiers refrained from making definitive predictions about Sooryavanshi's red-ball future, he expressed confidence that the youngster possesses the skill set to succeed across formats if he chooses that path.""Yeah, he's a wonderful talent. The red-ball thing I absolutely cannot answer. I think he can if he wants to, but there's your answer, and there's the big question as well is does he really want to? Time will tell. There's no doubt he's got the talent and the ability to do so. It won't always be easy, and I've mentioned that a few times before,"" de Villiers said.The batting great acknowledged that Test cricket would present a different set of challenges, but backed the Bihar-born prodigy to overcome them.""If he decides to play red-ball cricket, there will be some challenges, but he's got the skill and the ability to work through that and in my opinion, I hope he does try and play Test cricket, but I doubt it. We'll see in future,"" he added.Sooryavanshi's rise has been nothing short of extraordinary. The Rajasthan Royals opener dominated IPL 2026 with 776 runs at a staggering strike rate of 237.30 and smashed a record 72 sixes.",The 15-year-old made history on Saturday when he was named in India's squads for the tours of Ireland and England and the Asian Games. De Villiers said the selectors deserved credit for resisting the temptation to opt for experience. The batting great acknowledged that Test cricket would present a different set of challenges.,"https://static.toiimg.com/thumb/msid-131580849,imgsize-49796,width-400,height-225,resizemode-4/vaibhav-sooryavanshi.jpg"
Watch: Rs 50 lakh reward! Tamil Nadu CM Vijay plays chess with Norway Chess champion R Praggnanandhaa,https://timesofindia.indiatimes.com/sports/chess/watch-rs-50-lakh-reward-tamil-nadu-cm-vijay-plays-chess-with-norway-chess-champion-r-praggnanandhaa/articleshow/131581690.cms,"Tamil Nadu CM Vijay with Norway Chess champion R Praggnanandhaa (Screengrab)

ALSO READ:







NEW DELHI: Tamil Nadu Chief Minister C. Joseph Vijay honoured chess star R. Praggnanandhaa on Monday after his historic victory at the Norway Chess tournament, presenting him with a cash award of Rs 50 lakh and a memento.The event also featured a friendly chess game between the Chief Minister and the 20-year-old Grandmaster. Senior government officials, sports authorities, and Praggnanandhaa’s parents attended the ceremony.Praggnanandhaa made history in Oslo by becoming the first Indian to win the prestigious Norway Chess title. His remarkable campaign included two classical-format victories over World No. 1 Magnus Carlsen and an important win against reigning World Champion D Gukesh.Praising his calmness and brilliance on the international stage, the Chief Minister handed over the award on behalf of the Tamil Nadu Sports Development Authority.Watch:The triumph was even more impressive considering Praggnanandhaa’s difficult start. After six rounds, he was at the bottom of the standings in sixth place and had recently slipped to No. 16 in the world rankings.However, he turned things around with four consecutive wins, including another victory over Carlsen and a crucial win over Gukesh.The streak was the tournament’s first four-game winning run since Carlsen achieved the feat in 2021.Going into the final round, Praggnanandhaa trailed leader Wesley So by half a point and knew a win was essential. Playing with the white pieces against Vincent Keymer, he seized his opportunity and secured a vital victory. The result earned him the full three points, taking his tally to 18 points and moving him into first place overall.The title marked a major milestone in Indian chess, highlighting Praggnanandhaa’s resilience and ability to bounce back from adversity to claim one of the sport’s most prestigious crowns.",Tamil Nadu Chief Minister C. Joseph Vijay honoured chess star R. Praggnanandhaa. The 20-year-old became the first Indian to win the prestigious Norway Chess title. His remarkable campaign included two classical-format victories over World No. 1 Magnus Carlsen.,"https://static.toiimg.com/thumb/msid-131582303,imgsize-31028,width-400,height-225,resizemode-4/tamil-nadu-cm-vijay-with-norway-chess-champion-r-praggnanandhaa-screengrab.jpg"
IND vs AFG: Mohammad Saleem Safi walks off without review as animated scenes unfold near Afghanistan dugout,https://timesofindia.indiatimes.com/sports/cricket/india-vs-afghanistan/ind-vs-afg-mohammad-saleem-safi-walks-off-without-review-as-animated-scenes-unfold-near-afghanistan-dugout/articleshow/131579995.cms,"Confusion and heated exchanges near dugout

Manav Suthar's dream debut continues

Poll How do you rate the debut performance of Manav Suthar? Outstanding Average







NEW DELHI: India tightened their stranglehold on the one-off Test against Afghanistan on Monday, but the biggest talking point during the morning session came from yet another Decision Review System (DRS) blunder by the visitors and the animated scenes that followed near their dugout.Resuming Day Three on 113 for five, Afghanistan folded for 152, conceding a massive 412-run first-innings lead as debutant left-arm spinner Manav Suthar completed a dream outing with figures of 6 for 33 in 22 overs. India, who had declared their first innings at 564 for eight, wasted little time in enforcing the follow-on.The drama unfolded in the 58th over when Suthar trapped No. 10 batter Mohammad Saleem Safi in front. On-field umpire Richard Illingworth raised his finger immediately, and Safi initially appeared keen to challenge the decision.However, in a bizarre turn of events, the left-hander started walking back to the pavilion without taking the review. Moments later, confusion gave way to visible frustration near the Afghanistan boundary line as Safi was seen having an animated exchange with teammates and support staff close to the dugout.Television cameras captured discussions that suggested questions were being asked over why the batter had not opted for DRS despite appearing interested in doing so.The replay only added to Afghanistan's agony.Ball-tracking later revealed that the delivery had pitched outside leg stump, meaning the on-field decision would have been overturned had Safi reviewed it. While the impact was in front of the stumps, the point of pitching made the dismissal incorrect, handing Suthar a slice of fortune and Afghanistan another painful DRS lesson.The dismissal gave Suthar his sixth wicket and capped a memorable debut performance for the 23-year-old. The left-arm spinner ripped through the lower order as Afghanistan added only 39 runs to their overnight score.With the visitors dismissed for 152, India enforced the follow-on and maintained complete control of the contest.","Manav Suthar takes six wicket haul on debut for India in one-off Test. Afghanistan bowled out for 152, conceding a 412-run first-innings lead. Confusion and heated exchanges near dugout during morning session.","https://static.toiimg.com/thumb/msid-131580025,imgsize-43962,width-400,height-225,resizemode-4/mohammad-saleem-safi.jpg"
‘I don’t have to change’: Shreyas Iyer embraces India T20I captaincy challenge in his own way,https://timesofindia.indiatimes.com/sports/cricket/news/i-dont-have-to-change-shreyas-iyer-embraces-india-t20i-captaincy-challenge-his-own-way/articleshow/131578089.cms,"Shreyas Iyer (ANI Photo)

‘My mindset was always about winning’



Ganguly backs selectors' call



Poll What aspect of Iyer's personality do you think will benefit the team the most? His competitive spirit. His focus on teamwork.







NEW DELHI: India's newly-appointed T20I captain Shreyas Iyer has made it clear that taking over the leadership role will not change who he is, insisting that he would rather stay true to the values that shaped him than try to emulate anyone else.The 31-year-old, who was named India's new T20I skipper on Saturday in place of Suryakumar Yadav, said he intends to carry the same mindset and personality that helped him navigate the fiercely competitive cricket culture in Mumbai.“I don’t have to change my personality. I have to be the same person how I was before, and not try to be someone else or be under someone’s shadow,” Iyer said.The batter added that he had always thrived on competition and challenges from a young age.“I obviously loved challenges growing up, especially being from Mumbai, where the cricket is pretty big, competition is high. Every other kid on the street, they want to represent Mumbai,” he said.Iyer said his competitive streak had always revolved around winning and enjoying the game, something that he believes helped shape his personality as a cricketer.“My mindset was always about winning, against everyone that I challenged so whether it's about learning or winning that is secondary, but more fun you have growing up, the more competitive nature you have, especially while you play cricket or any other sport in general,"" said Iyer.“I think that takes you to another level and you want to take that sort of responsibility (and) even when I've got this job right now, or a responsibility as a captain. It’s a great challenge at the same time,” he added.The appointment marks a remarkable comeback for Iyer, who had fallen out of India's T20I plans after his last appearance in December 2023. He now returns not only as a middle-order batter but also as the man entrusted with leading the side in the format.His first assignment as captain will be the two-match T20I series in Ireland.Former India captain and ex-BCCI president Sourav Ganguly backed the decision to hand Iyer the leadership role, saying the Mumbai batter had earned the honour through his performances.“Shreyas has done well, he has earned it. I would not say that the removal of Suryakumar Yadav is unfair. The selectors have made a decision,” Ganguly said.Iyer replaces Suryakumar, who led India to the T20 World Cup title in March but was omitted from the latest squad.","Shreyas Iyer has been named India's new T20I captain. The 31-year-old replaces Suryakumar Yadav, who was omitted from the latest squad. Iyer says he will not try to emulate anyone else.","https://static.toiimg.com/thumb/msid-131578095,imgsize-126446,width-400,height-225,resizemode-4/shreyas-iyer.jpg"
"Christian Eriksen Health Update: Denmark issue statement after footballer collapses, match abandoned",https://timesofindia.indiatimes.com/sports/football/top-stories/christian-eriksen-health-update-denmark-issue-statement-after-footballer-collapses-match-abandoned/articleshow/131576128.cms,"Denmark's and Ukraine's gather on the pitch after the international friendly match between Denmark and Ukraine was cancelled in Odense, Denmark, Sunday, June 7, 2026, after Christian Eriksen has collapsed on the field again while playing for Denmark’s national team. (Bo Amstrup/Ritzau Scanpix via AP)

Match Stopped as Fans and Players React

Reminder of His Remarkable Comeback







NEW DELHI: Christian Eriksen was taken to hospital for further checks after collapsing during Denmark’s friendly match against Ukraine on Sunday, raising concerns because of his well-known heart issues from the 2021 European Championship.The 34-year-old midfielder appeared to clutch his chest in the 65th minute before falling to the ground. Medical staff rushed onto the field as players from both teams looked on with concern.The Danish football federation soon confirmed that Eriksen was “conscious and, under the circumstances, doing well.” Team doctor Morten Boesen later provided a more detailed update, saying: “Christian is doing well and walked off the pitch by himself. As I see it, the pacemaker responded as it should.""“He was briefly unconscious, but regained consciousness very quickly, and we were quickly in contact with him.”Eriksen was taken to hospital for tests to find out what caused the incident. Boesen added: “We are in ongoing contact with him and the doctors at the hospital. But Christian is doing well, and he asked me to send his regards to all the players and tell them that he was OK.”With no play resuming after the collapse, the referee officially abandoned the match in the 79th minute while Denmark led 2-1.The stadium fell silent before supporters began chanting “Eriksen, Eriksen.”After the game was called off, players from both teams gathered together before leaving the pitch to applause, with some visibly emotional.The incident brought back memories of Eriksen’s cardiac arrest during Denmark’s Euro 2021 opener against Finland, when he later revealed he had been “gone from this world for five minutes.”After receiving an implantable cardioverter defibrillator, he made a remarkable return to football with Brentford, later playing for Manchester United and then joining Wolfsburg.Both Wolfsburg and Manchester United released messages wishing Eriksen a speedy recovery as they awaited further updates on his condition.",Christian Eriksen was taken to hospital for further checks after collapsing during Denmark’s friendly match against Ukraine on Sunday. The 34-year-old midfielder appeared to clutch his chest in the 65th minute before falling to the ground. The referee officially abandoned the match in the 79th minute while Denmark led 2-1.,"https://static.toiimg.com/thumb/msid-131576136,imgsize-453316,width-400,height-225,resizemode-4/christian-eriksen-39conscious39-after-another-on-field-collapse-in-denmark-match-national-team-says.jpg"
How much prize money did R Praggnanandhaa win after historic Norway Chess triumph?,https://timesofindia.indiatimes.com/sports/chess/how-much-prize-money-did-r-praggnanandhaa-win-after-historic-norway-chess-triumph/articleshow/131544352.cms,"R Praggnanandhaa (Photo by Michal Walusza for Norway Chess)

How Much Prize Money Did Praggnanandhaa Win?



ALSO READ:

How Praggnanandhaa sealed the title









R Praggnanandhaa scripted history by becoming the first Indian ever to win the prestigious Norway Chess title. The 20-year-old Grandmaster completed a remarkable comeback in the final round, defeating Germany's Vincent Keymer to secure the championship and etch his name into the tournament's history books.Heading into the final round, Praggnanandhaa trailed American Grandmaster Wesley So in the standings. So led the tournament with 15.5 points, while the Indian star sat second with 15 points. To lift the trophy, Praggnanandhaa needed to beat Keymer and hope So dropped points against France's Alireza Firouzja.The results went perfectly in his favor.For winning Norway Chess 2026, Praggnanandhaa will receive 700,000 Norwegian Kroner (NOK), which converts to approximately Rs 70.5 lakh.The tournament featured a total prize pool of 1.69 million NOK, distributed among the six participants based on their final standings.Norway Chess 2026 Prize Money Breakdown1st Place: 700,000 NOK2nd Place: 350,000 NOK3rd Place: 200,000 NOK4th Place: 170,000 NOK5th Place: 150,000 NOK6th Place: 120,000 NOKAccording to tournament regulations, prize money is shared among players finishing on the same score. However, this rule does not apply to first place.In the event of a tie for the championship, a playoff or double round-robin tiebreak would be used to determine the winner.The title-clinching victory came in a dynamic Queen's Gambit Declined against Vincent Keymer. Praggnanandhaa gradually took control of the game before launching a decisive kingside attack.Key moments included the aggressive 33.f5 and the powerful 38.Ne6+, which exposed Black's king and paved the way for a winning rook ending. The victory earned the Indian Grandmaster three crucial points and kept his title hopes alive.Meanwhile, Wesley So and Alireza Firouzja played out a classical draw in their final-round encounter. That result proved enough to hand Praggnanandhaa the championship without requiring an Armageddon tiebreak.","R Praggnanandhaa is the first Indian to win the Norway Chess title. The 20-year- old completed a remarkable comeback in the final round. He will receive 700,000 Norwegian Kroner (NOK), which converts to approximately Rs 70.5 lakh.","https://static.toiimg.com/thumb/msid-131544369,imgsize-35446,width-400,height-225,resizemode-4/r-praggnanandhaa.jpg"
