Article Title,Article Link,Article Text,Article Summary,Article Image
IPL 2025: Mumbai Indians achieve historic first in 13-years against Rajasthan Royals,https://timesofindia.indiatimes.com/sports/cricket/ipl/top-stories/ipl-2025-mumbai-indians-achieve-historic-first-in-13-years-against-rajasthan-royals/articleshow/120808548.cms,"Hardik Pandya led Mumbai Indians to a dominant 100-run victory against Rajasthan Royals in Jaipur, a feat last achieved by an MI captain in 2012. MI's strong batting performance, highlighted by Pandya's unbeaten 48, propelled them to 217/2. Trent Boult and Karn Sharma's three-wicket hauls then dismantled RR for just 117.",Mumbai Indians beat Rajasthan Royals by 100 runs in Jaipur. Hardik Pandya's unbeaten 48 helped MI to 217-2. Trent Boult and Karn Sharma took three wickets each for MI. RR were bowled out for just 117.,"https://static.toiimg.com/thumb/msid-120808922,imgsize-262022,width-400,resizemode-4/Jaipur-Mumbai-Indians-players-after-winning-the-Indian-Premier-League-IPL-20-.jpg"
Watch: Akash Madhwal folds hands after seeing Rohit Sharma; ex MI skipper points at wife Ritika,https://timesofindia.indiatimes.com/sports/cricket/ipl/top-stories/watch-akash-madhwal-folds-hands-after-seeing-rohit-sharma-ex-mi-skipper-points-at-wife-ritika/articleshow/120809478.cms,"Mumbai Indians dominated Rajasthan Royals with a 100-run victory, propelled by half-centuries from Rohit Sharma and Ryan Rickelton, alongside explosive batting from Suryakumar Yadav and Hardik Pandya. This win propelled Mumbai to the top of the IPL 2025 table, while Rajasthan's defeat eliminated them from playoff contention.",Mumbai Indians beat Rajasthan Royals by 100 runs. Rohit Sharma and Ryan Rickelton scored half-centuries for Mumbai. Suryakumar Yadav and Hardik Pandya also impressed. Mumbai are now top of the IPL table.,"https://static.toiimg.com/thumb/msid-120810192,imgsize-31342,width-400,resizemode-4/Rohit-Akash-IPL.jpg"
"IPL 2025: Ryan Rickelton, Karn Sharma shine as Mumbai Indians throw Rajasthan Royals out of playoffs race",https://timesofindia.indiatimes.com/sports/cricket/ipl/top-stories/ipl-2025-ryan-rickelton-karn-sharma-shine-as-mumbai-indians-throw-rajasthan-royals-out-of-playoffs-race/articleshow/120800664.cms,"Ryan Rickelton (PTI Photo)

Poll Which performance was more crucial for MI's win against RR? Karn's bowling Rickelton's batting

Go Beyond The Boundary with our YouTube channel.

A Father's Pride: How RR, Dravid & Vikram Shaped Vaibhav Suryavanshi

NEW DELHI: Mumbai Indians continued their red-hot form in IPL 2025 with a commanding 100-run win over Rajasthan Royals at the Sawai Mansingh Stadium in Jaipur on Thursday.Central to MI's sixth straight win were opener Ryan Rickelton ’s authoritative 61 and Karn Sharma ’s clinical bowling performance, which helped dismantle RR’s fragile batting lineup.Sent to bat first, MI openers Rohit Sharma and Ryan Rickelton laid a powerful foundation. Rickelton, in particular, was relentless against the Rajasthan pacers, unleashing his full range of strokes.His 38-ball 61 was a display of fearless cricket, highlighted by a majestic flick off Fazalhaq Farooqi that soared over the ropes.He was especially effective against the quicker bowlers, handling express pace with composure and punishing any width offered.With the scoreboard ticking freely, MI posted 58/0 in the powerplay, and Rickelton reached his half-century in style with a towering six off a half-tracker from Kartikeya.While Rickelton and Rohit stitched a 116-run stand, it was the bowling unit that backed up the batters superbly -- particularly veteran leg-spinner Karn Sharma, who turned the game firmly in MI's favour after coming in as an impact substitute during the chase.With Royals reeling from the early loss of teenager Vaibhav Suryavanshi and Yashasvi Jaiswal, Karn struck thrice, removing Dhruv Jurel, Maheesh Theekshana and Kumar Kartikeya to notch up a figure of 3/23 with an economy of 5.80.His disciplined lines and clever variations choked the middle order and exposing RR’s lack of depth.With Trent Boult, Jasprit Bumrah and Deepak Chahar providing pace and bounce up front, Karn’s control in the middle overs ensured that RR never recovered.Rajasthan folded for just 117 in 16.1 overs, unable to cope with the scoreboard pressure or MI's all-round execution.With this comprehensive win, Mumbai Indians not only ended Rajasthan's playoff chances but also sent a strong message to the rest of the league: they’re peaking at the perfect time.",Mumbai Indians beat Rajasthan Royals by 100 runs in IPL 2025. Ryan Rickelton top scored for MI with 61 from 38 balls. Karn Sharma took three wickets for 3/23 with an economy of 5.80. MI have now won six consecutive matches in the IPL.,"https://static.toiimg.com/thumb/msid-120801695,imgsize-206712,width-400,resizemode-4/Jaipur-Mumbai-Indians-Ryan-Rickelton-gets-clean-bowled-during-the-Indian-Premi-.jpg"
Rohit Sharma's reaction goes viral after DRS overturns 'out' call,https://timesofindia.indiatimes.com/sports/cricket/ipl/top-stories/rohit-sharmas-reaction-goes-viral-after-drs-overturns-out-call/articleshow/120797857.cms,"Rohit Sharma (PTI Photo)

Go Beyond The Boundary with our YouTube channel.

NEW DELHI: Rohit Sharma lit up the Sawai Mansingh Stadium in Jaipur -- not just with his bat, but with his reaction -- after a dramatic moment during the Mumbai Indians vs Rajasthan Royals IPL 2025 clash on Thursday.In the second over of the match, Rohit was given out LBW off Fazalhaq Farooqi, only for the Decision Review System ( DRS ) to flip the script at the very last second.The incident happened on the fifth ball of the second over.Also See: MI vs RR Farooqi bowled a slower one that drifted into the pads. Rohit, completely outfoxed by the pace, missed his shot and was hit on the back leg.It looked plumb in real time, and the umpire raised his finger immediately. Rohit looked uncertain but decided to review the decision with just a second left on the DRS timer.To everyone’s surprise, the ball-tracking replay showed the delivery pitched just outside the leg stump.The decision was reversed, and Rohit burst into laughter -- his reaction perfectly captured by cameras and quickly going viral on social media.It was a moment of comic relief in a high-stakes game, and fans couldn’t get enough of it.At the toss earlier, Rajasthan Royals’ stand-in skipper Riyan Parag had opted to bowl first, citing potential dew later in the evening.Meanwhile, Mumbai Indians captain Hardik Pandya said he would’ve bowled first too but remained confident in his side’s approach and form.Mumbai came into the match riding high with five consecutive wins and sitting third on the table, while RR struggled in eighth place with only three wins from ten games.In a tournament filled with intensity, it’s these little moments, like Rohit’s laugh, that bring joy to cricket lovers everywhere.",Rohit Sharma was given out LBW off Fazalhaq Farooqi in the second over of the match. Decision Review System ( DRS) reversed the decision at the last second. Rohit's reaction to the decision was captured by cameras and quickly went viral.,"https://static.toiimg.com/thumb/msid-120798205,imgsize-161720,width-400,resizemode-4/Jaipur-Mumbai-Indians-Rohit-Sharma-plays-a-shot-during-the-Indian-Premier-Leag-.jpg"
"Who won yesterday's IPL match, RR VS MI: Yesterday IPL match result",https://timesofindia.indiatimes.com/sports/cricket/ipl/top-stories/who-won-yesterdays-ipl-match-rr-vs-mi-yesterday-ipl-match-result/articleshow/120801184.cms,"Mumbai Indians clinched their sixth straight victory, defeating Rajasthan Royals by 100 runs in Jaipur. Rohit Sharma and Ryan Rickelton's half-centuries, along with aggressive batting from Suryakumar Yadav and Hardik Pandya, propelled Mumbai to a formidable 217 for two. Rajasthan Royals faltered under pressure, being bowled out for 117, as Mumbai Indians strengthened their playoff chances with this dominant performance.",Mumbai Indians defeated Rajasthan Royals by 100 runs in Jaipur. Rohit Sharma and Ryan Rickelton scored half-centuries for Mumbai. Suryakumar Yadav and Hardik Pandya also hit half centuries.,"https://static.toiimg.com/thumb/msid-120801262,imgsize-205868,width-400,resizemode-4/Jaipur-Mumbai-Indians-Hardik-Pandya-and-Suryakumar-Yadav-run-between-the-wicke-.jpg"
Ting! Preity Zinta a 'happy girl' after Punjab Kings' win over Chennai Super Kings,https://timesofindia.indiatimes.com/sports/cricket/ipl/top-stories/ting-preity-zinta-a-happy-girl-after-punjab-kings-win-over-chennai-super-kings/articleshow/120782280.cms,"New Chandigarh: Punjab Kings' owner Preity Zinta gestures during an Indian Premier League (IPL) 2025 cricket match between Punjab Kings and Chennai Super Kings, in New Chandigarh. (PTI Photo/Ravi Choudhary)

Go Beyond The Boundary with our YouTube channel. SUBSCRIBE NOW!

Preity Zinta Applauds PBKS Openers

Punjab Kings (PBKS) co-owner Preity Zinta says she is a ""happy girl"" after her team defeated Chennai Super Kings by four wickets at the MA Chidambaram Stadium on Wednesday.After a tense finish, where Punjab got over the line, the PBKS team owner wrote on X: ""Yeahhhhhh !!! appa jeet gaye (We won)! What a superb team effort!""Chasing 191, Punjab Kings openers Priyansh Arya and Prabhsimran put on 44 for the first wicket. Prabhsimran brought up his second successive fifty in 31 balls, but his momentum was halted when he miscued a big shot off Noor and was caught at deep midwicket for 54. At that stage, PBKS were 116/2 after 13 overs, needing 75 from 42 balls. Shreyas Iyer tried to finish things in style but was bowled by a full delivery from Pathirana for a sublime 72 off 41 balls.Punjab's captain also received high praise from Preity Zinta.""Captain’s knock, openers’ fifty, an amazing hattrick & stunning catches! What a brilliant chase on a tricky ground, almost giving me a last-over heart attack.""So proud of the way Sadda Punjab played. I’m a happy girl tonight. Ting!""With the win, Shreyas Iyer's team is currently placed second with 13 points, while CSK became the first team to be eliminated from the playoff race.Punjab Kings will now play their next match on Sunday at the scenic Himachal Pradesh Cricket Association Stadium in Dharamshala against Lucknow Super Giants , whereas CSK will travel to Bengaluru on Saturday. MS Dhoni delved into his team’s defeat after they were knocked out of IPL 2025 .“I think the batting, yes, it was the first time we put enough runs on the board, but I feel it was slightly short of a par score,” Dhoni said after the match. “It’s demanding on the batsmen, but we needed slightly more.”","Punjab Kings co-owner Preity Zinta says she is a ""happy girl"" after her team defeated Chennai Super Kings by four wickets at the MA Chidambaram Stadium on Wednesday. MS Dhoni delved into his team’s defeat after they were knocked out of IPL 2025.","https://static.toiimg.com/thumb/msid-120782296,imgsize-118110,width-400,resizemode-4/New-Chandigarh-Punjab-Kings-owner-Preity-Zinta-gestures-during-an-Indian-Premi-.jpg"
"IPL match today, RR vs MI: Team prediction, head-to-head, Sawai Mansingh pitch report, Jaipur weather update",https://timesofindia.indiatimes.com/sports/cricket/ipl/top-stories/ipl-match-today-rr-vs-mi-team-prediction-head-to-head-sawai-mansingh-pitch-report-jaipur-weather-update/articleshow/120761894.cms,"Jaipur: Rajasthan Royals' Vaibhav Suryavanshi with teammate Yashasvi Jaiswal celebrates his century during the Indian Premier League (IPL) 2025 cricket match between Rajasthan Royals and Gujarat Titans, in Jaipur. (PTI Photo)

Go Beyond The Boundary with our YouTube channel. SUBSCRIBE NOW!

RR vs MI: Pitch Report

A Father's Pride: How RR, Dravid & Vikram Shaped Vaibhav Suryavanshi

RR vs MI: Predicted playing XIs

RR predicted XI:

Impact Subs:

MI predicted XI:

Impact Subs:

RR vs MI:

Matches played:

RR won:

MI won:

NR:

RR vs MI: Jaipur Weather Report

RR vs MI: Livestreaming details

RR vs MI: Squads

Rajasthan Royals:

Mumbai Indians:

Fresh from their thumping nine-wicket win over Gujarat Titans, Rajasthan Royals will lock horns against high-flying Mumbai Indians (MI) in match no 50 of the ongoing Indian Premier League (IPL) at the Sawai Mansingh in Jaipur on Thursday.With 14-year-old Vaibhav Suryavanshi potentially playing the knock of the tournament on Monday, the Royals have found a ray of hope in what has been an IPL campaign of missed opportunities. The hosts still have a mathematical chance of making the play-offs but deep down the management has accepted its fate.For Hardik Pandya-led Mumbai Indians, the return of Jasprit Bumrah has coincided with their ascent to the top of the table. The perennial slow starters have now collected five wins on the bounce and look unstoppable.Historically, chasing has been easier at Sai Mansingh, often due to dew setting in later in the evening, which can make the pitch flatter and harder for bowlers to grip the ball. Expect a match where batsmen can score freely, and chasing might be the preferred strategy. However, bowlers will need to be smart with their variations and lengths to contain the run flow.Yashasvi Jaiswal, Vaibhav Suryavanshi, Riyan Parag (c), Nitish Rana, Dhruv Jurel (wk), Shimron Hetmyer, Shubham Dubey, Wanindu Hasaranga, Jofra Archer, Maheesh Theekshana, Sandeep SharmaTushar Deshpande and Kumar Kartikeya,Rohit Sharma, Ryan Rickelton, Will Jacks, Suryakumar Yadav, Tilak Varma, Hardik Pandya, Naman Dhir, Deepak Chahar, Mitchell Santner, Jasprit Bumrah, Trent BoultVignesh Puthur and Karn SharmaHead-to-head301415Temperature is likely to hover in range of 28°C to 39°C during the day and evening match hours. It might feel as hot as 40°C. There is a low chance of rain (around 10%), so the match is unlikely to be affected by precipitation. In summary, expect a hot but dry evening in Jaipur for the RR vs MI game.The match between Rajasthan Royals and Mumbai Indians will be telecast on Star Sports Network on TV, with the live-streaming available on JioHotstar from 7:30 PM IST onwards.Yashasvi Jaiswal, Shimron Hetmyer, Shubham Dubey, Vaibhav Suryavanshi, Sanju Samson, Dhruv Jurel, Kunal Singh Rathore, Riyan Parag, Yudhvir Singh Charak, Nitish Rana, Sandeep Sharma, Tushar Deshpande, Akash Madhwal, Kumar Kartikeya, Kwena Maphaka, Wanindu Hasaranga, Maheesh Theekshana, Fazalhaq Farooqi, Ashok Sharma, Jofra Archer.Suryakumar Yadav, Rohit Sharma, Tilak Varma, Bevon Jacobs, Ryan Rickelton, Robin Minz, Krishnan Shrijith, Hardik Pandya, Naman Dhir, Raj Bawa, Vignesh Puthur, Will Jacks, Mitchell Santner, Jasprit Bumrah, Arjun Tendulkar, Ashwani Kumar, Reece Topley, Lizaad Williams, Karn Sharma, Trent Boult, Deepak Chahar, Satyanarayana Raju, Mujeeb Ur Rahman.","Rajasthan Royals face Mumbai Indians in match no 50 of the ongoing Indian Premier League (IPL) at the Sawai Mansingh in Jaipur on Thursday. The match will be telecast on Star Sports Network on TV, with the live-streaming available on JioHotstar from 7:30 PM IST onwards.","https://static.toiimg.com/thumb/msid-120761934,imgsize-230074,width-400,resizemode-4/Jaipur-Rajasthan-Royals-Vaibhav-Suryavanshi-with-teammate-Yashasvi-Jaiswal-cel-.jpg"
"IPL 2025: Yuzvendra Chahal hat-trick, Shreyas Iyer special knock Chennai Super Kings out of playoffs race",https://timesofindia.indiatimes.com/sports/cricket/ipl/top-stories/ipl-2025-yuzvendra-chahal-hat-trick-shreyas-iyer-special-knock-chennai-super-kings-out-of-playoffs-race/articleshow/120773213.cms,"Yuzvendra Chahal celebrates with captain Shreyas Iyer (PTI Photo)

Poll Who was the most impactful player in the match? Shreyas Iyer Yuzvendra Chahal

Brief Scores:

NEW DELHI: Yuzvendra Chahal delivered a spell for the ages, taking a stunning hat-trick to derail Chennai Super Kings ' (CSK) innings, while skipper Shreyas Iyer's knock guided Punjab Kings (PBKS) to a thrilling four-wicket win and ended Chennai's hopes for this year's playoffs at Chepauk on Wednesday in IPL 2025.Sent to bat first, CSK looked well set for a massive total after a blazing 88 off 47 balls by Sam Curran.The left-hander smashed nine fours and four sixes, steadying the innings after early wickets. Dewald Brevis chipped in with 32, and MS Dhoni’s brief cameo (11 off 4) added late fireworks. At 177/5 in the 18th over, CSK were eyeing 200+.But then came Chahal.Bowling the 19th over, Chahal turned the game on its head.First, he dismissed Dhoni, who had just hit him for a six, caught at long-off. Two balls later, Deepak Hooda edged to the keeper.On the very next delivery, Anshul Kamboj was bowled for a golden duck. He completed the hat-trick by dismissing Noor Ahmad on the final ball. From 184/5, CSK crumbled to 190 all out in 19.2 overs.Chahal finished with 4/32 in three overs, recording his second IPL hat-trick and ninth 4-wicket haul—the most in league history.In reply, PBKS chased down the target with two balls to spare. Prabhsimran Singh (54 off 36) gave them a flying start, while skipper Shreyas Iyer anchored the innings with a composed 71 off 41 balls. Despite a few hiccups in the end, PBKS crossed the line at 194/6 in 19.4 overs.Khaleel Ahmed and Matheesha Pathirana tried to stage a late fightback with two wickets each, but CSK’s total proved insufficient after Chahal’s damage-limiting spell.PBKS now move to second on the table with 13 points, while CSK remain stuck at the bottom, struggling with just two wins in 11 games.CSK: 190 (Curran 88, Chahal 4/32), PBKS: 194/6 (Iyer 71, Prabhsimran 54), PBKS won by 4 wickets","Yuzvendra Chahal takes hat-trick to derail Chennai Super Kings innings. PBKS win by four wickets to move to second on the table with 13 points. CSK remain stuck at the bottom, struggling with just two wins in 11 games.","https://static.toiimg.com/thumb/msid-120774048,imgsize-260214,width-400,resizemode-4/Chennai-Punjab-Kings-Yuzvendra-Chahal-celebrates-with-captain-Shreyas-Iyer-aft-.jpg"
"IPL 2025: Vaibhav Suryavanshi will have to keep working hard, says Rahul Dravid",https://timesofindia.indiatimes.com/sports/cricket/ipl/top-stories/ipl-2025-vaibhav-suryavanshi-will-have-to-keep-working-hard-says-rahul-dravid/articleshow/120785135.cms,"<p>Rajasthan Royals batter Vaibhav Suryavanshi. (AP)<br></p>

Go Beyond The Boundary with our YouTube channel.

Jaipur: When Vaibhav Suryavanshi announced his arrival with a jaw-dropping 38-ball 101, a chuffed Rahul Dravid forgot about his injured leg and stood up beaming to applaud the 14-year-old. On Wednesday, putting Vaibhav’s knock in perspective, Dravid said that the 14-year-old’s ability to remain unfazed by the occasion was what stood out.“You don’t get to see (knocks like that) with people who are so young. The range of shots he showed, he is only going to develop and get better. Nobody is saying he is a finished article. He will have to keep working hard. No one should be in a rush to proclaim him as something he is not. He is what he is, an exceptionally talented young player,” Dravid said during the Star Sports Press Room show.The former India captain and coach said that the Royals coaching staff had given Vaibhav the freedom to express himself. “He is going to have his share of ups and downs. The nature of the T20 format is such that he is going to have some days where things won’t work out. From our side, we encourage him to play the game he enjoys. It’s important that we allow him to express himself and as he goes on, there will be lessons he will learn and mistakes he will make. He will refine himself and mould himself as time goes on. But as of now, from our side it’s all about letting him go out and have some fun and soak in everything,” the head coach said.Now that Vaibhav is the talk of the town, how does one protect him from the intense public glare? “He can’t completely avoid experiencing what’s going on around him. A lot of things will be beyond his and our control. We can’t control how much people are going to talk about him. It’s about recognising that this is what happens and helping him navigate all of this attention and still allowing him that space to be a youngster. But I think that is part of being a cricketer in this country,” Dravid said.","Rahul Dravid says Vaibhav Suryavanshi's ability to remain unfazed by the occasion was what stood out. The former India captain and coach said that the Royals coaching staff had given the 14-year-old the freedom to express himself. “He is going to have his share of ups and downs. The nature of the T20 format is such that he will have some days where things won’t work out,” he said.","https://static.toiimg.com/thumb/msid-120785109,imgsize-37336,width-400,resizemode-4/Vaibhav-Suryavanshi.jpg"
RJ Mahvash’s viral reaction on Yuzvendra Chahal’s hat-trick - 'God mode on',https://timesofindia.indiatimes.com/sports/cricket/ipl/top-stories/rj-mahvashs-viral-reaction-on-yuzvendra-chahals-hat-trick-god-mode-on/articleshow/120771733.cms,"Yuzvendra Chahal and RJ Mahvash

Go Beyond The Boundary with our YouTube channel.

A Father's Pride: How RR, Dravid & Vikram Shaped Vaibhav Suryavanshi

NEW DELHI: Punjab Kings spinner Yuzvendra Chahal sent cricket fans into a frenzy on Wednesday night with a jaw-dropping hat-trick against Chennai Super Kings (CSK), and among the many reacting to his heroics was RJ Mahvash, who posted a now-viral tribute on social media: “God mode on kya? Yuzvendra Chahal strength of a warrior sir.”The comment, shared on Instagram, quickly gained attention — not only for the praise it heaped on Chahal, but also because of ongoing dating rumours linking the RJ and the star spinner.The post added fuel to fan curiosity while celebrating one of the greatest bowling displays of IPL 2025 so far.Playing for Punjab Kings, Chahal turned the tide in the 19th over of the CSK innings at Chepauk.With CSK cruising at 177 for 5 and looking to finish strong, the leg-spinner struck gold, removing MS Dhoni , Deepak Hooda, Anshul Kamboj, and Noor Ahmad in the space of just six balls.He finished with incredible figures of 4 for 32 in just three overs.Dhoni, who had just hit Chahal for a six, was caught trying to clear long-off.Hooda and Kamboj followed in quick succession, both falling cheaply.Chahal sealed his hat-trick with the wicket of Noor Ahmad, joining an elite list of bowlers to take four wickets in a single IPL over.This was Chahal’s second IPL hat-trick and a record-breaking ninth instance of him claiming four or more wickets in an innings, the most in league history.The performance stunned CSK and tilted the momentum completely in Punjab’s favour.","Punjab Kings spinner Yuzvendra Chahal took a hat-trick against Chennai Super Kings. The leg-spinner removed MS Dhoni, Deepak Hooda, Anshul Kamboj, and Noor Ahmad in the space of just six balls. He finished with incredible figures of 4 for 32 in just three overs. RJ Mahvash posted a now-viral tribute to the star spinner on social media.","https://static.toiimg.com/thumb/msid-120772000,imgsize-62994,width-400,resizemode-4/Yuzvendra-Chahal-and-RJ-Mahvash.jpg"
IPL 2025: Can MS Dhoni-led CSK still qualify for playoffs?,https://timesofindia.indiatimes.com/sports/cricket/ipl/top-stories/ipl-2025-can-ms-dhoni-led-csk-still-qualify-for-playoffs/articleshow/120782971.cms,"Chennai Super Kings' struggles continued as they suffered their eighth defeat in the ongoing IPL season, succumbing to Punjab Kings by 4 wickets. This loss marks their third consecutive defeat, leaving them at the bottom of the standings with only 4 points.","Chennai Super Kings suffered their eighth defeat in the ongoing IPL season. This loss marks their third consecutive defeat, leaving them at the bottom of the standings with only 4 points. Punjab Kings beat Chennai Super Kings by 4 wickets.","https://static.toiimg.com/thumb/msid-120783030,imgsize-71348,width-400,resizemode-4/CSK-IPL-2025.jpg"
