Article Title,Article Link,Article Text,Article Summary,Article Image
‘A bit superstitious’: Why Manav Suthar's parents couldn't watch his India debut,https://timesofindia.indiatimes.com/sports/cricket/india-vs-afghanistan/a-bit-superstitious-why-manav-suthars-parents-couldnt-watch-his-india-debut/articleshow/131569622.cms,"India's Manav Suthar (PTI Photo)







India debutant Manav Suthar's memorable performance against Afghanistan came with an unusual twist. While the young spinner starred with the ball on the second day of the one-off Test in Mullanpur, his family chose not to witness the feat from the stands.According to PTI, Manav's father Jagdish Suthar, a retired Physical Education teacher from Rajasthan's Sri Ganganagar district, had travelled to Mullanpur along with his wife and daughter Mansi to watch the left-arm spinner receive his maiden Test cap. However, the family returned home before the second day's play because of nerves and superstition.Manav repaid the faith shown in him by India's team management with an outstanding spell of 3/21 in 15.5 overs, leaving Afghanistan struggling in their first innings.""Yes, me, my wife and my daughter Mansi (Manav's younger sister) had come to watch his debut. I can't describe how it felt seeing him get the Test Cap yesterday. However today we had come back home as we were all nervous and a bit superstitious watching him live in action from the stadium,"" Jagdish Suthar told PTI during an exclusive interaction on the second day of the Test.Despite his son's rise to international cricket, Jagdish was unwilling to take any credit for the achievement.Instead, he highlighted the dedication Manav has shown over the years and acknowledged the role played by his childhood coach.""It is completely Manav's hard work and the hours that he has put into practice. He would leave home for training in the morning and return late in the evening. It is his credit and his childhood coach Dheeraj Sharma to whom we are all indebted. Manav learnt all his cricket under him,"" Suthar senior said.Reflecting on his son's early years, Jagdish said there was never a single moment when he realised Manav could become a professional cricketer. Like many children, cricket was simply a game he loved from a young age.""Like every other child, he was also passionate about cricket. He would play with tennis and rubber ball when he was around six to seven years old. Since I was a PT teacher, I always encouraged my son to play the sport and enjoy. When he was around 10 to 11 years old, I had enrolled him in Dheeraj sir's academy. After that I just told him, 'Tujhe jo accha lage, tu kar, mera support humesha tere saath rahega (Whatever you feel like pursuing, do it and I will give you my full support),'” Jagdish added.When asked whether he was concerned about balancing cricket with education, Jagdish said that was never an issue.""Cricket was his focus but he has also completed his graduation,"" he informed.According to his father, Manav remains a quiet and reserved personality away from the game despite his growing reputation on the field.""When he is at home, we hardly have conversations on cricket. He doesn't speak much. Yes, we know that he is a big fan of Ravichandran Ashwin and the way he had dominated world cricket during his time,"" he concluded.The decision to leave the venue early may have spared the family some anxious moments, but back home they would have been delighted to learn that Manav had enjoyed a dream second day in Test cricket, putting Afghanistan under immense pressure with a three-wicket haul on debut.","India's Manav Suthar took three wickets on his Test debut against Afghanistan. The left-arm spinner's family travelled to Mullanpur to watch his debut. However, they returned home before the second day's play because of nerves.","https://static.toiimg.com/thumb/msid-131569594,imgsize-88476,width-400,height-225,resizemode-4/ind-vs-afg-test-match-day-2.jpg"
‘I'm confused about his career’: Manjrekar fires shots at Jasprit Bumrah's workload management,https://timesofindia.indiatimes.com/sports/cricket/news/im-confused-about-his-career-manjrekar-fires-shots-at-jasprit-bumrahs-workload-management/articleshow/131568970.cms,"Jasprit Bumrah (ANI Photo)







Former India batter Sanjay Manjrekar has expressed concern over Jasprit Bumrah 's international availability, saying he would like to see the star fast bowler commit more consistently to Indian cricket after his latest workload-related break. Bumrah was recently named in India's 15-member squad for the Asian Games in Japan, where Shreyas Iyer will lead the side in September. However, the pace spearhead has been rested for the upcoming T20I tours of Ireland and England in June and July. The decision comes after Bumrah featured in 13 matches for Mumbai Indians during IPL 2026.While acknowledging the physical demands of modern cricket, Manjrekar admitted he is struggling to understand the path Bumrah's career is taking. The former batter had previously criticised the pacer for featuring in only three Tests during India's five-match series against England.Speaking on Sony Sports Network, Manjrekar suggested that Bumrah could have managed the workload of a short T20I assignment, especially after completing a full IPL season.“Asian Games, those performances and those results don't stay with you for too long. Cricket is still a sport of bilaterals and our own World Cups.The Olympics, when it comes as well, I don't think it will have the same sanctity that you have. It would be nice to win the Asia Games, but Bumrah is somebody; I'm just confused about how his career is going in terms of his availability. I did an Insta post yesterday. I thought Bumrah was the frontrunner to become India's T20 captain because I thought he could handle the T20 workload,” Manjrekar said.The former cricketer went on to question the pattern of Bumrah's appearances for India, arguing that the pacer appears selective about the matches he prioritises.“But it seems like he's not very keen to play every game that India plays. So here is a guy who actually rests for India games and keeps himself fit for certain India games. So it's a very different approach, something that I don't understand. I just wish that he would commit himself more to India. I can understand the workload he feels for Test cricket; 50 overs of cricket is extremely demanding. But considering that he played the entire IPL, I thought he would be able to take the workload of a few T20 matches in Ireland and England,” he added.Manjrekar also revealed that he viewed Bumrah as a leading candidate to captain India's T20I side. According to him, the fast bowler's limited availability has opened the door for other players to take up leadership roles sooner than expected.Bumrah had turned down the Test captaincy in 2025 due to workload concerns, prompting selectors to hand the role to Shubman Gill . Now, with Bumrah unavailable for the Ireland and England T20Is, Shreyas Iyer has been entrusted with leading India at the Asian Games.“I wish he were available. And he was my go-to captain. He was certainly deserving of ability and leadership qualities as well. Bumrah has not been too keen to take captaincy. It's gone prematurely to other Indian players like Shubman Gill in England and now Shreyas Iyer as well,” he added.Bumrah's recent form has also come under scrutiny. During IPL 2026, the veteran pacer endured an unusually difficult campaign, claiming only four wickets while also struggling to contain runs.Having already been rested for the T20I series against Ireland and England and omitted from the Afghanistan ODI squad, attention will now turn to whether Bumrah returns for India's upcoming three-match ODI series against England.","Former India batter Sanjay Manjrekar has expressed concern over Jasprit Bumrah's international availability. The fast bowler was recently named in India's 15-member squad for the Asian Games in Japan. However, the pace spearhead has been rested for the upcoming T20I tours of Ireland and England in June and July. The decision comes after Bumra featured in 13 matches for Mumbai Indians during IPL 2026.","https://static.toiimg.com/thumb/msid-131568971,imgsize-80890,width-400,height-225,resizemode-4/quotrohit-sharma-never-used-bumrah-like-thisquot-mohammad-kaif39s-blunt-take-on-india39s-loss-against-proteas-in-t20-wc.jpg"
'We got it wrong': MCC breaks silence on Lord's pitch after England Test win,https://timesofindia.indiatimes.com/sports/cricket/news/we-got-it-wrong-mcc-breaks-silence-on-lords-pitch-after-england-test-win/articleshow/131569403.cms,"England's captain Ben Stokes, celebrates with teammates (AP Photo)







The Marylebone Cricket Club (MCC) has acknowledged concerns surrounding the Lord's pitch used for the opening Test between England and New Zealand, admitting that the surface did not meet the standards expected at the iconic venue.Following England's 115-run victory on Sunday, the MCC released a statement addressing the behaviour of the pitch, which came under scrutiny for its inconsistent bounce throughout the match.""We recognise that the pitch for this Test has shown more variable bounce than we would have wanted.""We hold ourselves to the highest standards and are naturally frustrated when a surface falls short of those expectations.""The club stressed that significant resources are devoted each year to preparing playing surfaces at Lord's. It pointed to ongoing investment in pitch maintenance, research and specialist expertise aimed at producing balanced conditions for both batters and bowlers.""MCC invests significantly each year in the preparation of the Main Square at Lord's, as well as in research, technology and expertise aimed at producing pitches that provide a fair and consistent contest between bat and ball.""The statement also highlighted the weather challenges faced by the groundstaff in the build-up to the match. According to the MCC, unusually hot and dry conditions during May were followed by wetter weather closer to the Test, creating complications during pitch preparation.""The unusually hot and dry weather during May, followed by wetter conditions in the lead-up to the match, presented a number of challenges in preparing the pitch.""While acknowledging the issues, the MCC said it is already focused on making improvements and implementing plans outlined in its recently released cricket strategy.""However, we fully recognise the need to act quickly. We will remain fully focused on applying all aspects of pitch development and improvement as outlined in our recently published MCC Cricket Strategy 2026-29.""The pitch proved highly favourable to seam bowling throughout the contest. England completed a comprehensive 115-run win on the fourth morning after dismissing New Zealand for 138 while defending a target of 254.New Zealand resumed Day 4 at 55/5 but lost their remaining wickets inside 40.3 overs. Gus Atkinson starred with career-best figures of 5/30, while Ollie Robinson and Josh Tongue chipped in with two wickets apiece. Devon Conway top-scored with 41, while Glenn Phillips remained unbeaten on 44.The match was dominated by fast bowlers from start to finish, with only 166 overs required across four innings to produce a result. After being bowled out for 140 in their first innings despite Harry Brook's 56, England hit back strongly as Robinson's 5/39 helped dismiss New Zealand for 113 and secure a 27-run lead.England then posted 226 in their second innings, thanks to Emilio Gay's patient 57 and Jamie Smith's 39. Although Nathan Smith claimed career-best figures of 6/70, the hosts set New Zealand a challenging target that ultimately proved beyond reach.Robinson's first-innings five-wicket haul earned him the Player of the Match award as England took a 1-0 lead in the three-Test series. The teams will now head to The Oval for the second Test, which begins on June 17.","England beat New Zealand by 115 runs in opening Test at Lord's. Marylebone Cricket Club (MCC) admits Lord's pitch did not meet standards. MCC says it is already focused on making improvements and implementing plans. The teams will now head to The Oval for the second Test, which begins on June 17.","https://static.toiimg.com/thumb/msid-131569419,imgsize-154734,width-400,height-225,resizemode-4/stokes-delivers-warning-for-test-cricket-after-england39s-historically-quick-win-over-new-zealand.jpg"
'Strong contender at Test level': Gavaskar's verdict on Manav Suthar,https://timesofindia.indiatimes.com/sports/cricket/india-vs-afghanistan/strong-contender-at-test-level-gavaskars-verdict-on-manav-suthar/articleshow/131568576.cms,"Manav Suthar (BCCI Photo)







NEW DELHI: Manav Suthar could hardly have asked for a better start to his Test career. The left-arm spinner marked his debut with three wickets on Day 2 against Afghanistan, earning praise from legendary India captain and batting great Sunil Gavaskar Suthar struck in his very first over in Test cricket, dismissing Abdul Malik to enter an elite list of Indian bowlers who have taken a wicket in their opening over on debut. He finished the day with figures of 3/34, removing Abdul Malik, Rahmanullah Gurbaz and Afsar Zazai as Afghanistan closed on 113/5, still trailing India by 451 runs.Impressed by the youngster's all-round display, Gavaskar highlighted not only Suthar's bowling but also the composure he showed with the bat.""Manav Suthar has certainly made an impressive start to his Test career. What stood out was not just his bowling, but also the confidence he showed with the bat, particularly in the way he used his feet and looked comfortable at the crease,"" Gavaskar while speaking on JioStar’s ‘Cricket Live’ said.""With the ball, he was extremely accurate and consistently put the batters under pressure. There was some assistance available from the surface, which he utilised well, but the real test for any spinner comes on flatter pitches where greater variety and adaptability are required.""While urging caution over judging a spinner solely on a helpful surface, Gavaskar felt Suthar had shown enough promise to suggest he can succeed at the highest level.""Having said that, this was a highly encouraging debut and he has shown the attributes to be a strong contender at the Test level going forward,"" he added.Suthar's selection was backed by a strong domestic record. The Rajasthan all-rounder has claimed 129 wickets in 29 first-class matches at an average of 25.76, including best figures of 8/33. His red-ball résumé also features six five-wicket hauls and three 10-wicket match hauls.The 23-year-old has also contributed with the bat, scoring 945 runs in 48 first-class innings at an average of 25.54, including a century and six fifties, with a highest score of 120.Earlier this year, Suthar represented Gujarat Titans in the IPL, picking up two wickets in four matches.","Manav Suthar took three wickets on his Test debut against Afghanistan. The 23-year-old bowled Abdul Malik, Rahmanullah Gurbaz and Afsar Zazai. India captain Sunil Gavaskar praised the youngster's all-round display.","https://static.toiimg.com/thumb/msid-131568582,imgsize-34180,width-400,height-225,resizemode-4/manav-suthar2-0706-bcci.jpg"
Wesley ruled out of FIFA World Cup 2026: Here's how Brazil now could line up,https://timesofindia.indiatimes.com/sports/football/fifa-world-cup/wesley-ruled-out-of-fifa-world-cup-2026-heres-how-brazil-now-could-line-up/articleshow/131581535.cms,"A blow for Brazil as right-back Wesley is ruled out due to a thigh injury, casting a shadow on their World Cup aspirations. With both specialist right-backs unavailable, Coach Ancelotti finds himself in a tight spot.(AP Photo)

The defensive crisis

How Brazil might line up in FIFA World Cup 2026

Danilo as a makeshift right-back

Three-man defence







Five-time winners Brazil’s preparations for the upcoming FIFA World Cup suffered a damaging blow on Sunday when their right-back Wesley was ruled out of the tournament with a left thigh muscle injury, leaving coach Carlo Ancelotti with limited coverage on that flank just six days before the Seleção's Group C opener against Morocco.The AS Roma defender suffered the injury during Brazil's friendly against Egypt on Saturday night in Cleveland. This was Brazil’s final friendly before their opener against Morocco. After picking up a knock, the defender was substituted in the 15th minute.The discomfort was quite visible as he left the field in tears. Later, it became apparent that the damage was serious enough to end his World Cup before it began.The Brazilian Football Confederation (CBF) later confirmed his injury. ""The CBF regrets the injury. Wesley is a player much loved by the team and will always be considered an integral part of this squad as it aims for its sixth World Cup title,"" an official statement from CBF read.The 26-year-old had been the preferred option on the right flank after Vanderson, Brazil's other specialist right back, was also sidelined by injury ahead of the squad announcement.With both players falling prey to injuries, Ancelotti has called up Atalanta midfielder Ederson, 26, as the injury replacement, a move that raised immediate tactical eyebrows, as Ederson is not a defender and has spent his career exclusively in the midfield.Brazil's defensive options at right back are now alarmingly thin. The squad does include the experienced Danilo, a veteran full-back who can operate on the right and St. Petersburg left-back Douglas Santos, who can fill in as an emergency option.But neither is deemed a natural first-choice right back like Wesley or Vanderson. Ancelotti's decision to bring in a midfielder rather than a defensive cover suggests he may be rethinking the tactical setup entirely and can switch to a different game plan.With no true right back remaining, Ancelotti faces a tactical dilemma. Here are the most credible routes available to him as he approaches the Morocco match in New Jersey on June 13:The Flamengo veteran slides to the right-back position in a familiar 4-2-3-1 shape, often played by Ancelotti. He provides reliable experience but a limited attacking threat.Danilo is 33, and he doesn’t possess the great pace like Wesley but could be a good fit for more defensive solidity.Ancelotti could shift to a 3-5-2 or 3-4-3, converting Danilo or Douglas Santos into a right wingback, which will give wider freedom. With the likes of Gabriel and Marquinhos available for the centre-back position, Ancelotti could opt for a three-at-the-back option.Another injury headache for the veteran manager is the ongoing uncertainty around Neymar.The 34-year-old forward, who was included in the squad after a remarkable two-and-a-half-year absence, did not travel to Cleveland with the rest of the group for the Egypt friendly. A calf injury has kept him sidelined, and his participation in the tournament opener remains in doubt.Brazil open their FIFA World Cup 2026 group C campaign against Morocco on June 13 before facing Haiti and Scotland later in the tournament.",Wesley is ruled out of the World Cup with a thigh injury. Coach Carlo Ancelotti has called up Atalanta midfielder Ederson as a replacement. Brazil open their World Cup 2026 campaign against Morocco on June 13. The Seleção also face Haiti and Scotland later in the tournament.,"https://static.toiimg.com/thumb/msid-131581535,imgsize-91484,width-400,height-225,resizemode-4/131581535.jpg"
SAFF Women's Championship: PM Modi hails Indian football team after seven-year title drought ends,https://timesofindia.indiatimes.com/sports/football/top-stories/saff-womens-championship-pm-modi-hails-indian-football-team-after-seven-year-title-drought-ends/articleshow/131581506.cms,"Team India celebrates with the trophy. (AIFF Photo)

India's seven-year title drought ends







NEW DELHI: India's return to the top of South Asian women's football after seven years earned praise from Prime Minister Narendra Modi , who said the team's success would inspire more youngsters to take up the sport.The Blue Tigresses clinched a record-extending sixth SAFF Women's Championship title with an emphatic 3-1 victory over defending champions Bangladesh in a thrilling final at the Pandit Jawaharlal Nehru Stadium in Goa on Saturday.Congratulating the side on social media, PM Modi lauded the team's performances throughout the tournament and highlighted the wider impact of their achievement.""Congratulations to the Indian Women's Football Team on winning the SAFF Women's Championship 2026. They have played excellently through the tournament. This will encourage more youngsters to play football in the coming times. Best wishes to the team for their future endeavours,"" Modi posted on X.The triumph marked India's first SAFF title since 2019 and ended a frustrating drought that had seen the side miss out on the crown in the previous two editions.Pyari Xaxa put India ahead in the 42nd minute, only for Bangladesh's Ritu Porna Chakma to restore parity in first-half stoppage time.However, Sanfida Nongrum ensured India regained the lead just 40 seconds after the restart before substitute Lynda Kom Serto sealed the contest with an 82nd-minute strike.The victory denied Bangladesh a third successive title and completed a remarkable campaign for the hosts.India won all four of their matches in the tournament, scoring 18 goals while conceding just once, underlining their dominance in the competition.The emotional scenes after the final whistle reflected the significance of the achievement. Match-winner Sanfida Nongrum dropped to her knees before embracing veteran Dangmei Grace, who brought the curtain down on an illustrious international career.Grace, who made her India debut in 2013 and went on to represent the country 95 times, bowed out in perfect fashion by lifting her third SAFF Women's Championship trophy.",India's return to the top of South Asian women's football after seven years earned praise from Prime Minister Narendra Modi. The Blue Tigresses clinched a record-extending sixth SAFF Women's Championship title with an emphatic 3-1 victory over defending champions Bangladesh in a thrilling final on Saturday.,"https://static.toiimg.com/thumb/msid-131581602,imgsize-131798,width-400,height-225,resizemode-4/team-india.jpg"
