Article Title,Article Link,Article Text,Article Summary,Article Image
FIFA World Cup 2026: Four master tacticians who could define the chase; From Carlo Ancelotti to Marcelo Bielsa,https://timesofindia.indiatimes.com/sports/football/fifa-world-cup/fifa-world-cup-2026-four-master-tacticians-who-could-define-the-chase-from-carlo-ancelotti-to-marcelo-bielsa/articleshow/131577559.cms,"As anticipation builds for the 2026 FIFA World Cup, eyes will be on four master tacticians: Ancelotti steering Brazil, Deschamps guiding France, Scaloni rallying Argentina, and Bielsa commanding Uruguay. (Photo/AP)







The 2026 FIFA World Cup will to be remembered for many things. Yet when the competition kicks off across the United States, Canada and Mexico, four men on the touchline could end up shaping the story more than any superstar player.These days, football is often all about the star players, but coaches are having a bigger impact than ever. And there aren’t many managers better at that than Brazil’s Carlo Ancelotti, France’s Didier Deschamps, Argentina’s Lionel Scaloni and Uruguay’s Marcelo Bielsa.Each has a different approach to football. All face big expectations, and their influence could be remembered long after the tournament ends. For Brazil, the appointment of Carlo Ancelotti was both revolutionary and desperate.Since lifting their fifth crown in Yokohama in 2002, Brazil have repeatedly arrived as favourites only to depart amid disappointment. The scars of the 7-1 defeat to Germany in 2014 still linger.If Brazil finally end their 24-year wait for World Cup glory, Ancelotti would become the foreign coach who restored the game’s most iconic national team to the summit.Standing in his way could be the man who has quietly put together one of the most impressive international coaching runs of the modern era.For nearly 14 years, Didier Deschamps has been the steady hand behind France’s success, guiding the team through multiple generations. He guided France to World Cup glory in 2018, reached another final in 2022 and has consistently kept Les Bleus among football’s elite.He has got a fabulous squad to work with, and their depth is unbelievable. Deschamps can assemble two starting XIs packed with elite talent. Kylian Mbappe remains the headline act, but their depth stretches across every position. If Deschamps lifts the trophy again, he would join the small group of coaches with multiple World Cup titles and further cement his place among the greatest international managers of his era.Then there is the defending champion. When Lionel Scaloni was appointed Argentina coach in 2018, the decision was widely questioned. He lacked significant managerial experience and inherited a fractured national team still reeling from World Cup disappointment.Eight years later, he has transformed Argentina into one of football’s great modern success stories.Scaloni’s success comes from keeping things simple. He brought the squad together, eased the pressure and created a team-first mentality. Even with Lionel Messi at the centre of attention, Argentina was never about one superstar but about the entire team. He ended Argentina’s long wait for major silverware by winning the Copa America before capturing the 2022 World Cup in Qatar.2026 will be different, though.Argentina are no longer outsiders. They are champions defending their crown. Opponents will now prepare specifically for them. Expectations are higher and the sentiment surrounding Messi’s likely final World Cup appearance only intensifies the pressure. Scaloni has repeatedly shown an ability to adapt and his Argentina side will need that.If Scaloni represents calm, then Uruguay’s Bielsa embodies controlled chaos. Few coaches in football history inspire as much admiration from fellow managers. Pep Guardiola has described him as the best coach in the world. Yet the Argentine’s career has always been defined by a curious contradiction. He is revered as a tactical visionary, but major trophies remain relatively scarce.That is precisely why the 2026 World Cup feels so significant.Bielsa has transformed Uruguay into one of South America’s most exciting teams. Players such as Federico Valverde, Darwin Nunez and Ronald Araujo have performed well under Bielsa.The concern, as always, is whether that intensity can be sustained through the emotional and physical demands of a month-long tournament. But if Bielsa finally delivers football’s biggest prize, it would rank among the sport’s most romantic stories.The World Cup often belongs to players. Pele, Maradona, Zidane and Messi became immortal because of what they did on football’s grandest stage. Yet as the quadrennial extravaganza approaches, the battle on the touchline may prove just as compelling.","The 2026 FIFA World Cup kicks off in the United States, Canada and Mexico on June 14. Carlo Ancelotti, Didier Deschamps, Lionel Scaloni and Marcelo Bielsa will all be on the touchline for their countries.","https://static.toiimg.com/thumb/msid-131577559,imgsize-1163077,width-400,height-225,resizemode-4/131577559.jpg"
José Mourinho's Real Madrid return gets closer after Florentino Pérez wins presidential election,https://timesofindia.indiatimes.com/sports/football/top-stories/jos-mourinhos-real-madrid-return-gets-closer-after-florentino-prez-wins-presidential-election/articleshow/131576342.cms,"José Mourinho set for Real Madrid return







NEW DELHI: Florentino Pérez will remain Real Madrid president for another four years after winning the club’s election against challenger Enrique Riquelme.Speaking to supporters after the result, Pérez said: “We are going to keep working so that Real Madrid keeps winning more titles.”The club has not yet released the official vote count, but Pérez’s new term will run until 2030.The victory strengthens Pérez’s plans for the future. One of his key goals is bringing back José Mourinho for a second spell as Real Madrid coach.Mourinho managed the club between 2010 and 2013 and was featured prominently during Pérez’s campaign. Pérez said he was “proud that José Mourinho, one of the best coaches in the world, is set to return.”Pérez has also promised major changes to the squad. He wants to sign Liverpool defender Ibrahima Konaté and Inter Milan full-back Denzel Dumfries, while also teasing another high-profile signing worth more than 150 million euros that is expected to be revealed this week.The 79-year-old businessman has been one of the most influential figures in Real Madrid’s history.During his two spells in charge, the club has won seven European Cups and become the world’s most valuable football club.However, recent years have been challenging. Madrid has gone two seasons without winning a trophy despite signing star forward Kylian Mbappé, while Pérez’s proposed European Super League project failed to take off.He also faced criticism after suggesting the sale of 10% of the club to private investors.Although he lost, Enrique Riquelme accepted the result and congratulated Pérez.However, the 37-year-old renewable energy executive made it clear he is not stepping away from club politics.“For us, this is not the end, this is the beginning,” Riquelme said. “Real Madrid won’t spend another 20 years without holding elections.”Riquelme gained support from former Madrid stars including Raúl González, Fernando Hierro and Iker Casillas during his campaign.Around 98,000 club members were eligible to vote, with the election taking place at Madrid’s basketball arena because the Santiago Bernabéu Stadium is hosting events during Pope Leo XIV’s visit to Spain.",Florentino Pérez will remain Real Madrid president for another four years. The 79-year-old businessman defeated challenger Enrique Riquelme. One of his key goals is bringing back José Mourinho for a second spell as Real Madrid coach.,"https://static.toiimg.com/thumb/msid-131576398,imgsize-56170,width-400,height-225,resizemode-4/jos-mourinho-set-for-real-madrid-return.jpg"
Explained: Why Portugal are taking a '27+1' World Cup squad despite FIFA's strict 26-man limit,https://timesofindia.indiatimes.com/sports/football/fifa-world-cup/explained-why-portugal-are-taking-a-271-world-cup-squad-despite-fifas-strict-26-man-limit/articleshow/131564952.cms,"FILE - Portugal players pose for a team photo before a World Cup 2026 group F qualifying soccer match between Portugal and Hungary in Lisbon, Tuesday, Oct. 14, 2025. (AP Photo/Armando Franca, File)

Portugal have not actually broken FIFA's rules

Portugal's players sing the national anthem before an international friendly soccer match between Portugal and Chile in Oeiras, outside Lisbon, Saturday, June 6, 2026. (AP Photo/Armando Franca)

Why Ricardo Velho is travelling as the 27th player

Martinez says Portugal are travelling with '27 players plus one'

Ronaldo leads Portugal's quest for history







Portugal's World Cup squad announcement attracted attention for more than one reason. When Roberto Martinez unveiled his travelling party for the 2026 FIFA World Cup, Cristiano Ronaldo's inclusion naturally dominated headlines as the 41-year-old prepared to embark on a record-extending sixth World Cup campaign. Yet it was another detail that quickly sparked confusion among supporters: Martinez's description of Portugal travelling with ""27 players plus one.""At first glance, it appeared Portugal were taking a 28-player squad to a tournament where FIFA regulations limit all participating nations to a maximum of 26 registered players.The unusual arrangement has led many fans to wonder whether Portugal have been granted a special exemption. The reality is slightly more complicated, and it also carries deep emotional significance following the death of Liverpool forward Diogo Jota last year.Despite widespread discussion surrounding Portugal's squad size, Roberto Martinez has not submitted a 27-man squad to FIFA.The official World Cup regulations remain unchanged. Every one of the 48 participating nations is permitted to register a maximum of 26 players for the tournament, and Portugal have complied with that requirement.Martinez's official list contains the standard 26 players allowed under FIFA rules.The confusion stems from the presence of an additional player travelling with the squad.Fourth-choice goalkeeper Ricardo Velho will travel to North America alongside the Portugal squad despite not being included on the official FIFA list.Speaking at Cidade do Futebol while announcing his selections, Martinez confirmed that Velho would remain with the group throughout the tournament.The Genclerbirligi Ankara goalkeeper will train alongside Portugal's registered squad members and be fully integrated into the camp. However, he cannot appear in matches or be included on official team sheets under normal circumstances.His status is essentially that of an emergency reserve.If one of Portugal's three registered goalkeepers suffers an injury during the tournament, Velho could then be formally added to the official squad in accordance with FIFA's goalkeeper replacement provisions.As a result, Portugal will physically travel with 27 players while still adhering to FIFA's official 26-man limit.No other nation has adopted a similar arrangement for the tournament.The squad announcement also carried a deeper emotional message. Martinez repeatedly referenced Diogo Jota, who died alongside his brother Andre Silva in a car accident in northern Spain last July.Jota earned 49 caps for Portugal and scored 14 international goals during an international career that included Nations League triumphs in both 2018-19 and 2024-25. Portugal's victory over Spain in the latter final proved to be his final appearance for the national team.While discussing his World Cup squad, Martinez explained that he sees Portugal's travelling group as more than just the 27 players making the journey.""He is our strength, our joy,"" Martinez said of Jota.""Losing Diogo was an unforgettable and very difficult moment, but the very next day it was up to all of us to fight for Diogo's dream and for the example he always set in our national team.""Martinez then revealed why he considers the squad to contain one additional symbolic member.""Diogo Jota's spirit, strength and example are the plus one and will always be the plus one.""For that reason, the Portugal manager described the group as consisting of ""27 players plus one"" rather than simply 27 players.Beyond the unusual squad setup, Portugal arrive at the tournament carrying major ambitions.Martinez's side are chasing the first World Cup title in the country's history and will once again be led by Ronaldo, who becomes one of the defining stories of the competition simply by taking part at 41 years old.Portugal head to North America after completing their final preparations, including a 2-1 friendly victory over Chile courtesy of goals from Goncalo Guedes and Bruno Fernandes. They also recorded a 2-0 win over the United States and played out a goalless draw against Mexico during their warm-up schedule.Their Group K campaign begins on June 17 against DR Congo in Houston before further matches against Uzbekistan on June 23, also in Houston, and Colombia on June 27 in Miami.While Portugal's squad announcement initially appeared to suggest a breach of FIFA regulations, the reality is ultimately far simpler. The official list remains officially capped at 26 players, Ricardo Velho travels as an emergency reserve goalkeeper, and Martinez's reference to ""plus one"" serves as a moving tribute to Jota's enduring place within the national team setup.In practical terms, Portugal are following FIFA's rules. In emotional terms, however, Martinez believes his squad will always contain one extra member.","Portugal's World Cup squad announcement attracted attention for more than one reason. Roberto Martinez's description of Portugal travelling with ""27 players plus one"" initially appeared to breach FIFA regulations. The confusion stems from the presence of an additional player travelling with the squad. Ricardo Velho will travel to North America alongside the Portugal squad.","https://static.toiimg.com/thumb/msid-131565885,imgsize-356802,width-400,height-225,resizemode-4/wcup-portugal-soccer.jpg"
"Brazil, Argentina, Belgium and Portugal secure crucial wins in final FIFA World Cup 2026 warm-up matches",https://timesofindia.indiatimes.com/sports/football/fifa-world-cup/brazil-argentina-belgium-and-portugal-secure-crucial-wins-in-final-fifa-world-cup-2026-warm-up-matches/articleshow/131562741.cms,"FIFA warm-up matches (Image: IANS)

Endrick fires Brazil past Egypt

Argentina cruise past Honduras

Germany edge United States

Portugal overcome Chile despite red card drama

Belgium dominate Tunisia

Poll Should Cristiano Ronaldo play a more significant role in Portugal World Cup campaign? Yes, he is critical to the team. No, it's time for younger players.

Major Friendly Results:







With the FIFA World Cup 2026 just days away, several of the tournament's leading contenders fine-tuned their preparations with encouraging victories in their final round of international friendlies.Brazil, Argentina, Belgium and Portugal all recorded important wins, while Germany continued their impressive form with a hard-fought victory over co-hosts United States as teams across the globe completed their last competitive rehearsals before the tournament begins in the United States, Mexico and Canada.Five-time world champions Brazil wrapped up their World Cup preparations with a 2-1 victory over Egypt at Huntington Bank Field. Newcastle United captain Bruno Guimarães opened the scoring after capitalizing on a defensive mistake from Mohanad Lasheen before calmly finishing into the far corner.Egypt responded through Mostafa Ziko, who intercepted an errant back pass from Marquinhos and slotted past Alisson Becker to level the scores. However, Brazil regained control in the second half when teenage sensation Endrick, introduced at halftime, met Raphinha's inviting cross with a first-time finish to secure victory for the Seleção.Brazil will begin their World Cup campaign against Morocco in New Jersey, while Egypt face Belgium in Seattle in their opening fixture.Defending world champions Argentina continued their smooth preparations with a comfortable 2-0 victory over Honduras in Texas. Lionel Scaloni's side controlled possession throughout and produced another disciplined defensive display to record a clean sheet ahead of their title defense.The result extended Argentina's positive momentum as they look to become the first nation since Brazil in 1962 to successfully defend the World Cup crown.Germany maintained their excellent form by defeating World Cup co-hosts United States 2-1 at Chicago's Soldier Field.Kai Havertz handed the Germans an early advantage before Antonee Robinson brought the home crowd to life with a stunning long-range strike. The decisive moment arrived when Leroy Sané found space and fired past goalkeeper Matt Freese to secure Germany's ninth consecutive victory heading into the tournament.Despite the defeat, Mauricio Pochettino's United States side showed encouraging signs ahead of their World Cup opener.Portugal secured a 2-1 victory over Chile in Oeiras, though the win was overshadowed by Rafael Leão's first-half dismissal for an off-the-ball altercation with defender Iván Román. After a cagey opening period, Portugal found their rhythm in the second half. Gonçalo Guedes broke the deadlock before Bruno Fernandes added a second to put the match beyond Chile's reach. Cristiano Ronaldo featured during the opening half as Portugal concluded their preparations on a winning note.Belgium produced one of the standout performances of the international window, thrashing Tunisia 5-0 in Brussels. Leandro Trossard opened the scoring after excellent work from Jeremy Doku before Charles De Ketelaere doubled the advantage early in the second half.Tunisia's task became even harder when Ismael Garbi was sent off shortly after the restart. Kevin De Bruyne added Belgium's third goal before substitutes Dodi Lukebakio and Nicolas Raskin completed the rout in the closing stages.Elsewhere, Türkiye continued their strong form with a 2-1 win over Venezuela, while England edged New Zealand 1-0 thanks to Harry Kane's decisive strike.Romania defeated Wales 2-1, and World Cup co-hosts Canada were held to a 1-1 draw by the Republic of Ireland.Brazil 2-1 EgyptArgentina 2-0 HondurasBelgium 5-0 TunisiaPortugal 2-1 ChileGermany 2-1 United StatesEngland 1-0 New ZealandTürkiye 2-1 VenezuelaRomania 2-1 WalesCanada 1-1 Republic of Ireland","Brazil, Argentina, Belgium and Portugal all recorded important wins. Germany continued their impressive form with a hard-fought victory over co-hosts United States. Portugal secured a 2-1 victory over Chile, though the win was overshadowed by Rafael Leão's first-half dismissal.","https://static.toiimg.com/thumb/msid-131562760,imgsize-860800,width-400,height-225,resizemode-4/131562760.jpg"
"""Matter of when, not if "": 49ers WR Brandon Aiyuk's future tied to $7.6 billion NFC team in bold prediction",https://timesofindia.indiatimes.com/sports/nfl/news/matter-of-when-not-if-49ers-wr-brandon-aiyuks-future-tied-to-7-6-billion-nfc-team-in-bold-prediction/articleshow/131576578.cms,"San Francisco 49ers WR Brandon Aiyuk's future tied to $7.6 billion NFC team in bold prediction (Getty Images)

Washington Commanders continue to surface in Brandon Aiyuk trade talks as NFL analysts make bold predictions about the WR







Brandon Aiyuk's future remains one of the biggest unanswered questions around the NFL. The San Francisco 49ers wide receiver has not played since October 2024, yet his name continues to dominate NFL trade rumors. Now, a bold prediction from an NFL analyst has put the Washington Commanders back in the spotlight.Just days after drawing attention with cryptic Instagram activity, Brandon Aiyuk found himself linked once again to the NFC East franchise. While no trade appears imminent, the connection refuses to go away.The latest prediction came from NFL columnist Josh Taylor. Posting on X, Taylor made his stance clear. ""Brandon Aiyuk will be a Washington Commander. It's a matter of when, not if.""The comment quickly gained traction because Washington has long looked like a logical fit for the former All-Pro receiver. Also, Brandon Aiyuk shares a strong connection with Commanders quarterback Jayden Daniels. The two played together at Arizona State during the 2019 season before taking different paths to the NFL. Daniels has since emerged as one of the league's young stars, making Washington an attractive destination for any receiver.The Washington Commanders also employ general manager Adam Peters, who spent years in San Francisco's front office and helped build the roster that selected Aiyuk in the first round of the 2020 NFL Draft.Then came Brandon Aiyuk's social media activity. The 49ers wide receiver posted an Instagram story showing himself wearing a Washington Commanders hat. He later followed it with another post featuring the message, ""the gig is up."" The posts immediately sparked fresh discussion among fans and fueled speculation about his preferred destination.Still, a Brandon Aiyuk trade remains complicated. According to David Lombardi of The San Francisco Standard, the 49ers have little financial motivation to release the receiver. Lombardi reported that keeping Aiyuk on the roster benefits San Francisco's salary-cap structure. Since he remains on the reserve list, the team also avoids paying his salary.Brandon Aiyuk has not appeared in a game since suffering a major knee injury against the Kansas City Chiefs in Oct. 2024. He missed the entire 2025 season, and the 49ers later voided his 2026 guarantees because he failed to meet participation requirements.Currently, Taylor's prediction remains just that, a prediction. Yet, between Brandon Aiyuk's ties to Daniels, his relationship with Peters, and his recent Instagram posts, the Washington Commanders continue to sit at the centre of the conversation whenever trade rumours swirl.",Washington Commanders continue to surface in Brandon Aiyuk trade talks. NFL analysts make bold predictions about the San Francisco 49ers wide receiver's future. The Washington Commanders have long looked like a logical fit for the former All-Pro receiver.,"https://static.toiimg.com/thumb/msid-131576624,imgsize-28290,width-400,height-225,resizemode-4/brandon-aiyuk.jpg"
Erin Andrews' Bahamas vacation with Matthew Stafford puts reporter-athlete friendships under the microscope again,https://timesofindia.indiatimes.com/sports/nfl/news/erin-andrews-bahamas-vacation-with-matthew-stafford-puts-reporter-athlete-friendships-under-the-microscope-again/articleshow/131576475.cms,"Erin Andrews under fire as viral vacation photo divides NFL fans and sports media world (Getty Images)

Does going on vacation with a player you cover cross a line?



Should NFL reporters be this close to the players they cover?









Fox Sports sideline reporter Erin Andrews is in the Bahamas for the NFL offseason, and a single Instagram photo has turned a relaxing group trip into a full-blown media ethics debate. Andrews posted a picture from a boat at Baker's Bay, with her husband Jarret Stoll, FOX colleague Charissa Thompson and her boyfriend, and Los Angeles Rams quarterback Matthew Stafford alongside his wife Kelly. The photo itself is innocent. What followed online was not.The trip reignited questions about journalistic ethics and how close NFL reporters should get to the athletes they cover. The timing matters here. The Dianna Russini-Mike Vrabel situation is still fresh in people's minds, and that backdrop made some observers look at this photo with a sharper eye than they might have a year ago.To be clear, Andrews has done nothing wrong. She and the Staffords have been close for years, and that friendship has always been out in the open. But the debate isn't really about Andrews specifically. It's about a broader pattern that's become normalized across NFL media.FOX's Jay Glazer, one of the most connected insiders in the league, regularly works out and vacations with coaches and players. Nobody blinks. That's just how the scoops get made. The honest reality is that the insider model of NFL journalism runs almost entirely on personal access, and personal access doesn't come without personal relationships.There's a real tension here worth acknowledging. Andrews works the sidelines and does pre-game feature packages. She's not the one breaking trade news or investigating locker room dysfunction. Her role doesn't put her in a position where a friendship with Stafford would compromise her reporting in any meaningful way. That's a different situation than, say, a beat writer or a reporter who regularly breaks team news on the Rams.Still, perception matters in this business. Some feel it simply isn't the best image for an NFL reporter to be this publicly close with an active player she covers, regardless of what's actually happening behind the scenes.The conversation will likely fade quickly. But it points to something the NFL media world hasn't quite figured out yet: where exactly does the line sit between being well-sourced and being too comfortable with the people you're supposed to hold accountable?","Fox Sports sideline reporter Erin Andrews is in the Bahamas for the NFL offseason. Andrews posted a picture from a boat with her husband Jarret Stoll, Charissa Thompson and her boyfriend, and Los Angeles Rams quarterback Matthew Stafford. The photo itself is innocent. What followed online was not.","https://static.toiimg.com/thumb/msid-131576537,imgsize-678897,width-400,height-225,resizemode-4/erin-andrews.jpg"
