Article Title,Article Link,Article Text,Article Summary,Article Image
Kalinga Super Cup: Goa hope to spoil Bagan’s trophy hunt,https://timesofindia.indiatimes.com/sports/football/top-stories/kalinga-super-cup-goa-hope-to-spoil-bagans-trophy-hunt/articleshow/120752911.cms,"Bhubaneswar, April 29 (IANS) Mohun Bagan Super Giant and FC Goa, the two top sides in the Indian Super League (ISL) 2024-25 season, will go head-to-head at the Kalinga Stadium in the semifinal of the Kalinga Super Cup here on Wednesday.

Bhubaneswar

Go Beyond The Boundary with our YouTube channel. SUBSCRIBE NOW!



Poll Which team do you think has the best chance of reaching the Kalinga Super Cup finals? Mumbai City FC Jamshedpur FC Mohun Bagan Super Giants FC Goa

: Two games won, two more to go.That’s the scenario for Kalinga Super Cup semifinalists, barring Mohun Bagan Super Giants who needed just one win to join the last four, as they look to book a place in the summit clash with another win here on Wednesday.“All four teams have the same target. And we are all in that moment of the competition where every game is very difficult,” India and FC Goa head coach Manolo Marquez said at the pre-match press conference at Kalinga Stadium on Tuesday.Marquez’s Goa will be vying it out with ISL Shield and Cup winners Mohun Bagan in an afternoon fixture and Jamshedpur FC are set to lock horns with Mumbai City FC in the game scheduled for the evening.While the absence of the star foreigners in the ISL champions’ squad makes FC Goa – who dominated Gokulam Kerala in a 3-0 win before edging a valiant Punjab FC 2-1 in the quarterfinal – the favourites in their last-four clash, their Spanish head coach is not ready to pay heed to the statistics.“Mohun Bagan are here with half of the main team squad and the other half were champions of the Reliance Foundation Development League two weeks ago. The game will be very difficult because they have nothing to lose. That is the reality. They have already won two trophies and the slot for the Asian competition,” he added.Led by assistant coach Bastab Roy in absence of Jose Molina, Bagan were devastating in their quarterfinal against Kerala Blasters, with Kerala boys Ashique Kuruniyan and Sahal Abdul Samad combining well while 21-year-old playmaker Salahudheen Adnan K stole the show with his Player of the Match performance.Roy, meanwhile, took the game in the team’s stride and admitted that they have a tough job against Marquez’s Goa.“FC Goa are, without a doubt, a better and a stronger team than Kerala Blasters. So my job is not easy. But my players are focussed and ready. It’s an exposure trip for the young boys and some seniors as well. It's a semifinal and I’ve told my boys to enjoy the game,” was Roy’s comments on Tuesday.Goa, however, have a silver lining even in a semis defeat as AIFF earlier announced they would get the 2025-26 AFC Champions League 2 spot if Bagan go on to clinch the trophy on Saturday.That’s not the case for the other semifinalists with Mumbai City and Jamshedpur both eager to make up for their ISL playoffs disappointments and leave the memories of exiting the Super Cup last time in the last-four stage behind and end this season on a high.“We never think like this (about the previous tournaments). If this is a new challenge, you must think positively and try to get good positive results. We’re playing in the semifinal. It’s an important game. We are playing against a good team and must work hard to get a positive result,” Khalid Jamil said at the pre-match interaction.Jamshedpur, who will hope to be third-time lucky after being ousted twice in the last-four stage, will have the psychological edge having beaten Mumbai City in both legs of the ISL.However, the Red Miners’ defence — led by the in-form Stephen Eze — will have to deal with the Lallianzuala Chhangte threat with the opposition skipper being the standout performer so far with three goals and an assist, including the winner against Inter Kashi in the last eight.But only Wednesday will tell who gets the chance to vie for the trophy on Saturday.",Mohun Bagan Super Giant and FC Goa will go head-to-head in the semifinal of the Kalinga Super Cup on Wednesday. Jamshedpur FC are set to lock horns with Mumbai City FC in the game scheduled for the evening. AIFF earlier announced that Goa would get the 2025-26 AFC Champions League 2 spot if Bagan go on to clinch the trophy on Saturday.,"https://static.toiimg.com/thumb/msid-120752967,imgsize-14286,width-400,resizemode-4/Kalinga-Super-Cup-Favourites-FC-Goa-take-on-young-Mohun-Bagan-SG-side-in-semi-final.jpg"
'Don't compare myself to Lionel Messi': Barcelona's young sensation Lamine Yamal,https://timesofindia.indiatimes.com/sports/football/top-stories/dont-compare-myself-to-lionel-messi-barcelonas-young-sensation-lamine-yamal/articleshow/120731105.cms,"Lionel Messi and Lamine Yamal

NEW DELHI: Barcelona sensation Lamine Yamal has distanced himself from any comparisons to Lionel Messi as he prepares for the Champions League semi-final against Inter Milan on Wednesday.The 17-year-old has established himself as a crucial player on the right wing, the position previously held by Barcelona's record goalscorer Messi, with both being products of the La Masia academy .The last time Barcelona reached the Champions League final was in 2015 with Messi occupying the right-wing position, and now Yamal aims to guide the Catalans back to the prestigious final.""I don't compare myself to him, because I don't compare myself to anyone -- and much less with Messi,"" Yamal told reporters Tuesday.""We are thinking about improving ourselves, every day, and on being better on the next day.""So I don't think the comparison makes sense, with Messi even less -- I'm going to enjoy myself, and be myself.""The young talent expressed his belief that the Argentine footballer stands as the greatest in history.""I admire him obviously, as the best player in history, but I don't compare myself to him,"" he reiterated.A milestone awaits Yamal as he is expected to make his 100th appearance for Barcelona when they face Inter Milan on Wednesday at the Olympic Stadium.Yamal's recent contribution included two assists in Barcelona's Copa del Rey final victory against Real Madrid on Saturday, keeping their hopes alive for a potential quadruple this season.""I'm really excited, it's my first (European) semi-final, and for many others in the team too,"" added Yamal, expressing his confidence before the match.""I've not had any fear, but I have motivation ahead of the game -- I think the butterflies in your stomach are good, all of us players have them.""But fear... I left fear in the park in Mataro (Yamal's hometown) a long time ago.""",Lamine Yamal has distanced himself from any comparisons to Lionel Messi. The 17-year-old has established himself as a crucial player on the right wing. Yamal is expected to make his 100th appearance for Barcelona when they face Inter Milan.,"https://static.toiimg.com/thumb/msid-120732726,imgsize-44780,width-400,resizemode-4/Lionel-Messi-and-Lamine-Yamal.jpg"
"Liverpool clinch Premier League crown, equal record 20th English title with 5-1 thrashing of Tottenham",https://timesofindia.indiatimes.com/sports/football/epl/top-stories/liverpool-clinch-premier-league-crown-equal-record-20th-english-title-with-5-1-thrashing-of-tottenham/articleshow/120673331.cms,"Liverpool players celebrate their win. (Pic credit: LFC)

Go Beyond The Boundary with our YouTube channel.

Poll Do you think Liverpool can maintain their dominance in the league next season? It's too early to tell No, other teams will catch up Yes, they will continue to dominate

Liverpool secured their 20th English top-flight title with a stunning 5-1 victory over Tottenham Hotspur at an electrified Anfield on Sunday, sealing a record-equalling crown in emphatic style. The Reds, under manager Arne Slot, left no doubt as they turned an early deficit into a comprehensive win that saw them extend their lead to 15 points over second-placed Arsenal, making their title mathematically unassailable with just four games remaining.The match began with an air of anticipation, as Liverpool fans serenaded their team with the iconic ""You'll Never Walk Alone,"" and their team responded with attacking intent. However, Tottenham briefly threatened to spoil the party when Dominic Solanke powered home a header from a James Maddison corner in the 12th minute. The goal, which initially appeared to be offside, was awarded after VAR's intervention.The setback only seemed to galvanize Liverpool, who quickly leveled through Luis Diaz. The Colombian forward slotted home from close range following a fine cross from Dominik Szoboszlai. The home side then took the lead just minutes later, as Alexis Mac Allister rifled a thunderous shot past Spurs goalkeeper Guglielmo Vicario in the 24th minute.Liverpool were rampant, and after Tottenham's inability to clear their lines, Cody Gakpo seized the opportunity to make it 3-1, firing a low shot into the corner. Spurs, fielding a weakened side due to manager Ange Postecoglou's focus on the Europa League semi-finals, were now on the back foot.As the second half progressed, the Liverpool faithful were craving a goal from their star man, Mohamed Salah. Their wish was granted when Salah collected a pass from Szoboszlai, cut inside, and blasted the ball into the bottom corner, celebrating by taking a selfie with a fan in front of the Kop. The crowd erupted in joyous chants, and the atmosphere at Anfield reached fever pitch.The final goal came when Tottenham defender Destiny Udogie inadvertently turned the ball into his own net, sealing a 5-1 rout and sending the Liverpool fans into a frenzy. As the final whistle blew, Anfield reverberated with deafening cheers, and the celebrations began in full force.Liverpool's triumph marked their 20th league title, bringing them level with Manchester United at the top of the all-time list. It also represented a significant achievement for manager Arne Slot, who has steered the club to glory in his first season after replacing Jurgen Klopp last year.","Liverpool secured their 20th English top-flight title with a stunning 5-1 victory over Tottenham Hotspur at an electrified Anfield on Sunday. The Reds, under manager Arne Slot, left no doubt as they turned an early deficit into a comprehensive win that saw them extend their lead to 15 points over second- placed Arsenal.","https://static.toiimg.com/thumb/msid-120673300,imgsize-69258,width-400,resizemode-4/Liverpool.jpg"
AIFF awards I-League trophy to Churchill Brothers despite CAS stay,https://timesofindia.indiatimes.com/sports/football/top-stories/aiff-awards-i-league-trophy-to-churchill-brothers-despite-cas-stay/articleshow/120671758.cms,"Go Beyond The Boundary with our YouTube channel.

Poll How should AIFF handle the situation moving forward? Consult FIFA for further guidance. Stand by their decision and await CAS verdict. Revoke the trophy award until CAS concludes.

In a controversial move, the All India Football Federation (AIFF) awarded the I-League trophy to Churchill Brothers on Sunday, just hours after the Court of Arbitration for Sport (CAS) had stayed the decision and barred any formal felicitation. The defiant act could invite further scrutiny from global bodies like FIFA and CAS.Deputy secretary general M Satyanarayan handed the trophy to Churchill Brothers at a ceremony in Goa, claiming the AIFF only learned about the CAS order after the presentation. ""I was on a flight to Goa and the AIFF Secretariat was closed on Sunday. I came to know about the order only after giving away the trophy,"" Satyanarayan told PTI.The CAS stay came on an urgent application filed by Inter Kashi, who argued that a pending points dispute could alter the final standings. Inter Kashi president Prithiijit Das asserted, ""The CAS order came around 1:30 pm IST and the mail was marked to AIFF also,"" questioning the federation's explanation.CAS deputy president Elizabeth Steiner had clearly ruled that the AIFF must not declare a winner or hold any ceremony until the arbitration concludes. The respondents, including AIFF and Churchill Brothers, have until April 29 to respond.Defending its move, AIFF later issued a statement, emphasising that the presentation was based on previous Delhi High Court and Appeals Committee rulings and that the federation would comply with CAS' final verdict.Churchill Brothers had provisionally finished atop the I-League standings, but Inter Kashi's challenge over a disputed match result could yet overturn the title race. With the CAS involved, how FIFA and the world body react remains to be seen, especially since sports federations are bound to respect CAS directives.The controversy has cast a shadow over Indian football's governance yet again.","The All India Football Federation (AIFF) awarded the I-League trophy to Churchill Brothers on Sunday, just hours after the Court of Arbitration for Sport (CAS) had stayed the decision. The defiant act could invite further scrutiny from global bodies like FIFA and CAS.","https://static.toiimg.com/thumb/msid-120671847,imgsize-12028,width-400,resizemode-4/AIFF.jpg"
Real Madrid showcase fight in Copa del Rey final against Barcelona but lack class throughout,https://timesofindia.indiatimes.com/sports/football/top-stories/real-madrid-showcase-fight-in-copa-del-rey-final-against-barcelona-but-lack-class-throughout/articleshow/120668038.cms,"Real Madrid players protest against a decision during the Copa del Rey final against Barcelona in Seville. (AP)

Go Beyond The Boundary with our YouTube channel.

Antonio Rudiger issued an apology as an Instagram Story.

Poll Which team do you think will win the next Clasico? It's too close to call Barcelona Real Madrid

Real Madrid came into the Copa del Rey final on the back of a horrid month. Defeats against Valencia and over both legs against Arsenal had thrown them out of Champions League and dented La Liga title hopes. Even in the Cup, they needed to claw from 1-3 down to beat Real Sociedad in the semi-final. On the field, it hasn't been smooth sailing by a long shot.Over the last two days, off-the-field antics took a massive hit as well. A club that prides itself on its class and gentlemanliness, showed neither in a haughty display which veered on petulance.At La Cartuja in Sevilla, Real Madrid were outplayed by a superior Barcelona side , losing 3-2 in extra time to lift the Cup for a record-extending 32nd time. It marked a third straight defeat for Real Madrid in Clasicos this season, scoring four and conceding 12. Two of those came in the finals - first in the Spanish Super Cup and now in the Copa. As far as warming up to the big job is concerned, Hansi Flick has done an incredible job. And the job is far from finished, Barcelona remain on course for a treble.Real Madrid, meanwhile, only have the league to play for. And that is hardly an easy passage. The Carlo Ancelotti-managed side are four points behind Barcelona with five matches to go. Winning the Clasico on May 11 is vital to the club's bid to avoid a trophy-less season. If it comes in a season where your arch-rivals win a treble, that is a recipe for disaster.Before all that, though, Real Madrid's conduct pre-and-post the Copa del Rey final has come under intense scrutiny. After the final whistle, Antonio Rudiger , Jude Bellingham and Lucas Vazquez were sent off for protesting amid ugly scenes.Both Bellingham and Rudiger were required to be restrained as they had a pop at the referee. The latter could even cop a lengthy ban for throwing an object at the referee from the sidelines. Questioning the referees had started at an institutional level . For months, Real Madrid TV attacked referees for their decisions and after taking umbrage with a decision in February, the club issued an official statement labelling officiating in the country as ""rigged"" and ""completely discredited"".Furthermore, the club has refused to make players available for pitch-side and mixed zone interactions during the league - a practice followed by every other club. Instead, Real Madrid players have kept their interactions limited to the club's official TV channel.Slamming of the referees and dissection of their decisions continued until it reached boiling point on Friday. In an emotional news conference before the Copa del Rey final, officials for the high-stakes encounter hit back.Referee Ricardo de Burgos Bengoetxea broke down in tears while explaining the impact Real Madrid's attacks have had on his family life and that of other referees.VAR referee Pablo Gonzalez Fuertes, seated alongside him, suggested officials will have to take ""much more serious measures"" while hinting at a possible strike.In response, Real Madrid didn't buckle down. Instead, they went into counter-attack. They pulled out of the scheduled open training session for the media, a press conference, president's traditional dinner and a photo-call.The game went ahead, with the same officials, despite suggestions in the Spanish media that Real Madrid were considering withdrawing. The focus, well and truly, was on the referees.For the most part, the referees did a good job of keeping the game flowing despite 34 fouls being committed by both teams and seven yellow cards being brandished out.Ironically, Barcelona were awarded a penalty in the sixth minute of stoppage time when Raphinha fell under pressure from Raul Asencio. As tension crept up, the cameras panned squarely on the officials, De Burgos Bengoetxea was called to assess the incident by the VAR official. Following a brief look, the decision was overturned.In a game that had 50-50 decisions galore, and players of both sides upset with the referee, Jules Kounde drilled in a low shot past Thibaut Courtois to seal the deal.As Real Madrid looked for yet another miracle, Kylian Mbappe was penalised for a foul, getting his hand in the face of a Barcelona player. That broke all the pent-up frustration for the Real Madrid players.Rudiger, already substituted by then, threw something at the referee and was sent off. It took several players and staff to contain him as a bag of ice burst in his hands - which may well have been his next projectile. After hours to cool down, the German defender has apologised for his behaviour.Bellingham, who had already vented to the officials in the tunnel before, was then sent off, too. As was Vazquez for coming onto the pitch to protest.Ancelotti admitted he had no idea about the last two red cards. A reflection of cluelessness that has plagued the Italian manager this season. The squad has struggled to find the right structure for the team. Since Toni Kroos, Nacho Fernandez and Joselu's departure in the summer, the club hasn't filled in the right replacements.Lamine Yamal's post-match message delivered the zinger. ""They can't handle us this year, we've proven it,"" said the teenager, wearing two pairs of sunglasses, the ice-cool antithesis to Madrid's red-hot rage.","Real Madrid lost 3-2 in extra time to Barcelona in the Copa del Rey final. After the final whistle, Antonio Rudiger, Jude Bellingham and Lucas Vazquez were sent off for protesting amid ugly scenes. The focus, well and truly, was on the referees. Real Madrid TV attacked referees for their decisions in February.","https://static.toiimg.com/thumb/msid-120668220,imgsize-49738,width-400,resizemode-4/Real-Madrid-CdR-referee-AP.jpg"
Monaco E-Prix: Here’s all about the breathtaking Circuit de Monaco you can’t take your eyes off,https://timesofindia.indiatimes.com/sports/formula-e/monaco-e-prix-heres-all-about-the-breathtaking-circuit-de-monaco-you-cant-take-your-eyes-off/articleshow/120809978.cms,"Here’s all you need to know about this special Monaco circuit

The tickets have been sold and calendars marked for the Monaco E-Prix , taking place at the Circuit de Monaco on May 3 and 4. One look at the Monaco landscape is enough to understand why race enthusiasts call this the most stunning circuit in the world. Words often fall short when describing the beauty of high-speed electric cars racing through a cityscape that blends historic and modern architecture, weaving around the waterfront with boats watching from the harbour.High-speed Gen3 Evo cars will take to the famed Monaco streets, known for providing plenty of overtaking opportunities. That alone explains why no pole-sitter has gone on to win the final race in the past three seasons. Notably, Formula E now uses the actual Formula 1 Grand Prix layout, so fans can expect full-speed thrills and sustainable entertainment with no shortcuts.The stunning full-length circuit includes an uphill climb, Casino Square, the iconic hairpin turn, a chicane, and even a tunnel that often delivers surprises when the cars burst back into the open.It’s not just the track that excites—Monaco’s grandstands offer a wide range of views to suit every fan’s preference. From the panoramic view at Sainte Devote, to the lively Casino Square, and the finish line near the swimming pool and Anthony Noghes Corner, spectators are in for a visual treat at whichever grandstand they book for the race.According to FormulaE.com, former Formula 1 champion Nelson Piquet once said that racing through the Monegasque streets feels like ""riding a bicycle around your living room.""The official X handle of Formula E has also shared a graphic breakdown of the Circuit de Monaco, beautifully highlighting every nook and corner of the 3.337 km track.Also Read: Meet the winners of the Monaco E-Prix so far — and why Pole Position isn’t always good news The Monaco E-Prix kicks off this weekend, beginning with the first free practice session early Saturday. It’s a packed double-header with races on both Saturday and Sunday. Jaguar’s Mitch Evans won the last race but this time there are multiple favourites for the winner’s trophy including him, Oliver Rowland, Nick Cassidy and Antonio Felix Da Costa.","Monaco E-Prix takes place at the Circuit de Monaco on May 3 and 4. Formula E now uses the actual Formula 1 Grand Prix layout, so fans can expect full-speed thrills. The stunning full-length circuit includes an uphill climb, Casino Square, the iconic hairpin turn, a chicane, and even a tunnel.","https://static.toiimg.com/thumb/msid-120809950,imgsize-1036001,width-400,resizemode-4/Image-credit-Formula-E.jpg"
Revisiting Antonio Felix Da Costa’s epic high-altitude pool dive after his Monaco E-Prix win,https://timesofindia.indiatimes.com/sports/formula-e/revisiting-antonio-felix-da-costas-epic-high-altitude-pool-dive-after-his-monaco-e-prix-win/articleshow/120809848.cms,"Antonio Felix Da Costa’s epic celebration in Monaco

The Monaco E-Prix is here, and all the world is talking about is the stunning Circuit de Monaco and who the two drivers will be to win the double-header this year. However, there is also something very special about celebrating a win at the Monaco race. In 2021, a Formula E driver Antonio Felix Da Costa —who raced for Techeetah-DS at the time—did a high-altitude jump into a swimming pool to celebrate his victory at the race. He now races for Tag Heuer Porsche .The video of Antonio Felix Da Costa’s iconic 2021 celebration after winning the Monaco E-Prix was shared by Formula E’s social media handles to revisit the famous moment. The video shows an all-charged-up Da Costa, in his race costume and shoes, climbing high onto the platform overlooking the pool and diving in like a champion diver. He didn’t show even an iota of hesitation and dove right in without a second thought.The moment was shown on television in the video, with an anchor also mentioning his hair flip as he lifted his head out of the water after the epic dive.Reacting to the video, a fan wrote on Instagram, “That’s a little bit too high for comfort.” Another commented, “Epic! Let's gooooo Antonio!” One more said, “Let’s do another one this weekend.” An Instagram user called it “The most iconique celebration ever.” A comment also read: “Portuguese do it Better.”Antonio is also among the favourites to win the race. He recently took the third spot on the podium at the Miami E-Prix, which had Pascal Wehrlein as the winner and Lucas Di Grassi in second place.The 33-year-old Portuguese driver is also a surfer. He is the last Formula E driver to have won a race in Monaco after taking pole position in the qualifying race.Also Read: Antonio Felix Da Costa has his eyes on Monaco after the Miami E-Prix: “This is really looking good” The Monaco E-Prix double-header starts on May 3, Saturday. The two free practice sessions, the qualifying, and the Round 6 race will take place on Saturday, while the third free practice session, the Round 7 qualifying, and the Round 7 final race will take place on Sunday.",Formula E driver Antonio Felix Da Costa did a high-altitude jump into a swimming pool to celebrate his victory at the Monaco E-Prix in 2021. The video was shared by Formula E’s social media handles to revisit the famous moment. The 33-year- old Portuguese driver is also a surfer.,"https://static.toiimg.com/thumb/msid-120809827,imgsize-858764,width-400,resizemode-4/Image-credit-Formula-E/Antonio-Felix-Da-Costa.jpg"
