Article Title,Article Link,Article Text,Article Summary,Article Image
Rohit Sharma thanks Abhishek Nayar after match-winning knock for MI against CSK,https://timesofindia.indiatimes.com/sports/cricket/ipl/top-stories/rohit-sharma-thanks-abhishek-nayar-after-match-winning-knock-for-mi-against-csk/articleshow/120489922.cms,"File Pic: Rohit Sharma and Abhishek Nayar

Poll Which factor do you think contributes most to a player's performance? Player's individual skills and form Coaching and mentorship

Go Beyond The Boundary with our YouTube channel.

NEW DELHI: India captain Rohit Sharma publicly thanked his long-time friend and personal mentor Abhishek Nayar on Monday, days after the BCCI terminated Nayar’s tenure as the national team's assistant coach.Also visit: KKR vs GT, IPL Live Score In a heartfelt Instagram post following his unbeaten 76-run knock for Mumbai Indians in the IPL , Rohit shared a photo celebrating his return to form and tagged Nayar with a simple yet powerful message: ""Thanks bro @ABHISHEKNAYAR.""Rohit and Nayar go back a long way, having played together for Mumbai in domestic cricket. In recent years, whenever Rohit returns home, Nayar has quietly taken on the role of his personal coach, helping the India skipper refine his game through one-on-one sessions.Nayar's influence extends well beyond Rohit. KL Rahul , after a match-winning knock for Delhi Capitals, had recently acknowledged Nayar's support, stating, ""Big shoutout to Abhishek Nayar. I've worked a lot with him ever since he came into the Indian team.""Despite his sacking — alongside fielding coach T Dilip and strength and conditioning coach Soham Desai — Nayar has swiftly returned to the IPL circuit. He has rejoined the Kolkata Knight Riders setup, a franchise he previously helped to the IPL title in 2024. Though KKR has yet to officially announce his designation, his quiet but impactful return could once again prove decisive.","Rohit Sharma thanks Abhishek Nayar on Instagram for his support. Nayar was sacked as India's assistant coach earlier this month. He has rejoined the Kolkata Knight Riders, the franchise he previously helped to the IPL title in 2024.","https://static.toiimg.com/thumb/msid-120490188,imgsize-36560,width-400,resizemode-4/Rohit-Sharma.jpg"
Danny Morrison catches Shubman Gill off guard with personal question at toss in KKR vs GT,https://timesofindia.indiatimes.com/sports/cricket/ipl/top-stories/simon-doull-catches-shubman-gill-off-guard-with-query-at-toss-in-kkr-vs-gt/articleshow/120490679.cms,"Gujarat Titans' captain Shubman Gill plays a shot during the Indian Premier League cricket match between Kolkata Knight Riders and Gujarat Titans at Eden Gardens in Kolkata, India, Monday, April 21, 2025. (AP Photo/Bikas Das)

Go Beyond The Boundary with our YouTube channel.

Poll What aspect of IPL excites you the most? The intense competition for playoff spots The thrilling batting performances

Shah Rukh Khan: The superstar who turned cricket into blockbuster

KKR XI:

Gujarat Titans XI:

At the toss of IPL 2025 match between Gujarat Titans and Kolkata Knight Riders at Eden Gardens on Monday, GT captain Shubman Gill faced an unexpected personal question from former cricketer Danny Morrison about potential wedding plans, leading to a viral social media moment. The match saw KKR captain Ajinkya Rahane winning the toss and choosing to bowl first against the table-toppers Gujarat Titans.Gill was caught off guard when Morrison asked, ""You're looking good, wedding bells around the corner? Getting married soon?"" The GT captain, blushed and said, ""No, nothing like that."" Hilariously, Morrison didn't ask Gill anything about the playing XI. KKR made strategic changes to their lineup , bringing in Rahmanullah Gurbaz and Moeen Ali to replace South African duo Quinton de Kock and Anrich Nortje. Angkrish Raghuvanshi was designated as the impact player for the chase.Gujarat Titans, the IPL 2022 champions, currently lead the points table with five wins from seven matches, while defending champions KKR sit at seventh position with three wins and four losses. GT also holds a 2-1 advantage in head-to-head encounters against KKR.""The pitch looks on the drier side, and when we bowl we want to see how it is behaving. It is a chasing ground. We spoke after the last game. The players are working very hard. There is a motivation to go up the ladder. I am positive about all players. Not too worried about middle-order,"" said Rahane after winning the toss.""Don't think there will be any dew. So it should be a good game. The way we have been bowling has been great. We have been contributing with wickets. The skill set that he (Rashid Khan, GT vice-captain) brings with his bowling has been great,"" said GT skipper Gill.Rahmanullah Gurbaz, Sunil Narine, Ajinkya Rahane, Venkatesh Iyer, Rinku Singh, Moeen Ali, Andre Russell, Ramandeep Singh, Harshit Rana, Vaibhav Arora, and Varun Chakaravarthy.Shubman Gill, B Sai Sudharsan, Jos Buttler, Sherfane Rutherford, Shahrukh Khan, Rahul Tewatia, Rashid Khan, Washington Sundar, Sai Kishore, Mohammed Siraj, and Prasidh Krishna.",Gujarat Titans face Kolkata Knight Riders in IPL 2025 on Monday. KKR captain Ajinkya Rahane won the toss and chose to bowl first. Former cricketer Danny Morrison asked GT captain Shubman Gill about his wedding plans.,"https://static.toiimg.com/thumb/msid-120490917,imgsize-120102,width-400,resizemode-4/India-IPL-Cricket.jpg"
From MS Dhoni to Digvesh Rathi: How have uncapped players fared in IPL 2025 so far?,https://timesofindia.indiatimes.com/sports/cricket/ipl/top-stories/from-ms-dhoni-to-digvesh-rathi-how-have-uncapped-players-fared-in-ipl-2025-so-far/articleshow/120452225.cms,"MS Dhoni and Digvesh Rathi (BCCI Photos)

Digvesh Rathi leads the pack of uncapped bowlers

Poll Who do you think is the most impressive uncapped bowler in IPL 2025 so far? Ashwani Kumar Vignesh Puthur Vaibhav Arora Digvesh Rathi

Bombay Sport Exchange Episode 3: Kane Williamson exclusive on NextGen cricketers to watch out for

How has MS Dhoni performed as IPL's oldest uncapped player?

NEW DELHI: As the Indian Premier League 2025 crosses its halfway mark, it's not just the superstars who have made headlines.This season has witnessed an exciting surge of uncapped players stepping into the spotlight, proving their mettle in high-pressure situations.While legends like MS Dhoni, who entered the league as an uncapped player due to a rule change, continue to draw crowds, it's the lesser-known names: Digvesh Rathi, Vaibhav Suryavanshi, and Ashwani Kumar, among others, who’ve turned heads and started carving their own legacy.Go Beyond The Boundary with our YouTube channel. SUBSCRIBE NOW! Among the uncapped bowlers, Digvesh Rathi of Lucknow Super Giants (LSG) has arguably been the most consistent.In eight matches so far, the leggie has picked up nine wickets at an economy of 7.43, a commendable rate in today’s batting-dominant format.His best of 2/30 might not be headline-grabbing, but Rathi’s control and temperament under pressure, powered by his unorthodox bowling action, have added real depth to LSG’s bowling arsenal.Close on his heels is Kolkata Knight Riders ' Vaibhav Arora, whose eight wickets in just six matches have come at a strike rate of 16.12.QUIZ: Who's that IPL player? While his economy (9.11) suggests a bit of leakage, Arora’s knack for breakthroughs has made him invaluable.Mumbai Indians' Vignesh Puthur has been a revelation in fewer opportunities: six wickets in four matches at a superb average of 15.66.However, it’s Ashwani Kumar who provided one of the most eye-catching performances of the season. He notched a four-wicket haul in his maiden league appearance, becoming the first Indian to take four wickets on IPL debut.If MI use him smartly in the latter half, he could turn into a late-season X-factor.Meanwhile, some uncapped bowlers have struggled to adapt. Simarjeet Singh, Prince Yadav, and Yash Thakur have all gone for 10-plus runs an over, with high bowling averages and minimal impact.While these young guns show promise, the pressure of the IPL spotlight is clearly a tough crucible.Another name making waves is Punjab's Priyansh Arya, who smacked a blistering 103 against Chennai Super Kings (CSK) in his fourth IPL start. Currently, he boasts a mind-boggling strike rate of over 200.With 254 runs, he’s played the aggressor’s role to perfection.Teammates Nehal Wadhera and Prabhsimran Singh have added substance to Punjab’s batting, with both showing improved shot selection and situational awareness.Abishek Porel (DC) and Amanjot Raghuvanshi (KKR) have been steady performers in the middle order, while Aniket Verma (SRH), with a strike rate of 187.05, has delivered explosive cameos that have turned matches.Asutosh Sharma has emerged as Delhi’s clutch finisher, striking at 178.94 with a cool head and a fearless blade in the death overs.However, not all uncapped batters have flourished.Naman Dhir, Ramandeep Singh, and Sameer Rizvi have had underwhelming runs, showing flashes of brilliance but lacking consistency.Even as these youngsters make their mark, MS Dhoni’s presence continues to be magnetic. Albeit, considering the 43-year-old -- who played over 500 matches for India -- qualifies as an uncapped player by a rule change, the comparisons are hardly like-for-like.On the face of it, the numbers paint a rosy picture. Batting precariously down the order, the former Indian skipper has scored 134 runs in 8 matches with a stunning strike rate of 152.27.Again, considering he's no ordinary 'uncapped' player, these are paltry returns for someone of his experience.As some of these names, such as Rathi, bring their names into a conversation for national team selection, if there's one certainty in IPL, it's that heroes can emerge from the unlikeliest corners, and maybe we can find a new one today?",Digvesh Rathi leads the pack of uncapped bowlers in IPL 2025. Ashwani Kumar is the first Indian to take four wickets on IPL debut. Priyansh Arya boasts a mind- boggling strike rate of over 200.,"https://static.toiimg.com/thumb/msid-120454763,imgsize-53878,width-400,resizemode-4/MS-Dhoni-and-Digvesh-Rathi-BCCI-Photos.jpg"
"KKR vs GT, IPL 2025: Why have Quinton de Kock and Anrich Nortje been dropped by Kolkata Knight Riders?",https://timesofindia.indiatimes.com/sports/cricket/ipl/top-stories/kkr-vs-gt-ipl-2025-why-have-quinton-de-kock-and-anrich-nortje-been-dropped-by-kolkata-knight-riders/articleshow/120489992.cms,"Kolkata: KKR's Quinton de Kock during a practice session ahead of the IPL match between Kolkata Knight Riders and Gujarat Titans, at the Eden Gardens in Kolkata. (PTI Photo/Swapan Mahapatra)

Go Beyond The Boundary with our YouTube channel.

'I take the blame': Ajinkya Rahane after KKR's defeat to Punjab Kings

Gully To Glory: Ramandeep Singh's journey from Chandigarh to Team India via KKR

Kolkata Knight Riders XI:

Gujarat Titans XI:

Kolkata Knight Riders captain Ajinkya Rahane won the toss and chose to bowl first against Gujarat Titans in match 39 of IPL 2025 at Eden Gardens on Monday, bringing in Rahmanullah Gurbaz and Moeen Ali as replacements for Quinton de Kock and Anrich Nortje.""The pitch looks on the drier side, and when we bowl we want to see how it is behaving. It is a chasing ground. We spoke after the last game. The players are working very hard. There is a motivation to go up the ladder. I am positive about all players. Not too worried about middle-order,"" said Rahane after winning the toss.KKR, seventh in the IPL points table, have been forced into making the changes following their embarrassing 95 all out show against Punjab Kings last week.De Kock, former South Africa wicketkeeper-batter, has been dropped for Gurbaz. This is Afghanistani youngster's first match of the season.After the 95 run show, they've reinforced their batting further with all-rounder Moeen Ali coming in for Anrich Nortje.Gujarat Titans, the IPL 2022 champions, currently lead the points table with five wins from seven matches. GT also hold a 2-1 advantage in head-to-head encounters against KKR.Also See: IPL Live Score, KKR vs GT GT captain Shubman Gill commented on the match conditions: ""Don't think there will be any dew. So it should be a good game. The way we have been bowling has been great. We have been contributing with wickets. The skill set that he (Rashid Khan, GT vice-captain) brings with his bowling has been great.""Rahmanullah Gurbaz, Sunil Narine, Ajinkya Rahane, Venkatesh Iyer, Rinku Singh, Moeen Ali, Andre Russell, Ramandeep Singh, Harshit Rana, Vaibhav Arora, and Varun Chakaravarthy.Impact Subs: Manish Pandey, Angkrish Raghuvanshi, Rovman Powell, Luvnith Sisodia, and Anukul Roy.Shubman Gill, B Sai Sudharsan, Jos Buttler, Sherfane Rutherford, Shahrukh Khan, Rahul Tewatia, Rashid Khan, Washington Sundar, Sai Kishore, Mohammed Siraj, and Prasidh Krishna.Impact Subs: Ishant Sharma, Mahipal Lomror, Anuj Rawat, Karim Janat, and Arshad Khan.","Kolkata Knight Riders captain Ajinkya Rahane won the toss and chose to bowl first against Gujarat Titans. Rahane brought in Rahmanullah Gurbaz and Moeen Ali as replacements for Quinton de Kock and Anrich Nortje. KKR, seventh in the IPL points table, have been forced into making the changes following their embarrassing 95 all out show against Punjab Kings last week.","https://static.toiimg.com/thumb/msid-120490089,imgsize-251798,width-400,resizemode-4/Kolkata-KKRs-Quinton-de-Kock-during-a-practice-session-ahead-of-the-IPL-match-.jpg"
Sanju Samson Injury: IPL 2025: Rajasthan Royals captain Sanju Samson to miss next match against RCB too due to injury,https://timesofindia.indiatimes.com/sports/cricket/ipl/top-stories/ipl-2025-rajasthan-royals-captain-sanju-samson-to-miss-next-match-against-rcb-too-due-to-injury/articleshow/120486427.cms,"Sanju Samson (Getty Images)

Also visit:

Go Beyond The Boundary with our YouTube channel.

Poll Will Sanju Samson's absence be felt more in batting or leadership? Neither, they can adapt Both equally More in leadership More in batting

Bombay Sport Exchange Episode 3: Kane Williamson exclusive on NextGen cricketers to watch out for

MUMBAI: In a big blow to the Rajasthan Royals , captain Sanju Samson will miss their next IPL 2025 match too, against Royal Challengers Bengaluru in Bengaluru on April 24 due to a side strain injury.The right-handed batter retired out on 31 off 19 balls against Delhi Capitals following a side issue. Samson missed RR's last match against Rishabh Pant's Lucknow Super Giant. Before that match, Royals' head coach Rahul Dravid had revealed that his side was awaiting the scan results, and Samson's participation will be decided later.In a statement on Samson’s fitness status, RR said, "" Rajasthan Royals captain Sanju Samson is currently undergoing recovery and will remain at the team’s home base with select RR medical staff. As part of his ongoing rehab process, he will not be travelling to Bangalore for the upcoming match against RCB. The team management is monitoring his progress closely and will take a game-by-game approach regarding his return to action.""Sanju sustained his injury during RR's match against Delhi Capitals. He was seen in visible pain when he attempted a cut shot off the bowling of Vipraj Nigam. The physio then checked the left side around his rib. Samson retired soon after and did not come out to bat again.""Sanju experienced a bit of pain in the abdominal area,"" head coach Rahul Dravid said on Friday. ""So we have gone for scans. He has done some scans today, so we are waiting for the results of those scans.And then once we get a bit more clarity around the scans and the severity of the injury, we'll take a decision going forward, and we'll see what happens,"" he added.Rajasthan Royals have won just two matches from eight. The side are languishing at eighth position in the standings.",Sanju Samson will miss Rajasthan Royals' next IPL match against Royal Challengers Bengaluru due to a side strain injury. The right-handed batter retired out on 31 off 19 balls against Delhi Capitals following a side issue. Samson missed RR's last match against Rishabh Pant's Lucknow Super Giant.,"https://static.toiimg.com/thumb/msid-120487305,imgsize-54712,width-400,resizemode-4/Sanju-Samson.jpg"
'Held bats before phones': Anaya Bangar meets her best friend Sarfaraz Khan after three years,https://timesofindia.indiatimes.com/sports/cricket/news/held-bats-before-phones-anaya-bangar-meets-her-best-friend-sarfaraz-khan-after-three-years/articleshow/120503097.cms,"Anaya Bangar with Sarfaraz Khan and Naushad Khan. (Instagram)

New Delhi:

Go Beyond The Boundary with our YouTube channel. SUBSCRIBE NOW!

Anaya Bangar , daughter of former India cricketer and coach Sanjay Bangar , on Tuesday paid a visit to her childhood friend Sarfaraz Khan . Sarfaraz and Anaya grew up playing cricket together in Mumbai.The 25-year-old, who publicly came out last year and shared her journey of transformation through hormone replacement therapy and gender-affirming surgery , was formerly known as Aryan. She shared photos on Instagram chilling with Sarfaraz Khan's father Naushad, brother Moin, and his toddler son.""We held bats before we held phones. Friends since the beginning. Missed you @musheerkhan.97,"" she wrote on her Instagram.Sarfaraz even posted a story for Anaya and revealed his excitement about meeting his childhood friend after a gap of three years.He said: ""Today is a very special day. It's been a year since we bought the Thar. We modified the vehicle, and this day is also very special as I am meeting my best friend Anaya Bangar after three years,"" said Sarfaraz.Last week, Anaya revealed facing harassment within the cricket world after her gender-affirming surgery. She received nude photos from cricketers and faced verbal abuse, including a proposition from a former player.“There has been support, and there has been some harassment as well,” Anaya said during an interview with Lallantop, reflecting on her journey.When asked how fellow cricketers responded after her gender-affirming surgery, Anaya said: “There have been a few cricketers who randomly sent me nude pictures of themselves.”She also shared more distressing experiences:“The person used to give gaalis (slang for abuses) in front of everybody. The same person would then come and sit beside me and ask for my photos. There was another instance when I was in India, and I told a puraane (veteran) cricketer about my situation. He told me, ‘Let’s go in the car, I want to sleep with you.’”","Anaya Bangar, daughter of former India cricketer and coach Sanjay Bangar paid a visit to her childhood friend Sarfaraz Khan. The 25-year-old publicly came out last year and shared her journey of transformation through hormone replacement therapy and gender-affirming surgery.","https://static.toiimg.com/thumb/msid-120503146,imgsize-81330,width-400,resizemode-4/Anaya-and-Sarfaraz.jpg"
IPL 2025: Kolkata Knight Riders suffer third home defeat against Gujarat Titans,https://timesofindia.indiatimes.com/sports/cricket/ipl/top-stories/ipl-2025-kolkata-knight-riders-suffer-third-home-defeat-against-gujarat-titans/articleshow/120503043.cms,"<p>KKR vs GT<br></p>

Go Beyond The Boundary with our YouTube channel. SUBSCRIBE NOW!

Kolkata: It was another case of meek surrender by Kolkata Knight Riders (KKR), who suffered back-to-back defeats as they went down to Gujarat Titans by 39 runs at the Eden Gardens here on Monday. This was the Knights’ third loss in four home matches.Table-toppers GT’s top-three batters continued to make merry as Shubman Gill, Sai Sudharsan and Jos Buttler once again got the runs to help them put up 198/3 after KKR skipper Ajinkya Rahane won the toss and elected to field.KKR’s chase never got going as they lost openers Rahmanullah Gurbaz, coming in for Quinton de Kock, and Sunil Narine early, and managed only 45/2 in the Powerplay. Both Rahane and Venkatesh Iyer found it difficult to keep the scoreboard moving.They failed to find a single boundary in 34 balls between the fifth and 11th overs. As Iyer and Rahane (50 off 36 balls) departed in quick succession, it was left to Rinku Singh and Andre Russell to find a way. However, the duo struggled against some tight bowling as KKR ended up at 159/8.Earlier, Gill and Sudharsan got off to a sedate start. With the ball not coming on to the bat in the early stages of the match, the duo concentrated on singles and converting the ones into twos. Former Knight Gill cherished his return to the Eden with a well-paced innings, accelerating after settling down.Gill missed out on what would have been a welldeserved century, falling for 90 (55 balls; 10x4, 3x6). Russell finally got the breakthrough in the 13th over by having Sudharsan caught behind by Gurbaz for 52 (36b, 4x6, 1x6). But Jos Buttler (41 not out off 23b; 8x4), who had two tons and a fifty from seven innings at the Eden, picked up from where he left in the last match against Delhi Capitals, in which he had scored an unbeaten 97, hitting Russell for three consecutive boundaries.The Englishman was dropped on 17 by Vaibhav Arora, who failed to latch on to a skier running backward at mid-off. But with the platform well set to go for big shots, Buttler continued to play his strokes, including his signature reverse sweep, hitting Rana for two boundaries as GT reached 150 in 15.5 overs.With none of the KKR bowlers succeeding in creating an impression, GT batters stepped on the gas, getting 81 runs in the seven overs between 7th and 13th. The Buttler-Gill duo raced to 50 runs off 31 balls before Gill perished to a well-judged catch by Rinku Singh at mid-wicket off Arora. Buttler’s love affair with the Eden continued as he helped GT score 59 runs off the last five overs.","Gujarat Titans beat Kolkata Knight Riders by 39 runs at the Eden Gardens. Table- toppers put up 198/3 after KKR skipper Ajinkya Rahane won the toss and elected to field. KKR’s chase never got going as they lost openers Rahmanullah Gurbaz, Quinton de Kock, and Sunil Narine early.","https://static.toiimg.com/thumb/msid-120502998,imgsize-148056,width-400,resizemode-4/KKR-vs-GT.jpg"
"IPL 2025: CAB requests removal of Harsha Bhogle, Simon Doull from commentating on KKR home matches",https://timesofindia.indiatimes.com/sports/cricket/ipl/top-stories/ipl-2025-cab-requests-removal-of-harsha-bhogle-simon-doull-from-commentating-on-kkr-home-matches/articleshow/120492757.cms,"Cricket commentators Harsha Bhogle (L) and Simon Doull (R).

Go Beyond The Boundary with our YouTube channel.

Shah Rukh Khan: The superstar who turned IPL into a blockbuster

Poll What do you think about the pitch conditions at Eden Gardens for KKR? Favours the opposition Balanced for both teams Not suitable for spinners

The Cricket Association of Bengal has requested BCCI to remove commentators Harsha Bhogle and Simon Doull from Kolkata Knight Riders' home matches after they publicly criticised the Eden Gardens curator. The controversy emerged when Doull suggested KKR should relocate if they don't get spin-friendly tracks, while Bhogle supported the team's right to home advantage during a panel discussion following KKR's losses in two of their first three home games.CAB secretary Naresh Ojha sent a formal complaint to BCCI about ten days ago seeking their removal from the commentary panel for home games.Neither Bhogle nor Doull were present for commentary during Monday's KKR versus Gujarat Titans match, though sources close to Bhogle claimed he wasn't scheduled for any KKR games.""Bhogle and Doull are no longer part of the IPL commentary team for KKR's home matches. However, the situation might change when Eden hosts the Qualifier 2 and the Final on May 23 and 25,"" a CAB official told PTI.The controversy intensified after KKR's team management expressed disappointment over pitch conditions. Both captain Ajinkya Rahane and head coach Chandrakant Pandit were unhappy about not getting spin-friendly tracks.After KKR's loss to Lucknow Super Giants in a high-scoring game, Rahane expressed his frustration at the post-match press conference, stating, ""There was no help for the spinners, let me make that clear,"" and suggested further comments could create controversy.During the expert panel discussion, Doull had strongly criticised the curator's stance: ""If he (the curator) is not taking heed of what the home team wants... they are paying the stadium fees, they are paying for what's going on in the IPL. If he's still not listening, then just move the franchise away. His job is not to pass an opinion on the game. That's not what he's paid for.""Bhogle supported this view, saying: ""If they are playing at home, they should get the kind of tracks that suit their bowlers. I saw something about what the KKR curator has said.""The KKR management had reportedly requested surfaces favouring their spin bowlers Varun Chakravarthy, Sunil Narine, and Moeen Ali.CAB has defended their curator Sujan Mukherjee, stating he has followed BCCI guidelines which prohibit franchises from influencing pitch preparation.In the match against LSG that sparked the controversy, LSG posted 238/3 while KKR managed 234/7 in response.CAB president Snehasish Ganguly and secretary Naresh Ojha were unavailable for comments on the matter.",CAB has requested BCCI to remove commentators Harsha Bhogle and Simon Doull from Kolkata Knight Riders' home matches. The controversy emerged when Doull suggested KKR should relocate if they don't get spin-friendly tracks. Bhogle supported the team's right to home advantage during a panel discussion.,"https://static.toiimg.com/thumb/msid-120492978,imgsize-64406,width-400,resizemode-4/Simon-Doull.jpg"
