Article Title,Article Link,Article Text,Article Summary,Article Image
Meet Sporting manager Emily Holloway: The woman powering Formula E behind the scenes,https://timesofindia.indiatimes.com/sports/formula-e/meet-sporting-manager-emily-holloway-the-woman-powering-formula-e-behind-the-scenes/articleshow/120481433.cms,"How

Emily Holloway

made it to Formula E

Formula E is all about high-speed electric cars driven by fearless racers, backed every moment by a skilled team of engineers. But behind the scenes, there's a woman orchestrating it all—ensuring seamless communication between the teams and Formula E departments, dashing from one task to another to keep everything on schedule, overseeing Race Control, track safety, and handling countless other responsibilities that make the motorsport such a spectacular event.""The camaraderie and shared dedication are what I love most about my job. Motorsport can be demanding, but we always pull together,” she says about her work. Emily didn’t land straight into Formula E’s sporting team; instead, she explored various roles on her journey to becoming a Sporting Manager. A sports enthusiast with a love for travel, she moved from working in a rugby stadium to the Formula 1 hospitality team, then to Formula E’s catering team, before finally finding her place where she is today.Emily carved her own space in a predominantly male environment—among engineers and operational staff—not by chance, but by consistently proving her leadership and management skills from day one.She considers the Rome E-Prix in Season 4 her biggest milestone to date. In just one month, she pulled off a mammoth task: managing hospitality for 1300 guests under intense pressure and many sleepless nights. She told Formula E’s Girls on Track how the appreciation she received after the event made every moment worth it.Motorsport, and Formula E in particular, is still evolving when it comes to embracing more women in its workforce. When asked what it takes to land a role like hers, Emily shared with FIAFormulae.com, “Network and connect. Don't be afraid to put yourself out there. Your enthusiasm and can-do attitude will make you stand out. And always be prepared to go the extra mile.""Right now, Emily is likely focused on the upcoming double-header race in Monaco, scheduled to take place in motorsport’s dream destination on May 3 and 4.Also Read: Miami E-Prix wrapped: 11 more Formula E races lined up over the next 3 months, here's the full calendar",Emily Holloway is the Sporting Manager of Formula E's hospitality team. She says the camaraderie and shared dedication are what she loves most about her job. The Monaco double-header race is scheduled to take place on May 3 and 4. Emily says the appreciation she received after the event made every moment worth it.,"https://static.toiimg.com/thumb/msid-120481368,imgsize-594030,width-400,resizemode-4/Image-credit-Emily-Holloway/LinkedIn.jpg"
Lucas Di Grassi’s podium at Miami E-Prix was an emotional moment: “You need to have lot of discipline to be able to work when you have bad results”,https://timesofindia.indiatimes.com/sports/formula-e/lucas-di-grassis-podium-at-miami-e-prix-was-an-emotional-moment-you-need-to-have-lot-of-discipline-to-be-able-to-work-when-you-have-bad-results/articleshow/120478349.cms,"Lucas Di Grassi ’s podium finish at the Miami E-Prix wasn’t something he or his team, Lola Yamaha ABT , had expected. Overwhelmed with emotion, Di Grassi was heard screaming with excitement in the car as it crossed the finish line and headed to the paddock. His family also joined him on the podium to share the special moment.Lucas Di Grassi opens up on his long journey to podiumLucas Di Grassi had not scored a podium in the last two years with Lola Yamaha ABT, and he expressed the frustration that had been building up during that time, as his hard work wasn’t translating into results. His last podium came in Season 9, when he was part of Mahindra Racing.The 40-year-old shared his journey to the podium after the win. He said, “It’s very hard to start the project from zero so in the four races, I had four critical problems that pretty much didn’t allow me to finish the race. So I was like, it’s extremely (tough), you need to have a lot of discipline to be able to continue the work and continue to push when you have bad results.”“When you have good results, it’s very easy. But when you have bad results, to go back home, keep the focus, keep the head down and keep doing the work that you do that at one point it’s going to pay off. It’s hard because you work, it doesn’t. Then you work again, it doesn’t pay off again. And then you keep working until it pays off. And today was a day it paid off. So I am very happy.”It was also emotional to see Di Grassi’s wife, Bianca Diniz Caloi, and their young children standing alongside him on the podium as they popped the champagne. Buzzing with confidence, the driver is now aiming to keep the momentum going at the next race in Monaco. The double-header is scheduled for May 3 and 4.Di Grassi was promoted to second place after a series of post-race penalties altered the fate of several drivers who had finished ahead of him, including the original winner, Norman Nato. As Pascal Wehrlein was declared the official winner, Di Grassi was moved up to second place.Also Read: Lucas Di Grassi on Lola Yamaha ABT's second-place finish at the Miami E-Prix: ""It's a very special podium for many reasons”","Lucas Di Grassi had not scored a podium in the last two years with Lola Yamaha ABT. His last podium came in Season 9, when he was part of Mahindra Racing. The 40-year-old shared his journey to the podium after the win at the Miami E-Prix.","https://static.toiimg.com/thumb/msid-120478330,imgsize-1022783,width-400,resizemode-4/Image-credit-Lucas-Di-Grassi/Instagram.jpg"
Andretti’s Nico Mueller and race engineer Bertrand Mermine top ABB Engineered to Outrun Leaderboard at Miami E-Prix,https://timesofindia.indiatimes.com/sports/formula-e/andrettis-nico-mueller-and-race-engineer-bertrand-mermine-top-abb-engineered-to-outrun-leaderboard-at-miami-e-prix/articleshow/120412856.cms,"Here’s ABB Engineered to Outrun leaderboard for Miami Grand Prix

How Nico Mueller secured the top spot

Andretti driver Nico Mueller and his race engineer Bertrand Mermine have surged to the top of the ABB Engineered to Outrun leaderboard following a dramatic Miami Grand Prix, where post-race penalties reshuffled the final standings in Mueller’s favour. Though he originally crossed the line in 10th, Mueller was promoted to 4th, thanks to a well-timed strategy and a dash of late-race chaos. His calculated decision to split Attack Mode usage proved decisive, paying off when several drivers were hit with time penalties after the chequered flag.The Engineered to Outrun leaderboard celebrates the most dynamic driver-engineer duos in Formula E—tracking those who gain the most positions during a race, with emphasis on overtaking prowess, energy management, and overall race pace. The season concludes with an award for the top-ranked pairing.After Round 5 in Miami, the leaderboard has Maserati MSG Racing’s Stoffel Vandoorne and his race engineer Thibault Arnal on number 2. Mahindra Racing’s Nyck De Vries and race engineer Tom Bayles are in third position in the ABB Engineered to Outrun leaderboard.The FIA Formula E Instagram account also shared the update, posting:“@nico.mueller51 overtaking his way up the rankings! With a mega drive from P18 to P4, the @andrettife driver tops the @abbgroup Engineered to Outrun leaderboard after Round 5. #MiamiEPrix #FormulaE #Motorsport #Racing.”Nico Mueller’s rise was the result of strategy combined with fortunate timing. While many drivers delayed activating Attack Mode until later in the race, Mueller opted for a more aggressive strategy—using two four-minute activations, starting with the first on Lap 11 to position himself within points range.By Lap 20, Mueller was running in 10th when a red flag was brought out following a three-car collision. After the restart, as the majority of the grid scrambled to use their remaining Attack Mode activations, Mueller’s earlier strategy gave him an edge.Despite finishing 10th on the road, he was ultimately classified 4th after multiple post-race penalties were issued. Drivers including Norman Nato, Robin Frijns, Oliver Rowland, Sam Bird, and Taylor Barnard were penalized 10 seconds each for misuse of Attack Mode, while Nick Cassidy received a five-second penalty for exceeding track limits.Also Read: Formula E Miami E-Prix 2025: Jake Hughes crashes at chicane, here’s how the multi-car collision changed the outcome. Watch","Andretti driver Nico Mueller and his race engineer Bertrand Mermine have surged to the top of the ABB Engineered to Outrun leaderboard following a dramatic Miami Grand Prix. Though he originally crossed the line in 10th, Mueller was promoted to 4th thanks to a well-timed strategy and a dash of late-race chaos.","https://static.toiimg.com/thumb/msid-120412853,imgsize-662520,width-400,resizemode-4/Image-credit-Nico-Mueller/Instagram.jpg"
Taylor Barnard shares first reaction after almost coming last at Miami E-Prix: “Time to turn our attention to streets of Monaco”,https://timesofindia.indiatimes.com/sports/formula-e/taylor-barnard-shares-first-reaction-after-almost-coming-last-at-miami-e-prix-time-to-turn-our-attention-to-streets-of-monaco/articleshow/120412662.cms,"Taylor Barnard reacts after disappointing Miami E-Prix

Taylor Barnard is the youngest Formula E driver to participate in the ongoing FIA Formula E World Championship. Things were very different for the NEOM McLaren driver in Miami. He topped the second free practice session but ended up 11th in qualifying. Things got worse when he finished 20th in the Miami E-Prix final race. He has now penned an Instagram post reflecting on his experience in Miami.Taking to Instagram three days after the race, Taylor Barnard shared a picture from the event. He wrote along with it, “It’s no secret that the final result in Miami wasn’t what we were hoping for as a team, but we take away plenty of positives from the overall performance shown across the weekend. Thank you to all the fans who came out and showed support! Time to turn our attention to the double-header on the streets of Monaco.” He also added a bicep emoji with the post.Barnard’s fans were quick to praise him for his efforts. One fan reacted, “You're one of the best drivers. Just keep your head up and everything will be okay.” Another said, “Excellent performance from birdy p19 to p5 what a great race again to be overshadowed by penalties.” One more commented, “It's ok Taylor, we learn and we move on. Onto the next one, let's keep pushing. We want to see you smile again on the podium.” An encouraging comment also read: “Not end of the season yet, let’s get ittt!”Taylor Barnard is 20 and began racing in Formula E at 19, becoming the youngest driver in the sustainable motorsport. Before the Miami race, he had shared a video from a candid interview in which he was asked questions about his fellow Formula E drivers. He had happily named himself when asked to name the youngest driver in Formula E.As the youngest in the field, Barnard currently holds the records for being the youngest driver to debut in Formula E, the youngest point scorer, youngest podium finisher, youngest pole sitter, and youngest driver to lead a lap.Also Read: Miami E-Prix 2025 results: Pascal Wehrlein wins Formula E Round 5 after Nato Norman loses first place due to penalty",Taylor Barnard is the youngest Formula E driver to participate in the ongoing FIA Formula E World Championship. The NEOM McLaren driver finished 20th in the Miami E-Prix final race. He has now penned an Instagram post reflecting on his experience in Miami.,"https://static.toiimg.com/thumb/msid-120412766,imgsize-596159,width-400,resizemode-4/Image-credit-Taylor-Barnard/Instagram.jpg"
"Following Miami E-Prix setback, Formula E driver Norman Nato gears up for Endurance race in Italy, greets fans with ""Buongiorno""",https://timesofindia.indiatimes.com/sports/formula-e/following-miami-e-prix-setback-formula-e-driver-norman-nato-gears-up-for-endurance-race-in-italy-greets-fans-with-buongiorno/articleshow/120374738.cms,"What happened at Miami E-Prix

Norman Nato to participate in World Endurance Championship race

After a heart-breaking end at the Miami E-Prix , Norman Nato of Nissan has reached Italy to participate in the FIA Endurance Championship . He will compete in the 6 Hours of Imola race. The French driver takes part in both kinds of races. He drives Nissan’s electric car in the Formula E World Championship and represents Cadillac Hertz Team Jota in the World Endurance Championship in the Hypercar category.Norman Nato was the first to cross the finish line at the recently held Miami E-Prix and could have even lifted the trophy had the results not undergone a massive reshuffling due to penalties. He faced a penalty for misuse of the Attack Mode and was disqualified from the race, while Pascal Wehrlein of TAG Heuer Porsche was declared the winner. However, the decision was soon changed, with Nato being pushed back to sixth position, bringing a slight breather for the Nissan driver.Nato had been missing from the scene ever since the terrible fate he suffered at the iconic Homestead-Miami Speedway. Taking to his Instagram Stories on Wednesday, he simply shared the schedule of the World Endurance Championship race in Imola, named 6 Hours of Imola. It’s the second race of the season. Nato finished in eighth position in the first race, the Qatar 1812 km.The 6 Hours of Imola is a three-day event, with the first two free practice sessions lined up on Thursday, April 18. The third free practice session will be followed by Qualifying and the Hyperpole on Friday, April 19. The main race is on Saturday, April 20.Nato also wished his fans good morning in Italian while sharing a picture of a serene location along with Italian flag emoji. “Boungiorno,” he captioned the picture.Coming back to Formula E, Norman Nato will try to fix things at Round 6 of the Formula E World Championship. The double-header is scheduled in Monaco on May 3 and May 4. According to a Fulloversteer.com report published last year, Nato is expected to skip the Berlin double header (Formula E Championship Round 13 and 14) on July 12-13 as it clashes with the Six Hours of Sao Paulo in the World Endurance Championship.Also Read: Miami E-Prix 2025 results: Pascal Wehrlein wins Formula E Round 5 after Nato Norman loses first place due to penalty","Norman Nato has reached Italy to participate in the FIA Endurance Championship. The French driver will compete in the 6 Hours of Imola race. Nato finished in eighth position in the first race of the season, the Qatar 1812 km. Nato is expected to skip the Berlin double header (Formula E Championship Round 13 and 14)","https://static.toiimg.com/thumb/msid-120374734,imgsize-662670,width-400,resizemode-4/Image-credit-Norman-Nato/Instagram.jpg"
Formula E CEO Jeff Dodds shares memorable moments from Miami E-Prix: “It came down to the final few laps and a masterclass from Porsche”,https://timesofindia.indiatimes.com/sports/formula-e/formula-e-ceo-jeff-dodds-shares-memorable-moments-from-miami-e-prix-it-came-down-to-the-final-few-laps-and-a-masterclass-from-porsche/articleshow/120374521.cms,"Jeff Dodds on the Miami E-Prix

FIA Formula E CEO Jeff Dodds was recently in Florida for the Miami E-Prix as the sustainable motorsport returned to the city after a decade. The race was held at the iconic Homestead-Miami Speedway and ended with very unpredictable results. After the race, Dodds took to Instagram to update his fans with some happy pictures from the event and appreciate the drivers who got to the podium amid much chaos and confusion.At the Miami E-Prix, the TAG Heuer Porsche driver Pascal Wehrlein was declared the winner, his teammate Antonio Felix da Costa took the third spot on the podium. Lola Yamaha ABT’s Lucas di Grassi was the second runner-up.Dodds penned down a special post to sum up the Miami E–Prix and share a word for the winners. He shared a montage of pictures from Miami and wrote, “What a week in Miami! After a 10 year hiatus from racing in Miami it reminds just how much we love this city and how far we’ve come as a series on putting on world-class events. As usual, it came down to the final few laps and a masterclass from Porsche for getting both their drivers on the podium! A special mention must also go to @lucasdigrassi and Lola Yamaha ABT for their first podium in their current team configuration, reminding us why he’s one of the greats of this championship.”Former Haas principal turned F1 analyst Guenther Steiner also attended the eventful Formula E race in Miami. Dodds also shared a picture with him on Instagram along with the caption: “Great fun today with @lifeofsteiner - great to have him here at the Miami E Prix.”More about Jeff Dodds’s vision for Formula ELast month, Jeff Dodds was named the UN Champion for the Energy Global Compact, a role that underscores Formula E’s dedication to driving meaningful change.Dodds has played a big role in making Formula E a known motorsport with an ever-increasing fanbase. Talking about the all-new Formula E car, he had said in an interview with Motorsport Week a few months ago, “This car on the track now [GEN3 Evo] is the fastest single-seater motor car in any FIA championship, and in two years’ time, it’s a whole new car, Generation 4, so there’s loads of stuff in the pipeline. More broadcast deals with big, successful broadcasters around the world. More digital disruption, more social activity, higher-profile drivers.”Formula E will now move to Monaco for Round 6. The double header is scheduled for May 3 and 4.Also Read: Antonio Felix Da Costa has his eyes on Monaco after the Miami E-Prix: “This is really looking good”",FIA Formula E CEO Jeff Dodds was recently in Florida for the Miami E-Prix. The race was held at the iconic Homestead-Miami Speedway. TAG Heuer Porsche driver Pascal Wehrlein was declared the winner. Lola Yamaha ABT’s Lucas di Grassi was the second runner-up.,"https://static.toiimg.com/thumb/msid-120374503,imgsize-831632,width-400,resizemode-4/Jeff-Dodds-left-with-Guenther-Steiner-Image-credit-Jeff-Dodds/Instagram.jpg"
"Lucas Di Grassi on Lola Yamaha ABT's second-place finish at the Miami E-Prix: ""It's a very special podium for many reasons""",https://timesofindia.indiatimes.com/sports/formula-e/lucas-di-grassi-on-lola-yamaha-abts-second-place-finish-at-the-miami-e-prix-its-a-very-special-podium-for-many-reasons/articleshow/120330171.cms,"The Miami E-Prix was full of surprises for some and disappointments for many. The race at the Homestead-Miami Speedway turned out to be almost shocking when Nissan’s Norman Nato lost despite crossing the finish line first, but it turned out to be a pleasant surprise for Lucas di Grassi ’s Lola Yamaha ABT , which went on to secure a rare podium at the race on Saturday. He took the second spot on the podium after qualifying seventh. Pascal Wehrlein stood first, and António Félix Da Costa of Tag Heuer Porsche finished third.Lucas di Grassi gets a rare podium for Lola Yamaha ABTSharing his happiness after the podium finish at Miami, di Grassi said, as per Fiaformulae.com, “It's a very special podium for many reasons. I haven’t been in a competitive car for the last three seasons. It's rough to keep the motivation up, knowing that sometimes you don't have the most competitive car, but I just tried to keep my head down and do the work the best I can.”Lola Yamaha ABT has been around the corner for quite a long time but has only managed to add 14 wins and 48 podium finishes in 119 races. Things turned even more discouraging when Nico Muller switched to Andretti after playing a prominent role in making the team count. In Miami, the team was represented by Lucas di Grassi and rookie Zane Maloney, but they weren’t expecting much after failing to gain any points in the first four races.Miami was not a predictable track for the drivers, as the Formula E race returned to the circuit after a decade. The first-ever Formula E race was held at the venue. But Lucas di Grassi was no newcomer and can safely be called a veteran. He had played a crucial role in the early years of Formula E and contributed to sustainable motorsport by being a test driver for electric cars.Also Read: Miami E-Prix 2025 results: Pascal Wehrlein wins Formula E Round 5 after Nato Norman loses first place due to penalty Di Grassi had started in Formula E racing with ABT Sportsline in 2014 but tried his luck with other teams like ROKiT Venturi Racing and Mahindra Racing for a brief period before returning to ABT in 2024. While he had made a podium finish for Mahindra Racing in Formula E Season 9, he had been facing a podium drought for two years. Thankfully, he ended the Miami trip on a good note!",Lucas di Grassi gets a rare podium for Lola Yamaha ABT at the Miami E-Prix. He had been facing a podium drought for two years. Di Grassi had started in Formula E racing with ABT Sportsline in 2014.,"https://static.toiimg.com/thumb/msid-120330156,imgsize-824342,width-400,resizemode-4/Image-credit-Lucas-Di-Grassi/Instagram.jpg"
Antonio Felix Da Costa has his eyes on Monaco after the Miami E-Prix: “This is really looking good”,https://timesofindia.indiatimes.com/sports/formula-e/antonio-felix-da-costa-has-his-eyes-on-monaco-after-the-miami-e-prix-this-is-really-looking-good/articleshow/120330105.cms,"The Miami E-Prix was dominated by TAG Heuer Porsche drivers, who secured two of the three podium spots. While Pascal Wehrlein claimed the win, Antonio Felix Da Costa finished strong in third place. The Saturday race held extra significance for Felix Da Costa, marking his debut outing in Miami as Formula E returned to the city after a decade. Now, the 33-year-old driver sets his sights on more standout moments at the upcoming race in Monaco.Antonio Felix Da Costa expresses his happiness on InstagramAntonio Felix Da Costa celebrated the moment with his fans on Instagram. He shared a photo of himself holding the trophy. Alongside it, he wrote in Portuguese (translated to English), “We had a perfect race, but when it's not meant to be, it's not. I really thought yesterday's victory was in the bag, but that's just how sports and racing are. We moved up to second place and got a podium. The next race is in Monaco, let's go get revenge, because this is really looking good. (bicep emoji).”In a separate post, the 33-year-old added, “Aaaahhrggggg, this was ours! It was in our pocket but for the second time this season a safety car ruined our party. It ended up on the podium anyway, P3 and closer to the championship lead!”Sports commentator Toni Cowan-Brown reacted to his post, writing, “This seriously was yours - great though to have you on the podium nonetheless,” along with clapping emojis. Content creator James Coker chimed in, “Big congrats on another podium, DAC!”—to which Felix Da Costa responded, “Lezgo.”A fan added, “You did everything right and we are all proud of you! You’re in the championship fight and when you win again it will be worth it! Let’s DAC attack in Monaco.” Another supporter commented, “It's not over until it's Over, VENHA MÓNACO!!!”Also Read: Miami E-Prix 2025 results: Pascal Wehrlein wins Formula E Round 5 after Nato Norman loses first place due to penalty The day before the race, Felix Da Costa made the most of his time in Miami by heading to the beach. Wearing a cream co-ord set and carrying his team helmet, the Portuguese driver soaked up the sun while posing by the shore. Though he’s also an avid surfer, it seems he skipped the waves this time—likely saving his energy for race day.",Antonio Felix Da Costa finished third at the Miami E-Prix on Saturday. The race marked his debut in Miami as Formula E returned to the city after a decade. The 33-year-old shared a photo of himself holding the trophy with his fans.,"https://static.toiimg.com/thumb/msid-120330100,imgsize-625434,width-400,resizemode-4/Image-credit-Antonio-Felix-Da-Costa/Instagram.jpg"
