Article Title,Article Link,Article Text,Article Summary,Article Image
"IPL match today, LSG vs DC: Team prediction, head-to-head, Ekana pitch report, Lucknow weather update",https://timesofindia.indiatimes.com/sports/cricket/ipl/top-stories/ipl-match-today-lsg-vs-dc-team-prediction-head-to-head-ekana-pitch-report-lucknow-weather-update/articleshow/120502532.cms,"Lucknow: Lucknow Super Giants' captain Rishabh Pant plays a shot during an Indian Premier League (IPL) 2025 T20 cricket match between Lucknow Super Giants and Chennai Super Kings, at Bharat Ratna Shri Atal Bihari Vajpayee Ekana Cricket Stadium, in Lucknow. (PTI Photo/Atul Yadav) (

LSG vs DC

: Pitch Report

LSG vs DC: Predicted Playing XIs

LSG Impact Sub:

DC Predicted XI:

Impact Sub:

LSG vs DC: Head-to-Head

Total Matches Played:

LSG won:

DC Won:

LSG vs DC: Weather Report

LSG vs DC: Livestreaming details

LSG vs DC: Squads

Lucknow Super Giants:

Delhi Capitals:

Rishabh Pant-led Lucknow Super Giants (LSG) will lock horns against Axar Patel 's Delhi Capitals (DC) in match No 40 of the Indian Premier League (IPL) at the Bharat Ratna Shri Atal Bihari Vajpayee Ekana Cricket Stadium in Lucknow.With five wins in seven games, DC are placed at the second place on the points table, whereas LSG are at fifth position with 10 points in eight games.For Lucknow the poor form of their captain Rishabh Pant is a big worry. He has merely 106 runs from eight games and 63 of those came in a single match. His strike-rate of 98 is also a tad worrisome.On the other hand, Axar too will have some concerns about their skipper -- Axar Patel. Axar has led well and made 140 runs at a strike-rate of 159, but those improvements have masked his diminishing returns as a bowler -- just a solitary wicket from seven matches at an economy of 9.36.This season, LSG have played four matches at home, two each on black and red soil surfaces, respectively. The black soil pitches have favoured the team’s strengths and brought two victories, while the team has lost both matches played on the red soil pitch, which will be used for Tuesday’s game. Rishabh Pant and Co. will be keeping their fingers crossed heading into this one.LSG predicted XI: Aiden Markram, Mitchell Marsh, Nicholas Pooran, Rishabh Pant (c & wk), Ayush Badoni, David Miller, Abdul Samad, Shardul Thakur, Avesh Khan, Ravi Bishnoi, Prince YadavDigvesh RathiAbhishek Porel, KL Rahul (wk), Karun Nair, Axar Patel (c), Tristan Stubbs, Ashutosh Sharma, Vipraj Nigam, Mitchell Starc, Kuldeep Yadav, Mohit Sharma, Mukesh KumarDonovan FerreiraAccuWeather forecasts a temperature drop from 36°C at the start of the match to 29°C by the end, with no rain expected.Catch the match between LSG vs DC on the Star Sports Network on TV, with livestreaming available on JioHotstar from 7:30 PM IST onwards.Rishabh Pant (wk/captain), Aiden Markram, Mitchell Marsh, Nicholas Pooran, Ayush Badoni, Abdul Samad, David Miller, Shardul Thakur, Avesh Khan, Akash Deep, Digvesh Singh Rathi, Ravi Bishnoi, Prince Yadav, Shahbaz Ahmed, Matthew Breetzke, Himmat Singh, Shamar Joseph, Manimaran Siddharth, Aryan Juyal, RS Hangargekar, Yuvraj Chaudhary, Akash Maharaj Singh, Mayank Yadav, Arshin Kulkarni.Axar Patel (c), Jake Fraser-McGurk, Abishek Porel, Karun Nair, KL Rahul(w), Tristan Stubbs, Ashutosh Sharma, Vipraj Nigam, Mitchell Starc, Kuldeep Yadav, Mohit Sharma, Mukesh Kumar, Sameer Rizvi, Darshan Nalkande, Donovan Ferreira, Tripurana Vijay, Dushmantha Chameera, Faf du Plessis, T Natarajan, Ajay Jadav Mandal, Manvanth Kumar L, Madhav Tiwari.","Lucknow Super Giants (LSG) take on Delhi Capitals (DC) in match No 40 of the Indian Premier League (IPL) at the Bharat Ratna Shri Atal Bihari Vajpayee Ekana Cricket Stadium in Lucknow. LSG are fifth on the points table with 10 points in eight games, while DC are second with five wins in seven games. Lucknow have played four matches at home, two each on black and red soil surfaces.","https://static.toiimg.com/thumb/msid-120502582,imgsize-164698,width-400,resizemode-4/Lucknow-Lucknow-Super-Giants-captain-Rishabh-Pant-plays-a-shot-during-an-India-.jpg"
"Sanju Samson’s absence, captaincy gamble haunt Rajasthan Royals’ IPL 2025 campaign",https://timesofindia.indiatimes.com/sports/cricket/ipl/top-stories/samsons-absence-captaincy-gamble-haunt-rajasthan-royals-ipl-2025-campaign/articleshow/120502520.cms,"Rajasthan Royals are facing a challenging IPL-2025 season. Sanju Samson's early injury and subsequent absence forced Riyan Parag to step in as captain, a decision that has drawn criticism due to the team's underwhelming performance. Parag's captaincy record stands at one win in four matches. Samson will miss the upcoming game against RCB as he recovers from an abdominal injury.",Riyan Parag's captaincy record stands at one win in four matches. Sanju Samson will miss the upcoming game against RCB as he recovers from an abdominal injury. Rajasthan Royals are facing a challenging IPL-2025 season.,"https://static.toiimg.com/thumb/msid-120502865,imgsize-60840,width-400,resizemode-4/Rajasthan-Royals.jpg"
KKR Vs GT Highlights: IPL 2025: Shubman Gill-Sai Sudharsan stand sets up Gujarat Titans' win as Kolkata Knight Riders falter on slow Eden track,https://timesofindia.indiatimes.com/sports/cricket/ipl/top-stories/ipl-2025-shubman-gill-sai-sudharsan-stand-sets-up-gujarat-titans-win-as-kolkata-knight-riders-falter-on-slow-eden-track/articleshow/120494595.cms,"Shubman Gill and Sai Sudharsan (Pic credit: IPL)

Go Beyond The Boundary with our YouTube channel.

Poll Who was the standout player for Gujarat Titans in the match against Kolkata Knight Riders? Rashid Khan Jos Buttler Sai Sudharsan Shubman Gill

Shah Rukh Khan: The superstar who turned IPL into a blockbuster

NEW DELHI: A commanding 114-run opening stand between skipper Shubman Gill and Sai Sudharsan on a sluggish Eden Gardens surface proved decisive as Gujarat Titans outclassed Kolkata Knight Riders by 39 runs in their IPL clash on Monday.Sent in to bat on a pitch described as “really slow” by both captains, Gill and Sudharsan played with patience and precision, blunting any early advantage KKR hoped to gain after opting to bowl. The Titans posted a competitive 198/3, hitting just five sixes in their innings but making smart use of gaps and strike rotation.Gill, who looked set for his first hundred of the season, fell for a sublime 90 off 55 balls (10 fours, 3 sixes), while Sudharsan continued his consistent form with 52 off 36. Jos Buttler, fresh from his last match heroics, remained unbeaten on 41 from 23 balls, surprisingly not hitting a single six but crunching eight boundaries.The target of 199 proved well beyond KKR’s reach as they were restricted to 159/8. The loss was their fifth in eight matches, leaving them languishing in seventh place. Titans, meanwhile, stayed at the top with 12 points from eight games. Ajinkya Rahane , leading KKR, top-scored with 50 off 36 but lacked support. Rahmanullah Gurbaz fell in the opening over to Mohammed Siraj, and the hosts never recovered. GT’s spinners then tightened the screws — Rashid Khan (2/25), Sai Kishore (1/19), and Washington Sundar (1/36) all struck at key intervals.Post-match, Rahane acknowledged the Titans’ strong start. “I thought 199 was chaseable. We came back into the game well with the ball, but our batting let us down again. We’ve struggled to get solid starts, and that’s something we need to improve quickly,” he said.He added, “The pitch was slow, but 200 was still gettable. It’s about being brave with the bat — you can’t think about getting out. We need to back ourselves, especially in the middle overs.”Purple Cap holder Prasidh Krishna (2/25) and veteran Ishant Sharma (1/18) ensured KKR had no late surge, sealing another clinical win for the Titans.","Gujarat Titans beat Kolkata Knight Riders by 39 runs in IPL clash. Shubman Gill and Sai Sudharsan put on 114-run opening stand. Titans posted 198-3, with Ajinkya Rahane top scoring with 50. KKR were restricted to 159-8, their fifth loss in eight matches.","https://static.toiimg.com/thumb/msid-120494705,imgsize-68704,width-400,resizemode-4/GT-beat-KKR.jpg"
'You can't be complacent or relax': Former Australian captain on Rohit Sharma wanting to play on for India,https://timesofindia.indiatimes.com/sports/cricket/news/you-cant-be-complacent-or-relax-former-australian-captain-on-rohit-sharma-wanting-to-play-on-for-india/articleshow/120493143.cms,"Rohit Sharma (X Photo)

Go Beyond The Boundary with our YouTube channel.

India win Champions Trophy title; Rohit Sharma confirms he's not retiring

Poll Should Rohit Sharma continue as captain of the Indian cricket team? No, it's time for a change. Yes, he should continue.

IND vs AUS: Rohit Sharma has had a terrible time with the bat in whites

Australian cricket legend Steve Waugh has advised Indian captain Rohit Sharma to reflect on his future in cricket, particularly regarding his leadership role ahead of India's upcoming Test series against England in June. Waugh emphasised that Rohit, who turns 38 this month, must make his own decision about continuing as captain while also expressing concerns about protecting Test cricket amid the growing popularity of T20 leagues .Waugh believes the decision about leading India must come from Rohit himself, especially considering his recent performance struggles.""It is totally up to him. He is the only one who can solve that problem. He has got to look himself in the mirror and say, do I still want to be captain or play for India? Am I committed?"" Waugh, a member of the Laureus World Sports Academy , said.""Am I putting enough time and effort into it? It is a privilege and an honour to play for your country. You can't be complacent or relax,"" he added.Rohit's recent form has been concerning, with poor performances in Test series against Bangladesh, New Zealand, and Australia. He notably opted out of the Sydney Test due to poor form during India's 1-3 series loss earlier this year in the Border-Gavaskar Trophy.Waugh also addressed the future of Test cricket, stressing on its importance despite T20's rising popularity.""There is stress on Test cricket, whether it will survive because we need it as a sport. T20 cricket is amazing, great for players and spectators and great for sponsors but I still think Test cricket is the very essence of cricket. The players I believe still want to play Tests to see how good they can actually be. It's the ultimate contest. Making sure that it survives and thrives and is healthy is really important,"" Waugh explained.Regarding criticism about South Africa's World Test Championship qualification despite playing fewer matches, Waugh defended the current system.""There's always complaints. In Champions Trophy, India played a neutral ground in Dubai and people complained about that. You have to do what you can to make things happen. It's not a perfect situation. Some countries play a lot of Test matches, some don't play many. South Africa probably didn't play as many as other countries. They were pretty successful in what they did. I believe the two best Test playing countries are lining up in the final,"" he stated.Waugh opposed the proposed two-tier system for Test cricket.""I don't like two tier, It weakens whoever's in the second tier not playing vs strong sides, they're not going to be able to improve and get better. The top sides will keep getting better and stronger and it'll just separate world cricket into teams that are top level and other teams that are okay and we want to develop the other teams right now,"" he remarked.""Test cricket is pretty strong actually, it's probably seven or eight sides capable of beating each other and that hasn't been the case for few years so I actually think Test cricket is going okay right now,"" Waugh said.On the suggestion of bonus points for away wins in the 2025-27 WTC cycle, Waugh disagreed.""That's all subjective. How do you say who's a stronger team? I think the current system is pretty good. At end of the day, you've got to be consistent, you've got to win both away and at home,"" he commented.","Australian cricket legend Steve Waugh has advised Indian captain Rohit Sharma to reflect on his future in cricket. Waugh emphasised that Rohit, who turns 38 this month, must make his own decision about continuing as captain. He also expressed concerns about protecting Test cricket amid the growing popularity of T20 leagues.","https://static.toiimg.com/thumb/msid-120493204,imgsize-42282,width-400,resizemode-4/Rohit-Sharma-X-Photo.jpg"
IPL 2025 Points Table: Latest standings after KKR vs GT at Eden Gardens,https://timesofindia.indiatimes.com/sports/cricket/ipl/top-stories/ipl-2025-points-table-latest-standings-after-kkr-vs-gt-at-eden-gardens/articleshow/120493469.cms,"<p>Gujarat Titans remain top of the IPL 2025 points table following their win against Kolkata Knight Riders at<span class=""redactor-invisible-space""> Eden Gardens on April 21. (AP)</span><br></p>

Go Beyond The Boundary with our YouTube channel.

Poll Can Gujarat Titans maintain their momentum for playoffs? No, tougher challenges lie ahead Yes, they’re looking strong and consistent

Shah Rukh Khan: The superstar who turned IPL into a blockbuster

IPL Points Table after KKR vs GT at Eden Gardens.

Gujarat Titans bolstered their chances of qualifying for the IPL 2025 playoffs following their convincing 39-run win against Kolkata Knight Riders at the Eden Gardens on Monday night. The win maintained GT's foothold at the top of the IPL points table with 12 points from eight matches - winning six and losing two.Delhi Capitals, Royal Challengers Bengaluru and Punjab Kings occupy the remain three playoff spots.KKR, meanwhile, remain seventh as they picked up their second straight loss in the season. They are on six points after eight matches - winning three and losing five. They are still in contention for playoffs but will have to pull up their socks if they are to go through without a hiccup considering the table is tight above them with four teams on 10 points and Mumbai Indians on eight points.Captain Ajinkya Rahane emerged as KKR's primary fight, scoring a determined 50 off 36 balls with five boundaries and a six as they chased 199 runs. His innings concluded when Washington Sundar had him stumped in the 13th over.The middle order's collapse followed quickly as Venkatesh Iyer and Rahane followed in quick succession followed by the same episode with the wickets of Andre Russell and Ramandeep Singh.Prasidh Krishna delivered a double strike in the 17th over, removing both Ramandeep Singh and Moeen Ali, further diminishing KKR's chances of victory.In the first innings, GT skipper Shubman Gill led the scoring with a brilliant 90 runs off 55 balls, helping GT set a challenging total of 198/3 in 20 overs.On a slow surface, GT struggled initially, managing only 45 runs in the powerplay, but they accelerated their scoring afterward. Gill and B Sai Sudharsan, who scored 52, formed a formidable opening partnership of 114 runs.Jos Buttler added a quick 41 not out from just 23 deliveries, capitalising on some fielding mistakes by KKR. However, it raised questions about GT's risk management, as they could only muster 59 runs in the last five overs.","Gujarat Titans remain top of the IPL 2025 points table following their win against Kolkata Knight Riders at the Eden Gardens on April 21. KKR, meanwhile, remain seventh as they picked up their second straight loss in the season. They are on six points after eight matches - winning three and losing five.","https://static.toiimg.com/thumb/msid-120494640,imgsize-56426,width-400,resizemode-4/GT-KKR-IPL-AP.jpg"
"After hair dryer and trimmer, PSL franchise gifts gold-plated iPhone 16 Pro to star bowler",https://timesofindia.indiatimes.com/sports/cricket/news/after-hair-dryer-and-trimmer-psl-franchise-gifts-gold-plated-iphone-16-pro-to-star-bowler/articleshow/120492737.cms,"The gold-plated iPhone 16 Pro (Video grab)

Go Beyond The Boundary with our YouTube channel.

WATCH:

The Pakistan Super League PSL ) has seen its fair share of viral moments this season, but none quite as glamorous as this. Lahore Qalandars captain Shaheen Shah Afridi has been gifted a customised 24-carat gold-plated iPhone 16 Pro , making headlines and sparking envy among his teammates.Also visit: KKR vs GT, IPL Live Score This extravagant gesture comes shortly after Karachi Kings made headlines for their quirky rewards — gifting a hairdryer to England’s James Vince and a beard trimmer to Hasan Ali for standout performances.Lahore Qalandars shared a slick unboxing video on their official social media handles, which has since gone viral. The caption read: “The iPhone has landed. Our Captain Qalandar receives a gift he’s worthy of. A custom 24K Gold-plated iPhone 16 Pro, made just for Lahore Qalandars’ main man, Shaheen!”The video captures Afridi receiving the luxurious gift with a surprised smile, exclaiming “Ye heavy hai (This is heavy)” as he walks off the field holding the phone. His teammates, particularly fast bowler Haris Rauf , couldn't hide their playful jealousy. Rauf quipped, “No brother, this is unfair,” drawing laughs and further fan attention to the viral moment.However, Lahore Qalandars’ golden gift to Shaheen Afridi has clearly upped the ante. It also reflects the franchise’s admiration for their skipper. This gold-plated surprise has undoubtedly added another layer of sparkle to the league’s vibrant entertainment.",Lahore Qalandars captain Shaheen Shah Afridi has been gifted a customised 24-carat gold-plated iPhone 16 Pro. The extravagant gesture comes shortly after Karachi Kings made headlines for gifting a hairdryer to England’s James Vince.,"https://static.toiimg.com/thumb/msid-120492764,imgsize-17300,width-400,resizemode-4/PSL.jpg"
IPL 2025 Points Table: Latest standings after RCB vs PBKS and MI vs CSK,https://timesofindia.indiatimes.com/sports/cricket/ipl/top-stories/ipl-2025-points-table-latest-standings-after-rcb-vs-pbks-and-mi-vs-csk/articleshow/120460859.cms,"Rohit Sharma and Suryakumar Yadav during Mumbai Indians vs Chennai Super Kings in IPL 2025. (AP)

Go Beyond The Boundary with our YouTube channel.

IPL 2025 Points after April 20.

Not a typical Chinnaswamy wicket: RCB pacer Josh Hazlewood after loss vs Punjab Kings

Poll Which team do you think has the best chance to claim the IPL 2025 title? Mumbai Indians Royal Challengers Bengaluru Delhi Capitals Gujarat Titans

Royal Challengers Bengaluru returned to the IPL 2025 playoff spots after their win against Punjab Kings in Mullanpur on Sunday afternoon. In the second fixture, Mumbai Indians kept their push for a playoff spot alive with a convincing 9-wicket win against five-time champions Chennai Super Kings RCB's seven-wicket win propelled them from fifth place to third in the latest IPL standings . The top-four places are currently occupied by Gujarat Titans, Delhi Capitals, RCB and PBKS.The top-four teams will qualify for the playoffs and the two teams will get two chances at making the final. But the race will not be straightforward with five teams now on 10 points. Besides the top-four, Lucknow Super Giants also have 10 points to their name.Meanwhile, the 9-wicket defeat for CSK could well mean curtains for their chances of making the next stage in the competition. They continue to struggle for runs and were hapless with the ball as well at the Wankhede Stadium to occupy the last spot. They have picked just two wins from eight matches in the season.In the contest at Wankhede, Rohit Sharma and Suryakumar Yadav struck fluent half-centuries as MI chased down the 177-run target with 26 balls to spare.Needing 177 to win, Rohit (76 not out off 45 balls) and Suryakumar (68 not out off 30) shared an unbeaten 114-run stand for the second wicket to take MI home. Ravindra Jadeja (1/18) was the lone wicket-taker for CSK.Earlier, Shivam Dube and Jadeja cracked half-centuries and shared a 79-run partnership for the fourth wicket as five-time champions Chennai Super Kings made 176 for 5.In the day's first game, Virat Kohli and Devdutt Padikkal smashed half-centuries as Royal Challengers Bengaluru crushed Punjab Kings by seven wickets.Chasing 158, Kohli (73 not out off 54 balls) and Padikkal (61 off 35 balls) shared a 103-run partnership, which formed the backbone of the massive win achieved with seven balls to spare.Earlier, spinners Krunal Pandya (2/25) and Suyash Sharma (2/26) shared four wickets between them as Punjab Kings struggled to build momentum with RCB striking at regular intervals.Opener Prabhsimran Singh top-scored for the hosts with a 17-ball 33 after being invited to bat.","Royal Challengers Bengaluru return to the IPL 2025 playoff spots after their win against Punjab Kings in Mullanpur on Sunday afternoon. In the second fixture, Mumbai Indians kept their push for a playoff spot alive with a convincing 9-wicket win against five-time champions Chennai Super Kings. The top-four places are currently occupied by Gujarat Titans, Delhi Capitals, RCB and PBKS.","https://static.toiimg.com/thumb/msid-120461103,imgsize-59190,width-400,resizemode-4/Rohit-SKY-MI-CSK-IPL.jpg"
'I'm fed up!': How Kieron Pollard inspired Mumbai Indians to break losing streak against Chennai Super Kings,https://timesofindia.indiatimes.com/sports/cricket/ipl/top-stories/im-fed-up-how-kieron-pollard-inspired-mumbai-indians-to-break-losing-streak-against-chennai-super-kings/articleshow/120487956.cms,"Mumbai Indians defeated Chennai Super Kings emphatically on Sunday evening, ending their losing streak. Kieron Pollard revealed he motivated the team by expressing his frustration with repeatedly praising CSK. Suryakumar Yadav's promotion to No. 3 proved fruitful as he smashed an unbeaten 68 off 30 balls.",Mumbai Indians defeated Chennai Super Kings emphatically on Sunday evening. Kieron Pollard revealed he motivated the team by expressing his frustration with repeatedly praising CSK. Suryakumar Yadav's promotion to No. 3 proved fruitful as he smashed an unbeaten 68 off 30 balls.,"https://static.toiimg.com/thumb/msid-120489125,imgsize-195900,width-400,resizemode-4/Mumbai-Apr-20-ANI-Mumbai-Indians-Hardik-Pandya-and-teammates-celebrate-the-.jpg"
KL Rahul returns to 'old home' Ekana stadium as Delhi Capitals face Lucknow Super Giants - Watch,https://timesofindia.indiatimes.com/sports/cricket/ipl/top-stories/kl-rahul-returns-to-old-home-ekana-stadium-as-delhi-capitals-face-lucknow-super-giants-watch/articleshow/120491105.cms,"KL Rahul (PTI Photo)

Go Beyond The Boundary with our YouTube channel.

WATCH:

Poll Which team do you think will win the IPL 2025 clash: DC or LSG? It's too close to call Lucknow Super Giants Delhi Capitals

NEW DELHI: KL Rahul will walk onto familiar turf on Tuesday, but this time in new colours. The star Indian batter, now representing Delhi Capitals , returns to the Bharat Ratna Shri Atal Bihari Vajpayee Ekana Stadium in Lucknow to face his former team, Lucknow Super Giants (LSG), in what promises to be a high-stakes IPL 2025 clash.Also visit: KKR vs GT, IPL Live Score Rahul, who led LSG from their debut season in 2022 until 2024, will be playing against the franchise he once captained — and at the very venue where he was the face of the home crowd.Delhi Capitals marked the moment by sharing a video on social media of Rahul entering the stadium, captioned: ""Enter KL Rahul [fire emoji]"".In fine form this season, Rahul has amassed 266 runs from six matches at an impressive average of 53.20 and a strike rate of 158.33. He’s struck two fifties and has emerged as a pillar in Delhi’s batting line-up. He missed the earlier clash between DC and LSG in Visakhapatnam, a match that Delhi narrowly won by one wicket.Rahul's release ahead of the 2024 mega auction was a major talking point, especially after a solid personal season last year, where he scored 520 runs in 14 games. However, LSG failed to reach the playoffs, finishing seventh.With both teams tied on 10 points, DC currently sit second, while LSG are fifth due to net run rate. A win in Lucknow could shake up the points table — and for Rahul, it’s a chance to make a statement at his old home.","Delhi Capitals take on Lucknow Super Giants (LSG) in IPL 2025 clash. Former LSG captain KL Rahul will be playing for Delhi for the first time. Rahul led LSG from their debut season in 2022 until 2024. Both teams are tied on 10 points, with DC second and LSG fifth.","https://static.toiimg.com/thumb/msid-120491224,imgsize-14658,width-400,resizemode-4/KL-Rahul.jpg"
