Article Title,Article Link,Article Text,Article Summary,Article Image
Aiden Markram to continue opening for South Africa to fit in more power-hitters,https://timesofindia.indiatimes.com/sports/cricket/news/aiden-markram-to-continue-opening-for-south-africa-to-fit-in-more-power-hitters/articleshow/123323580.cms,"Aiden Markram (Getty Images)

Go Beyond The Boundary with our YouTube channel. SUBSCRIBE NOW!

South Africa captain Aiden Markram confirmed he will continue opening in the T20I team to accommodate more middle-order batters. With the three-match series against Australia tied 1-1, the decider will be played in Cairns on Saturday.Markram enjoyed a strong IPL 2025 as an opener for Lucknow Super Giants, scoring five half-centuries in 13 innings at a strike rate of 148.82. However, he has not crossed fifty in T20Is since October 2022.""Going through our squads and the players that we've got around, we think probably that (opening) is the best fit. We've got some guys in the middle order that are a lot more destructive than I am, and we feel probably it's better off for me and Ricks ( Ryan Rickelton ) to be up top.”“I did it a bit at the IPL and am starting to do it now again at international cricket. It's an exciting role. It's always nice to bat in the powerplay, and the focus is to get the team off to good starts,"" Markram told reporters on Friday.His opening stands with Rickelton in the series have been 12 and 34. While number three Lhuan-dre Pretorius is yet to find form, Dewald Brevis provided a boost with an unbeaten 125 in the second T20I.Markram also provides an off-spin option and has occasionally taken the new ball, including dismissing Travis Head in the second match in Darwin. ""It's very much a feel thing. It's quite a daunting task. You just see the ball flying nowadays, and I'm not so sure I really want to be a bowler.""But there'll be occasions where you feel like the wicket might be on the slower side or might offer something, and you sort of take that punt. The way I try to operate is just go on my gut feel, whatever my gut's telling me in the moment, run with that and back that and reflect on what could have been and what should have been possibly after the game,"" he said.With South Africa having won only one of their last nine bilateral T20I series, including losing the tri-series final to New Zealand, Markram is eager to turn the tide. ""It feels like we are moving in the right direction. The series so far has been good. The bowlers have been pretty good for us.“The previous game made our batters look good, but it was very much an individual performance (Brevis hit an unbeaten 125). So a nice challenge for our batters tomorrow to hopefully click and for them to put on a good score.""","South Africa captain Aiden Markram confirms he will continue opening in the T20I team to accommodate more middle-order batters. The three-match series against Australia tied 1-1, the decider will be played in Cairns on Saturday. Markram enjoyed a strong IPL 2025 as an opener for Lucknow Super Giants, scoring five half-centuries.","https://static.toiimg.com/thumb/msid-123323590,imgsize-43576,width-400,resizemode-4/123323590.jpg"
"'For me, it's really good practice': Australia's Alyssa Healy on playing against India 'A' ahead of Women's ODI World Cup 2025",https://timesofindia.indiatimes.com/sports/cricket/news/for-me-its-really-good-practice-australias-alyssa-healy-on-playing-against-india-a-ahead-of-womens-odi-world-cup-2025/articleshow/123323414.cms,"Alyssa Healy (Photo by Chris Hyde/Getty Images)

Go Beyond The Boundary with our YouTube channel.

Australia's captain and wicketkeeper Alyssa Healy believes the spin-dominant bowling she faces in the ongoing India ""A"" series is providing valuable practice for the upcoming Women's ODI World Cup scheduled from September 30 to November 2.In the second 50-over match at Ian Healy Oval on Friday, Healy scored an impressive 91 runs from 87 balls, including eight fours and three sixes. Despite her strong performance, Australia 'A' suffered a two-wicket defeat.""They've got a really spin-heavy attack and we're going to have to play a lot of that … throughout the World Cup as well, a lot of the middle overs will be spin-biased. For me it's really good practice, a good opportunity to be really decisive with your feet. I felt like it was okay at times today – not where I exactly want it to be – but can improve next game,"" Alyssa was quoted as saying by cricket.com.au.During the match, Healy kept wickets for 42 overs and made subtle adjustments to her stance to reduce strain on her joints.""It actually feels really good. I feel in a really good place. To have a little bit of time to focus on my keeping has been really worthwhile,"" she added.With Tahlia McGrath leading Australia 'A', Healy has found relief from captaincy duties.""Today was a prime example of why I enjoy sitting out at times! Not having to think about what to do at the back-end there is refreshing,"" she further stated.The final 50-over match will take place at Ian Healy Oval on Sunday. India 'A' aims to achieve a clean sweep in the one-day portion of the multi-format series.","Alyssa Healy scored 91 runs from 87 balls, including eight fours and three sixes. Australia 'A' suffered a two-wicket defeat. Healy believes the spin- dominant bowling she faces is providing valuable practice for the upcoming Women's ODI World Cup.","https://static.toiimg.com/thumb/msid-123323453,imgsize-89260,width-400,resizemode-4/123323453.jpg"
'It's going to be tricky to get in there': Steve Smith wants to make Australia squad for LA Olympics 2028,https://timesofindia.indiatimes.com/sports/cricket/news/its-going-to-be-tricky-to-get-in-there-steve-smith-wants-to-make-australia-squad-for-la-olympics-2028/articleshow/123322236.cms,"Steve Smith (Agency Photo)

Go Beyond The Boundary with our YouTube channel.

Australian cricket star Steve Smith has expressed his thoughts about qualifying for the T20I squad in the upcoming Los Angeles 2028 Olympics, acknowledging the challenges ahead.Cricket is making its return to the Olympics after a long absence of 128 years, with its last appearance dating back to 1900. Smith, who will be 39 during the Los Angeles Games, is eager to represent Australia at this prestigious sporting event.""I mean, it is a goal of mine to try and make that Olympic team in 28. I think, you know, the team's doing pretty well at the moment, the Australian T20 team. So it's going to be tricky to get in there, but you know, just got to keep putting my best foot forward, and we'll never know,"" Smith was quoted as saying to Sky Sports.""Yeah, I mean, I've watched a lot of Olympics since I was a young kid and really enjoyed watching the Australian athletes go about it. So, you know, when I heard that cricket was going to be a part of it, I was like, that would be really cool to be involved.""The prospect of competing at the Olympics has captured Smith's interest, despite his extensive experience in major cricket tournaments including World Cups, Champions Trophy, and World Test Championship finals.""So, you know, I've obviously played in, you know, lots of World Cups and Ashes and uh Border Gavaskar Trophy and things like that, but um yeah, when this popped up, it was something new and another opportunity to, you know, represent your country on a world stage. So, yeah, it was like I'd love to be involved in that, but it's still a fair way away. So, we'll see,"" he added.Smith recently retired from ODI cricket following a Champions Trophy disappointment. His participation in T20 internationals has been limited, with his most recent appearance occurring in February 2024 against New Zealand.The upcoming T20 World Cup in India and Sri Lanka next year adds uncertainty to Smith's position in Australia's future plans.","Australian cricket star Steve Smith has expressed his thoughts about qualifying for the T20I squad in the upcoming Los Angeles 2028 Olympics. Cricket is making its return to the Olympics after a long absence of 128 years. Smith, who will be 39 during the Los Angeles Games, is eager to represent Australia.","https://static.toiimg.com/thumb/msid-123322304,imgsize-27276,width-400,resizemode-4/123322304.jpg"
ICC slaps five-year ban on ex-cricketer for match fixing,https://timesofindia.indiatimes.com/sports/cricket/news/icc-slaps-five-year-ban-on-ex-cricketer-for-match-fixing/articleshow/123321950.cms,"Go Beyond The Boundary with our YouTube channel. SUBSCRIBE NOW!

NEW DELHI: Former Sri Lankan domestic cricketer Saliya Saman has been banned from all cricket for five years after an ICC Anti-Corruption Tribunal found him guilty of breaching the Emirates Cricket Board (ECB) Anti-Corruption Code.Saman was among eight individuals charged in September 2023 for violating the Code. His ban is backdated to 13 September 2023, the date he was provisionally suspended, meaning he has already served two years of his sentence.The 39-year-old, who played 101 first-class matches and 77 List A games, faced charges relating to the 2021 Abu Dhabi T10 Cricket League and attempts to corrupt matches in that tournament. The incidents were disrupted by the ICC and the Designated Anti-Corruption Official (DACO) for the purposes of the ECB’s Code for the event.Saman was found guilty on three counts — Articles 2.1.1, 2.1.3 and 2.1.4.Article 2.1.1 states: ""Being party to an attempt to fix, contrive or influence improperly matches or aspects of matches in the Abu Dhabi T10 2021.""As per Article 2.1.3, Saman offered ""a Reward to another Participant in exchange for that player engaging in Corrupt Conduct under the Code.""Article 2.1.4 states: ""Directly or indirectly soliciting, inducing, enticing, instructing, persuading, encouraging or intentionally facilitating any Participant to breach Code Article 2.1.""","Former Sri Lankan domestic cricketer Saliya Saman has been banned from all cricket for five years. The 39-year-old was found guilty of breaching the Emirates Cricket Board (ECB) Anti-Corruption Code. His ban is backdated to 13 September 2023, the date he was provisionally suspended.","https://static.toiimg.com/thumb/msid-123321972,imgsize-26184,width-400,resizemode-4/123321972.jpg"
"Australia vs South Africa, 3rd T20I: Live Streaming, Telecast, When and Where to Watch AUS vs SA Match",https://timesofindia.indiatimes.com/sports/cricket/news/australia-vs-south-africa-3rd-t20i-live-streaming-telecast-when-and-where-to-watch-aus-vs-sa-match/articleshow/123321651.cms,"Tim David of Australia bats during the T20 international cricket match between Australia and South Africa (Jono Searle/AAPImage via AP)

Go Beyond The Boundary with our YouTube channel.

AUS vs SA, 3rd T20I: Date, Time, and Venue

When will the Australia vs South Africa 3rd T20I match be played?

Where will the Australia vs South Africa 3rd T20I match be played?

What time will the Australia vs South Africa 3rd T20I match start?

What time will the toss for the Australia vs South Africa 3rd T20I match take place?

Where to watch Australia vs South Africa 3rd T20I live telecast in India?

Where to watch the live stream of the Australia vs South Africa 3rd T20I match in India?

Australia vs South Africa squads

Australia:

South Africa:

Cazaly’s Stadium in Cairns will host the high-stakes decider on Saturday as Australia and South Africa head into the 3rd T20I locked at 1-1. After Australia’s dominant win in the opener, the Proteas roared back in style in Darwin, inspired by a record-breaking innings from Dewald Brevis.The 22-year-old smashed an unbeaten 125 off just 56 balls – the highest individual T20I score by a South African – to set up a convincing 53-run win in the second match.Brevis’s blistering knock, featuring 12 fours and eight sixes, rescued his side from a shaky 57 for three and propelled them to 218 for seven. Tristan Stubbs chipped in with 31, while the Proteas’ bowlers, led by teenage pacer Kwena Maphaka (3/57), dismantled Australia for 165 in 17.4 overs.For Australia, the defeat ended a nine-match winning streak in the format and exposed some middle-order fragility. Tim David’s 50 kept them in the chase, but regular wickets derailed momentum.Glenn Maxwell impressed early with the ball, removing South African captain Aiden Markram and Lhuan-dre Pretorius, but his batting dismissal in the middle overs proved a turning point.Heading into the decider, both sides have plenty to play for. Australia will rely on the experience of captain Mitchell Marsh, Travis Head, and Josh Hazlewood, along with the firepower of David and Maxwell, to reclaim control.South Africa, buoyed by Brevis’s heroics, will look to Markram’s leadership and the pace threat of Rabada, Ngidi, and the young Maphaka to seal a rare T20I series win on Australian soil.The tropical Cairns conditions could make batting trickier than in Darwin, putting a premium on disciplined bowling and sharp fielding. With the series in the balance, expect a fierce contest where one individual performance could once again decide the outcome.The Australia vs South Africa 3rd T20I match will be played on Saturday.T he Australia vs South Africa 3rd T20I match will be played at Cazaly's Stadium in Cairns.The Australia vs South Africa 3rd T20I match will begin at 2:45 PM IST.The toss for the Australia vs South Africa 3rd T20I match will take place at 2:15 PM IST.The Australia vs South Africa 3rd T20I match will be telecast on the Star Sports Network.The Australia vs South Africa 3rd T20I match will be streamed live on the JioHotstar app and website.Mitchell Marsh (c), Alex Carey (wk), Travis Head, Cameron Green, Tim David, Glenn Maxwell, Aaron Hardie, Ben Dwarshuis, Sean Abbott, Adam Zampa, Josh Hazlewood, Josh Inglis, Nathan Ellis, Matthew KuhnemannAiden Markram (c), Ryan Rickelton (wk), Rassie van der Dussen, Lhuan-dre Pretorius, Dewald Brevis, Tristan Stubbs, Corbin Bosch, Kagiso Rabada, Nqabayomzi Peter, Kwena Maphaka, Lungi Ngidi, George Linde, Nandre Burger, Senuran Muthusamy, Prenelan Subrayen",Cazaly's Stadium in Cairns will host the high-stakes decider on Saturday. Australia and South Africa head into the 3rd T20I locked at 1-1. Australia’s dominant win in the opener was inspired by a record-breaking innings from Dewald Brevis.,"https://static.toiimg.com/thumb/msid-123321949,imgsize-80970,width-400,resizemode-4/123321949.jpg"
"'Retirement le lu?’: Rohit Sharma asks Rishabh Pant directly, video goes viral - WATCH",https://timesofindia.indiatimes.com/sports/cricket/news/retirement-le-lu-rohit-sharma-asks-rishabh-pant-directly-video-goes-viral-watch/articleshow/123321715.cms,"Rohit Sharma and Rishabh Pant (AFP Photo)

'Never Dreamt of This...': Rohit Sharma's BIG CONFESSION After Retirement From Test Cricket

Go Beyond The Boundary with our YouTube channel. SUBSCRIBE NOW!

Poll What do you admire most about Rohit Sharma? Leadership & Team Spirit Batting & On-field Skills

WATCH:

NEW DELHI: The feeling of winning the ICC Champions Trophy 2025 still hasn’t sunk in. India defeated New Zealand by four wickets in the final to clinch their second ICC Champions Trophy title under Rohit Sharma ’s captaincy, having previously won the tournament in 2013 under MS Dhoni.The celebrations were electric after India sealed the win.On Friday, Independence Day, star wicketkeeper-batter Rishabh Pant shared a video on social media capturing the jubilant scenes — from dressing-room banter to a light-hearted exchange with skipper Rohit that caught fans’ attention.In the clip, Pant went around recording reactions from Ravindra Jadeja, Shubman Gill, Virat Kohli , Shreyas Iyer, Arshdeep Singh, Kuldeep Yadav, and Axar Patel. When he finally reached Rohit, Pant asked, “Bhaiya, ye stump leke kahaan jaa rahe ho?”Rohit, who had announced his retirement from T20Is after leading India to the 2024 T20 World Cup title, replied with a grin: “Kya? Retirement le lu? Har baar jeetenge to har baar thodi retirement leta rahunga?”To this, Pant laughed and said, “Hum to chahte hain khelo.”The 2025 Champions Trophy was Rohit’s second ICC title as captain, following the T20 World Cup triumph in 2024.Rohit and Virat Kohli will next be seen in action during the ODI series against Australia in October, with both stalwarts already preparing for their ODI comebacks.","India beat New Zealand by four wickets to win the ICC Champions Trophy 2025. It was Rohit Sharma’s second ICC title as captain, following the T20 World Cup triumph in 2024. Wicketkeeper-batter Rishabh Pant shared a video on social media capturing the jubilant scenes.","https://static.toiimg.com/thumb/msid-123321726,imgsize-38668,width-400,resizemode-4/123321726.jpg"
MS Dhoni's seven-word message: 'Consider me as retired',https://timesofindia.indiatimes.com/sports/cricket/news/ms-dhonis-seven-word-message-consider-me-as-retired/articleshow/123320840.cms,"MS Dhoni (Image credit: BCCI/IPL)

When will CSK legend MS Dhoni retire from IPL? Astrologer Greenstone Lobo predicts

Go Beyond The Boundary with our YouTube channel. SUBSCRIBE NOW!

Poll What do you admire most about Dhoni? His captaincy and leadership skills His batting and finishing prowess

NEW DELHI: Five years ago, on this day, India’s legendary captain and wicketkeeper MS Dhoni bid farewell to international cricket, drawing the curtains on a career that transformed the landscape of Indian cricket. At exactly 7:29 pm on August 15, 2020, Dhoni stunned the cricketing world with a brief Instagram post: ""Thanks a lot for your support throughout. From 1929 hrs consider me as Retired."" Minutes later, his long-time teammate and friend Suresh Raina joined him in announcing his own retirement, making it a double blow for fans.‘Thala’, skipper, icon, legend, ICC Hall of Famer — Dhoni’s career was a glittering showcase of trophies and milestones. Respected across the globe for his calm demeanour and sharp cricketing mind, he rose from Ranchi’s dusty grounds to become ‘Captain Cool’, redefining leadership in world cricket.In his very first assignment as captain, Dhoni led India to the inaugural T20 World Cup title in 2007. Four years later, he guided the team to the 2011 ICC ODI World Cup triumph, ending a 28-year wait. In 2013, under intense scrutiny, he silenced critics by clinching the Champions Trophy — making him the only captain to win all three major ICC white-ball trophies.Across formats, Dhoni’s numbers underline his greatness: 17,266 international runs, 829 dismissals, and 538 matches for India.His Test career ended quietly after the Boxing Day Test in Melbourne in 2014, having scored 4,876 runs in 90 matches at 38.09, with six centuries and a highest score of 224.His most prolific arena remained ODIs — 10,773 runs in 350 matches at an average of 50.57, including 10 centuries, 73 fifties, and a career-best 183*. In T20Is, he featured in 98 matches, scoring 1,617 runs at 37.60 and a strike rate of 126.13, with two fifties.Five years on, Dhoni’s international career may be over, but his legacy continues. Still turning out for Chennai Super Kings in the IPL, the 44-year-old has aged like fine wine — a leader, a finisher, and an icon whose impact on Indian cricket remains unmatched.","Five years ago, India’s legendary captain and wicketkeeper MS Dhoni bid farewell to international cricket. At exactly 7:29 pm on August 15, 2020, Dhoni stunned the cricketing world with a brief Instagram post. Minutes later, his long-time teammate and friend Suresh Raina joined him in announcing his own retirement.","https://static.toiimg.com/thumb/msid-123320927,imgsize-40126,width-400,resizemode-4/123320927.jpg"
'Greed for money stands above sacrifice': Aaditya Thackeray criticises BCCI on India vs Pakistan in Asia Cup,https://timesofindia.indiatimes.com/sports/cricket/asia-cup/greed-for-money-stands-above-sacrifice-aaditya-thackeray-criticises-bcci-on-india-vs-pakistan-in-asia-cup/articleshow/123319740.cms,"Aaditya Thackeray has strongly criticised the BCCI for prioritising financial interests over national sentiment by agreeing to play against Pakistan in the Asia Cup. This follows the Pahalgam terror attack and Operation Sindoor. Thackeray questioned the BCCI's decision, highlighting Prime Minister Modi's warning against any enemy misadventures.",Aaditya Thackeray has criticised the BCCI for agreeing to play against Pakistan in the Asia Cup. This follows the Pahalgam terror attack and Operation Sindoor. Prime Minister Modi has warned against any enemy misadventures.,"https://static.toiimg.com/thumb/msid-123320067,imgsize-2562443,width-400,resizemode-4/123320067.jpg"
'We smile in freedom because they stood with courage': Virat Kohli’s message on 79th Independence Day,https://timesofindia.indiatimes.com/sports/cricket/news/we-smile-in-freedom-because-they-stood-with-courage-virat-kohlis-message-on-79th-independence-day/articleshow/123318695.cms,"On India's 79th Independence Day, Virat Kohli and other cricketing legends joined the nation in celebration, honoring the sacrifices of past heroes. Prime Minister Modi hoisted the tricolor at the Red Fort, accompanied by a symbolic flower petal shower from IAF helicopters.","Prime Minister Modi hoisted the tricolor at the Red Fort, accompanied by a symbolic flower petal shower from IAF helicopters. Virat Kohli and other cricketing legends joined the nation in celebration, honoring the sacrifices of past heroes.","https://static.toiimg.com/thumb/msid-123318863,imgsize-1278422,width-400,resizemode-4/123318863.jpg"
Watch: Mohammed Salah reduced to tears as fans pay emotional tribute to Diogo Jota,https://timesofindia.indiatimes.com/sports/football/top-stories/youll-never-walk-alone-liverpool-pays-heartfelt-tribute-to-diogo-jota-and-andre-silva-watch/articleshow/123328139.cms,"Mohamed Salah was reduced to tears after dedicating his goal to Diogo Jota during the Premier League match against Bournemouth. (AP)

Go Beyond The Boundary with our YouTube channel.

Poll What was the most emotional moment of the match for you? The tribute before kick-off Salah's celebration The final whistle with fans singing Jota’s name

Anfield was filled with emotion on Friday night as Liverpool paid a heartfelt tribute to Diogo Jota and his brother, Andre Silva, before their Premier League opener against Bournemouth. It was the first competitive game at the stadium since the two Portuguese footballers tragically lost their lives in a car accident last month.Before kick-off, the entire stadium stood in silence. Fans held up placards to form “DJ20” and “AS30” in two stands, while both sets of players stood arm-in-arm in the centre circle. A large banner in The Kop sent a message of comfort to Jota’s wife, Rute Cardoso, and their three children: “Rute, Dinis, Duarte, Mafalda – Anfield will always be your home. You’ll Never Walk Alone.”Liverpool manager Arne Slot, his staff, and all players wore black armbands. A picture of Jota and Silva appeared on the big screen, while “You’ll Never Walk Alone” rang out with scarves, flags, and banners waving in their memory.The match itself was a rollercoaster. Liverpool took the lead through Hugo Ekitike and Cody Gakpo, but Bournemouth’s Antoine Semenyo struck twice to level, despite earlier reporting racial abuse from a spectator. Federico Chiesa’s late goal and a stoppage-time strike from Mohamed Salah sealed a 4-2 win for the Reds.The emotion peaked after the final whistle. Salah, who had mimicked one of Jota’s celebrations after scoring, stood in front of The Kop in tears as supporters sang Jota’s name. Slot later described the tribute as “impressive and powerful.”Jota spent five seasons at Liverpool, winning the Premier League , FA Cup, and League Cup. The club has retired his number 20 shirt and will honour him with a permanent memorial sculpture at Anfield, ensuring his legacy lives on.It was a night of victory, grief, and love — a reminder of football’s power to unite people in both joy and sorrow.",Liverpool beat Bournemouth 4-2 in their Premier League opener. Mohamed Salah was reduced to tears after dedicating his goal to Diogo Jota. The two Portuguese footballers tragically lost their lives in a car accident last month. The entire stadium stood in silence before kick-off.,"https://static.toiimg.com/thumb/msid-123328603,imgsize-34928,width-400,resizemode-4/123328603.jpg"
