Article Title,Article Link,Article Text,Article Summary,Article Image
Monaco E-Prix: When and where to watch the most stunning Formula E double header,https://timesofindia.indiatimes.com/sports/formula-e/monaco-e-prix-when-and-where-to-watch-the-most-stunning-formula-e-double-header/articleshow/120766971.cms,"Where can you watch the Formula E race

When to watch the Monaco E-Prix double header

Here’s when you can watch the race in India:

Monaco E-Prix is around the corner and the Formula E fans have already made their weekend plans to watch the race. Happening in the hub of motorsport, Monaco, the race is considered one of the most beautiful races, not just for its picturesque track but also due to the star-studded presence expected to fill up the stands. And the action is doubled this year, with the venue hosting a double header for the first time.Formula E fans across the globe can watch the speeding electric cars at the Monaco E-Prix on television. In India, one can watch the race on Sony Sports Network. Some other South Asian countries can also tune in to the race on the channel. Those who are outdoors can watch the Free Practice Live Stream from the official Formula E YouTube channel.India - Sony Sports NetworkCanada - TSN, TVA SportsUSA - Roku, CBSUK - ITV, TNT SportsEurope - EurosportJapan - J SportsNew Zealand - Sky TVAustralia - Stan SportIndonesia - MNC TVSouth Africa - e.tvBrazil - Band TVSouth America - Claro SportsItaly - MEDIASETFrance and Monaco - L’EquipeGermany - DF1The live action at the Formula E Championship Round 6 will begin in Monaco early Saturday, with the First Free Practice session starting at 11:00 AM (IST). This will be followed by the Second Free Practice session at 12:40 PM (IST). The Qualifying race will start at 2:10 PM (IST), and the final race is at 6:35 PM (IST).Round 7 will take place on Sunday, with the Third Free Practice session starting at 12 PM (IST). The Round 7 Qualifying will begin at 2:10 PM (IST), while the final Round 7 race is at 6:35 PM (IST).Also Read: Monaco E-Prix 2025: Formula E set for yet another double-header, here’s all about the most loved race of the year Round 6 Free Practice 1 - 11 AMRound 6 Free Practice 2 - 12:40 PMRound 6 Qualifying - 2:10 PMRound 6 final race - 6:35 PMRound 7 Free Practice 3 - 12 PMRound 7 Qualifying - 2:10 PMRound 7 final race - 6:35 PM","Monaco E-Prix is around the corner and the Formula E fans have already made their weekend plans to watch the race. The race is considered one of the most beautiful races, not just for its picturesque track but also due to the star- studded presence expected to fill the stands. The action is doubled this year, with the venue hosting a double header for the first time.","https://static.toiimg.com/thumb/msid-120766986,imgsize-1127931,width-400,resizemode-4/Image-credit-Formula-E/Instagram.jpg"
Meet the winners of the Monaco E-Prix so far — and why Pole Position isn’t always good news,https://timesofindia.indiatimes.com/sports/formula-e/meet-the-winners-of-the-monaco-e-prix-so-far-and-why-pole-position-isnt-always-good-news/articleshow/120766615.cms,"What’s changed in the last three Monaco races?

Earlier Monaco E-Prix Winners

The stage is set for the Monaco E-Prix, and among the favourites are Mitch Evans , Oliver Rowland, António Félix Da Costa , and Nick Cassidy. With Monaco hosting a double-header for the first time, there are even more opportunities for new names—or different combinations—to climb the podium this weekend. But before that, let’s take a look at the six winners of the Monaco E-Prix so far.Interestingly, since the Monaco E-Prix adopted the full 3.337 km layout at the Circuit de Monaco, no pole-sitter has gone on to win the race.2022: Jaguar’s Mitch Evans started from pole but finished second. Stoffel Vandoorne of Mercedes claimed the win.2023: McLaren’s Jake Hughes took pole but didn’t make the podium. Nick Cassidy of Envision Racing won, followed by Evans in second and Andretti’s Jake Dennis in third.2024: Pascal Wehrlein secured pole for Porsche but also failed to finish on the podium. Jaguar dominated the race, with Evans taking the win and teammate Cassidy finishing second. Stoffel Vandoorne, now with DS Penske, completed the podium in third.The 2021 race was an exception to the recent trend. It was the first time Formula E used the full Monaco layout, and the pole-sitter went on to win the race. That year, António Félix da Costa achieved the double for Techeetah-DS. His recent third-place finish at the Miami E-Prix shows he’s still in strong form with Tag Heuer Porsche. Robin Frijns (Virgin-Audi) finished second in 2021, while Mitch Evans took third that year.Meanwhile, Sébastien Buemi of e.dams Renault remains the only driver to have won the Monaco E-Prix twice—and in consecutive editions. He triumphed in 2015 and 2017, during a period when the race was held biennially. On both occasions, Lucas Di Grassi (ABT Sportsline) finished second. Di Grassi is currently showing strong form again, having secured second place for Lola Yamaha ABT in the recent Miami race. In 2019, it was Jean-Éric Vergne of Techeetah-DS who claimed victory.The official Formula E Instagram handle recently shared a poster featuring the six different winners of the Monaco E-Prix, accompanied by the caption: “Will anybody join the exclusive list of #MonacoEPrix winners?”Also Read: Monaco E-Prix 2025: Formula E set for yet another double-header, here’s all about the most loved race of the year Predicting this weekend’s results, one fan wrote: “Oliver Rowland first, Jake Dennis second, and Pascal Wehrlein in third.” Rowland received plenty of support in the comments, with even the Formula E page noting: “A lot of love for @oliverrowland1 here.”","Mitch Evans, Oliver Rowland, António Félix Da Costa and Nick Cassidy are among the favourites to win this weekend's Monaco E-Prix. Sébastien Buemi remains the only driver to have won the Monaco E.Prix twice, and in consecutive editions.","https://static.toiimg.com/thumb/msid-120766588,imgsize-694010,width-400,resizemode-4/Image-credit-Getty-Images.jpg"
"Monaco E-Prix 2025: Formula E set for yet another double-header, here’s all about the most loved race of the year",https://timesofindia.indiatimes.com/sports/formula-e/monaco-e-prix-2025-formula-e-set-for-yet-another-double-header-heres-all-about-the-most-loved-race-of-the-year/articleshow/120750475.cms,"Monaco E-Prix Schedule

Round 5 – Saturday

Round 6 – Sunday

Last Monaco E-Prix Winners

Return of the Pit Boost

What better venue for a car race than the global hub of motorsport—Monaco? Formula E is all set to return to the picturesque Monte Carlo for the Monaco E-Prix double-header, scheduled to take place from May 3 to May 4. In a treat for motorsport fans, the venue will host a double-header for the first time this season. Spectators can look forward to thrilling action as the lightning-fast Gen3 Evo electric cars deliver up to 197 overtakes, as seen last year. And this year, it can be even more.The Monaco E-Prix kicks off early on Saturday, with the first practice session beginning at 11:00 AM (IST). The 45-minute session will be followed by a second free practice at 12:40 PM (IST), lasting 35 minutes.The day continues with a packed schedule. Qualifying starts at 2:10 PM (IST) and ends at 3:33 PM (IST). After a three-hour break, the main Round 5 race will begin at 6:35 PM (IST) and conclude by 10:05 PM (IST)Racing action resumes on Sunday with the third free practice session starting at 12:00 PM (IST). This 55-minute session will wrap up at 12:55 PM (IST). The Round 6 Qualifying will follow at 2:10 PM (IST) and end at 3:33 PM (IST). The main race of Round 6 begins at 6:35 PM (IST) and will conclude at 7:30 PM (IST).Jaguar dominated last year’s race, landing two drivers on the podium. Jaguar TCS Racing’s Mitch Evans won the Monaco E-Prix, with teammate Nick Cassidy finishing second. DS Penske’s Stoffel Vandoorne claimed third place.Evans, who also won the opening race of the 2024–25 season in São Paulo, will be aiming to repeat his success in Monaco.Also Read: Antonio Felix Da Costa has his eyes on Monaco after the Miami E-Prix: “This is really looking good” A new strategic element—Pit Boost—has recently been introduced in Formula E. First used in Jeddah this year, it’s a mandatory mid-race feature in which cars receive a 10% energy boost (3.85 kWh) through a 30-second, 600kW charge in the pit lane. This boost can be used only once during a double-header weekend.",The Monaco E-Prix double-header will take place from May 3 to May 4. Jaguar TCS Racing’s Mitch Evans won the race last year. A new strategic element—Pit Boost—has recently been introduced in Formula E.,"https://static.toiimg.com/thumb/msid-120750464,imgsize-1043419,width-400,resizemode-4/Image-credit-Formula-E.jpg"
Autoliv joins Formula E as official mobility safety partner,https://timesofindia.indiatimes.com/sports/formula-e/autoliv-joins-formula-e-as-official-mobility-safety-partner/articleshow/120729148.cms,"Autoliv logo on the safety cars

Increasing the usage and understanding of safety equipment: Leveraging Formula E’s global platform and fan base, Autoliv seeks to encourage consistent seatbelt use, promote vehicles with advanced safety systems, and inspire safe driving behavior in all traffic conditions.

Inspiring current and future talent: Autoliv aims to cultivate a global safety mindset, engaging audiences of all ages who share a passion for automotive innovation and encouraging careers in the field of automotive safety.

Electric vehicle safety : Autoliv will continue to explore and develop advanced safety technologies tailored specifically for electric vehicles in the years ahead.

In a significant move, Autoliv, a global leader in automotive safety , has announced that it will become the new official mobility safety partner of the ABB FIA Formula E World Championship. The partnership, revealed on Tuesday, aims to promote the use of safety equipment and spotlight technological advancements that benefit both racers and everyday drivers by showcasing Autoliv 's market-leading products and innovations.The collaboration, set to begin in April 2025, will include a series of branding activations. These will feature the Autoliv logo on the safety and medical cars, along with localised activations at various race venues. In its first year, the partnership will center around three key focus areas:""We are proud to partner with Formula E and showcase our expertise in automotive and electrical safety,"" said Gabriella Etemad, Senior Vice President Communications of Autoliv.""This partnership represents a significant milestone in our journey to show how we empower safety within the automotive industry,"" Etemad said.“This collaboration is a testament to our dedication to making vehicles safer for everyone, and we are enthusiastic about the opportunities this partnership can bring for advancing global automotive safety standards,” she added.Tiziana Di Gioia, Chief Commercial Officer of Formula E, said, “As we have some of the fastest and most advanced race cars in global motorsport going wheel to wheel on our circuits, safety is our number one priority. This focus and attention to detail aligns perfectly with Autoliv’s own ethos and business strategy. Collectively, we won’t just promote vehicle safety to our current fan and consumer bases but look how we can continually develop and deploy cutting edge systems in both the motorsport and automotive industries.”","Autoliv will become the official mobility safety partner of the ABB FIA Formula E World Championship. The partnership, revealed on Tuesday, aims to promote the use of safety equipment and spotlight technological advancements. The collaboration, set to begin in April 2025, will include a series of branding activations.","https://static.toiimg.com/thumb/msid-120729316,imgsize-820271,width-400,resizemode-4/Image-credit-Autoliv.jpg"
McLaren to exit Formula E at end of season; fans eager for updates on Taylor Barnard and Sam Bird’s future,https://timesofindia.indiatimes.com/sports/formula-e/mclaren-to-exit-formula-e-at-end-of-season-fans-eager-for-updates-on-taylor-barnard-and-sam-birds-future/articleshow/120696737.cms,"Why McLaren is pulling out of Formula E?

McLaren has been one of the strongest teams in Formula E since joining the championship three years ago. However, according to the latest updates, the company will exit Formula E at the end of this season. The NEOM McLaren Formula E team currently features the youngest driver on the grid, Taylor Barnard, alongside the experienced Sam Bird. What the future holds for the two British drivers remains to be seen.It has been revealed that McLaren’s owners are planning to shift their focus towards Formula One — where they are currently leading the season — as well as IndyCar and their new hypercar project, set to debut in 2027 in the World Endurance Championship.As per Reuters, McLaren CEO Zak Brown said in a statement, ""The time is right to explore other opportunities that more closely align with McLaren Racing's overall strategic direction - including our 2027 entry into the FIA World Endurance Championship. For now, we are focused on setting this great team up for future success by working towards securing a new owner.""The NEOM McLaren team also shared a statement on its official Instagram account. It read: “McLaren Racing confirmed today that following a strategic review of its racing portfolio the decision was taken not to continue our participation in the FIA Formula E World Championship beyond the current 2024/25 season.”It further read: “Work is already well under way to set this great team up for future success by working towards securing new investment. In the meantime, we remain fully committed to building on our strong start to the season and fighting for on-track success until the very last race.”“Our heartfelt thanks go to the team for their continued commitment and dedication, and to Formula E, our partners, and our fans for their continued support.”Expressing concern for the McLaren drivers, a fan wrote in the comments section of the post, “Hopefully Taylor and Sam can find a new team cause it would be sad if they left the sport.” Another wrote, “This is so sad! I hope not only our amazing drivers find their paths to keep around the sport but also the amazing team on the garage and back home. You will be missed papaya.”Also Read: Taylor Barnard shares first reaction after almost coming last at Miami E-Prix: “Time to turn our attention to streets of Monaco” As of now, Taylor Barnard is 4th in the Drivers' Standings this year with 3 podium finishes and 51 points. Meanwhile, Sam Bird is in 13th position with 16 points.","McLaren will exit Formula E at the end of this season. The NEOM McLaren Formula E team currently features the youngest driver on the grid, Taylor Barnard, alongside the experienced Sam Bird. It has been revealed that McLaren’s owners are planning to shift their focus towards Formula One, IndyCar and their new hypercar project.","https://static.toiimg.com/thumb/msid-120696764,imgsize-964253,width-400,resizemode-4/Image-credit-Neom-McLaren/Instagram.jpg"
Formula E: Know all about GEN3 Evo race car that’s dominating the track this season,https://timesofindia.indiatimes.com/sports/formula-e/formula-e-know-all-about-gen3-evo-race-car-thats-dominating-the-track-this-season/articleshow/120695369.cms,"What makes the GEN3 Evo a revolutionary leap in

electric racing

The GEN3 Evo race car is tearing through the Formula E circuit in Season 11, redefining speed, agility, and performance. With lightning-fast acceleration, cutting-edge features, and a robust design, it has quickly become the dominant force on the track. For fans, it means electrifying action; for drivers, fierce new rivalries. In short, the GEN3 Evo is the future of racing.Faster, quicker, unstoppableThe GEN3 Evo can go from 0 to 60 mph in just 1.82 seconds (0-100 kph in 1.86s), making it 30% quicker than a current F1 car. With performance gains of 2%, it's not just fast — it’s engineered for excellence. It's also the world’s first net-zero carbon race car, with performance enhancements delivered through state-of-the-art software engineering.Aerodynamic body and enhanced gripSleek, sturdy, and more aerodynamic than ever, the GEN3 Evo is built for high-intensity, wheel-to-wheel racing. It features all-weather Hankook iON tires, offering 5–10% moe grip and crafted from 35% recycled and sustainable materials — a 9% improvement over the GEN3 specs.Top speedYes, you read that right. The GEN3 Evo clocks a top speed of 200 mph. With its 600 kW regenerative braking system, the car can generate nearly 50% of the energy required for a race — during the race itself. And thanks to its electric motor, it achieves over 95% energy efficiency.Battery and sustainabilityThis machine doesn’t just race — it respects the planet. Battery minerals are ethically sourced, and the chassis incorporates recycled carbon fiber and natural materials like linen. A groundbreaking new tech enables a 30-second, 600 kW high-speed mid-race charge, giving drivers a strategic energy boost when they need it most.Current Driver Standings for the seasonAt the top of the leaderboard is Nissan’s Oliver Rowland, leading the pack with 69 points. Hot on his heels is Antonio Felix da Costa of Tag Heuer Porsche, sitting in second with 54 points. Just behind is his teammate, Pascal Wehrlein, with 51 points — a score he shares with the youngest driver on the grid, Taylor Barnard, who continues to impress in his rookie season.Also Read: Formula E 2024-2025 driver standings so far: Oliver Rowland maintains lead, Antonio Felix Da Costa on second In fifth is Maximilian Günther, who despite winning Jeddah Part 1, has 37 points to his name. Further down the order, Mitch Evans, who began the season in style with a win in Sao Paulo, currently sits 10th in the standings.","The GEN3 Evo race car is tearing through the Formula E circuit in Season 11. With lightning-fast acceleration, cutting-edge features, and a robust design, it has quickly become the dominant force on the track. The car can go from 0 to 60 mph in just 1.82 seconds, making it 30% quicker than a current F1 car.","https://static.toiimg.com/thumb/msid-120695712,imgsize-962326,width-400,resizemode-4/Image-credit-Andretti/Instagram.jpg"
Mahindra Racing on a roll: Formula E Team surpasses its season 10 points total in just 5 races,https://timesofindia.indiatimes.com/sports/formula-e/mahindra-racing-on-a-roll-formula-e-team-surpasses-its-season-10-points-total-in-just-5-races/articleshow/120694956.cms,"Mahindra Racing Formula E team is set to achieve big things this year

Mahindra Racing is driving at an altogether different speed this season as the Formula E team has already surpassed their Season 10 points total in just five races. There are 11 more rounds to go, with the next in Monaco in May. And with such a wonderful performance this year, the Indian outfit is surely on the way to making history. Mahindra Racing drivers Edoardo Mortara and Nyck De Vries can rightfully take the credit for making the team reach a prominent place in the competition.Mahindra Racing’s achievement was highlighted by Formula E, which shared a post on Instagram to laud the team. The picture of team drivers Edoardo Mortara and Nyck De Vries was captioned: “What a turnaround from @MahindraRacing surpassing their Season 10 points total in the first 5 rounds,” along with clapping emojis.The team was struggling at just 47 points last season, but it has already made 51 points in 5 rounds out of 16 races. As a result, it’s in fifth position in the Teams' Standings this year. While Mortara stands at 8th position in the Drivers' Standings with 27 points, De Vries is at 11th position with 24 points.In its run so far in Formula E’s inaugural season, Mahindra Racing has participated in 136 races, out of which it has won just 5 and clinched 24 podiums. They are yet to win a pole position or a podium this season so far, but it's great going and good results are sure to follow.The current season has seen a lot of ups and downs already. It started on a strong note for the team as Mortara and De Vries managed to take 5th and 6th positions in the season opener Sao Paulo E-Prix, respectively. De Vries slipped to 8th position in the second race in Mexico, whereas Mortara failed to leave an impression. The two bounced back strongly at Jeddah E-Prix Round 1, where De Vries climbed to an impressive 4th position and Mortara finished 7th. But they once again slipped to 10th and 13th positions in Round 2.At the Miami E-Prix this month, Mortara once again bounced back by clenching 5th position, but De Vries finished 11th in the race. Team principal Frederic Bertrand is always seen encouraging the drivers and had written after the impressive Miami E-Prix, “We keep pushing, fighting, improving! Great job @mahindraracing this week-end in Miami! Both cars in top 10 on the grid - 100% duel in S11! - points again with P5/P11 at the end of the race - we scored points in 100% of races in S11, - we get to P5 in teams championship.”Also Read: Formula E 2024-2025 driver standings so far: Oliver Rowland maintains lead, Antonio Felix Da Costa on second “But more importantly, the team is now in full delivery mode, and the spirit is one of those which can make you face any challenge with confidence and calm. Bye Miami. Next stop Monaco!” he further added.",Mahindra Racing has surpassed their Season 10 points total in just five races. The Indian outfit is in fifth position in the Teams' Standings this year. Drivers Edoardo Mortara and Nyck De Vries can rightfully take the credit for making the team reach a prominent place.,"https://static.toiimg.com/thumb/msid-120694964,imgsize-812203,width-400,resizemode-4/Image-credit-Mahindra-Racing/Instagram.jpg"
Formula E founder Alejandro Agag honoured to be shortlisted for Reuters Global Energy Transition Award,https://timesofindia.indiatimes.com/sports/formula-e/formula-e-founder-alejandro-agag-honoured-to-be-shortlisted-for-reuters-global-energy-transition-award/articleshow/120650901.cms,"Alejandro Agag on being shortlisted for Reuters Award

Formula E founder Alejandro Agag is a frontrunner in bringing clean technology to the world of motorsports, creating sustainable car racing and paving the way for a broader global shift toward eco-friendly innovation. The rise in electric car sales around the world is just one example of this growing trend. In recognition of his tireless efforts, Agag has been shortlisted in the Transition Advocator category at the Reuters Global Energy Transition Awards 2025. The awards ceremony will take place in New York on June 24.Alejandro Agag said in a statement via FormulaE.com: ""To be recognised among the world's leading energy transition advocates is a huge honour. I’ve always believed that sport has the power to inspire change, and through motorsport, we’ve created a platform that pushes sustainable technologies forward while entertaining and educating at the same time. This nomination is not just a personal milestone, it’s a recognition of the entire ecosystem working behind the scenes to deliver innovation at speed.”Alejandro Agag has achieved what once seemed unimaginable in advancing the case for sustainable energy through motorsport. He founded Formula E, the all-electric equivalent of car racing, which has grown into a massive success—especially with the arrival of Gen3 Evo cars. Formula E is currently in its 11th season, featuring 16 races.Expanding on this mission, Agag launched Extreme E, an off-road SUV racing series held in climate-affected regions. He also introduced E1, the world’s first all-electric boat racing championship. E1 features RaceBirds, which reach high speeds using electric propulsion combined with foil technology.Next up is Extreme H, set to launch this year as the world’s first hydrogen-powered motorsport championship.Also Read: Formula E 2024-2025 driver standings so far: Oliver Rowland maintains lead, Antonio Felix Da Costa on second Formula E’s 11th season began in December last year and will conclude in July. The most recent race, Round 5, was held in Miami, with Pascal Wehrlein emerging as the winner. Rounds 6 and 7, a double-header, will take place in the motorsport hub of Monaco on May 3 and 4.","Alejandro Agag has been shortlisted for the Reuters Global Energy Transition Awards 2025. Agag founded Formula E, the all-electric equivalent of car racing. Formula E is currently in its 11th season, featuring 16 races. The awards ceremony will take place in New York on June 24.","https://static.toiimg.com/thumb/msid-120650910,imgsize-481291,width-400,resizemode-4/Image-credit-Alejandro-Agag/Instagram.jpg"
