Article Title,Article Link,Article Text,Article Summary,Article Image
Norman Nato shares July dump from Formula E and Endurance Championship but his daughter steals the show,https://timesofindia.indiatimes.com/sports/formula-e/norman-nato-shares-july-dump-from-formula-e-and-endurance-championship-but-his-daughter-steals-the-show/articleshow/123124362.cms,"Norman Nato (Image credit: Instagram)

Norman Nato shows a glimpse of his friends and family

How Norman Nato spent his July

Norman Nato has been making the most of the long break after the end of Formula E Season 11. He was recently spotted chilling with Nissan teammate and Formula E championship winner Oliver Rowland. Nato has now shared a bunch of candid pictures to show a glimpse of how he spent July with his family, friends, and on the track. But it is his daughter who is the star of his post.Norman Nato shared the bunch of pictures with just a one-word caption: “July.” He did add emojis of a Formula E car, sun, octopus, lemon, and camera to hint at the July mohod. The star of the pictures was his baby girl, as he spent several candid moments with her, including one from the races.Car racer Will Stevens commented on the post, “Good collection this month.” Nato replied to him sarcastically, “First time you deserve to be in my carousel.” Another racer, Alex Lynn, wrote, “This love.” One more racer, Tom Blomqvist, commented, “Proud I made the cut.” Racer Sean Gelael wrote, “NN Style.”Nissan also reacted to the post with raising hands emojis.Norman Nato participates in both Formula E and the Endurance Championship.He races for Nissan in Formula E and had a disappointing season this time. In the last race, however, he finished ninth and eleventh at the London double-header. The French racer finished in 20th place in the Driver Sandings with just 21 points. He did win a pole this season.His teammate Oliver Rowland had the best season ever, as he went on to win the Formula E World Championship. The two, however, can celebrate Nissan finishing third in the Teams and Manufacturer Championship.Summing up Formula E Season 11, Nato had written a small note on Instagram along with a few pictures. He wrote, “That’s a wrap for Season 11 of @fiaformulae. Top 3 in the team and manufacturer championship. Big congrats to my mate @oliverrowland1 for a very impressive season. Massive thanks to all the team for the hard work. Merci @nismo.”Also Read: Oliver Rowland and Norman Nato chill on a beach after Formula E Season 11 ends, see photos He did very well in the Endurance Championship. He races for Cadillac Hertz Team Jota in the Hypercar category. He had skipped the Berlin E-Prix to participate in the Endurance Championship. He won the Sao Paulo edition of the Endurance Championship this season and currently stands third.",Norman Nato has shared a bunch of candid pictures of how he spent July. The French racer races for Nissan in Formula E and the Endurance Championship. Nato finished in 20th place in the Driver Sandings with just 21 points. His teammate Oliver Rowland had the best season ever.,"https://static.toiimg.com/thumb/msid-123124374,imgsize-82550,width-400,resizemode-4/123124374.jpg"
"Maximilian Gunther spends time with girlfriend Anaju Dorigon, reflects on a mixed ride this season",https://timesofindia.indiatimes.com/sports/formula-e/maximilian-gunther-spends-time-with-girlfriend-anaju-dorigon-reflects-on-a-mixed-ride-this-season/articleshow/123121146.cms,"Maximilian Gunther with girlfriend Anaju Dorigon (Image credit: Instagram)

Maximilian Gunther sums up Formula E Season 11

Maximilian Gunther spending time with girlfriend

Maximilian Gunther’s performance in Formula E Season 11

Maximilian Gunther had a topsy-turvy ride in Formula E Season 11 with two wins and six retirements out of 16 races. The DS Penske driver, however, chooses to count only the positives and looks determined for the upcoming season. The German driver still put up a decent performance this season as he finished in 10th position in the Formula E Championship, which saw many new winners and pole sitters. At present, Gunther is spending most of his time with girlfriend Anaju Dorigon.Maximilian Gunther shared a post after the last race of the season in London. Sharing a few pictures from the ExCeL Circuit, Gunther wrote, “We really gave it our all yesterday. Starting from P2, we had everything to play for, but having the Full Course Yellow and Safety Car at the same time as both of our Attack Modes very much compromised our strategy. At the end, P7 was the best we could do. Thank you @ds_penske_fe and @dsperformance for an unforgettable season with wins, poles, and everything in between. We are only just starting!”The pictures also included one of Maximilian Gunther with his girlfriend Anaju Dorigon, who was present in London to cheer for the DS Penske driver.Anaju Dorigon is an actor and social media influencer. She occasionally posts pictures with Maximilian Gunther from their outings on Instagram. She recently celebrated her birthday and shared a picture with Gunther from their birthday date. It showed Gunther sitting by her side as she blew a firecracker candle placed on a small cake.She wrote along with it, “A few from these days! There were so many beautiful messages, how lucky I am to share this journey with you.”She also shared a glimpse of her and Gunther’s red carpet appearance at a gala in London.Also Read: Dan Ticktum plays piano, reveals reason for learning: “I will not elaborate for fear of being arrested” Maximilian Gunther had mixed results throughout Formula E Season 11. He registered a win in Jeddah and then in Shanghai. But otherwise, he couldn’t finish even among the top five in any of the remaining races. He had to retire from as many as six races this season. He still managed to take 10th position in the 2025 Formula E Driver Standings. He tied with Cupra Kiro driver Dan Ticktum, who earned similar points this season.","Maximilian Gunther had a topsy-turvy ride in Formula E Season 11 with two wins and six retirements out of 16 races. The DS Penske driver still put up a decent performance as he finished in 10th position in the Formula E Championship. At present, Gunther is spending most of his time with girlfriend Anaju Dorigon.","https://static.toiimg.com/thumb/msid-123121138,imgsize-34076,width-400,resizemode-4/123121138.jpg"
"Oliver Rowland cheers for Formula 2 driver Arvid Lindblad at Hungarian Grand Prix, shares candid photo",https://timesofindia.indiatimes.com/sports/formula-e/oliver-rowland-cheers-for-formula-2-driver-arvid-lindblad-at-hungarian-grand-prix-shares-candid-photo/articleshow/123099549.cms,"Arvid Lindblad and Oliver Rowland (Image credit: Formula E)



Oliver Rowland shares candid photo from Hungaroring Circuit

Oliver Rowland shared a picture with Arvid Lindblad (Image credit: Instagram)

Oliver Rowland on his win in Formula E World Championship

Oliver Rowland has all the free time in the world after wrapping up Formula E Season 11 by winning the Formula E World Championship. The Nissan driver is not just chilling with family but also focusing on his student, Arvid Lindblad, who recently competed in the Formula 2 format of the Hungarian Grand Prix. Rowland has now shared a candid picture from the Hungaroring circuit as he and Lindblad had some fun after the race.Taking to his Instagram Stories, Oliver Rowland shared the candid picture featuring him and Arvid Lindblad sitting on a quad bike along with two others. He captioned the picture “Summer break,” while hinting at the three-month break for Lindblad and the months-long break for Rowland.Oliver Rowland has been a mentor to Arvid Lindblad, who competes in Formula 2 for Compos Racing as part of Red Bull Junior Team. Lindblad finished sixth in the Formula 2 Feature Race at the Hungarian Grand Prix and tenth in the Formula 2 Sprint this weekend.After the Hungarian Grand Prix, Arvid Lindblad wrote on Instagram, “The last few rounds have been tough. Saturday’s Sprint hurt — a win was there, and I let it slip. Yesterday, I came back fighting. Pace wasn’t quite there, but I raced hard and defended well. Now time for a reset and a much-needed break.”Meanwhile, Oliver Rowland is soaking in his success in Formula E Season 11. He said after sealing his Formula E Championship win in Berlin, “I’ve not had a chance for it to sink in. Part of me realizes what we’ve achieved, and I’m trying to digest it in a positive way and balance my emotions. From a mental health perspective, I feel a lot lighter, like a weight has come off my shoulders. It’s not something we drivers talk about very often, but the last few days have been a huge release of emotion and energy. It feels great. Even now, when I watch the videos back, I struggle to believe it’s actually done!”Also Read: Jake Dennis grabs podium in GT World Challenge, shares hilarious slip-up during champagne celebrations Formula E Season 12 will begin on December 6 with the Sao Paulo E-Prix in Brazil. Testing, however, will begin in October in Valencia. It will be the longest Formula E season, with 18 races to be held across 12 cities around the globe.","Nissan driver Oliver Rowland wrapped up Formula E Season 11 by winning the World Championship. Rowland has been a mentor to Arvid Lindblad, who competes in Formula 2 for Compos Racing as part of Red Bull Junior Team. The pair shared a candid picture from the Hungaroring circuit as they had some fun after the race.","https://static.toiimg.com/thumb/msid-123099548,width-400,resizemode-4/123099548.jpg"
"Jake Dennis, Pascal Wehrlein to Oliver Rowland: What’s common among the last three Formula E world champions",https://timesofindia.indiatimes.com/sports/formula-e/jake-dennis-pascal-wehrlein-to-oliver-rowland-whats-common-among-the-last-three-formula-e-world-champions/articleshow/123098373.cms,"Jake Dennis, Pascal Wehrlein and Oliver Rowland (Formula E)

What’s common between the three Formula E world champions

How the three World Champions fared in Formula E Season 11

Days after Oliver Rowland lifted his Formula E World Championship trophy in London this season, an interesting trend has come to the attention of Formula E and its fans. As a coincidence, all Formula E drivers who won the Mexico City E-Prix went on to win the Formula E World Championship that season, and this has been proved right for three consecutive years.Highlighting the same since 2023, a poster of three World Champions was shared on X by Formula E with the caption, “The trend continues. Each winner of the #MexicoCityEPrix from the past three seasons has gone on to become World Champion.”The special poster features 2023 Formula E World Champion Jake Dennis from Andretti, then TAG Heuer Porsche’s Pascal Wehrlein, who won in 2024, and the new World Champion, Nissan driver Oliver Rowland. All three of them won in the Mexico E-Prix and went on to lift the winner’s trophy in the Formula E World Championship that year.Oliver Rowland had strengthened his chances of winning the Formula E World Championship this year much earlier. He was leading the Formula E Driver Standings ever since he won Part 2 of the Jeddah E-Prix, which was his second win of the season after winning the Mexico E-Prix. In the last leg, the Nissan driver got nervous for a while as Pascal Wehrlein, who was following him in the number two position, closed the gap after grabbing quite a few podiums while Rowland had a dull period.Things became serious for Rowland when he failed to finish the Round 13 race in Berlin, while Wehrlein won second spot on the podium. But he eventually managed to confirm his championship in Berlin after four wins and three more podiums.Sharing about his bad race in Berlin, Rowland had said, “I was hoping before the weekend that the outcome could be [the World Championship], but after yesterday (Saturday) and this morning (Sunday), I was more worried that it might never come.”Also Read: Oliver Rowland reacts to daughter’s sweet radio message after Formula E Championship win: “It’s amazing” Things, however, changed for Wehrlein, who was pushed to third position after Nick Cassidy made a late entry in the Formula E Driver Standings by registering three consecutive wins. He was pushed from second place to third, with Cassidy in second. Wehrlein registered one win and five more podiums this season.Meanwhile, Andretti driver Jake Dennis finished in seventh position in the Formula E Driver Standings. He won two podium spots this season.","All three Formula E drivers who won the Mexico City E-Prix went on to win the Formula E World Championship that season. This has been proved right for three consecutive years. A poster of three World Champions was shared on X by Formula E with the caption, “The trend continues.”","https://static.toiimg.com/thumb/msid-123098362,imgsize-62062,width-400,resizemode-4/123098362.jpg"
"Jake Dennis grabs podium in GT World Challenge, shares hilarious slip-up during champagne celebrations",https://timesofindia.indiatimes.com/sports/formula-e/jake-dennis-grabs-podium-in-gt-world-challenge-shares-hilarious-slip-up-during-champagne-celebrations/articleshow/123079660.cms,"Jake Dennis (Instagram)

Jake Dennis shares a glimpse of the hilarious celebrations at GT World Challenge

Jake Dennis finished 7th in Formula E Season 11 World Championship

Jake Dennis wrapped up Formula E Season 11 and, instead of taking a breather, he headed straight to the GT World Challenge Europe Endurance Cup. He participated in the GT Challenge as part of the Paradine Competition team and ended up on the podium. Dennis has now shared a glimpse of the podium celebrations from the GT World race.Jake Dennis grabbed a podium spot at the GT World Challenge Europe Endurance Cup. Sharing a bunch of pictures and videos after the race on Instagram, Jake Dennis wrote, “Always good fun being back with the @paradine.competition guys! Darren takes the highlight of the weekend with the podium stumble! Thanks for all your efforts and I’ll see you all in Valencia!”The pictures showed Dennis and other podium winners sprinkling champagne when one of them slipped on the wet surface and ended up crashing into a chair. Though he wasn’t hurt, he continued to laugh over the incident.Jake Dennis’ fans were happy to see him on the podium. Reacting to his post, a fan wrote, “The struggles must be contagious but what a brilliant drive yesterday! Pity about today's race though.” Another said, “Congratulations on the podium — also, your ‘struggle’ is now passing on to your teammates I see.” One more commented, “Summed up the past couple of weeks pretty succinctly, this one.”A comment also read: “Great to see you on the podium. Well done.”Jake Dennis races for Andretti in Formula E and put up a decent performance in Season 11, which wrapped up in London recently. After claiming fourth position in the London E-Prix, Dennis wrote on Instagram, “And that’s a wrap! 15th to 4th is a great way to see off the season. Awesome race and some nice battles along the way. A thank you to everyone at Andretti for all their efforts — a roller coaster year, but we never stopped fighting. ”Dennis finished 7th in the 2025 Formula E Driver Standings. He won two podium spots in Formula E Season 11, one at the Monaco E-Prix and the other at the Berlin E-Prix.Also Read: Jake Dennis sums up season 11, shares moment with girlfriend Lexi Grace Boosey from London E-Prix Dennis and the other Formula E drivers will now return for Season 12, which begins with the testing season in Valencia in October. It will be the longest season ever, with 18 races to be held across 12 cities.",Jake Dennis finished 7th in Formula E Season 11 World Championship. He participated in the GT World Challenge Europe Endurance Cup. Dennis shared a glimpse of the podium celebrations from the race. The pictures showed Dennis and other podium winners sprinkling champagne.,"https://static.toiimg.com/thumb/msid-123079641,imgsize-74072,width-400,resizemode-4/123079641.jpg"
Taylor Barnard proud to have had a shot at Formula E runner-up: “One weekend doesn’t define the year we’ve had”,https://timesofindia.indiatimes.com/sports/formula-e/taylor-barnard-proud-to-have-had-a-shot-at-formula-e-runner-up-one-weekend-doesnt-define-the-year-weve-had/articleshow/123077979.cms,"Taylor Barnard (Image credit: Instagram)

Taylor Barnard on losing top three spot in Formula E World Championship

Fans hail Taylor Barnard for his fantastic rookie season

It was Taylor Barnard’s rookie season this year, and the NEOM McLaren driver put up a fantastic performance by temporarily making it to the top three in the Formula E Driver Standings by ousting the much more experienced Porsche driver Antonio Felix Da Costa. He was, however, ousted from the top three at the London E-Prix as Jaguar’s Nick Cassidy went on to register three consecutive wins. Barnard took to Instagram to share his feelings on losing out on the top three in his first-ever season and his claim to the championship.Taking to Instagram after the London E-Prix, Barnard wrote, “London wasn’t what we hoped for, easily being the toughest weekend of our season. Taking 0 points away as a team from a doubleheader hurts, but one weekend doesn’t define the year we’ve had.”He further wrote, “As the season closes, I want to say a massive thank you to the entire team, both trackside and behind the scenes, for everything this season. Finishing P4 in the Drivers’ Championship and coming into the final weekend with a shot at runner-up is something to be proud of.”Also adding a note for teammate Sam Bird, as NEOM McLaren withdrew from Formula E after the end of the season, Barnard wrote, “@sambird_official it wasn’t the weekend you deserved either.You’ve been a huge part of my season both on and off the track, and I’m grateful for everything. You deserved more. To all the Papaya fans, thank you for the incredible support in our final race together. You always go above and beyond. ”Reacting to his post, a fan wrote, “An incredible debut season, huge congrats and excited to see where you go next!” Another said, “I know I said it the other day, but you’ve been incredible to watch this last year and a pleasure to support you in Papaya — there are many of us that can’t wait to support you in whatever you do next!” One more commented, “You were incredible all season around, Taylor. Massive congratulations. You are the future of this sport.”Recalling Barnard’s maiden pole, a fan also wrote, “Fantastic season, Taylor, we'll never forget that Monaco pole.”Also Read: Taylor Barnard looks back at rookie season at McLaren: “Every step has been unforgettable” Barnard claimed five podiums in his first full season in Formula E. The 21-year-old finished the season with 112 points in the Formula E Driver Standings.",NEOM McLaren driver Taylor Barnard finished fourth in the Formula E Driver Standings. The 21-year-old claimed five podiums in his first full season in Formula E. Barnard took to Instagram to share his feelings on losing out on the top three.,"https://static.toiimg.com/thumb/msid-123077985,imgsize-43816,width-400,resizemode-4/123077985.jpg"
"Ian James pens farewell letter to fans as McLaren exits Formula E: ""We’ll cross paths again soon""",https://timesofindia.indiatimes.com/sports/formula-e/ian-james-pens-farewell-letter-to-fans-as-mclaren-exits-formula-e-well-cross-paths-again-soon/articleshow/123065466.cms,"Ian James with Taylor Barnard and Sam Bird (Image credit: Instagram)

McLaren team principal Ian James pens open letter to fans

What’s next in Formula E?

Team Principal Ian James of the departing Formula E team NEOM McLaren has penned an open letter to the fans of the team, marking their departure from the electric motorsport format. Addressing the Papaya Army, James thanked them for their trust and support as the team went on to win two Drivers’ World Championships and two Teams’ World Championships over 103 races in seven seasons.Ian James began the letter saying that he wrote it with “a huge amount of pride, as well as with more than a hint of sadness,” as the team closed the final chapter after seven years of competing in the ABB FIA Formula E World Championship.Thanking the fans for their love on social media and at the track, he said, “The team was always blown away by the amount of papaya we saw at circuits across the world, race-in, race-out, right from our very first round as the NEOM McLaren Formula E team. Through the early days, the good days, the bad days, and the great days, we have always felt an overwhelming amount of support from you all.”For the partners associated with the team, he wrote, “They say that ‘racing is a state of mind’, and since its inception, this team has had the privilege of working for organisations, with partners, and racing for fans who fully embrace this philosophy.This is certainly true of those at McLaren, whose passion for racing is second to none.”“My heartfelt thanks go out to everyone who has been involved: those at McLaren who backed us, the fans who supported us, and the partners who allowed us to go racing. We couldn’t have done it without you all — your trust and support have never been taken for granted,” he added.Praising the two McLaren drivers, he wrote, “Sam clinched McLaren’s first-ever fully electric win at the São Paulo E-Prix in Season 10, pulling off one of Formula E’s all-time great overtakes, before being waved across the line by none other than Emerson Fittipaldi – McLaren's first Formula 1 World Champion. While Taylor has been a rookie sensation in Season 11, securing five Formula E records, including the youngest driver to start a race, the youngest points scorer, the youngest driver to lead a lap, the youngest podium finisher, and the youngest polesitter. ”He ended the letter saying, “Some of us have been together since the day we first launched this team, while others have seamlessly fitted in along the way and flourished within the environment we have cultivated. For many, I am sure that we will cross paths again soon, but whatever the future holds for those here at Bicester, whatever path they choose to follow, I have no doubt that it will be bright. Their potential is limitless. ”Reacting to the open letter on Instagram, Taylor Barnard wrote, “It’s been an honour to wear Papaya and represent this team.” Sam Bird also dropped a heart emoji and a hands-joined-in-prayer emoji in the comments section.Also Read: Taylor Barnard looks back at rookie season at McLaren: “Every step has been unforgettable” Neither Taylor Barnard nor Sam Bird has revealed their future course of action in Formula E Season 12. It will begin on December 6, 2025, with the Sao Paulo E-Prix. It will be the longest season, with 18 races across 12 cities.",McLaren team principal Ian James pens open letter to fans of NEOM McLaren. James thanks them for their trust and support as the team went on to win two Drivers' World Championships and two Teams’ World Championships over 103 races in seven seasons. Taylor Barnard and Sam Bird have not revealed their future course of action.,"https://static.toiimg.com/thumb/msid-123065473,imgsize-50490,width-400,resizemode-4/123065473.jpg"
