Article Title,Article Link,Article Text,Article Summary,Article Image
"""Date with the guy"": Podcaster discovers a different side of Dianna Russini amid Mike Vrabel fallout",https://timesofindia.indiatimes.com/sports/nfl/news/date-with-the-guy-podcaster-discovers-a-different-side-of-dianna-russini-amid-mike-vrabel-fallout/articleshow/131576190.cms,"Football Podcaster discovers a different side of Dianna Russini amid Mike Vrabel fallout(Getty Images)

Dianna Russini's old basketball clip showcases an athletic side that many fans have never seen

Why Mike Vrabel and Dianna Russini continue to dominate headlines







""It will probably last the whole year, and questions will be asked all season long."" Former NFL player Dexter Jackson offered that prediction while speaking to Betway about the fallout surrounding Dianna Russini and Mike Vrabel. Days later, his words continue to ring true. Every new development seems to pull the former NFL insider and the New England Patriots coach Mike Vrabel back into the spotlight.This time, though, it is not another report or public statement making waves. Instead, a long-forgotten basketball video featuring Dianna Russini has suddenly caught the attention of NFL fans. The clip quickly spread across social media, sparking jokes, questions, and plenty of reactions from people surprised to see a very different side of the longtime football reporter.The video surfaced this week after football podcast host Tony Farmer shared footage from a charity basketball game involving Dianna Russini.The play itself was fairly simple. Russini stepped in front of an opposing player and took a charge, sending her to the floor. But what happened next is what got people talking.After getting up, Dianna Russini struck a playful pose, turning an ordinary basketball sequence into a viral social media moment.Almost immediately, fans flooded the comments section. ""I wonder if she made a date with the guy that nailed her,"" one folk joked.Another said, “She’s so athletic, have you ever seen her catch with Rex Ryan? Sick.”Others seemed more fascinated by the fact that somebody managed to locate the clip years later. ""WHO finds this?? Who has this saved?? 😭😭😭"" one fan wrote.Another commenter asked the same thing. ""How do you even find this 😭""Meanwhile, one user credited the person who dug up the footage. ""Lol, your level of trolling is an all-time high. Cracks me up though!""Another fan focused on Russini's reaction after the collision. ""Of course she'd get up like that 😂""The comments kept piling up as the video made rounds across NFL pages and sports accounts. For many viewers, it was their first glimpse of Russini outside her reporting role.The renewed attention comes less than two months after Dianna Russini resigned from The Athletic on April 14. The resignation followed a series of reports involving Russini and Patriots head coach Mike Vrabel. The story first gained national attention on April 7 when Page Six published photos showing the two together at a luxury resort in Sedona, Arizona.At the time, both pushed back against speculation. Russini said the images lacked context and did not accurately reflect the situation. Mike Vrabel also described the encounter as an innocent interaction.The story took another turn later in April when additional photos allegedly showing the pair together in New York in 2020 and at a Mississippi casino in 2024 surfaced online.On April 23, Mike Vrabel addressed the situation during a press conference. While he did not mention Dianna Russini by name, he acknowledged that his actions had created a distraction for his family, the Patriots organization, and the football team. He also announced plans to seek counseling and spend time with his family during NFL Draft weekend.Since then, nearly every update connected to either Dianna Russini or Mike Vrabel has generated discussion. This week, that attention came from an unexpected place. A brief basketball moment from years ago suddenly became the latest viral chapter in a story that still refuses to fade from the NFL spotlight.","Dianna Russini's old basketball clip showcases an athletic side that many fans have never seen. The clip quickly spread across social media, sparking jokes, questions, and plenty of reactions. The renewed attention comes less than two months after Russini resigned from The Athletic.","https://static.toiimg.com/thumb/msid-131576265,imgsize-53802,width-400,height-225,resizemode-4/mike-vrabel-and-dianna-russini.jpg"
Taylor Swift and Travis Kelce's Madison Square Garden wedding price tag will leave you completely speechless,https://timesofindia.indiatimes.com/sports/nfl/news/taylor-swift-and-travis-kelces-madison-square-garden-wedding-price-tag-will-leave-you-completely-speechless/articleshow/131576223.cms,Taylor Swift and Travis Kelce's Madison Square Garden wedding price tag will leave you completely speechless,Taylor Swift and Travis Kelce are getting married at Madison Square Garden. The wedding will take place on November 14. The couple are reportedly planning a $1 billion wedding. The ceremony will be held at the Garden on November 15. The reception will be on November 16.,"https://static.toiimg.com/thumb/msid-131576260,imgsize-50912,width-400,height-225,resizemode-4/travis-kelce-taylor-swift.jpg"
"""At Least 10 Years"": Dianna Russini's alleged relationship with Mike Vrabel was reportedly known inside the NFL for at least 10 years",https://timesofindia.indiatimes.com/sports/nfl/news/at-least-10-years-dianna-russinis-alleged-relationship-with-mike-vrabel-was-reportedly-known-inside-the-nfl-for-at-least-10-years/articleshow/131566008.cms,"Did Mike Vrabel and Dianna Russini’s relationship extend back a decade?

Why are Froyd’s comments drawing renewed attention?







The Mike Vrabel-Dianna Russini controversy has drifted out of the daily NFL news cycle in recent weeks, but fresh comments from former USA Today reporter Crissy Froyd have pushed the story back into public view. Speaking on The Howard Eskin Show, Froyd made new claims about the alleged timeline of the relationship that has dominated league circles since April. Her remarks arrived months after photos, videos, and reports sparked widespread scrutiny of both figures, leading to Russini’s resignation from The Athletic and raising broader questions about media and NFL workplace boundaries.Froyd’s most striking allegation centered on how long she believes the relationship had been known within NFL and media circles.When host Howard Eskin asked, “How far back do you think people knew that this was going on between Dianna Russini and Mike Vrabel?”, Froyd responded bluntly.“At least 10 years,” Froyd replied. “At least 10 years. I would assume… for what I know between her and him and certainly for what I know about her, at least 10 years.”Her comments went further than previous public reporting, which has largely focused on photos and videos dating from 2020 and 2021.Froyd suggested that what troubled her most was not simply the alleged relationship itself, but what she described as an open secret among people connected to the league.“The biggest thing to me was the way that everyone knew and no one did anything about it, and it was obvious. To me, the worst part of it was… I would almost feel bad for her if she, like, fell in love for six months and made these horrible mistakes and she owned up to it ‘cause everybody makes mistakes in their lifetime… But you don’t make the same mistake for six years, 10 years, anything of that longevity whatsoever,” she added.However, Froyd did not provide evidence supporting her assertion that the relationship stretched back a decade. As of now, the claim remains unverified.Part of the interest stems from Froyd’s insistence that she faced professional consequences for speaking publicly about matters that, according to her, many insiders already knew.During the interview, she also criticized Russini’s since-deleted X account, saying, “The way that she had deleted her Twitter account and it appeared, at least the way I took it and the way that most people took it, that she had been like covertly bragging on that. I mean, it’s disgusting.”Froyd has continued making similar arguments in recent months. In a Daily Mail column, she claimed multiple female reporters privately told her about relationships with NFL personnel, suggesting such situations may be more common than publicly acknowledged.For now, the controversy remains largely fueled by allegations, leaked images, and competing narratives rather than confirmed new evidence. Yet with Vrabel expected to face reporters regularly as the season approaches, the issue may not disappear entirely. Questions that faded during the offseason could return once training camp begins and media attention intensifies.","Former USA Today reporter Crissy Froyd made new claims about the alleged timeline of the relationship that has dominated league circles since April. She suggested that what troubled her most was not the alleged relationship itself, but what she described as an open secret among people connected to the league.","https://static.toiimg.com/thumb/msid-131566380,imgsize-70166,width-400,height-225,resizemode-4/mike-vrabel-dianna-russini.jpg"
NFL Trade Rumors: Philadelphia Eagles linked to blockbuster trade for $20 Million Las Vegas Raiders star,https://timesofindia.indiatimes.com/sports/nfl/news/nfl-trade-rumors-philadelphia-eagles-linked-to-blockbuster-trade-for-20-million-las-vegas-raiders-star/articleshow/131575817.cms,"Rumors are growing around a potential blockbuster trade between the Philadelphia Eagles and Las Vegas Raiders involving five-time Pro Bowler Maxx Crosby. ESPN analyst Bart Scott believes Eagles GM Howie Roseman could make another aggressive move after missing out on Myles Garrett. While the Raiders are not actively shopping Crosby, Philadelphia reportedly remains interested if Las Vegas struggles early this season.

Category Details Player Maxx Crosby Current Team Las Vegas Raiders Rumored Team Philadelphia Eagles Contract Status Under contract Salary Cap Hit Reportedly among Raiders’ highest defensive cap figures Trade Likelihood Moderate but uncertain Latest Insider Update Bart Scott believes Eagles could make a major push Potential Return Nolan Smith, draft picks, additional assets

Which teams are interested in Maxx Crosby?

What insiders are saying about the trade rumors

Contract details and salary cap implications

How the trade could impact both teams







Rumors linking the Philadelphia Eagles to Las Vegas Raiders star Maxx Crosby picked up steam this week after ESPN analyst Bart Scott suggested Howie Roseman could already be preparing another blockbuster move. Crosby is entering the season with a contract carrying a significant cap figure, and despite questions around his recent knee issue, league chatter around a possible Eagles pursuit has not disappeared.Philadelphia has become the loudest team connected to Crosby, largely because of Roseman’s aggressive offseason approach. The Eagles already strengthened their roster with headline moves, including the addition of Jonathan Greenard, but league executives still believe the front office is searching for another elite pass rusher.The Eagles’ interest is not coming out of nowhere. Reports recently revealed that Philadelphia aggressively pursued Myles Garrett before the Cleveland Browns ultimately sent him to the Los Angeles Rams. During those talks, the Eagles were reportedly willing to discuss Nolan Smith or Jalyx Hunt alongside draft compensation.That history matters because Crosby fits the same profile Philadelphia has targeted for years.He is productive, relentless and capable of changing games without needing heavy blitz support. Pairing him with the Eagles’ current defensive front would immediately give the team one of the NFL’s deepest pass-rushing groups.There are still questions about whether any other contenders could enter the conversation. Teams needing edge help will monitor the Raiders closely if their season starts poorly. For now, though, Philadelphia appears to be the franchise most strongly tied to the five-time Pro Bowler.Bart Scott added fuel to the speculation during an ESPN discussion about the growing competition among NFC contenders.“Listen, I know Howie Roseman, and I see a big move coming. I’m telling you guys. A big move is coming. Roseman always has a plan. I believe that Roseman is gonna take this (cap) space that he has. I think Maxx Crosby is going to Philadelphia. I think Nolan Smith is the player to trade. The arms race is just beginning.”Scott also connected the possibility directly to the recent Garrett trade, suggesting elite pass rushers are becoming the latest priority among Super Bowl contenders trying to outmatch each other defensively.Crosby remains under contract with the Raiders, which gives Las Vegas control over any negotiations. There is no indication he has requested a trade, and the organization has publicly continued to support him as a franchise cornerstone.The financial side complicates any potential deal. Crosby carries a major cap commitment, meaning Philadelphia would need to balance future flexibility while also preparing for upcoming extensions across the roster.There is also the lingering concern surrounding his knee after the Baltimore Ravens reportedly backed away from a previous trade agreement because of a failed physical. Rival teams will likely want updated medical evaluations before making a serious offer.For Philadelphia, adding Crosby would send a clear message that the franchise is fully committed to chasing another Super Bowl immediately. The Eagles already possess one of the NFL’s strongest defensive fronts, and Crosby could elevate the unit into a weekly nightmare for opposing quarterbacks.Las Vegas would face a different reality. Trading Crosby would likely signal a larger roster reset focused on younger talent and future draft capital. A package involving Nolan Smith and premium picks could help accelerate that process.Still, unless the Raiders struggle badly early in the season, league sources believe Las Vegas will continue resisting calls about their star defender. For now, the speculation remains exactly that. But around the NFL, people have learned not to dismiss a major Howie Roseman move too quickly.","ESPN analyst Bart Scott believes Eagles GM Howie Roseman could make another aggressive move after missing out on Myles Garrett. Crosby is entering the season with a contract carrying a significant cap figure. Philadelphia has become the loudest team connected to Crosby, largely because of Roseman's aggressive offseason approach.","https://static.toiimg.com/thumb/msid-131575817,imgsize-61316,width-400,height-225,resizemode-4/131575817.jpg"
"""Just go away"": Kayla Nicole brutally slammed online as fans accuse her of clinging to Travis Kelce and Taylor Swift headlines",https://timesofindia.indiatimes.com/sports/nfl/news/just-go-away-kayla-nicole-brutally-slammed-online-as-fans-accuse-her-of-clinging-to-travis-kelce-and-taylor-swift-headlines/articleshow/131566500.cms,"Kayla Nicole’s latest interview sparked major backlash online as fans linked her comments to Travis Kelce and Taylor Swift’s rumored wedding. While Kayla insisted she is focused on dating and new opportunities, critics accused her of staying attached to the celebrity couple’s spotlight. Social media quickly erupted, with some fans demanding she “move on,” while others defended her against clickbait-driven attacks.

Kayla Nicole says she is “single as a dollar bill” while embracing new opportunities

Fan reactions explode over Kayla Nicole and Travis Kelce discourse







Kayla Nicole walked into a red carpet interview expecting to talk about her career, dating life, and future projects. Instead, the conversation quickly exploded online because of one unavoidable topic: her past relationship with Travis Kelce and the nonstop attention surrounding his rumored wedding plans with Taylor Swift The influencer’s latest TMZ appearance has now triggered a fresh wave of fan reactions across social media. Some defended her right to move forward publicly, while others accused her of keeping herself tied to headlines connected to Kelce and Swift. The divide turned especially heated after viral comments on X began circulating alongside clips from the interview.During the interview, Kayla Nicole made it clear she is enjoying her current phase of life and is not rushing into anything serious. She described herself as “single as a dollar bill” while explaining that she is casually dating and exploring new opportunities in entertainment.The appearance focused heavily on her expanding media presence. She spoke about her podcast work, joked about entering her “video vixen season,” and even discussed potentially hosting a dating show one day. She also touched on sharing the stage with Toni Braxton and appearing in a Chris Brown music video, signaling that she is leaning deeper into entertainment and pop culture visibility.Even though TMZ referenced the ongoing attention surrounding Travis Kelce and Taylor Swift, Kayla’s actual comments centered on her own future. Still, the timing immediately fueled online speculation because wedding rumors around Kelce and Swift continue to dominate celebrity sports coverage.The strongest reactions came after one fan criticized Kayla Nicole under the TMZ post, writing:“I just want Kayla Nicole go away. I am not even a huge fan of Taylor Swift but enough is enough. I myself was up and down with Taylor’s relationship with Travis Kelce and I was questioning them but Kayla just looks like a looser every single time she is still taking about Travis. She just has to move on with her own life.”Another user pushed back against that narrative and defended Kayla, replying:“You just embarrassed yourself by showing how gullible you are to clickbait headlinesNowhere in the video did she talk about either of them.I know the fantasy of Kayla Nicole being bothered by their relationship makes the boring ship interesting but y'all need to let it go!”The exchange quickly gained traction because it reflects the larger split inside the fandom. Some viewers believe every Kayla Nicole interview becomes linked to Travis Kelce and Taylor Swift whether she mentions them or not. Others think the public fascination continues because fans remain deeply invested in every chapter connected to the high-profile relationship.","Kayla Nicole’s latest interview sparked major backlash online as fans linked her comments to Travis Kelce and Taylor Swift's rumored wedding. While Kayla insisted she is focused on dating and new opportunities, critics accused her of staying attached to the celebrity couple's spotlight. The divide turned especially heated after viral comments on X began circulating alongside clips from the interview.","https://static.toiimg.com/thumb/msid-131566500,imgsize-55502,width-400,height-225,resizemode-4/131566500.jpg"
Patrick Mahomes’ recovery takes dramatic turn as Andy Reid breaks silence on shocking Week 1 return possibility,https://timesofindia.indiatimes.com/sports/nfl/news/patrick-mahomes-recovery-takes-dramatic-turn-as-andy-reid-breaks-silence-on-shocking-week-1-return-possibility/articleshow/131566184.cms,"Andy Reid offered a hopeful update on Patrick Mahomes’ recovery from ACL and LCL surgery, saying he would not “bet against” the Chiefs quarterback returning for Week 1. Mahomes has resumed limited practice work while wearing a knee brace, though Kansas City remains cautious with his rehab. The Chiefs also added Justin Fields as insurance while Mahomes continues progressing through recovery checkpoints ahead of the 2026 season opener.",Andy Reid said he would not ‘bet against’ Patrick Mahomes returning for Week 1. Mahomes has resumed limited practice work while wearing a knee brace. The Chiefs also added Justin Fields as insurance while Mahomes continues progressing through recovery checkpoints.,"https://static.toiimg.com/thumb/msid-131566184,imgsize-40502,width-400,height-225,resizemode-4/131566184.jpg"
"""They’re going to go after her and sue her"": Dianna Russini controversy explodes after analyst suggests lawsuit from The Athletic",https://timesofindia.indiatimes.com/sports/nfl/news/theyre-going-to-go-after-her-and-sue-her-dianna-russini-controversy-explodes-after-analyst-suggests-lawsuit-from-the-athletic/articleshow/131565964.cms,"The controversy surrounding Mike Vrabel and former NFL insider Dianna Russini intensified after sports radio analysts suggested The Athletic could potentially sue Russini if allegations involving fake expense reports are proven true. The scandal gained traction following reports and photos linking Russini and Vrabel during private trips. While Russini has not accepted the allegations, the growing investigation and public debate continue fueling one of the NFL offseason’s biggest controversies.

Mike Vrabel and Dianna Russini controversy takes another dramatic turn

The Athletic under pressure as NFL scandal keeps growing







The controversy surrounding Mike Vrabel and former NFL insider Dianna Russini continues to spiral, and now the conversation is moving far beyond rumors about a personal relationship. Fresh debate erupted after sports radio analysts suggested The Athletic could potentially pursue legal action if allegations tied to expense reports are proven true.What began as tabloid speculation has now become one of the NFL offseason’s most talked-about scandals. Public interest exploded after photos surfaced showing Vrabel and Russini spending time together during a trip to an upscale Arizona resort. Since then, the fallout has only intensified, especially after reports claimed Russini resigned from The Athletic during an internal investigation into her conduct.The latest wave of attention came after analysts on Boston sports radio station 98.5 The Sports Hub discussed rumors surrounding the investigation. During the segment, NFL podcaster Tony Farmer was referenced as someone who claimed a colleague at The Athletic said findings from the probe could be released within weeks.That discussion quickly turned serious when one analyst floated the possibility of financial misconduct becoming part of the story.“Fake expense reports submitted for travel to be with Vrabel and not doing her job. She could have been putting those in all the time and getting reimbursed for fake expenses,” Frank said. “I’d go after that for sure.”The comments immediately sparked strong reactions online. Critics questioned whether the accusations crossed into dangerous territory without public evidence, while others argued that a media company would have to investigate every possible angle if money and company resources were involved.When another host asked whether The Athletic should publicly reveal its findings, Frank doubled down.“If they’re going to go after her and sue her, for them to get it back, absolutely,” Frank replied.The conversation also shifted toward the organizations connected to Russini’s career. Radio host Marc Bertrand argued that The Athletic and ESPN could face criticism for not addressing rumors sooner.“She was working for you while this was going on. You hired her while this was going on,” Marc Bertrand said. “ESPN is involved in this in a way, too. Like, you know, they’ve skated. She worked for The Athletic when this happened, but before that, she had been working for ESPN while this stuff was going on. You know, they’ll have nothing to say. They’re smart. They’ve stayed below the radar on this one, pretending that none of it has happened. ”Meanwhile, public fascination with the story keeps growing as older reports about alleged meetings, vacations, and private outings continue resurfacing online. Russini has not publicly accepted the allegations tied to the controversy. Vrabel initially dismissed the situation as “laughable” before later admitting he had fallen short of his own standards.With speculation building around the investigation’s reported findings, many across the NFL world are now waiting to see whether this story fades away or becomes an even bigger legal and media firestorm.","Sports radio analysts suggested The Athletic could potentially sue Russini if allegations involving fake expense reports are proven true. The scandal gained traction following reports and photos linking Russini and Vrabel during private trips. While Russini has not accepted the allegations, the growing investigation and public debate continue fueling the controversy.","https://static.toiimg.com/thumb/msid-131565964,imgsize-32194,width-400,height-225,resizemode-4/131565964.jpg"
