Article Title,Article Link,Article Text,Article Summary,Article Image
'He won’t be the same player if he…': Former India cricketer bold verdict on Virat Kohli,https://timesofindia.indiatimes.com/sports/cricket/news/he-wont-be-the-same-player-if-he-former-india-cricketer-bold-verdict-on-virat-kohli/articleshow/123315852.cms,"Virat Kohli of India (Photo by Francois Nel/Getty Images)

Virat Kohli on why did he retire from Test cricket: 'It's time when you...'

Go Beyond The Boundary with our YouTube channel. SUBSCRIBE NOW!

Poll Do you think Virat Kohli's aggression is essential to his success as a player? Yes, it defines his playing style No, he should tone it down It doesn't matter, his skills are enough Not sure

Former Indian cricketer S Sreesanth has shared his views on Virat Kohli 's aggressive playing style and reflected on his own career experiences during a conversation with sports commentator Padamjeet Sehrawat on his YouTube channel. Sreesanth , who was part of India's 2011 World Cup-winning team alongside Kohli , emphasized that Kohli's aggressive demeanor is essential to his success as a player.Sreesanth expressed his perspective on Kohli's on-field behavior, distinguishing between aggression and passion.""Nothing (on whether he would change anything). What others call aggression, I call it passion. Is Virat Kohli aggressive? No. I think he is obsessed. Virat's aggression, people say, is a lot. I would say if he reduces that aggression, he won't be the same player.""The careers of both cricketers took different paths following the 2011 World Cup victory. Kohli made his Test debut in the West Indies series, while Sreesanth did not participate in that tour.Sreesanth's final Test appearance for India came during the fourth Test against England in 2011, while Kohli's career continued to flourish.During the interview, Sreesanth also addressed the 2008 incident involving himself and Harbhajan Singh , where the latter slapped him after an IPL game in Mohali.The former pacer revealed how this incident affected his family, particularly his daughter's perception of Harbhajan Singh.""When I told my daughter, 'This is Bhajji pa, he's played with me', she straight away said, 'No, no, I won't say hi'. I couldn't understand why. In school, there may have been the odd conversation about it.""Sreesanth elaborated on his attempts to explain the situation to his daughter and his current perspective on the incident.""There are different stories doing the rounds. Then we tried explaining, but she said she still won't talk to him. The next day, when the legends tournament was going on, we explained that he was like our elder brother. I don't think Bhajji pa did that deliberately. It happened in the spur of the moment. It was just a learning experience for both of us.""The incident has since become a significant talking point in Indian cricket history, with Harbhajan Singh previously expressing his desire to erase that moment from his life during an episode of ""Kutti Stories with Ash.""Both Sreesanth and Harbhajan Singh were prominent figures in Indian cricket during their active playing days, contributing to various successes for the national team, including the 2011 World Cup victory.The 42-year-old Sreesanth's international career came to an end shortly after the 2011 World Cup, with his last ODI being the World Cup final and his final Test match coming against England later that year.Throughout the interview, Sreesanth maintained a reflective stance on his career and experiences, indicating that he wouldn't change anything about his journey in cricket, despite the various challenges and controversies he faced.The conversation highlighted the complex dynamics of professional cricket, from on-field aggression to personal relationships between players, and how these aspects continue to influence their lives even after their playing careers.",Former Indian cricketer S Sreesanth has shared his views on Virat Kohli's aggressive playing style. The 42-year-old was part of India's 2011 World Cup- winning team alongside Kohli. He also reflected on his own career experiences and the 2008 incident involving himself and Harbhajan Singh.,"https://static.toiimg.com/thumb/msid-123315963,imgsize-119588,width-400,resizemode-4/123315963.jpg"
"'My country, my identity, my life' – Gautam Gambhir’s powerful Independence Day message",https://timesofindia.indiatimes.com/sports/cricket/news/my-country-my-identity-my-life-gautam-gambhirs-powerful-independence-day-message/articleshow/123314900.cms,"India cricket team head coach Gautam Gambhir (Ben Whitley/PA via AP)

IND vs ENG: When Gautam Gambhir lost his cool at Oval pitch curator



Go Beyond The Boundary with our YouTube channel. SUBSCRIBE NOW!



Gautam Gambhir tweet on X

Poll How do you feel about Gautam Gambhir's impact as India's head coach so far? Very Positive Somewhat Positive Neutral Negative

On Independence Day Gautam Gambhir kept it simple but powerful. Posting a picture with the tricolour, he wrote, “My country, my identity, my life! Jai Hind!🇮🇳” — a message that resonated with fans across India. It was more than a patriotic caption; it was a reflection of a man whose cricketing journey has always been intertwined with the nation’s pride.Now serving as India’s head coach, Gambhir carries the same passion he once showed as an opener. His tenure, which began in July 2024, has already been full of highs, lows and intense scrutiny. In Test cricket, results have been mixed. India has played 15 Tests under him, winning five, losing eight and drawing two.The most recent Anderson-Tendulkar Trophy in England was a thrilling battle — India lost the first and third Tests, bounced back to win the second and final matches, with a high-scoring draw in Manchester sealing a 2-2 series result. It was a contest filled with tense finishes, resilient comebacks and moments that reminded fans of India’s fighting spirit.In white-ball cricket, Gambhir’s impact has been more immediate.India has dominated in T20Is, winning 13 out of 15 games, remaining unbeaten in series. ODIs saw an early stumble with a home series loss to Sri Lanka, but the team rebounded strongly, winning eight consecutive matches and lifting the 2025 Champions Trophy.Gambhir’s leadership style has sometimes drawn criticism for too much chopping and changing, but he remains steadfast in taking responsibility, famously saying, “We lose together, we win together.” For a man who scored 97 in the 2011 World Cup final and 75 in the 2007 T20 World Cup final, that sense of accountability and love for the country is nothing new. His Independence Day post was a reminder that, for him, cricket and patriotism have always gone hand in hand.","Gautam Gambhir's tenure as India's head coach has been full of highs, lows and intense scrutiny. India has played 15 Tests under him, winning five, losing eight and drawing two. In white-ball cricket, India has dominated in T20Is, winning 13 out of 15 games, remaining unbeaten in series.","https://static.toiimg.com/thumb/msid-123314896,imgsize-123194,width-400,resizemode-4/123314896.jpg"
"Arjun Tendulkar gets engaged to Saaniya Chandok - Pictures, net worth and everything you need to know",https://timesofindia.indiatimes.com/sports/off-the-field/arjun-tendulkar-gets-engaged-to-saaniya-chandok-pictures-net-worth-and-everything-you-need-to-know/articleshow/123314363.cms,"Arjun Tendulkar, Sara Tendulkar and Saaniya Chandok (Insta)

Who is Saaniya Chandok?

Go Beyond The Boundary with our YouTube channel. SUBSCRIBE NOW!

Saaniya’s professional role

Saaniya Chandok, Arjun Tendulkar and Sara Tendulkar. (X)

Arjun’s cricket career

Spot Saaniya in Sara Tendulkar ’s photos

Sara Tendulkar with her future sister-in-law Saaniya Chandok (on Sara’s right, wearing a green kurti) and other friends and family.

Sara Tendulkar and Saaniya Chandok (Sara-Insta)

Sara Tendulkar and Saaniya Chandok (Sara-Insta)

Sara Tendulkar and Saaniya Chandok (Sara-Insta)

Sara Tendulkar and Saaniya Chandok (Sara-Insta)

Arjun Tendulkar, the 25-year-old son of cricket legend Sachin Tendulkar , has reportedly become engaged to Saaniya Chandok in an intimate ceremony attended by close friends and family. The engagement marks a special moment for both families and has drawn warm attention from fans across social media.Saaniya Chandok comes from one of Mumbai’s most prominent business families. She is the granddaughter of industrialist Ravi Ghai, whose Graviss Group owns popular ice cream brands like The Brooklyn Creamery and operates Baskin Robbins in India.The family also manages the InterContinental hotel in Mumbai and other ventures in the hospitality and food sector. Graviss Food Solutions Private Limited, the parent company, reported revenue of ₹624 crore for the financial year 2023-24, showing a 20 percent growth over the previous year.Saaniya herself serves as Designated Partner and Director at Mr. Paws Pet Spa & Store LLP, a Mumbai-based venture she has been involved with since 2022. Despite her high-profile family background, she has maintained a low public profile, quietly supporting family businesses while preparing for her life with Arjun Arjun Tendulkar has been making his own name in cricket, following in his father’s footsteps while carving a unique path.A left-arm fast bowling all-rounder, he began his professional career with Mumbai in the 2020-21 season, making his T20 debut against Haryana. He later moved to Goa in the 2022-23 season, where he made his First-Class and List A debuts. Arjun made his IPL debut against Kolkata Knight Riders in the 2023 season at Wankhede.In red-ball cricket, he has played 17 matches, scored 532 runs including one century and two fifties, and taken 37 wickets with one five-wicket haul and two four-wicket hauls. In List A cricket, he has played 17 matches, scoring 76 runs. Arjun has also represented Mumbai Indians in the Indian Premier League, featuring in five matches.Recent pictures shared on Instagram offer a rare glimpse into the Tendulkar household. They show Sachin Tendulkar performing a pooja at home, accompanied by his wife Anjali, daughter Sara, and Saaniya Chandok, who stands to Sara’s right wearing a green kurti.Sara Tendulkar has also shared several photos with Saaniya on her Instagram, suggesting that the two may be close friends. The images capture a quiet, personal family moment while highlighting the growing bond between the Tendulkar and Ghai families ahead of the wedding.The engagement is a celebration of cricketing legacy meeting business prominence, and it reflects the private nature of both families. Fans have extended heartfelt congratulations to the couple as Arjun continues to pursue his cricketing career and Saaniya balances her responsibilities in the family business.","Arjun Tendulkar has reportedly become engaged to Saaniya Chandok. The engagement marks a special moment for both families and has drawn warm attention from fans across social media. Arjun has been making his own name in cricket, following in his father’s footsteps while carving a unique path.","https://static.toiimg.com/thumb/msid-123314716,imgsize-1246623,width-400,resizemode-4/123314716.jpg"
Watch: Fab 4 icons Joe Root and Kane Williamson reunite at Lord’s,https://timesofindia.indiatimes.com/sports/cricket/news/watch-fab-4-icons-joe-root-and-kane-williamson-reunite-at-lords/articleshow/123315272.cms,"Joe Root and Kane Williamson (The Hundred)

Go Beyond The Boundary with our YouTube channel. SUBSCRIBE NOW!

Poll Who do you think has had a more impactful career in Tests? Joe Root Kane Williamson

It was a moment that had cricket fans smiling – Joe Root and Kane Williamson sharing a friendly chat during The Hundred. The video, which has been making waves online, shows the two batting greats meeting at Lord’s before their respective sides took the field. While the competition on the pitch is fierce, this was a glimpse of the mutual respect that exists between two of the finest players of their generation.Both Root and Williamson are part of the famous “Fab Four” – a term used to describe the modern batting giants alongside Virat Kohli and Steve Smith . Over the years, they have built reputations not only on their remarkable records but also on their grace, sportsmanship, and ability to deliver in the toughest moments.In 2025, Root remains one of England’s most dependable batters, bringing his signature calmness and precision to every innings. Williamson, representing London Spirit in the tournament, continues to exude the same composure and tactical sharpness that have defined his career. Whether in whites or coloured kits, both have shown that class is timeless and format-proof.Their careers have been marked by extraordinary consistency.Root has amassed 13,543 Test runs in 158 matches at an average of 51, while Williamson’s 9,276 runs in 105 Tests at almost 55 reflect his mastery against all attacks.Seeing them together at Lord’s wasn’t just a meeting of two cricketers. It was a quiet celebration of skill, longevity, and the enduring bonds formed through years of competing at the very highest level. Moments like these remind fans why cricket is as much about respect as it is about rivalry.","Joe Root and Kane Williamson share a friendly chat during The Hundred. The video shows the two batting greats meeting at Lord's. Root has amassed 13,543 Test runs in 158 matches at an average of 51. Williamson’s 9,276 runs in 105 Tests at almost 55.","https://static.toiimg.com/thumb/msid-123315253,imgsize-1373227,width-400,resizemode-4/123315253.jpg"
Sanju Samson puts IPL teams on alert with fifty in KCA match on Independence Day,https://timesofindia.indiatimes.com/sports/cricket/news/sanju-samson-puts-ipl-teams-on-alert-with-fifty-in-kca-match-on-independence-day/articleshow/123329116.cms,"Sanju Samson (X)

Go Beyond The Boundary with our YouTube channel. SUBSCRIBE NOW!

Poll Should Sanju Samson be traded from Rajasthan Royals? Yes, he should be traded No, he should stay

On a night when cricket and Independence Day celebrations came together, Sanju Samson gave fans plenty to cheer. The Kerala star scored a fluent half-century in an exhibition match organised by the Kerala Cricket Association (KCA) at the Greenfield Stadium in Thiruvananthapuram. The timing could not have been better, coming just weeks before India’s squad for the Asia Cup 2025 is announced.The Greenfield lit up on Friday with its brand-new LED floodlights, which were inaugurated through a dazzling laser and music show. The exhibition clash, a curtain-raiser for the Kerala Cricket League Season 2, brought together two local sides. KCA President’s XI, led by Sachin Baby, faced off against KCA Secretary’s XI, which featured Samson.President’s XI posted 184 for 8, built on Rohan Kunnummal’s 29-ball 60 and Abhijith Praveen’s quick 47. Sharafudden was the pick of the bowlers, returning 3 for 25.Chasing, Secretary’s XI got off to a flying start with Vishnu Vinod hammering 69 off just 29 balls. After the early fireworks, Samson anchored the innings with a composed 54 off 36 deliveries. His dismissal with 13 runs still needed created late drama, but Basil Thampi cleared the ropes to secure a thrilling one-wicket win with two balls to spare.While the night was about cricketing joy, off-field developments continue to swirl around Samson. According to a Cricbuzz report, the Rajasthan Royals captain has asked to be traded or released ahead of IPL 2026. Multiple franchises are believed to be in discussions, with RR co-owner Manoj Badale personally leading talks. Although Chennai Super Kings were linked, their reluctance to part with big names like Ravindra Jadeja or Ruturaj Gaikwad has made such a deal unlikely.Shivam Dube’s name has been floated too, but CSK have no plans to release him. This leaves the door open for other franchises who are showing strong interest. There also remains the chance that Samson stays with the Royals if no trade materialises, despite reported differences with the management.For now, Samson’s future remains uncertain, but on the field he continues to remind everyone of his value with knocks like the one at Greenfield.",Sanju Samson scored a fluent half-century in an exhibition match. The match took place at the Greenfield Stadium in Thiruvananthapuram. The exhibition clash was a curtain-raiser for the Kerala Cricket League Season 2. Multiple franchises are believed to be in discussions with RR co-owner Manoj Badale.,"https://static.toiimg.com/thumb/msid-123329126,imgsize-974682,width-400,resizemode-4/123329126.jpg"
Historic! 21-year-old Jacob Bethell on brink of breaking 136-year-old England cricket record,https://timesofindia.indiatimes.com/sports/cricket/news/historic-21-year-old-jacob-bethell-on-brink-of-breaking-136-year-old-england-cricket-record/articleshow/123324167.cms,"Jacob Bethell (Photo by Gareth Copley/Getty Images)

Old Trafford cricket ground: A stadium tour of the iconic venue in Manchester

Who is Jacob Bethell?

England batter Jacob Bethell is set to create history by becoming England men's cricket team's youngest skipper at age 21, surpassing a record that has remained intact for 136 years.He will captain England's T20 squad in three matches against Ireland in Dublin.The record for England's youngest captain was previously held by Monty Bowden, who led the team at 23 in 1889 during a test match in South Africa, when the appointed captain Aubrey Smith was indisposed due to fever.The Ireland series will not feature several key players, including designated white-ball captain Harry Brook , who will be leading the ODI and T20 matches against South Africa in early September.""Jacob Bethell has impressed with his leadership qualities ever since he has been with the England squads, and the series against Ireland will provide him with the opportunity to further develop those skills on the international stage,"" England men's selector Luke Wright said in a statement on Friday.This captaincy appointment marks swift progress for Bethell, who only made his international debut across all formats last year.The series in Ireland commences on September 17.Jacob Bethell is a talented England cricketer, born in Barbados in 2003, who moved to England as a teenager and rose quickly through the ranks with Warwickshire.A left-handed batting all-rounder known for his aggressive stroke play and useful left-arm spin, he first made waves at the 2022 ICC Under-19 World Cup and debuted for England’s senior side in 2024.Now, at just 21, Bethell is set to captain England’s T20I team against Ireland, putting him on the cusp of breaking a 136-year-old record as the youngest men’s captain in the country’s history.","Jacob Bethell will captain England's T20 squad in three matches against Ireland in Dublin. The record for England's youngest captain was previously held by Monty Bowden, who led the team at 23 in 1889. The Ireland series will not feature several key players, including designated white-ball captain Harry Brook.","https://static.toiimg.com/thumb/msid-123324253,imgsize-58570,width-400,resizemode-4/123324253.jpg"
"MS Dhoni, Virat Kohli, Rohit Sharma — India's rare all-format captains",https://timesofindia.indiatimes.com/sports/cricket/news/ms-dhoni-virat-kohli-rohit-sharma-indias-rare-all-format-captains/articleshow/123323876.cms,"MS Dhoni, Virat Kohli and Rohit Sharma

Go Beyond The Boundary with our YouTube channel. SUBSCRIBE NOW!

MS DHONI

(2008–2017)

When will CSK legend MS Dhoni retire from IPL? Astrologer Greenstone Lobo predicts

MS Dhoni - captaincy record

Span 2007–2018 Matches 332 Won 178 Lost 120 Tied 6 Draw 15 No Result (NR) 13 Win/Loss Ratio (W/L) 1.48 % Wins 53.61 % Losses 36.14

VIRAT KOHLI

(2017–2021)

Virat Kohli- captaincy record

Span 2013–2022 Matches 213 Won 135 Lost 60 Tied 3 Draw 11 No Result (NR) 4 Win/Loss Ratio (W/L) 2.25 % Wins 63.38 % Losses 28.16

ROHIT SHARMA (2022–2024)

Rohit Sharma- captaincy record

Span 2017–2025 Matches 142 Won 103 Lost 33 Tied 2 Draw 3 No Result (NR) 1 Win/Loss Ratio (W/L) 3.12 % Wins 72.53 % Losses 23.23

NEW DELHI: In 2025, Indian cricket entered a new leadership phase, with three different captains across formats. Ahead of the five-Test series in England, Rohit Sharma announced his retirement from Test cricket, paving the way for Shubman Gill to take over as India’s red-ball skipper. Gill’s first assignment as Test captain came in the high-profile England tour. While Rohit continues to lead the ODI side, Suryakumar Yadav has been entrusted with the T20I captaincy.But has India ever had one captain leading all three formats?The answer is yes — on multiple occasions.Mahendra Singh Dhoni became India’s all-format leader after Anil Kumble retired from Tests in 2008. He captained the team in Tests, ODIs, and T20Is until stepping away from Test cricket on December 30, 2014, after the Boxing Day Test against Australia in Melbourne. Dhoni relinquished the ODI and T20I captaincy on January 4, 2017.Between 2007 and 2018, Dhoni led India in 332 international matches. His record included 178 wins, 120 losses, 6 ties, 15 draws, and 13 no-results. That translated to a win–loss ratio of 1.48 and a win percentage of 53.61%. Overall, factoring in draws and ties, his teams avoided defeat in 59.53% of matches.Virat Kohli became India’s full-time captain in all formats in early 2017 after Dhoni stepped down from limited-overs leadership.He led until the end of the 2021 T20 World Cup in the UAE, where he stepped down from the T20 role. In 2022, the BCCI removed him as ODI captain, and soon after, Kohli resigned from Test captaincy following a 2-1 series defeat to South Africa.From 2013 to 2022, Kohli captained India in 213 matches across formats, securing 135 wins against 60 defeats, along with 3 ties, 4 no-results, and 11 Test draws. His win–loss ratio of 2.25 reflected India’s dominance under his watch, with a win percentage of 63.38% and an overall success rate of 68.93% — one of the highest in Indian cricket history.Rohit Sharma first took over the T20I captaincy after the 2021 T20 World Cup, before also being appointed ODI skipper in January 2022. When Kohli stepped down from the Test role later that year, Rohit became the all-format leader. His tenure saw notable triumphs, including the 2024 T20 World Cup and the 2025 ICC Champions Trophy.Rohit retired from T20Is after the 2024 World Cup victory and stepped away from Test cricket ahead of the 2025 England series.Between 2017 and 2025, he led India in 142 matches, winning 103, losing 33, tying 2, drawing 3, and with just 1 no-result. His win–loss ratio of 3.12 and win percentage of 72.53% make him one of India’s most successful captains, with his teams avoiding defeat in 75.36% of matches.","Mahendra Singh Dhoni became India’s all-format leader after Anil Kumble retired from Tests in 2008. He captained the team in Tests, ODIs, and T20Is until stepping away from Test cricket on December 30, 2014. Virat Kohli became India's full-time captain in all formats in early 2017 after Dhoni stepped down from limited-overs leadership. Rohit Sharma first took over the T20I captaincy after the 2021 T20 World Cup.","https://static.toiimg.com/thumb/msid-123324004,imgsize-69080,width-400,resizemode-4/123324004.jpg"
