Article Title,Article Link,Article Text,Article Summary,Article Image
"Mediation, debt and disorder: Can Pakistan keep balancing China, America and its own crises?",https://timesofindia.indiatimes.com/world/pakistan/mediation-debt-and-disorder-can-pakistan-keep-balancing-china-america-and-its-own-crises/articleshow/131353373.cms,"Mediation, debt and disorder: Can Pakistan keep balancing China, America and its own crises?","summarize: Mediation, debt and disorder: Can Pakistan keep balancing China, U.S. and its own crises? Can Pakistan make a deal with China to end its debt crisis? Can it deal with its own debt crisis and with China's growing influence?","https://static.toiimg.com/thumb/msid-131353443,imgsize-1138545,width-400,height-225,resizemode-4/shehbaz-sharif-file.jpg"
No Krishna Nagar in Lahore? Pakistan pauses heritage renaming plan after outrage by extremist elements,https://timesofindia.indiatimes.com/world/pakistan/no-krishna-nagar-in-lahore-pakistan-pauses-heritage-renaming-plan-after-outrage-by-extremist-elements/articleshow/131330959.cms,"Representative image

Government retreats after religious backlash

Historic names at centre of debate



Catch all LIVE updates on the US-Iran conflict here.



Pakistan’s Punjab government has deferred its plan and appears to take a U-turn to restore the original historical names of roads and streets in Lahore following criticism from extremist groups over the revival of several pre-Partition Hindu and Sikh-era names.The Lahore Heritage Areas Revival (LAHR) committee had earlier approved the proposal during a meeting jointly presided over by Nawaz Sharif and Punjab chief minister Maryam Nawaz.The Punjab CM’s office had officially announced the decision in a statement issued after the meeting held in March.However, the government now appears to have stepped back from the move.“No such decision has been taken as yet,” Lahore deputy commissioner Capt R Muhammad Ali Ijaz said, as quoted by Dawn on Monday, despite the earlier announcement confirming approval for restoration of the original names.When reminded that Nawaz Sharif and Maryam Nawaz had already approved the proposal, Ijaz maintained that the matter was still “under discussion”.An official quoted by news agency PTI said that extremist elements and social media vloggers strongly criticised the government’s move of restoring “Hindu and Sikh” names to Lahore’s roads and streets.“As the critics gave the government's decision a religious colour, the Maryam Nawaz administration has gone on the back foot and deferred the decision to avert backlash,” the official said on condition of anonymity.Following the controversy, the LAHR convened another meeting involving scholars, historians, architects, urban planners and other experts to discuss the proposal and seek broader consensus.According to a statement issued by the committee, participants discussed the “cultural, historical, and civic significance” of reviving Lahore’s traditional nomenclature as part of efforts to preserve the city’s heritage and identity.“The meeting concluded with a consensus that Lahore’s historic identity constitutes an invaluable legacy, deserving thoughtful preservation for future generations,” the statement said, adding that most participants supported restoring the historical names.The proposal sought to revive several pre-Partition names that had been changed over decades by successive governments.Among the roads and localities proposed for restoration were Queen’s Road, renamed as Fatima Jinnah Road; Jail Road, renamed Allama Iqbal Road; Lawrence Road, now Bagh-i-Jinnah Road; and Empress Road, currently Shahrah-i-Abdul Hameed bin Badees.Other renamed areas include Krishan Nagar, now Islampura; Santnagar, changed to Sunnat Nagar; Dharampura, renamed Mustafabad; and Laxmi Chowk, now called Maulana Zafar Ali Khan Chowk.The initiative was aimed at reviving Lahore’s pre-Partition cultural identity and heritage. The move was reportedly spearheaded by Nawaz Sharif, who heads the Lahore Heritage Areas Revival Project.The former Pakistan prime minister had also proposed restoring historic cricket grounds and a traditional wrestling arena at Minto Park, now known as Greater Iqbal Park, which once hosted legendary wrestlers such as Gama Pehalwan and Inzamam-ul-Haq had also trained in nearby cricket clubs.",The Lahore Heritage Areas Revival (LAHR) committee had earlier approved the proposal during a meeting jointly presided over by Nawaz Sharif and Punjab chief minister Maryam Nawaz. The Punjab CM’s office had officially announced the decision in a statement issued in March.,"https://static.toiimg.com/thumb/msid-131331103,imgsize-664741,width-400,height-225,resizemode-4/untitled-design-2026-05-26t192440.jpg"
17 killed as speeding minibus crashes into parked bus in Pakistan’s Khyber Pakhtunkhwa,https://timesofindia.indiatimes.com/world/pakistan/17-killed-as-speeding-minibus-crashes-into-parked-bus-in-pakistans-khyber-pakhtunkhwa/articleshow/131312087.cms,"17 killed as speeding minibus crashes into parked bus in Pakistan’s Khyber Pakhtunkhwa







At least 17 people were killed and five others injured after a speeding minibus rammed into a bus parked along a motorway in Pakistan’s northwestern Khyber Pakhtunkhwa province on Monday.The accident took place near Mardan district on the Swat Expressway when the passenger vehicle crashed into a bus that had reportedly been stationed on the roadside due to a mechanical fault, reported news agency PTI.The parked bus was carrying passengers travelling towards the scenic Swat Valley when the collision occurred.Rescue officials and police personnel rushed to the spot soon after the crash.Shah Fahad, director-general of rescue 1122 emergency services, said preliminary findings pointed towards driver negligence as the likely cause of the accident, as per news agency AP.Rescue teams shifted the injured and bodies of the deceased to a nearby hospital for treatment and identification.Authorities are continuing investigations into the incident.Road accidents remain frequent in Pakistan due to poor road infrastructure, reckless driving and weak implementation of traffic safety regulations.",A speeding minibus rammed into a bus parked along a motorway in Pakistan’s northwestern Khyber Pakhtunkhwa province on Monday. The accident took place near Mardan district on the Swat Expressway. The parked bus was carrying passengers travelling towards the scenic Swat Valley.,"https://static.toiimg.com/thumb/msid-131312154,imgsize-829999,width-400,height-225,resizemode-4/untitled-design-2026-05-25t201834.jpg"
"Pakistan train blast: 24 killed, over 50 injured in Quetta explosion near railway track",https://timesofindia.indiatimes.com/world/pakistan/pakistan-train-blast-dozens-killed-several-injured-in-quetta-explosion-near-railway-track/articleshow/131289475.cms,".







At least 24 people were killed and more than 50 injured after a powerful explosion targeted a train carrying military personnel near Chaman Phatak railway station in Pakistan's Balochistan province on Sunday, authorities said.The blast took place near the railway track in Quetta and caused partial damage to a train, while at least 10 vehicles parked nearby were also damaged, according to police officials.The impact of the explosion shattered windows and glass panels of nearby buildings, GeoTV reported. Several injured persons were rushed to nearby hospitals for treatment.According to AFP, army servicemen were among those killed in the attack in Quetta, the provincial capital of Balochistan.The train, carrying army personnel and their family members, was travelling from Quetta to Peshawar and was en route for Eid holidays when the blast occurred.The official said the train was passing a signal at Chaman Pattak when an explosive-laden device struck one of the carriages, triggering a powerful explosion.Images and videos from the site showed a mangled train carriage lying on its side, with people climbing over wreckage in search of survivors.Several injured victims were seen being carried away on stretchers as armed security personnel cordoned off the area.Following the incident, authorities declared an emergency in government hospitals across Quetta and summoned additional doctors and medical staff to deal with the situation.Railway officials said the Peshawar-bound Jaffar Express was stopped at Quetta Railway Station as a precautionary measure after the explosion.Babar Yousafzai, spokesperson for the provincial home minister, said all relevant institutions had been placed on high alert following the blast.He also urged people to avoid gathering near the site of the explosion so that rescue and emergency teams could continue operations without obstruction.Security personnel and rescue teams reached the area soon after the explosion and launched relief and investigation operations.Balochistan, Pakistan’s largest but poorest province, has long faced instability and underdevelopment. The region has also seen a long-running insurgency, with separatist groups accusing the federal government of exploiting its rich natural gas and mineral resources without adequate local benefit.","Explosion targeted a train carrying military personnel in Quetta, Pakistan. At least 24 people were killed and more than 50 injured in the blast. The train was travelling from Quetta to Peshawar and was en route for Eid holidays. The Peshawar-bound Jaffar Express was stopped at Quetta Railway Station.","https://static.toiimg.com/thumb/msid-131289523,imgsize-830756,width-400,height-225,resizemode-4/131289523.jpg"
Pakistan PM Shehbaz Sharif begins 4-day China visit amid fragile US-Iran truce,https://timesofindia.indiatimes.com/world/pakistan/pakistan-pm-shehbaz-sharif-begins-4-day-china-visit-amid-fragile-us-iran-truce/articleshow/131279740.cms,"Shehbaz Sharif and Xi Jinping (File photo)

(With AFP inputs)







Pakistan Prime Minister Shehbaz Sharif on Saturday began a four-day visit to China, arriving there days after visits by US President Donald Trump and Russian leader Vladimir Putin.He arrived in Hangzhou, in Zhejiang province, according to state news agency Xinhua, which did not provide further details.The visit comes amid the ongoing US-Iran conflict, with Pakistan playing a mediatory role between the two sides.However, the Chinese foreign ministry has yet to confirm whether Chinese President Xi Jinping and Sharif would discuss the Middle East conflict.Earlier this week, foreign ministry spokesperson Guo Jiakun said only “issues of common concern” would be discussed.“China supports Pakistan in playing a fair and balanced mediating role in promoting peace and ending the war,” he told reporters.Islamabad has emerged as a public mediator between Washington and Tehran, hosting historic face-to-face talks last month that failed to produce a lasting agreement.Beijing, meanwhile, has played a quieter diplomatic role, facilitating phone calls and meetings with officials from Gulf nations affected by Iran’s attacks following the joint American-Israeli strikes that triggered the conflict on February 28.The war has remained paused since April 8 after Trump announced a ceasefire.However, in recent days, the US leader has described the intermittent negotiations with Iran as being on the “borderline” between renewed military action and a possible agreement to end the conflict.After high-profile talks with Xi in Beijing last week, Trump told Fox News that his Chinese counterpart had offered to help reopen the Strait of Hormuz — a key oil shipping route that has been virtually blockaded by Iran since the war erupted.The Republican leader's Beijing visit was the first by a sitting US president to China since 2017, when Trump himself travelled to the country during his first term in office.","Shehbaz Sharif arrives in Hangzhou, in Zhejiang province, for four-day visit. Visit comes amid ongoing US-Iran conflict, with Pakistan playing mediatory role. Chinese foreign ministry has yet to confirm whether Xi Jinping and Sharif will discuss the Middle East conflict.","https://static.toiimg.com/thumb/msid-131279753,width-400,height-225,resizemode-4/in-this-photo-released-by-xinhua-news-agency-chinese-president-xi-jinping-meets.jpg"
Pakistan gets its own ‘Cockroach Awaam Party’ as India’s viral CJP sparks cross-border satire wave,https://timesofindia.indiatimes.com/world/pakistan/pakistan-gets-its-own-cockroach-awaam-party-as-indias-viral-cjp-sparks-cross-border-satire-wave/articleshow/131263286.cms,"-

Poll Do you think satire in politics can effectively address youth issues? Yes, it's a powerful tool No, it trivializes serious problems



Catch all LIVE updates on the US-Iran conflict here.



The viral Cockroach Janta Party appears to have inspired a wave of similarly themed satirical political groups in Pakistan, with pages such as the Cockroach Awami Party (CAP) and Cockroach Awami League (CAL) emerging on social media soon after the Indian satirical social media outfit went viral online.The Cockroach Janta Party emerged in mid-May after remarks by Chief Justice of India Surya Kant referring to certain unemployed youth engaged in activism as “cockroaches” and “parasites” triggered widespread reactions online. However, the CJI later clarified that the remarks were not intended to refer to all unemployed youth.Soon after, US-based public relations graduate and former Aam Aadmi Party associate Abhijeet Dipke launched the social media-driven Cockroach Janta Party on May 16 along with a Google form-based membership drive.Within days, the party’s Instagram account amassed more than 15 million followers, overtaking the official handles of both the Bharatiya Janata Party and the Indian National Congress. The group positioned itself as a voice for “lazy and unemployed” youth and raised issues related to education, healthcare, employment opportunities, examination reforms and accountability.Although the party’s X account was withheld in India on Thursday, it later resurfaced through another handle carrying the message that said, “You thought you can get rid of us? Lol”.Soon after its online rise in India, similar pages began appearing in Pakistan. One Instagram page calling itself Cockroach Awami Party described itself with the bio: “Yeah copied but who cares. Motto is same”.The account, which uses green-and-white branding, says it aims to become “the real voice of every Gen-Z” in Pakistan and positions itself as an alternative to mainstream political parties including the Pakistan Tehreek-e-Insaf, Pakistan Muslim League (N) and Pakistan Peoples Party.Several similar accounts have also appeared on X. One page described itself with the line: “Jinhein system ne cockroach samjha, hum unhi awaam ki awaaz hain,” while another page claiming to represent the Cockroach Awami League used the slogan: “Har halaat mein zinda hain.”","The Cockroach Janta Party emerged in mid-May after remarks by Chief Justice of India Surya Kant. The group positioned itself as a voice for ‘lazy and unemployed’ youth. Within days, the party’s Instagram account amassed more than 15 million followers.","https://static.toiimg.com/thumb/msid-131263333,imgsize-1128827,width-400,height-225,resizemode-4/-.jpg"
"IMF-Pakistan talks: Key discussions, outcomes and what comes next",https://timesofindia.indiatimes.com/world/pakistan/imf-pakistan-talks-key-discussions-outcomes-and-what-comes-next/articleshow/131239610.cms,"IMF-Pakistan talks: Key discussions, outcomes and what comes next (mage credit :ANI)

What was discussed?

Key outcomes of the talks







The International Monetary Fund (IMF) on Wednesday concluded its discussions with Pakistani authorities on key economic developments, fiscal planning for the upcoming financial year, and progress on reforms under the country’s IMF-backed programmes.Led by IMF advisor Iva Petrova, the team visited Islamabad from May 13 to May 20.Earlier this month, the IMF cleared the South Asian nation to access about $1.32 billion in fresh ‌funding with Pakistan on a $7 billion IMF program.The talks focused on ongoing structural reforms, including changes in the energy sector, state-owned enterprises, product market liberalisation, and financial sector reforms.The IMF and Pakistani authorities also reviewed the impact of disruptions caused by the ongoing Middle East conflict, preparations for the FY2027 budget, and progress under the Extended Fund Facility (EFF) and the Resilience and Sustainability Facility (RSF).According to the statement, discussions also covered measures aimed at supporting long-term economic growth and attracting high-quality private investment.Progress under the RSF framework was another major focus area, including efforts to introduce a disaster risk financing framework, integrate climate considerations into budget and investment planning, and push ahead with power subsidy reforms.Pakistan reaffirmed its commitment to achieving a primary surplus target of 2 percent of GDP in FY2027, a move aimed at strengthening fiscal sustainability and economic resilience.The State Bank of Pakistan also reiterated its commitment to maintaining a tight monetary policy stance to keep inflation expectations under control.The IMF further noted that exchange rate flexibility should continue to act as a key shock absorber, while efforts to deepen the foreign exchange interbank market should continue.The fund added that discussions on Pakistan’s FY2027 budget will continue in the coming days, while its next mission to the country is expected in the second half of 2026 for consultations and programme reviews.","The talks focused on ongoing structural reforms, including changes in the energy sector, state-owned enterprises, product market liberalisation, and financial sector reforms. Pakistan reaffirmed its commitment to achieving a primary surplus target of 2 percent of GDP in FY2027, a move aimed at strengthening fiscal sustainability and economic resilience.","https://static.toiimg.com/thumb/msid-131239838,imgsize-401098,width-400,height-225,resizemode-4/imf-pakistan-talks-key-discussions-outcomes-and-what-comes-next.jpg"
Pakistan Air Force jet crashes during training mission: Reports,https://timesofindia.indiatimes.com/world/pakistan/paf-trainer-aircraft-crashes-during-training-mission-reports/articleshow/131226588.cms,"Screenshot from a viral video of the location of the PAF trainee aircraft crash







A training aircraft of the Pakistan Air Force (PAF) crashed in Pakistan’s Punjab province on Wednesday during a routine operational training mission, reports said.The aircraft crashed in Mianwali district following a reported technical malfunction in the engine.Both pilots ejected safely before the crash, and no casualties were reported on the ground. Unverified videos circulating on social media showed two men in PAF jumpsuits being attended to by people on the ground.An investigation has been launched into the incident.","The aircraft crashed in Mianwali district following a reported technical malfunction in the engine. Both pilots ejected safely before the crash, and no casualties were reported. Unverified videos circulating on social media showed two men in PAF jumpsuits being attended to by people on the ground.","https://static.toiimg.com/thumb/msid-131226903,imgsize-56296,width-400,height-225,resizemode-4/untitled-design.jpg"
Pakistan's claim of hitting 2 Indian airbases falls apart over one detail: The locations don't exist,https://timesofindia.indiatimes.com/world/pakistan/pakistans-claim-of-hitting-2-indian-airbases-falls-apart-over-one-detail-the-locations-dont-exist/articleshow/131215769.cms,"





Now, over a year after the Pahalgam attack and India’s strong retaliatory action, Pakistan has made a bizarre claim of engaging and hitting two airbases in India that do not even exist, after being hit hard last year during counterterror operations under Operation Sindoor The strong military action under Operation Sindoor was met with a Pakistani counter, as Islamabad launched a barrage of missiles and drone swarms towards India. However, India’s air defence intercepted and destroyed every single incoming threat in the air, avoiding any loss of life or property on Indian soil.Also Read| Operation Sindoor: The 88-hour operation that defined 'new normal' in India’s counter-terrorism strategy Pakistan named its counter-action “Operation Bunyan Ul Marsoos,” and now a bizarre claim by a Pakistani army official has surfaced on social media.He said that under Operation Bunyan Ul Marsoos, Pakistan targeted and engaged two airbases, Rajouri and Mamun, both located in bordering sectors along the India-Pakistan border.However, what makes it bizarre is that no such airbases exist.In a clip being shared on social media, a Pakistani army official is heard saying that “they were assigned two targets, Rajouri airbase and Mamun airbase,” during an interview with a Pakistani channel.Also Read: 'Why in English?' Pakistan's bizarre reaction to Indian presser on Op Sindoor goes viral Rajouri, a town in Jammu and Kashmir, lies along the line of control and is a heavily militarised zone where tensions with Pakistan remain high. Similarly, Mamun falls in Punjab’s Pathankot district, another area close to the border, but neither location has an airbase.Last year as well, during official briefings, Colonel Sofiya Qureshi confirmed that Pakistan used long-range weapons and loitering munitions, which were all intercepted and destroyed by India’s highly coordinated multi-layered air defence response.","Pakistan was hit hard last year during counterterror operations under Operation Sindoor. The strong military action was met with a Pakistani counter, as Islamabad launched a barrage of missiles and drone swarms towards India. India’s air defence intercepted and destroyed every single incoming threat in the air.","https://static.toiimg.com/thumb/msid-131215959,imgsize-949176,width-400,height-225,resizemode-4/-.jpg"
