Article Title,Article Link,Article Text,Article Summary,Article Image
Why ‘Looksmaxxing’ streamer Androgenic got kicked off a Jetstar flight despite claiming medical clearance?,https://timesofindia.indiatimes.com/world/us-streamers/why-looksmaxxing-streamer-androgenic-got-kicked-off-a-jetstar-flight-despite-claiming-medical-clearance/articleshow/131379678.cms,"Why ‘Looksmaxxing’ streamer Androgenic got kicked off a Jetstar flight despite claiming medical clearance? (Image via Getty)

Ronan Androgenic disputes Jetstar decision after Thailand facial surgery

A controversial social media streamer was removed from a flight after airline staff said his condition following facial surgery raised concerns about whether he was fit to travel. Ronan Androgenic, a 25-year-old influencer based in Brisbane, Australia, shared a video on TikTok showing the moment he was asked to leave a Jetstar flight after boarding. According to Androgenic, he had undergone cosmetic surgery in Thailand just five days earlier and was trying to return home.The video quickly gained attention online. In the footage, Ronan Androgenic can be seen sitting on the aircraft with heavy bandages around his jaw and chin. He claimed airline staff questioned his condition and eventually decided he could not remain on the flight. Ronan Androgenic told viewers that staff were concerned because he did not have his medication with him in his carry-on luggage. However, airline employees also pointed to his physical condition, saying he appeared unusually tired and unwell. Staff members said his responses were slow and that visible swelling around his face and eyes raised concerns about his health.During the exchange shown in the video, airline staff repeatedly told Ronan Androgenic they were worried about his ability to safely complete the flight. One employee said he appeared drowsy when answering questions. Another pointed to the swelling on his face and told him he did not look well enough to travel.Ronan Androgenic strongly disagreed. He said he was only tired because he was preparing to sleep during the flight. He also stated that a doctor had cleared him to fly after the procedure.According to the video, Ronan Androgenic argued that resting before a long flight was normal. He told staff he needed to get home and felt he was being treated unfairly despite having medical approval.The discussion became more heated as it continued. Airline employees told him that regardless of any documents he had shown earlier, crew members were still responsible for deciding whether a passenger appeared fit to fly at the time of boarding. Staff also said his behavior was becoming disruptive during the disagreement.Jetstar later responded to the incident in a statement provided to News.com.au. The airline said crew members are trained to assess passengers before departure and can refuse travel if they believe someone may not be well enough to fly safely. Jetstar also said abusive language and aggressive behavior toward staff are not accepted.Ronan Androgenic is known online for promoting “looksmaxxing,” a trend focused on improving physical appearance through intense self-improvement, cosmetic procedures, and body modifications. The trend has gained popularity on social media in recent years. Another creator linked to the trend, Clavicular, has also faced controversy in the past for online content that attracted criticism.","Ronan Androgenic, a 25-year-old influencer based in Brisbane, Australia, shared a video on TikTok showing the moment he was asked to leave a Jetstar flight after boarding. He claimed airline staff questioned his condition and eventually decided he could not remain on the flight. The video quickly gained attention online. Jetstar later responded to the incident in a statement provided to News.com.au.","https://static.toiimg.com/thumb/msid-131379674,imgsize-851564,width-400,height-225,resizemode-4/why-looksmaxxing-streamer-androgenic-got-kicked-off-a-jetstar-flight-despite-claiming-medical-clearance.jpg"
"""I'm done with the abuse"": QTCinderella threatens legal action against “hate farming” clip accounts after emotional return online",https://timesofindia.indiatimes.com/world/us-streamers/im-done-with-the-abuse-qtcinderella-threatens-legal-action-against-hate-farming-clip-accounts-after-emotional-return-online/articleshow/131379511.cms,"Popular Twitch streamer QTCinderella has announced plans to take legal action against clip accounts that allegedly use her stream content to spread harassment and misleading narratives. Returning online after grieving the loss of her dog Swift, she said she would issue DMCA takedowns against malicious reposts. The move comes amid growing concerns over “clip farming” on social media, where creators’ content is repackaged with misleading context to generate engagement and fuel online hate campaigns.

QTCinderella legal action targets clip accounts spreading misleading narratives

QTCinderella controversy highlights wider creator concerns over clip farming

QTCinderella has returned to the internet after a deeply personal loss, but instead of finding support, the popular Twitch star says she was met with something far more troubling. The creator, who recently stepped away from social media while grieving the death of her longtime dog Swift, is now pushing back against accounts she believes are profiting from harassment and misinformation.The streamer has announced a major shift in how she handles unauthorized clips of her content. After years of largely ignoring reposts and commentary channels, she says certain accounts have crossed a line by twisting harmless moments from her broadcasts into fuel for targeted online attacks.In a lengthy statement shared on X, QTCinderella revealed that she plans to pursue DMCA takedowns against accounts that use her content in ways she considers malicious or intentionally deceptive. The move marks a significant change for a creator who has rarely relied on legal tools to protect her content.Explaining her frustration, QT wrote:“This is not something I have EVER done,” she wrote. “But it is something that I am setting my boundary on.Call me a b**ch or pathetic, whatever you want for taking legal action. I am done with the bullsh*t.”Her comments quickly gained support from fans and fellow creators, many of whom argued that content manipulation has become a growing problem across streaming platforms and social media. Supporters praised her decision to establish clearer boundaries and defend herself against what she describes as coordinated hate campaigns.The problem is not just one creator. In the past year, social media platforms have been flooded with accounts reposting clips from streamers with sensationalist captions, misleading contexts or false claims meant to drive engagement.The trend has drawn concern from a number of high-profile creators. Earlier this year, streamer Jasontheween spoke out about potential legal action against an account linking him and Pokimane to a criminal case without evidence. The situation reportedly cooled, with posts taken down, but it showed how quickly misinformation can spread online.The talk has turned to the X itself, too. Some accounts have been profiting and gaining visibility from reposts, platform executives recently admitted. In response, X has started to redirect impressions and credit to original creators instead of accounts that recycle content without adding substantive value.The message to QTCinderella is simple: criticism is part of the job, but using clips as tools for harassment is a line she is no longer willing to cross.",Popular Twitch streamer QTCinderella has announced plans to take legal action against clip accounts. She said she would issue DMCA takedowns against malicious reposts. The move comes amid growing concerns over “clip farming’ on social media.,"https://static.toiimg.com/thumb/msid-131379511,imgsize-80148,width-400,height-225,resizemode-4/131379511.jpg"
"""Attacking Erika IS attacking Charlie"": Candace Owens drags Charlie Kirk’s old support into escalating online firestorm",https://timesofindia.indiatimes.com/world/us-streamers/attacking-erika-is-attacking-charlie-candace-owens-drags-charlie-kirks-old-support-into-escalating-online-firestorm/articleshow/131379499.cms,"A resurfaced video of Charlie Kirk defending Candace Owens has reignited debate online. In the clip, Kirk calls Owens “the best” and says, “We're on Team Candace.” Owens shared the video, writing that Kirk “always had my back.” However, many social media users criticized her, arguing that her recent attacks on Kirk’s family and organization contradict the loyalty and support he once showed her.

Charlie Kirk’s Candace Owens endorsement back in the news

Candace Owens faces criticism over posthumous Charlie Kirk claims



Months after the death of conservative commentator Charlie Kirk , a resurfaced video of him and Candace Owens has caused a heated online debate. The clip, which recently went viral on social media, shows Kirk publicly defending Owens and lauding her role in the conservative movement. Although the video was filmed years ago, its resurfacing has attracted renewed attention thanks to the increasing controversy surrounding Owens’ comments and actions after Kirk’s death.The viral clip came at a time when emotions are still running high among Kirk’s supporters, political allies and critics. Many users saw the video as a reminder of the strong professional relationship the two once had. Others said the circumstances around its reappearance have only deepened divisions within conservative circles.In the resurfaced clip, Charlie Kirk expressed his strong support for Owens, and made clear that he views her as an important ally. “We’re on Team Candace and I’m also, you know, I’m on Team Freedom,” he said in the interview.Owens later posted the clip to social media and reflected on Kirk’s support during challenging times in her career. In her post, she wrote, “Charlie always had my back but especially after the Daily Wire fallout and subsequent media smearing.The exchange quickly went viral online, with thousands of reactions. Supporters hailed the friendship and loyalty demonstrated in the video, while others questioned the timing of its release. Soon the conversation drifted past the clip into a larger discussion about Kirk's legacy and the tensions that have emerged since his death.The resurfaced footage also revived criticism directed at Owens over statements she has made in the aftermath of Kirk’s death. Critics argue that her recent allegations involving Kirk’s family and leadership at Turning Point USA conflict with the supportive relationship shown in the older video.Social media users were particularly vocal in the comments section. One commenter wrote, “And you repaid that by smearing his legacy, his family and trying to destroy the organization that he dedicated his life to. With friends like that..” Another added, “Would have been nice of you to return the favor.”A third user posted, “Hey Candace, Charlie and Erika are one flesh. Attacking Erika IS attacking Charlie. Bringing up old videos to justify your attack on his wife is abominable. Charlie would choose his wife over you every day. Stop pretending he would side with you on this.”As debate continues across online platforms, the resurfaced video has become more than a nostalgic look at a past alliance. Instead, it has evolved into a flashpoint in an ongoing battle over loyalty, legacy, and how Charlie Kirk should be remembered.","A resurfaced video of Charlie Kirk defending Candace Owens has reignited debate online. In the clip, Kirk calls Owens “the best” and says, “We're on Team Candace” Owens shared the video, writing that Kirk “always had my back”","https://static.toiimg.com/thumb/msid-131379499,imgsize-42026,width-400,height-225,resizemode-4/131379499.jpg"
"'Sorry pal, this is how rest of the world travels': American journalist shows chaos at Lisbon Airport due to new EU rules, gets trolled",https://timesofindia.indiatimes.com/world/us/sorry-pal-this-is-how-rest-of-the-world-travels-american-journalist-shows-chaos-at-lisbon-airport-due-to-new-eu-travel-rules/articleshow/131377687.cms,"CNN journalist's video from Lisbon Airport went viral as she showed the long queue to leave the country owing to the new EU travel rules -- making travelers miss their flights

What is the new Entry/Exit rule?

The European Union began a new Entry/Exit System in 2025 but it became fully operational in April this year, unloading the heat on summer travelers. In the new system, they are now collecting fingerprints and facial images of travelers but resulted in massive chaos at the airports as people are missing their flights waiting in those queues.The video of CNN journalist Clarissa Ward went viral as she said she missed her flight while she was waiting for two hours for her biometric data collection.Ward showed the huge queue of people with non-EU passports who wanted to leave Lisbon. ""I stood in the longest line I have ever seen in my life (no joke). All because of the EU’s recently updated Entry/Exit System, which requires biometric scanning for every non-EU passport holder. I saw lots of elderly people and families with small children. People who missed connections. Others who missed flights. Me included. Airport staff only let TAP (Portugal’s main airline) passengers cut the line if they were seconds away from missing their flight. Everyone else? Good luck,"" Ward wrote.""Since the much delayed rollout began in October there have been similar scenes in many European cities. Airlines are begging airports to suspend the new measures during peak summer travel.EU officials called this a “digital leap.” From where I was standing, it looked more like a total cluster f*$k,"" Ward said.Ward was mostly trolled as social media users said this is also what happens when Europeans travel to the US. ""Sorry pal, this is just how the rest of the world travels. And yeah, the EES is a mess but the rest of the world is already used to queuing up,"" one wrote. ""Do you know what happens to us Europeans when we arrive at JFK? We wait. It's part of the process. Stop whining,"" another wrote.The Entry/Exit System (EES) is an automated IT system for registering non-EU nationals travelling for a short stay (up to 90 days within any 180-day period), each time they cross the external borders of any of the following European countries using the system. Non-EU national means a traveller not holding the nationality of any European Union country or the nationality of Iceland, Liechtenstein, Norway or Switzerland.Full list of countries under this system: Austria, Belgium, Bulgaria, Croatia, Czechia, Denmark, Estonia, Finland, France, Germany, Greece, Hungary, Iceland, Italy, Latvia, Liechtenstein, Lithuania, Luxembourg, Malta, Netherlands, Norway, Poland, Portugal, Romania, Slovakia, Slovenia, Spain, Sweden, Switzerland.",Video of CNN journalist Clarissa Ward went viral as she said she missed her flight while she was waiting for her biometric data collection. Ward showed the huge queue of people with non-EU passports who wanted to leave Lisbon. Airlines are begging airports to suspend the new measures during peak summer travel.,"https://static.toiimg.com/thumb/msid-131377691,imgsize-56198,width-400,height-225,resizemode-4/cnn-journalists-video-from-lisbon-airport-went-viral-as-she-showed-the-long-queue-to-leave-the-country-owing-to-the-new-eu-travel-rules-making-travelers-miss-their-flights.jpg"
"'Millions of Indians, Pakistanis taking our jobs': UK MP makes 'racist' remarks",https://timesofindia.indiatimes.com/world/uk/millions-of-indians-pakistanis-taking-our-jobs-uk-mp-makes-racist-remarks/articleshow/131380009.cms,"Source: rupertlowe.co.uk

UK MP Rupert Lowe has sparked controversy after making anti-migration remarks targeting people of Indian and Pakistani origin in Britain, despite the apparent risk of being labelled racist.Independent MP Lowe claimed that “millions of Pakistanis and Indians” are being brought to the UK to take up jobs that, according to him, should instead go to unemployed Britons.He wrote on X: ""I don't believe we should import millions of Pakistanis and Indians to do jobs that unemployed Brits should be doing.""“If that makes me racist, then so be it,” he added.According to the Office for National Statistics, 2021 Census, Lowe's constituency of Great Yarmouth has just 907 residents of Indian and Pakistani origin — 786 Indian and 121 Pakistani. That is less than 1% of the town's 99,750 population.The unemployment rate in Great Yarmouth stands at 9.8%, nearly double the national average of 5.4%.According to data cited from Migration Observatory, University of Oxford, ""Migrants in the UK Labour Market: An Overview"", nationally, 20% of employee jobs in December 2025 were held by non-UK nationals — 6.5 million jobs. This share has increased steadily from 12% in 2014.Between January 2021 and December 2025, Indian and Nigerian nationals saw the sharpest increases in UK employment. But these workers are not taking jobs from Britons. They are concentrated in sectors with chronic staffing shortages.A quarter of jobs held by non-EU nationals in December 2025 were in the health and care sector — 161,000 Skilled Worker visas were granted to non-EU care workers alone during this period. The Home Office added care workers to the visa eligibility list precisely because the sector could not fill vacancies domestically.Lowe has previously claimed that ""1.3 million foreign nationals"" are claiming Universal Credit. The actual figure: 13% of Universal Credit recipients are non-UK nationals — 1.1 million people. This is lower than their 16% share of the working-age population.Migrants on work, study or family visas are generally barred from claiming benefits under the ""No Recourse to Public Funds"" rule.Lowe, the Member of Parliament for Great Yarmouth, was elected as a Reform UK candidate in July 2024 before having the party whip suspended in March 2025. He now leads the Restore Britain party and has a history of anti-immigrant rhetoric, including a December 2025 tweet stating: ""I am sick of hearing that Britain was built by immigrants. No. No it was not. It was built by British men and women.""His party has refused to condemn supporters who called for ""total remigration"" — the deportation of all non-white citizens.","UK MP Rupert Lowe has sparked controversy after making anti-migration remarks. Lowe claimed that “millions of Pakistanis and Indians” are being brought to the UK to take up jobs that, according to him, should instead go to unemployed Britons. Lowe's constituency of Great Yarmouth has just 907 residents of Indian and Pakistani origin.","https://static.toiimg.com/thumb/msid-131380160,imgsize-23364,width-400,height-225,resizemode-4/131380160.jpg"
Kenya approves US Ebola quarantine request as WHO chief heads to Congo,https://timesofindia.indiatimes.com/world/rest-of-world/kenya-approves-us-ebola-quarantine-request-as-who-chief-heads-to-congo/articleshow/131380303.cms,"Kinshasa/Bunia: Kenya has approved a request from the US to open a quarantine facility in the East African nation for Americans exposed to Ebola, two US officials told Reuters on Thursday as the head of the WHO was travelling to the epicentre of the outbreak in Democratic Republic of Congo.Officials at Kenya's foreign and health ministries did not immediately respond to requests for comment, but one of the US officials said the authorisation grants the US access to land at an air force base in Laikipia in central Kenya.Health authorities in Congo and neighbouring countries are scrambling to contain the latest outbreak of the rare Bundibugyo strain, for which there is no vaccine or treatment. However, the outbreak, which is the third largest on record, is outpacing the world's response. The approach, which hinges on identifying and isolating potential cases to control the spread of the disease, is weeks, if not months behind the curve and the WHO has declared a public health emergency of international concern.""Sixteen times, this country has defeated Ebola. The 17th will be no different. But we must act now, together,"" said WHO director-general Tedros Adhanom Ghebreyesus on X, ahead of flying to Congo.Tedros is due to arrive in Kinshasa later on Thursday and will then travel to Ituri province in Congo's northeast, where the first Ebola cases were reported and the virus has been circulating for weeks.In a bid to curb the spread, countries across the world have rolled out travel-related containment measures. The US has taken some of the strictest, saying it ""cannot and will not allow"" any cases of Ebola to enter the country. It temporarily banned the entry of green card holders who have been in Congo, Uganda or South Sudan in the previous 21 days.The planned facility in Kenya is due to be staffed by members of the US Public Health Service, a uniformed branch of the department of health and human services. Kenya had been pushing for the facility to be open to all nationalities, not just US citizens.Some Kenyans have questioned why the US would not repatriate citizens exposed to Ebola back home.(This is a Reuters story)",Kenya has approved a request from the US to open a quarantine facility in the East African nation for Americans exposed to Ebola. The announcement comes as the head of the WHO was travelling to the epicentre of the outbreak in Democratic Republic of Congo. The planned facility in Kenya is due to be staffed by members of the US Public Health Service.,"https://static.toiimg.com/thumb/msid-131380330,imgsize-122912,width-400,height-225,resizemode-4/131380330.jpg"
"'Act of terror': Man stabs 3 at Swiss train station, arrested",https://timesofindia.indiatimes.com/world/europe/act-of-terror-man-stabs-3-at-swiss-train-station-arrested/articleshow/131379495.cms,"Police officers on scene after a stabbing attack at the train station in Winterthur, Switzerland

A man armed with a knife wounded three people at a train station in the Swiss city of Winterthur on Thursday in what authorities described as an “act of terror” before he was arrested by police.The attack took place shortly before 8:30 am local time. Police said the suspect, a 31-year-old Swiss-Turkish dual national living in Winterthur, was taken into custody within five minutes of emergency services being alerted.Regional police chief Marius Weyermann said the suspect had previously come to authorities’ attention in 2015 for distributing propaganda linked to the Islamic State group.Weyermann also said the man had recently been admitted to a psychiatric facility after calling emergency services and making “confused comments”, but left on Wednesday after doctors determined he was not a danger.Three Swiss men aged 28, 43 and 52 were injured in the stabbing. Authorities said two had been discharged or were expected to leave hospital later in the day, while the third remained hospitalised after surgery for a thigh injury.Investigators believe the suspect acted alone.Zurich regional security official Mario Fehr described the incident as “an evil act of terror”.Winterthur, located near Zurich in northeastern Switzerland, has a population of around 123,000 people.","Three Swiss men aged 28, 43 and 52 were injured in the stabbing. Authorities said two had been discharged or were expected to leave hospital. The third remained hospitalised after surgery for a thigh injury. Police said the 31-year- old suspect was taken into custody within five minutes of emergency services being alerted.","https://static.toiimg.com/thumb/msid-131379500,imgsize-1271234,width-400,height-225,resizemode-4/article-64.jpg"
