Article Title,Article Link,Article Text,Article Summary,Article Image
Ukraine targets Russian energy infrastructure; Moscow says over 200 drones intercepted overnight,https://timesofindia.indiatimes.com/world/europe/ukraine-targets-russian-energy-infrastructure-moscow-says-over-200-drones-intercepted-overnight/articleshow/131383157.cms,"Ukraine targets Russian energy infrastructure; Moscow says over 200 drones intercepted overnight (Image source: AP)

Ukraine claims Russ

ia drone targeted cargo ship bound for Turkey

Russian

drone hits apartment building in Romania

US says it is ready to mediate

Zelenskyy urges Trump to provide air defence systems

The Russia-Ukraine war, triggered by Russia’s full-scale invasion in February 2022, has entered its fifth year, with intense fighting continuing across multiple fronts and no clear end to the conflict in sight.In a recent development, fuel storage facilities caught fire following an overnight Ukrainian drone attack in Russia’s Yaroslavl Oblast, as per Yaroslavl Oblast Governor Mikhail Yevrayev.Authorities said firefighting operations were ongoing after the strike, Reuters reports.According to Russia’s defence ministry, Russian air defences shot down 208 drones overnight. More than 80 of those drones were intercepted over the southern Rostov Oblast region.Ukraine’s navy on Friday said that a Russian drone strike triggered a fire on a cargo ship heading to Turkey after it departed from the Ukrainian port city of Odesa.Details regarding casualties or damage to the vessel were not immediately released.In a recent development, a Russian drone struck an apartment building in Galati, Romania’s defence ministry said early Friday, injuring two people and sparking a fire.As per BBC report, the drone crashed into a residential building during Russian attacks near the Ukraine-Romania border.This marks the first known incident during the war in which civilians in Romania have been injured by a Russian drone strike. Moscow has not commented on the incident.US Secretary of State Marco Rubio, on May 26, said the United States remains willing to mediate between Russia and Ukraine despite renewed Russian strikes on Kyiv.“The US stands ready and prepared to help do whatever we can to help facilitate the end of this war, and hopefully the opportunity will present itself at some point,” he said.Ukrainian President Volodymyr Zelenskyy has urged US President Donald Trump to help Ukraine acquire air defence systems and interceptors after Russia threatened fresh strikes on Kyiv.Ballistic missiles remain Moscow's ""last major advantage on the battlefield,"" Zelenskyy said in a letter to Trump and the US Congress on May 27.""I ask for your help in protecting Ukraine's skies from Russian missiles,"" Zelenskyy wrote.Russia has rejected a US warning against systematic strikes on Kyiv during a UN Security Council session on Thursday, while reaffirming plans to target military and command facilities in the capital and urged foreign diplomats to leave the city.","Russia's defence ministry says over 200 drones intercepted overnight. Fuel storage facilities caught fire following an overnight Ukrainian drone attack in Russia's Yaroslavl Oblast. A Russian drone struck an apartment building in Galati, Romania, injuring two people and sparking a fire.","https://static.toiimg.com/thumb/msid-131383800,imgsize-73220,width-400,height-225,resizemode-4/ukraine-targets-russian-energy-infrastructure-moscow-says-over-200-drones-intercepted-overnight.jpg"
Why streamer Clavicular suddenly tried removing DaBaby from his Miami club mid-performance,https://timesofindia.indiatimes.com/world/us-streamers/why-streamer-clavicular-suddenly-tried-removing-dababy-from-his-miami-club-mid-performance/articleshow/131377677.cms,"Image Via Instagram

“Get him the f*** out of here”

Streamer Clavicular reportedly upset after DaBaby’s crew allegedly brought guns into club

A chaotic moment at streamer Clavicular’s Miami nightclub has gone viral after he was seen trying to remove rapper DaBaby during a live performance. Videos from the club showed Clavicular shouting,while DaBaby continued performing on stage. The surprising moment quickly spread online, leaving many viewers confused about why the streamer suddenly wanted the rapper removed from the venue in the middle of the show.The incident happened on Wednesday night at Bacara, a Miami club owned by Clavicular. The nightclub has already become popular online because streamers are allowed to record content inside the venue. This means many funny, wild, and dramatic moments are often caught on camera. However, this latest situation became much more serious after reports claimed Clavicular was angry because DaBaby’s crew allegedly brought guns into the club despite strict no-firearm rules.According to people at the venue, Clavicular became upset after learning that members of DaBaby’s crew may have entered the club with firearms. Bacara reportedly has a rule that does not allow anyone to bring weapons inside. After hearing about the situation, Clavicular tried to get DaBaby removed from the building while the performance was still happening.Despite the streamer yelling for DaBaby to leave, the rapper appeared to ignore the demand and continued performing for the crowd.Videos shared online showed the performance continuing even while Clavicular was visibly frustrated nearby. The situation quickly became a major talking point across social media because of how public the argument became.So far, DaBaby has not publicly responded to the incident. It is also unclear if police became involved or if anyone was officially removed from the venue after the confrontation. No injuries or violent incidents have been reported from the night.Bacara has already built a reputation online for viral streamer moments and dramatic clips. Because cameras are allowed inside the club, many incidents quickly spread across livestreams and social media platforms. This latest confrontation between Clavicular and DaBaby has now added another controversial moment to the club’s growing online attention.Fans are now waiting to see whether either side will speak more about what happened inside the Miami nightclub.","Streamer Clavicular reportedly upset after DaBaby’s crew allegedly brought guns into club Bacara. After hearing about the situation, he tried to get DaBaby removed from the building while the performance was still happening. Despite the streamer yelling for DaBaby to leave, the rapper appeared to ignore the demand and continued performing.","https://static.toiimg.com/thumb/msid-131377676,imgsize-511857,width-400,height-225,resizemode-4/why-streamer-clavicular-suddenly-tried-removing-dababy-from-his-miami-club-mid-performance.jpg"
"Farmer’s sudden death left 1,400 acres unharvested, then 75 neighbours arrived and harvested everything for his family",https://timesofindia.indiatimes.com/world/us/farmers-sudden-death-left-1400-acres-unharvested-then-75-neighbours-arrived-and-harvested-everything-for-his-family/articleshow/131377617.cms,"The neighbours effort that saved 1,400 acres after a farmer died

Why timing mattered so much

‘To know Randy was to love Randy’

A story that resonated far beyond North Dakota

When North Dakota farmer Randy Fyllesvold died unexpectedly in a car crash in September 2025, his family was left grieving while also facing an overwhelming reality. Around 1,400 acres of corn and soybeans still stood unharvested just as winter weather was beginning to close in. For farming families, missing the narrow harvest window can mean devastating financial losses. Randy’s wife, Kharra, and their children suddenly found themselves confronting both personal tragedy and the possibility of losing an entire season’s worth of work. What happened next, however, became a remarkable example of how rural communities still come together during moments of crisis.Shortly after Randy’s death, two of his close friends, Wyatt Thompson and Andy Gates, decided the family would not face the harvest alone. They began contacting neighbouring farmers across nearby North Dakota communities, asking if anyone could spare equipment, trucks or time to help bring in the crops.The response was immediate.Within days, around 75 farmers arrived with combines, grain carts and trucks, ready to work through the fields together. What could have taken weeks for one family to complete quickly turned into a coordinated community effort.According to local reports, the volunteer operation included roughly 12 combines, seven grain carts and more than 40 trucks. Farmers travelled from more than 10 nearby towns, bringing their own fuel, machinery and labour without asking for payment.For two days, the fields remained busy almost nonstop as equipment moved in organised lines through the crops. The operation resembled a professional large-scale harvest, yet every person involved had volunteered simply to help a grieving family.Some social media posts later described the scene as involving “42 trucks”, though local coverage generally reported the number as more than 40.Harvest season in the northern United States is heavily dependent on weather. Once snow, freezing temperatures or wet ground arrive, crops can quickly deteriorate or become impossible to collect efficiently.For the Fyllesvold family, the stakes were enormous. The 1,400 acres represented not just crops in a field, but an entire year of labour, investment and income. Losing the harvest would have created severe financial pressure on top of an already devastating personal loss.That urgency is one reason so many farmers immediately understood the need for action.Friends described Randy Fyllesvold as someone deeply respected in the local farming community. Several volunteers later explained that helping the family felt like a natural response because of the kind of person he had been.One friend summed up the feeling shared across the community by saying, “To know Randy was to love Randy.”Kharra Fyllesvold later described watching the combines and trucks fill the fields as emotional and overwhelming. For her family, the harvest became more than a farming operation. It became a public demonstration of support during one of the hardest moments of their lives.After local television coverage and social media posts began circulating online, the story quickly spread across the country. Many people were moved not only by the scale of the volunteer effort, but by what it represented.In many rural farming communities, neighbours still depend heavily on one another during emergencies, accidents and natural disasters. While modern farming often relies on advanced machinery and technology, stories like this continue to highlight the strong personal bonds that exist behind the industry.For many readers, the image of dozens of combines and trucks arriving to save a grieving family’s harvest stood as a rare reminder of collective kindness and solidarity in difficult times.","North Dakota farmer Randy Fyllesvold died unexpectedly in a car crash in September 2025. Around 1,400 acres of corn and soybeans still stood unharvested just as winter weather was beginning to close in. Two of his close friends decided the family would not face the harvest alone. They began contacting neighbouring farmers across nearby North Dakota communities, asking if anyone could spare equipment, trucks or time to help bring in the crops.","https://static.toiimg.com/thumb/msid-131377649,imgsize-1101673,width-400,height-225,resizemode-4/farmers-sudden-death-left-1400-acres-unharvested-then-75-neighbours-arrived-and-harvested-everything-for-his-family.jpg"
"Indian-origin founder in Canada says people talk about H-1B as if Indians randomly woke up one day, booked flights, started taking US jobs",https://timesofindia.indiatimes.com/world/us/indian-origin-founder-in-canada-says-people-talk-about-h-1b-as-if-indians-randomly-woke-up-one-day-booked-flights-started-taking-us-jobs/articleshow/131377409.cms,"Indian-origin tech leader in Canada says that before blaming H-1Bs, Americans should ask the corporations why they hire H-1Bs.

Ask your corporations why they hire Indians

Americans love Indian mangoes

An Indian-origin founder in Canada commented on the rampant targeting of H-1B visa holders in the US and explained that the situation is more complex than how MAGA portrays it. Vijayan Swaminathan, an Indian-origin tech leader in Canada, said it is not as simple as millions of Indians randomly waking up one day, booking flights to America and then starting to take jobs which are meant for Americans.""These are not random people picked off the street. They are often engineers who have already spent years working on the exact product the company depends on,"" Swaminathan said.""In many cases, American corporations themselves spent years and millions of dollars building offshore development centers, either directly or through partner firms. Certain projects become so deadline driven and market sensitive that bringing over one or two engineers who already understand the systems, architecture, and business logic becomes the fastest and most efficient option,"" he said.As Swaminathan objected to Texas whistleblower Sara Gonzales's pointed hatred towards H-1Bs, he said it is a fair question to ask that why one particular job was not given to an American and was offered instead to an Indian. But the question should be directed at the corporations making those hiring decisions and not the individual worker who came to the US leaving his family -- and the process is generally initiated by the US firm.Swaminathan said Americans enjoy Indian mangoes and butter chicken and the rest of the world enjoys Hollywood, American innovation and that's what should happen in globalization. ""The H-1B who came to the US may have grown up watching Hollywood movies. After watching a movie back home, maybe they celebrated the weekend with Pizza Hut or KFC with their family, contributing to American businesses long before ever stepping foot in the country. Little did he/she knew that the so called ""American Dream"" wasn't meant for a brown person from India,"" he wrote.","An Indian-origin founder in Canada commented on the rampant targeting of H-1B visa holders in the US. Vijayan Swaminathan said it is not as simple as millions of Indians randomly waking up one day, booking flights to America and then starting to take jobs.","https://static.toiimg.com/thumb/msid-131377427,imgsize-57686,width-400,height-225,resizemode-4/indian-origin-tech-leader-in-canada-says-that-before-blaming-h-1bs-americans-should-ask-the-corporations-why-they-hire-h-1bs.jpg"
"Google engineer arrested after turning $1,000 bet on jailed singer D4vd into $1.2 million; released on $2.25 million bond",https://timesofindia.indiatimes.com/world/us/google-engineer-arrested-after-turning-1000-bet-on-jailed-singer-d4vd-into-1-2-million-released-on-2-25-million-bond/articleshow/131376524.cms,"A Google software engineer has been arrested in US after allegedly using confidential company data to place prediction bets that earned him more than $1 million.Michele Spagnuolo, an Italian citizen who worked at Google, used internal search trend information from the company to place bets on the prediction platform Polymarket involving singer D4vd, who is currently jailed in a murder case.According to a federal criminal complaint unsealed in New York on Wednesday, Spagnuolo accessed non-public “Year in Search” data through his role at Google and used the information to make profitable wagers before the results became publicly known. Spagnuolo used a Polymarket account named “AlphaRaccoon” to place bets predicting D4vd would become one of “Google’s Top 5 Most Searched People of 2025” and even the number one searched person of the year.At the time, Polymarket gave almost no chance of D4vd topping the rankings. However, Google’s internal search data had already shown that the singer had overtaken Kendrick Lamar as the most searched person of 2025. Using that insider information, Spagnuolo placed bets worth less than $1,000 and later collected around $1.2 million in winnings.Federal prosecutors also accused him of trying to hide where the money came from.They said Spagnuolo “took deliberate steps to conceal his unlawful use of nonpublic information by attempting to obscure the source and ownership of his unlawful proceeds.”Spagnuolo was arrested on Wednesday and charged with wire fraud, commodities fraud and money laundering. He appeared before a federal magistrate judge but did not enter a plea. He was later released on a $2.25 million bond.The case has also drawn attention because of D4vd’s criminal case. The singer is currently in custody after being accused of murdering 14-year-old Celeste Rivas Hernandez in April 2025. He has pleaded not guilty to the charge. It is not yet confirmed whether D4vd was involved in the betting scheme or had any connection to Spagnuolo’s actions.","Michele Spagnuolo, an Italian citizen who worked at Google, used internal search trend information from the company to place bets on the prediction platform Polymarket involving singer D4vd. The singer is currently in custody after being accused of murdering 14-year-old Celeste Rivas Hernandez.","https://static.toiimg.com/thumb/msid-131377417,imgsize-165060,width-400,height-225,resizemode-4/-.jpg"
"'Shut up you ugly...': White House adviser Stephen Miller insulted by Democrats, Katie Miller responds",https://timesofindia.indiatimes.com/world/us/shut-up-you-ugly-white-house-adviser-stephen-miller-insulted-by-democrats-katie-miller-responds/articleshow/131373897.cms,"A Democratic National Committee (DNC) staffer has stirred a row after the party’s official X account insulted White House adviser Stephen Miller.The controversy began when the Democrats’ official account replied to one of Miller’s posts with the words: “shut up you ugly f***.” Because the message came from the national party’s verified account, rather than a personal or campaign account, it went viral.Soon after, Paulina Mangubat, a senior digital strategist at the DNC, appeared to reference the exchange from her own X account. She wrote: “Team just ratioed Stephen Miller, who is ugly, evil, cruel, and bald.”30-year-old Mangubat currently serves as deputy chief mobilisation officer at DNC, according to her LinkedIn profile. She was previously the party’s digital content and creative director and has worked on rapid-response messaging and social media strategy for Democrats.She graduated from Barnard College in 2017 and has also worked as digital and creative director for Boston Mayor Michelle Wu’s campaign, where she handled online messaging and campaign communications.Online speculation linked Mangubat directly to the Democrats’ X account, but the account is operated by a bigger social media team made up of around a dozen staffers.The group has freedom to react online and shape the party’s tone on social media platforms.The exchange began after the Democrats’ account posted support for Texas Senate candidate James Talarico. Miller responded by falsely claiming Democrats had nominated a transgender Senate candidate.“The Democrats made history in Texas by nominating their first transgender Senate candidate,” Miller wrote, in what many interpreted as an attack on Talarico.In another post, Miller claimed Talarico was “transitioning”, despite there being no evidence that the candidate is transgender.The Democrats’ account responded with the now-viral insult, sparking backlash from conservatives.Mangubat was later publicly named by Katie Miller, Stephen Miller’s wife, who criticised the post and identified Mangubat as one of the people behind the account.In a post on X, Katie Miller described Mangubat as “unmarried with no kids” and said she should “put [her] name on it.”Mangubat responded by posting a picture of herself trying on wedding dresses and wrote: “Well, now seems like a good time to share that I’m getting married! We just put down the deposit on the venue and bought my dress lol.”The row came just one day after another controversy involving the Democrats’ X account. A Memorial Day post featuring 13 fallen US service members alongside criticism of Donald Trump was deleted after bipartisan criticism.Democratic senator Tammy Duckworth condemned the message, writing: “It is incredibly distasteful to use our heroic dead for a political attack on Memorial Day. I’m a Democrat and I condemn this post by the DNC.”","Paulina Mangubat, 30, is a senior digital strategist at the DNC. She appeared to reference the exchange from her own X account. She wrote: “Team just ratioed Stephen Miller, who is ugly, evil, cruel, and bald” Miller’s wife, Katie Miller, publicly named her as behind the post.","https://static.toiimg.com/thumb/msid-131375499,imgsize-167022,width-400,height-225,resizemode-4/-.jpg"
"Indians fill out every form without blinking: CEO says Americans are not lazy, they have low tolerance for meaningless paperwork",https://timesofindia.indiatimes.com/world/us/indians-fill-out-every-form-without-blinking-ceo-says-americans-are-not-lazy-they-have-low-tolerance-for-meaningless-paperwork/articleshow/131375029.cms,"US CEO says Indians are good at unnecessary paperwork which Americans hate.

Indians vs Americans

Former US Merchant Marine captain John Konrad, the CEO of gCaptain, shared his experience of working in India and with Indians and said hardworking Indians or visa holders are not the problem. He said there is no doubt that Indians are hardworking but after spending some time in India, he realized why Indians are so hardworking -- because they don't want to return to India. Konrad said this is not culture but a cultural escape and if he were ever told that he had two options: working 18 hours a day or going back to the Bronx, he would have worked 18 hours a day.But if he were given two options: to move back to the Brox or to go to India where he worked for two years, he would choose going back to the Bronx, he said.Comparing the red tape between the US and India, Konrad said paperwork in the US feels like a cakewalk next to Indian bureaucracy.Sharing his experience of working in oil and gas around the world, and in both the US and India, Konrad said getting permits to even do the simplest things in America in a nightmare but the nightmare is nothing in comparison to India.And thus, he concluded that Indians, accustomed to such lengthy processes and paperwork, are better at navigating grinding.""The average American thinks navigating government websites and IRS forms is torture. Compared to India, it’s child’s play. And here’s the key: the more punishing the process, the more HR nonsense piled on top, the bigger the edge H-1B visa holders from India hold,"" Konrad opined.""Americans quit before they’ll spend eight hours grinding through mind-numbing bullshit paperwork and HR training. Indians fill out every form without blinking.""""When Americans hit a bureaucratic death loop, we call HR or tech support (often a call center in India) and rage. Indians trade notes with each other and hunt for the loopholes.""""The real problem isn’t the visa holders. It’s that the system rewards them for making our bureaucracy worse, not better. Bureaucracy becomes an artificial moat, and the people who’ve mastered it have every incentive to deepen it.""Konrad's conclusion was that Americans are not lazy or not qualified but they are unwilling to navigate boring paperwork which means nothing.""So the next time an executive at Amazon or Google claims they can’t find Americans capable of doing the job, ask the real question: Are Americans incapable of doing the actual work? Or just unwilling to navigate paperwork that never needed to exist? Are Americans lazy or do we just have a low tolerance for bullsh!t paperwork?"" the CEO said.","Former US Merchant Marine captain John Konrad, the CEO of gCaptain, shared his experience of working in India and with Indians. He said there is no doubt that Indians are hardworking but after spending some time in India, he realized why Indians are so hardworking -- because they don't want to return to India.","https://static.toiimg.com/thumb/msid-131375395,imgsize-206184,width-400,height-225,resizemode-4/us-ceo-says-indians-are-good-at-unnecessary-paperwork-which-americans-hate.jpg"
