Article Title,Article Link,Article Text,Article Summary,Article Image
'How long have you known about Andrew and Epstein?': King Charles heckled outside Lichfield Cathedral — Watch,https://timesofindia.indiatimes.com/world/uk/how-long-have-you-known-about-andrew-and-epstein-king-charles-heckled-outside-lichfield-cathedral-watch/articleshow/124863162.cms,"Britain's King Charles III embraces a well wisher, after his visit to Lichfield Cathedral, in Lichfield. (AP)





A protester on Monday confronted King Charles outside Lichfield Cathedral in northwest England, questioning him about Prince Andrew's connections to Jeffrey Epstein while the monarch was greeting royal supporters. The incident occurred amid renewed scrutiny of the royal family's knowledge of Andrew's ties to the late sex offender.The heckler directly challenged the King, shouting: ""How long have you known about Andrew and Epstein?""The protest comes as Prince Andrew, 65, recently announced he would stop using his Duke of York title following years of controversy over his association with Epstein.The protester also questioned potential police involvement, calling out: ""Have you asked the police to cover up for Andrew? Should the MPs be allowed to debate the royals in the House of Commons?""The King continued engaging with other members of the public, ignoring the protestor's remarks.Recent developments have intensified public interest in the matter, including the contents of a posthumous memoir by Virginia Giuffre, who had accused Prince Andrew of sexual abuse when she was a teenager.Andrew has consistently denied Giuffre's allegations. He reached an undisclosed settlement in 2022 to resolve a US lawsuit filed by Giuffre, who died by suicide in April.British law enforcement is currently investigating media reports that Andrew requested a police officer to gather compromising information about Giuffre in 2011.The renewed attention to the case has kept the royal family under public scrutiny, despite Andrew's recent decision to distance himself from his royal title.","Protester confronted King Charles outside Lichfield Cathedral in northwest England. The heckler directly challenged the King, shouting: ""How long have you known about Andrew and Epstein?"" Prince Andrew, 65, recently announced he would stop using his Duke of York title.","https://static.toiimg.com/thumb/msid-124863526,imgsize-1571636,width-400,resizemode-4/october-28.jpg"
Hurricane Melissa hits category 5: Strongest storm of 2025 nears Jamaica; Caribbean braces for catastrophic floods,https://timesofindia.indiatimes.com/world/rest-of-world/hurricane-melissa-hits-category-5-strongest-storm-of-2025-nears-jamaica-caribbean-braces-for-catastrophic-floods/articleshow/124862924.cms,"Hurricane Melissa moving towards Jamaica (AP)

Track and timing



Strength and intensification



Impacts so far & risks ahead



In Jamaica, authorities imposed mandatory evacuations for parts of the southern coast including Port Royal and activated emergency funding of at least US $33 million.



Prior to reaching Jamaica, Melissa triggered heavy rainfall across Haiti and the Dominican Republic, with confirmed deaths and large-scale evacuations.

Forecasters expect rainfall totals of up to 40 inches (≈1 m) in portions of Jamaica, and storm surge peaking near 13 feet (4 m) along the southern coast.



Mountainous regions are especially vulnerable: the combination of heavy rain, steep slopes and deforested terrain raises landslide danger



Preparation and warnings



Climate context







Hurricane Melissa, now a Category 5 system and the strongest storm anywhere in the world this year, is barreling toward Jamaica with sustained winds nearing 280 km/h, threatening catastrophic flooding, landslides and coastal storm surges across the Caribbean. The US national hurricane center (NHC) said the storm, which underwent explosive intensification over the weekend, has become a “potentially catastrophic” cyclone as it inches closer to the island’s southern coastline.By late Monday, Melissa was located roughly 200 km south-southwest of Kingston, moving slowly westward at about 5 kilometres per hour - a sluggish pace that forecasters warn will amplify rainfall and prolong destructive winds over Jamaica and neighbouring islands. The system has already lashed parts of Haiti and the Dominican Republic, leaving several dead and thousands displaced, according to the AP.Meteorologists describe Melissa as the most powerful Atlantic hurricane of the 2025 season, drawing strength from exceptionally warm ocean waters - nearly 2-3 °C above average - and calm upper-level winds that have allowed it to rapidly intensify. Authorities in Jamaica have ordered evacuations along low-lying southern areas, shuttered airports, and urged residents to brace for what Prime Minister Andrew Holness called a “historic and life-threatening event.Melissa is forecast to cross Jamaica late early Tuesday, then advance toward eastern Cuba on Tuesday night and reach the Bahamas by Wednesday.At the latest advisory, the storm was located roughly 205 km south-southwest of Kingston, Jamaica, moving westward at about 6 km/h. The slow pace is a key factor in the threat, it increases the duration of exposure to high winds and heavy rain, and allows flooding and landslides to build. Experts say Melissa’s rapid escalation to Category 5 was driven by unusually warm Atlantic waters and favourable atmospheric conditions.According to the NHC and other meteorologists, the storm may now rank among the most powerful ever to enter the Caribbean Sea, with sustained winds around 175 mph. The NHC issued stark warnings: “Catastrophic and life-threatening flash flooding and numerous landslides are likely today through Tuesday.” Prime Minister Andrew Holness of Jamaica emphasised: “There is no infrastructure in the region that can withstand a Category 5.”Transport Minister Daryl Vaz urged residents: “Don’t make foolish decisions… We are in a very, very serious time over the next few days.”Shelters have been opened and airports closed. Still, concerns linger about looting, inability to evacuate remote communities and potential delays in aid due to cut-off roads and communication loss. Meteorologists say storms like Melissa are emblematic of a warming world: ocean temperatures in the relevant zone are about 2-3 °C above average, creating a “vast reservoir of energy” for hurricane intensification.“It doesn’t mean every single cyclone will go through rapid or super-rapid intensification,” noted climate scientist Bernadette Woods Placky, “but in our warmer world, it will continue to increase the likelihood of storms going through rapid or super-rapid intensification.”(With inputs from agecies)","Hurricane Melissa, now a Category 5 system, is barreling toward Jamaica with sustained winds nearing 280 km/h. Forecasters expect rainfall totals of up to 40 inches (1 m) in portions of Jamaica, and storm surge peaking near 13 feet (4 m) Authorities in Jamaica have ordered evacuations along low-lying southern areas, shuttered airports, and urged residents to brace for what Prime Minister Andrew Holness called a “historic and life-threatening event”","https://static.toiimg.com/thumb/msid-124863161,imgsize-1409020,width-400,resizemode-4/hurricane-melissa-moving-towards-jamaica-ap.jpg"
‘No idea how long people can hold out’: US govt shutdown continues; federal workers feel brunt,https://timesofindia.indiatimes.com/world/us/no-idea-how-long-people-can-hold-out-us-govt-shutdown-continues-federal-workers-feel-brunt/articleshow/124861871.cms,"'Trump Trusts Us To Fix…’: Johnson Goes Ballistic On Dems For ‘Appeasing Marxists’ | Shutdown Day 27





When Jill Hornick woke up on a recent Monday morning, her first thought was that her timecard would be submitted that day for her job with the Social Security Administration in Chicago. But this Monday was different. The federal government was locked in a shutdown, and she received a paycheck for $0. ""This is the only income I have,"" she said. ""And I just started crying. I had a meltdown.""Hornick, 59, is one of 730,000 federal employees working without pay because of the impasse. Another 670,000 federal workers are furloughed without pay, according to data from the Bipartisan Policy Center, a think tank.As the shutdown stretches toward its fifth week, those govt employees are confronting an increasingly acute scenario. Their bills are mounting, and there is no clear resolution in sight.Some are turning to side hustles such as delivering food, walking dogs and selling personal items to bring in a bit of income. Others are relying on food banks that have been organised to provide federal workers and contractors with free groceries - efforts that community service providers say reflect food insecurity caused by the shutdown.The widespread anxiety is punctuating what has already been a gruelling year for federal workers as the Trump administration has raced to shrink and reshape govt, and moved to eliminate hundreds of thousands of jobs.The last shutdown, which came during Trump's first term, was the longest ever, lasting 34 full days. The current standoff, which began Oct 1, could stretch even longer. There are no negotiations for a deal to reopen govt, which Democrats say must include an agreement to extend expiring subsidies for health insurance.The impact of the political paralysis could be seen early Friday morning as hundreds of cars lined a road in Northern Virginia, filled with federal workers and govt contractors waiting for boxes of food being distributed by a local non-profit group. It was one of five sites set up in partnership with the Capital Area Food Bank, a hunger relief organisation, to distribute groceries in the Washington region, which is home to nearly 20% of federal workforce.Casey Perez, a mother of five from Maryland who is furloughed from her civilian job at Fort Belvoir, said the last three weeks had been tough. ""I don't know how to get the mortgage paid,"" Perez, 34, said as three of her children waited patiently in the back seat of her car.Some federal workers are seeking creative ways to string together enough money to cover their bills. Imelda Avila-Thomas, a furloughed labour department employee in Texas, said she had been going from room to room inside her home to see what she could sell to help make ends meet. One piece of furniture jumped out: a tan pullout sofa that her late mother slept on when she visited. Avila-Thomas said that her mother had died in 2022, and that she had held on to the sofa as she was still processing her death. ""I don't think I was ready to get rid of it,"" she said. But she sold it for $40.Under federal law, govt is required to pay back federal workers once funds become available. But Trump has said that may not be the case for everyone. Not all federal workers are going unpaid. Around 830,000 federal employees are still receiving their salaries because their offices are self-funded or there is other money to use, according to the Bipartisan Policy Center.As the shutdown continues, govt workers will have to make more tough decisions. Some said that they had called creditors seeking a reprieve. Others said that they were looking to take a loan out of their pension plans.","730,000 federal employees are working without pay because of the impasse. Another 670,000 are furloughed without pay, according to the Bipartisan Policy Center. As the shutdown stretches toward its fifth week, those govt employees are confronting an increasingly acute scenario.","https://static.toiimg.com/thumb/msid-124861875,imgsize-3688,width-400,resizemode-4/us-shutdown.jpg"
Who is Foxie? Twitch streamer opens up after Emiru assault as she reveals chilling stalking incident during stream,https://timesofindia.indiatimes.com/world/us-streamers/who-is-foxie-twitch-streamer-opens-up-after-emiru-assault-as-she-reveals-chilling-stalking-incident-during-stream/articleshow/124861655.cms,"Who is Foxie? Twitch streamer opens up after Emiru assault as she reveals chilling stalking incident during stream (Image via Getty)

Foxie shares fear after being allegedly stalked during solo travel

Nina Lin & Zoe Spencer Unbanned On Twitch One Day After Alleged Sexual Assault Ban

Emiru assault incident puts pressure on Twitch safety rules







Twitch streamer Foxie has shared a scary story online, saying a man was watching her livestream and stalking her in real life while she was traveling alone. This comes just days after fellow streamer Emiru was assaulted by a man at TwitchCon during a fan meet-and-greet. Foxie said on X that the man followed her around Ocean Beach for two days, and she is now staying safe with friends. She said she has informed the police and is still shaken by what happened.Foxie is a Twitch and Kick streamer who also calls herself a part-time van lifer, meaning she lives and travels in a van while streaming. In her X post, she said she has never felt this scared before.She said the man was watching her streams and following her around town. She wrote that she now feels afraid to sleep in her van at night. Foxie said, “I am sick thinking if he was near my van while I was sleeping.”She also said her “biggest fear came true”, and this happened while she was alone in Ocean Beach. Foxie confirmed that the police have been informed, and she is staying with friends as she figures out what to do next. She thanked fans for checking in and said she is safe for now but emotionally shaken.Foxie later said she always knew solo travel had risks but did not expect something this serious. She said this incident shows why sharing personal location online can be dangerous, because not everyone has good intentions.This comes after Emiru was assaulted by a man during a TwitchCon meet-and-greet, a moment that went viral online. Foxie also attended TwitchCon and said she had a positive time meeting people there. But now, after this stalking incident, many streamers and fans are again raising questions about safety for women streamers.Also Read: Influencer Ben Bader Dies Suddenly At 25 After Posting Final TikTok Hours Before Death Twitch CEO Dan Clancy said he is sorry to Emiru and confirmed that Twitch is reviewing security and sign-up systems for all future TwitchCon events. He said stronger safety rules are being worked on to protect streamers.Foxie said she will keep traveling but will now be more careful and alert. She thanked everyone for their support and said she needs time to calm down before streaming again.","Twitch streamer Foxie has shared a scary story online, saying a man was watching her livestream and stalking her in real life while she was traveling alone. This comes just days after fellow streamer Emiru was assaulted by a man at TwitchCon during a fan meet-and-greet. Foxie said on X that the man followed her around Ocean Beach for two days, and she is now staying safe with friends.","https://static.toiimg.com/thumb/msid-124861648,imgsize-707504,width-400,resizemode-4/who-is-foxie-twitch-streamer-opens-up-after-emiru-assault-as-she-reveals-chilling-stalking-incident-during-stream.jpg"
Trucker licenses row: Transportation secy Duffy warns California again; threatens to cut $160 million fed funding,https://timesofindia.indiatimes.com/world/us/trucker-licenses-row-transportation-secy-sean-duffy-warns-california-again-threatens-to-cut-160-million-fed-funding/articleshow/124861766.cms,"Sean Duffy (AP image)

Karoline Leavitt Calls Indian Trucker Illegal Alien After Deadly California Road Accident Kill Three





US transportation secretary Sean Duffy warned Sunday that he is about make good on a threat to revoke millions in federal funds for California because he says the state is illegally issuing commercial driver's licenses to non-citizens.In an appearance on Fox News Channel's ""Sunday Morning Futures,"" Duffy said governor Gavin Newsom has refused to comply with department of transportation rules that require the state to stop issuing such licenses and review those already issued. His statement came after investigations into two recent fatal crashes involving Sikh drivers showed widespread malpractice in issuance of commercial driving licences (CDLs).""So, one, I'm about to pull $160 million from California,"" Duffy said. ""And, as we pull more money, we also have the option of pulling California's ability to issue commercial driver's licenses.""Eva Spiegel, a spokesperson for California's department of motor vehicles, said the Trump administration ""has no legitimate basis"" to withhold federal highway transportation funds. ""The federal govt previously allowed commercial driver's licences for asylum seekers and refugees and on Sept 26 announced emergency regulations to cease this practice that went into effect on Sept 29.California is in compliance with these regulations and will remain in compliance with federal law. ""When Duffy threatened to revoke funds last month, a spokesperson for Newsom dismissed the attack and noted that CDL holders from California have a significantly lower rate of crashes than both the national average and that of Texas, which is the only state with more licenced commercial drivers.Duffy said California has unlawfully issued tens of thousands of these licences to non-citizens. Duffy said earlier he would withhold $40 million from California as it is failing to enforce English language requirements for truckers. agencies",US transportation secretary Sean Duffy says he is about to make good on a threat to revoke millions in federal funds for California. He says the state is illegally issuing commercial driver's licenses to non-citizens. Duffy said earlier he would withhold $40 million from California as it is failing to enforce English language requirements for truckers.,"https://static.toiimg.com/thumb/msid-124861784,imgsize-983692,width-400,resizemode-4/sean-duffy.jpg"
Kate Cassidy posts intimate unseen Liam Payne TikTok clip just days after his sister accused ‘fame seekers’,https://timesofindia.indiatimes.com/world/us-streamers/kate-cassidy-posts-intimate-unseen-liam-payne-tiktok-clip-just-days-after-his-sister-accused-fame-seekers/articleshow/124861422.cms,"Kate Cassidy posts intimate unseen Liam Payne TikTok clip just days after his sister accused ‘fame seekers’ (Image via DailyMail)

Kate Cassidy and Liam Payne seen together in pool and dress shoot video

Liam Payne’s Sister 'Blasts' Kate Cassidy? Ruth Calls Out Those Exploiting Tragic Death

Kate Cassidy now healing, open to dating again after dark grief period





Liam Payne has been seen in a new unseen video posted by his former girlfriend Kate Cassidy on her TikTok page, almost one year after his death. The video shows Liam, who died aged 31 in October 2024, smiling and filming Kate while they were on a holiday trip. Kate added only one word in the caption, “memories,” along with the song Apocalypse by Cigarettes After Sex. Fans quickly reacted with emotional comments, as many were not expecting new footage of the late One Direction singer.The unseen clip shows Liam holding the camera while swimming in a pool, then turning it to film Kate Cassidy, who was wearing a pale blue bikini. In the second part of the video, Liam can be heard giving Kate pose directions while she models a red mini dress.His voice is clearly heard as he takes photos of her. Kate shared this video just days after she appeared to respond to Liam’s sister Ruth Payne, who recently wrote that some people were “using his death for fame.”Kate Cassidy had posted luxury hotel photos during Liam Payne’s death anniversary trip on October 16, and raised her middle finger in one photo, which fans believed was aimed at the criticism. Kate continues to say Liam would have wanted her to go.According to Daily Mail, a close friend has said Kate is finally healing and is now open to dating again. The friend revealed that after Liam Payne’s death, which was ruled after a toxicology report showed alcohol, cocaine, and a prescription antidepressant in his system, Kate Cassidy went into a very dark phase where she stopped smiling and avoided people for months. Her grief was deep, and she cancelled many plans.But now, she is slowly coming back to normal life, posting light and fun photos again on Instagram. The friend shared that Kate is moving forward because she believes that is what Liam Payne would have wanted for her. Sources say she is not focusing on online gossip or comments and is only trying to live again after a very painful year.Also Read: Influencer Ben Bader Dies Suddenly At 25 After Posting Final TikTok Hours Before Death","Liam Payne has been seen in a new unseen video posted by his former girlfriend Kate Cassidy on her TikTok page. The video shows Liam, who died aged 31 in October 2024, smiling and filming Kate while they were on a holiday trip. Kate shared this video just days after she appeared to respond to Liam’s sister Ruth Payne, who recently wrote that some people were “using his death for fame”","https://static.toiimg.com/thumb/msid-124861416,imgsize-1129994,width-400,resizemode-4/kate-cassidy-posts-intimate-unseen-liam-payne-tiktok-clip-just-days-after-his-sister-accused-fame-seekers.jpg"
