Article Title,Article Link,Article Text,Article Summary,Article Image
Meet Shrey Parikh: 14-year-old Indian-origin Spelling Bee winner who spelled 32 words in 90 seconds,https://timesofindia.indiatimes.com/world/us/meet-shrey-parikh-14-year-old-indian-origin-spelling-bee-winner-who-spelled-32-words-in-90-seconds/articleshow/131383426.cms,"Shrey Parikh's spelling journey to win America’s biggest spelling contest

The 2026 Scripps National Spelling Bee: The night in detail

The spell-off: 90 seconds, 32 words, a record broken



The word that tested him most

His reaction: Joy, relief and redemption

Prizes and recognition

A historic tradition of Indian-origin champions

More than a speller

Indian-origin teenager Shrey Parikh has achieved what millions of young spellers dream of. The 14-year-old from Rancho Cucamonga, California, won the 2026 Scripps National Spelling Bee on May 28 at DAR Constitution Hall in Washington, D.C. He defeated runner-up Ishaan Gupta in a dramatic spell-off finale. During the tie-breaker, Parikh correctly spelled 32 words in just 90 seconds. The performance set a new spell-off record and secured his place in the competition's 101-year history. The victory was especially significant because it came in Parikh's third appearance at the national competition, completing a journey that saw him finish 89th in 2022 and third in 2024 before finally claiming the championship.Shrey Parikh is a 14-year-old Indian-American student currently enrolled in eighth grade at Day Creek Intermediate School in Rancho Cucamonga, California, sponsored by the San Bernardino County Superintendent of Schools. Far from being a one-dimensional academic, Shrey is known as a well-rounded individual with a rich set of interests. He is an accomplished musician who plays a remarkable range of instruments, including snare drum, bass drum, timpani, toms, break drum, triangle, glockenspiel, marimba, piano and ukulele.He is also a polyglot. From a young age, Shrey has spoken multiple languages, including three Indian dialects, reflecting his deep Indian-origin heritage. His principal at John L. Golden Elementary School, where Shrey studied before moving on, described him as ""well-rounded in all subjects.""Shrey's relationship with competitive spelling began remarkably early. As a fourth-grader at John L. Golden Elementary School in Rancho Cucamonga, he won the San Bernardino County Superintendent of Schools Spelling Bee, which earned him a spot at the 2022 Scripps National Spelling Bee, his very first appearance on the national stage. He tied for 89th place that year, a solid debut for a student so young.In 2024, Shrey returned and finished third, with Bruhat Soma taking the championship and Faizan Zaki finishing second. Shrey earned $12,500 in prize money. That result signalled he was firmly among the country's elite young spellers.Then came a stunning setback. Shrey lost his school bee last year when he was battling a fever, failing to qualify for the national competition entirely. It was a bitter blow. He took six months off from spelling before reopening his Merriam-Webster dictionary.With 2026 being his final year of eligibility, competitors must not have advanced beyond eighth grade or be older than 15, Shrey approached the season with an all-or-nothing intensity. His coaching team included Sam Evans , who has tutored each of the past three champions; Sohum Sukhatankar, a co-champion himself in 2019; and Vijaya Ganesh, a longtime coach and the mother of a former speller.The 14-year-old works with three coaches, pays for word lists and study guides, and tries to learn every Greek and Latin root, every language pattern and every spelling bee-worthy word he can find. He also competes throughout the year in online bees that pit him against the country's other top spellers. To prepare for the spelling bee, Shrey said he practised five hours each day.He arrived in Washington as one of the clear favourites, and he did not disappoint.The 2026 event comprised 247 participants from across the United States and its territories. After two preliminary rounds, the field was narrowed to eight finalists for the Thursday night showdown at DAR Constitution Hall.Sporting a business-casual look with a dark long-sleeve collared shirt, khakis and sneakers, the lanky Shrey strode to the microphone with a serious expression that instantly vanished when he heard his word from pronouncer Jacques Bailly and nodded vigorously, his tell that he knew the answer.The dreaded bell did not ring until the third round, which saw four contestants eliminated in a matter of minutes. By the end of the seventh round, only Parikh and Gupta were left. When both successfully spelled their words in the following round, the spell-off was triggered.The spell-off format, introduced in 2021, is as thrilling as it is ruthless. Each speller had 90 seconds to spell as many words as possible. As one participant competed, the other was sequestered with headphones on, unable to hear the words being read.Shrey was extraordinary. Parikh correctly spelled 32 out of 35 words attempted in 90 seconds to win the title and beat the previous spell-off record set in 2024 by Bruhat Soma, who spelled 29 out of 30 words correctly. Parikh crushed 32 words to Gupta's 25, ending on ""cashaw"", a type of plant, and setting a new spell-off record.It was only the third time a spell-off had decided the spelling bee since the format was introduced. Harini Logan won the first spell-off in 2022 by spelling 22 words in 90 seconds, while Bruhat Soma won in 2024 with 29.Scripps later announced that the championship word was ""bromocriptine"", a polypeptide alkaloid derived from ergot that mimics the activity of dopamine.For all his composure, one word gave Shrey pause during the finals: ""Bhubaneswar"", the capital city of the Indian state of Odisha.""I was 99% sure it had a 'B,' but doubt always creeps into your head, especially in the moment,"" he said. ""I knew I just had to stick with my gut and stick with my instincts on that word.""He spelled it correctly and moved on.""Right now I'm probably the happiest I've ever been. I'm just so happy and relieved, and just such a flood of emotions,"" Shrey said after the win.""At my school bee last year, I was really dejected and just very upset. It didn't even sink in until the next day. I had a really tough time, but I'm glad I was able to bounce back.""On the spell-off itself, Shrey was remarkably composed.""Spelling fast is what I do every day,"" he said while holding the Scripps Cup. ""A spell-off just came naturally.""He described the final round as feeling like ""just another day of spelling.""Upon hearing the announcement confirming his victory, Shrey immediately turned and shook Gupta's hand.As the 2026 champion, Shrey takes home an impressive haul. He received $52,500 in prize money, along with reference works from Encyclopaedia Britannica and Merriam-Webster, a custom trophy and commemorative medal, and $1,000 in flight credits from Delta Air Lines.He also earned an astronaut meet-and-greet at the Kennedy Space Center Visitor Complex in Florida. A trip to Universal Orlando Resort theme parks rounded out the prize package.Although this was the 98th bee, Shrey became the 111th champion because the competition has produced multiple co-champions over the years, including an eight-way tie in 2019.Shrey's victory continues a remarkable trend of Indian-American students excelling at the Scripps National Spelling Bee.Recent champions of Indian origin include Faizan Zaki (2025), Bruhat Soma (2024), Dev Shah (2023) and Harini Logan (2022), among many others. Notably, runner-up Ishaan Gupta is also of Indian origin, meaning both finalists this year traced their roots to the Indian subcontinent.For the first time in the bee's history, second- and third-place finishers from the same year later went on to win championships. Faizan Zaki won in 2025 after finishing second in 2024, while Shrey Parikh won in 2026 after finishing third that same year.What makes Shrey Parikh's story compelling is not just the trophy. It is the resilience, the fever that cost him a chance to qualify, the months away from spelling and the determination to return stronger. It is the discipline of five hours of daily practice and a coaching team assembled for one final shot at glory.It is also the calm of a teenager who broke a national record and then described the achievement as ""just another day of spelling.""As the 111th Scripps National Spelling Bee champion, Shrey Parikh is already part of American educational history. For a 14-year-old who once walked away from a school bee in tears, however, this moment represents something even bigger. It is proof of what can happen when talent meets persistence.","Shrey Parikh, 14, from Rancho Cucamonga, California, won the 2026 Scripps National Spelling Bee on May 28 at DAR Constitution Hall in Washington, D.C. He defeated runner-up Ishaan Gupta in a dramatic spell-off finale. During the tie- breaker, Parikh correctly spelled 32 words in just 90 seconds.","https://static.toiimg.com/thumb/msid-131383478,imgsize-125210,width-400,height-225,resizemode-4/shrey-parikh.jpg"
"Meet Antoine Moses: Canadian ‘tree lover’ sets a second Guinness World Record by planting 47,460 trees in just 24 hours on the Kenyan coast",https://timesofindia.indiatimes.com/world/rest-of-world/meet-antoine-moses-canadian-tree-lover-sets-a-second-guinness-world-record-by-planting-47460-trees-in-just-24-hours-on-the-kenyan-coast/articleshow/131381844.cms,"PC: Guinness World Record

Antoine Moses sets new green record in Kenya with 47,460 mangrove saplings planted



Antoine Moses: The Canadian tree planter redefining large-scale reforestation



Before Kenya: Antoine Moses’ 23,000-tree record in northern Alberta



Why mangroves matter in protecting fragile coastal shorelines



The long journey behind a million trees planted across seasons



From shoreline work to millions of online viewers worldwide



On the mudflats outside Mombasa, the tide does not sit still for long. It pulls in, withdraws, leaves behind a surface that looks soft but behaves like something less forgiving once you step into it. On a stretch of coast usually shaped by salt, heat, and passing weather systems, a man spent close to a full day moving in a narrow rhythm between holes already dug and saplings waiting to be pressed into place. The work did not pause much for daylight or nightfall. It just carried on, with a small group around him and a line of young mangroves gradually taking hold in the sand-heavy soil. What happened there later became a record, though on the ground it looked more like repetition than spectacle.Antoine Moses arrived on the Kenyan coast with a kind of routine already built into his movements. The work of planting mangroves is not gentle on the body. Each sapling has to be set into wet ground that shifts under pressure, often knee-deep in places where the tide has recently retreated.On 30 April, that rhythm stretched across hours that blurred together. The target was simple in wording but less so in practice: thousands upon thousands of mangrove propagules placed one after another, without much variation in pace.By the time the day folded into night, the count had reached 47,460. The number later entered record books, but at the time it was just a growing line of small plants disappearing into mud.Antoine Moses is a Canadian tree planter and environmental worker known for endurance planting records carried out in different parts of the world. His work sits in a niche corner of large-scale reforestation, where the focus is less on ceremony and more on how many saplings can be placed into the ground in tightly measured time windows.Before the attention around records, he spent years working in commercial planting operations in Canada, moving through long seasonal shifts where thousands of trees are planted manually in rough terrain. Over time, that routine became the foundation for attempts to push planting speed into record territory, first in North America and later internationally.This was not the first time he had attempted something at this scale. Years earlier, in northern Alberta, he had already pushed through a similar kind of endurance planting session, setting a record that involved more than 23,000 trees in a single day back in 2021.Those earlier efforts were shaped by Canada’s commercial reforestation work, where planting cycles can become repetitive and physically demanding over entire seasons. By the time he reached Kenya, that familiarity had turned into a kind of method, built on repetition rather than planning, where movement becomes almost automatic.Mangroves do not grow in neat conditions. They sit at the boundary where seawater meets land, tolerating both flooding and exposure in equal measure. In Mombasa, those edges matter for fishing communities and for the stability of the shoreline itself, though that is not always visible at first glance.What was being planted that day was part of that system, young shoots meant to take root in unstable ground and eventually hold it together. The work was physical, but the outcome belongs to a slower timeline. Nothing about it changes the coastline immediately.At points during the day, the planting line continued even as light faded, with headlamps and small groups working around the same narrow stretch. The mud did not change its consistency with the hour.By this stage, Antoine Moses was already known for endurance planting attempts. The previous record in Canada had placed him among a small group of people who treat tree planting less like an environmental gesture and more like sustained manual labour pushed to its limit.He has said in earlier conversations that he had already planted well over a million trees in total across different projects before attempting the Kenyan effort. The figure is difficult to visualise in practical terms, but it reflects years of seasonal work rather than a single campaign.After the planting session ended, the focus shifted away from the shoreline. Short clips and photographs began circulating through social media, where his work already has a following measured in the millions. Around 1.6 million people are currently connected to his updates, watching fragments of planting days that would otherwise pass unnoticed.He also runs a project called Antomos, which sits somewhere between storytelling and coordination work for reforestation campaigns. It links environmental planting efforts with digital documentation, often relying on third-party tracking systems such as veritree to log and verify what has been planted and where it has been placed.The idea is not framed as activism in a traditional sense. It appears more like an attempt to keep records aligned with physical work, so that what happens in muddy fields can be traced later without relying on memory alone.","Antoine Moses is a Canadian tree planter and environmental worker known for endurance planting records carried out in different parts of the world. His work sits in a niche corner of large-scale reforestation, where the focus is less on ceremony and more on how many saplings can be placed into the ground in tightly measured time windows.","https://static.toiimg.com/thumb/msid-131381909,imgsize-71178,width-400,height-225,resizemode-4/meet-antoine-moses-canadian-tree-lover-sets-a-second-guinness-world-record-by-planting-47460-trees-in-just-24-hours-on-the-kenyan-coast.jpg"
"A 2,000-year-old stone found in Karnak temple reveals a Roman emperor hidden in the form of an Egyptian pharaoh",https://timesofindia.indiatimes.com/world/rest-of-world/a-2000-year-old-stone-found-in-karnak-temple-reveals-a-roman-emperor-hidden-in-the-form-of-an-egyptian-pharaoh/articleshow/131381493.cms,"PC: Facebook (Ministry of Tourism and Antiquities)

Egypt’s Karnak project uncovers hidden stone-built layers beneath Emperor Ramses III’s northern gate



Facebook (Ministry of Tourism and Antiquities)

What does Karnak northern wall excavations reveal



Roman emperor shown like an Egyptian pharaoh in Karnak temple



Ancient stones rarely behave like still objects in Egypt. At the Karnak temples in Luxor, walls and gateways tend to reappear in unexpected forms, as if the past has been repeatedly folded and stitched back together by different hands across centuries. The latest work north of the temple complex has done exactly that, revealing a gate linked to Ramses III that had been buried in fragments and overgrowth for generations. What began as a careful restoration project has quietly shifted into something more layered, with hints of Roman-era presence surfacing beneath the sand. Among them is a carved stone slab connected to Emperor Tiberius, raising new questions about how sacred space was reused, rewritten, and reimagined over time in ancient Egypt.The northern wall gate associated with Ramses III has not had an easy history. Built during the 20th Dynasty, it reportedly suffered heavy damage long before modern restoration began, with its lower sections partially exposed and unstable when first documented in the 19th century. Vegetation had taken hold, stone blocks had shifted, and much of its original form was no longer readable in the landscape.According to Ministry of Tourism and Antiquities Facebook post, between 2022 and 2025, an Egyptian French archaeological team working within the Karnak temples undertook a slow reconstruction effort.Blocks were taken apart one by one, cleaned, recorded, and reassembled with scientific precision rather than guesswork. The aim was not to recreate a romantic version of the past, but to stabilise what remained and understand how the structure originally stood.What makes the process unusual is what surfaced during dismantling. Several reused stones, some bearing decorative elements from the reign of Amenhotep III, appeared embedded within the later structure. It suggests that the gate itself may have been built using material from even older monuments, turning the site into a kind of architectural archive layered with earlier dynasties.As work expanded around the gate, attention shifted to the surrounding northern wall of the Temple of Amun-Ra. Here, archaeologists appear to have encountered construction phases that do not belong to a single moment in time. Instead, the masonry hints at repeated rebuilding, stretching from the New Kingdom into later Greek and Roman periods.A paved road was also identified during recent fieldwork, one that had been partially recorded in early 20th-century surveys but never fully understood. It links the Ramses III gate to a major courtyard deeper inside the Karnak complex, suggesting that movement through this part of the temple was more structured than previously assumed.Mudbrick installations from later antiquity sit within the same zone, adding another layer of occupation. The picture that emerges is not of a static sacred boundary, but of a working religious landscape that continued to evolve long after its original builders had gone. Experts suggest the area may have been repeatedly repurposed as political control shifted, especially during the Roman and Byzantine eras.According to the Ministry of Tourism and Antiquities Facebook post, the most striking find is a sandstone stela linked to Emperor Tiberius, measuring roughly 60 by 40 centimetres. It was uncovered during restoration work close to the gate, lying within an archaeological layer associated with later settlements.The carving shows the Roman emperor presented in traditional pharaonic style, standing before the Theban triad of Amun-Ra, Mut, and Khonsu. Rather than appearing as a foreign ruler, he is shown participating in a familiar religious act, offering recognition to the divine order of the temple.This visual language was not unusual in Roman Egypt. Emperors were often adapted into Egyptian religious frameworks when depicted in temple settings, even if their political identity remained Roman elsewhere. The stela also contains a short hieroglyphic inscription referencing restoration work on temple structures, suggesting it may have functioned as a commemorative marker rather than a purely decorative object.Its presence inside the Karnak complex hints at how Roman authority was absorbed into existing religious systems rather than replacing them outright. The imagery appears designed to align imperial power with local belief structures, reinforcing legitimacy through ritual rather than conquest alone.","Egypt's Karnak project uncovers hidden stone-built layers beneath Emperor Ramses III’s northern gate. Among them is a carved stone slab connected to Emperor Tiberius, raising new questions about how sacred space was reused, rewritten, and reimagined over time in ancient Egypt.","https://static.toiimg.com/thumb/msid-131381503,imgsize-112348,width-400,height-225,resizemode-4/a-2000-year-old-stone-found-in-karnak-temple-reveals-a-roman-emperor-hidden-in-the-form-of-an-egyptian-pharaoh.jpg"
"Italy on red alert as France, Portugal beat hottest May day record",https://timesofindia.indiatimes.com/world/europe/italy-on-red-alert-as-france-portugal-beat-hottest-may-day-record/articleshow/131380258.cms,"Italy on red alert; Portugal records hottest May day

Tennis woes

Poll What is your main concern during extreme heat conditions? Health and dehydration risks Power cuts and daily disruptions

ROME: Italy issued a red alert warning for the capital Rome on Thursday and Portugal and France reported their hottest days in May as Europe struggled with a heatwave that has smashed records across the continent.Britain and France have already reported their hottest-ever May days this week as a ""heat dome"" brought sweltering temperatures usually unseen until high summer to western Europe.Several people have died in both Britain and France, mostly in drowning accidents that authorities have linked with the baking heat, while Portugal's Health Minister Ana Paula Martins reported that the heatwave had caused a spike in hospitalisations.The mercury peaked at 40.3C in Portugal's central town of Mora on Wednesday, topping the previous record of 40C from May 2001, the meteorological agency announced on Thursday, warning that the heatwave had a ""high likelihood"" of lasting into the beginning of June.Italy has so far been spared the highest temperatures but on Thursday officials warned people in Rome and four northern cities to stay out of the sun.""We're sweating a lot,"" said Spanish tourist Nana Martinez Garcia, trying to stay cool outside Rome's Colosseum on Thursday with temperatures hitting 32C.""We're drinking a lot of water so we can cool down,"" she said, with her friend Maria Angeles Mellinas Tello chiming in that they were ""staying in the shade"" whenever they could.The first red alert of the year in Italy -- which also covered Florence, Bologna, Brescia and Turin -- warned of ""possible negative effects on the health of healthy, active people"".Scientists say human-driven climate change is amplifying such extremes, with weather events like heatwaves, droughts and floods becoming more intense and frequent.The worst of the heat seemed to have passed in Britain, but much of France continued to bake on Thursday.Temperatures in the southwestern city of Angouleme hit a maximum of 37.8C, beating the records for May day temperatures just set on Monday and Tuesday, according to a provisional figure from Meteo France in the evening.A school in the southwest was forced to shut its doors on Thursday and Friday afternoon after temperatures in the corridors reached 53C on Tuesday, causing pupils to get sick, a local official said.""There was even someone who fainted and vomited,"" said Florian Deygas, an official in the Landes region.Paris was expecting temperatures to hit 34C and remained on orange heatwave alert, national weather service Meteo France said, following record-breaking days in France on Monday and Tuesday.Players at the French Open tennis tournament on the outskirts of Paris have been suffering from the heat, with one collapsing after winning a gruelling hours-long match.Italy's Jannik Sinner, the red-hot favourite at the Roland Garros tournament, complained of dehydration, dizziness and nausea as he succumbed to the heat on his way to a shock second-round loss to opponent Juan Manuel Cerundolo.Staff at the venue have been spraying the red earth courts with water after every set and once the day's matches are over, ""we flood the courts, we soak them, so as to replenish with water the different layers that make up the clay"", said head maintenance worker Philippe Vaillant.In Spain, the national weather office Aemet issued heat alerts for Friday for parts of the northeast and north, where temperatures were forecast to soar to up to 37C.The office said in a social media post that temperatures were ""extraordinarily high"" for this time of year across Spain, at levels typically seen in summer. It predicted that temperatures would drop noticeably next week.Back in Rome, US tourist Josh Ren said he had a game plan for the heat: ""Get up early, do things more early, take a lot of breaks.""Go sit down in some air-conditioned restaurant, go to the museum, stay inside a little bit more during the hottest time of the day.""","Italy issues a red alert warning for the capital Rome and four northern cities. Portugal and France report their hottest days in May as Europe struggles with a heatwave. Several people have died in both Britain and France, mostly in drowning accidents. Players at the French Open tennis tournament have been suffering from the heat.","https://static.toiimg.com/thumb/msid-131380278,imgsize-1047963,width-400,height-225,resizemode-4/article-78.jpg"
