Article Title,Article Link,Article Text,Article Summary,Article Image
Staircase leading to a brick wall: Bizarre architectural flaws emerge in Trump's ballroom design; no one knows what he's building,https://timesofindia.indiatimes.com/world/us/staircase-leading-to-a-brick-wall-bizarre-architectural-flaws-emerge-in-trumps-ballroom-design-no-one-knows-what-hes-building/articleshow/124853800.cms,"Major loopholes were found in the miniature model of the White House ballroom which is at the center of a raging controversy.

A staircase leading to a wall

Trump’s $350M ‘Presidential Ballroom’ Mystery Sends D.C. Into Frenzy; What’s He Really Building?

Windows opening onto one another





Donald Trump's ballroom design is in flux as bizarre architectural flaws emerge in the designs released so far. The construction was slated to begin in September, is supposed to be completed before the end of Trump's term. Plans shared by the MAGA administration suggest “a hurried process,” the New York Times reported, pointing out the technical flaws that were found in the miniature model unveiled Wednesday.The model showed a staircase leading up from the South Lawn, but it reaches nowhere and hits a wall.Another bizarre feature was a window that appears to open out onto another window.Last Monday, the White House started tearing down part of the East Wing, the traditional base of operations for the first lady, to build President Donald Trump’s $250 million ballroom despite lacking approval for construction from the federal agency that oversees such projects.Dramatic photos of the demolition work showed construction equipment tearing into the East Wing façade and windows and other building parts in tatters on the ground. Some reporters watched from a park near the Treasury Department, which is next to the East Wing.Trump announced the start of construction in a social media post and referenced the work while hosting 2025 college baseball champs Louisiana State University and LSU-Shreveport in the East Room.He noted the work was happening “right behind us.”The administration has dismissed attacks on the project as “manufactured outrage.” Donald Trump Jr. has rebuffed critiques from members of the Clinton family by pointing out scandals during their time in the White House. The Trump team also updated a page on the official White House website to include a timeline of “major events.” The timeline largely consists of significant construction projects, but Trump aides added in then-President Bill Clinton’s affair with Monica Lewinsky; the discovery of cocaine in the building during the Biden administration; and a 2023 Trans Day of Visibility celebration at which one attendee was topless.“We’ve been keeping you apprised of this project. We’ve shown you the renderings. And if you look at the renderings, it’s very clear the East Wing was going to be modernized,” White House press secretary Karoline Leavitt said.","The White House started tearing down part of the East Wing, the traditional base of operations for the first lady, to build President Donald Trump’s $250 million ballroom. The administration has dismissed attacks on the project as “manufactured outrage” Donald Trump Jr. has rebuffed critiques by pointing out scandals during their time in the White House.","https://static.toiimg.com/thumb/msid-124853923,imgsize-300070,width-400,resizemode-4/major-loopholes-were-found-in-the-miniature-model-of-the-white-house-ballroom-which-is-at-the-center-of-a-raging-controversy.jpg"
Donald Trump reveals why he won’t run for US president in 2028: ‘I’d rule that out because…’,https://timesofindia.indiatimes.com/world/us/donald-trump-reveals-why-he-wont-run-for-us-president-in-2028-id-rule-that-out-because/articleshow/124853335.cms,"Trump As US V-P In 2028? President's ‘Too Cute’ Attack On Dems, Leaves Door Open For 3rd Term





US President Donald Trump brushed aside growing speculation about seeking a third term in office, calling the idea “too cute” and “not right,” even as some of his MAGA allies push the idea that he could return to power again in 2028.Speaking to reporters aboard Air Force One en route to Japan on Monday, the GOP leader said he would technically be “allowed” to run as vice president in 2028 and then assume the presidency if the elected president resigned. However, he dismissed the idea outright, reports Alabama News.“Yeah, I’d be allowed to do that. But I wouldn’t do that. I think it’s too cute. Yeah, I’d rule that out because it’s too cute. I think people wouldn’t like that. It’s too cute. It wouldn’t be right,” Trump said.The US Constitution restricts presidents to two terms in office. The rule is not taken well among Trump’s supporters, who continue to float alternative theories that could allow Trump to lead again.Last week, Steve Bannon, Trump’s 2016 campaign chief and former White House adviser, insisted that Trump “will be president in 2028.” Speaking to The Economist, Bannon said, “There’s many different alternatives.At the appropriate time we’ll lay out what the plan is. But there’s a plan, and President Trump will be president in 2028.”Trump appeared to distance himself from that claim, saying the Republican Party would be “in good shape” without him on the ticket. He praised secretary of state Marco Rubio and vice president JD Vance as strong contenders for 2028.“Well, we have great people. I don’t have to get into that. But we have one of them standing here. We have JD, obviously. The vice president is great. I think Marco’s great. I’m not sure if anybody would run against those two. I think if they formed a group, they would be unstoppable,” Trump said.Still, the POTUS could not resist boasting about his continued popularity. “I would love to do it. I have the best numbers ever,” he said, before taking aim at potential Democratic challengers. He called opposition representatives Jasmine Crockett and Alexandria Ocasio-Cortez “low IQ” figures and mocked their intelligence.“They have Jasmine Crockett – a low IQ person. AOC’s a low IQ. You give her an IQ test, have her pass, like, the exams that I decided to take when I was at Walter Reed. They’re really aptitude tests, I guess, in a certain way. But they’re cognitive tests,” he said.",US President Donald Trump dismissed the idea that he could run for a third term in 2028. Trump said he would technically be “allowed” to run as vice president and then assume the presidency if the elected president resigned. The US Constitution restricts presidents to two terms in office.,"https://static.toiimg.com/thumb/msid-124853516,imgsize-60838,width-400,resizemode-4/-.jpg"
'Illogical Taliban': Pakistan-Afghanistan peace dud? Talks hit deadlock over cross-border tensions,https://timesofindia.indiatimes.com/world/pakistan/illogical-taliban-pakistan-afghanistan-peace-dud-talks-hit-deadlock-over-cross-border-tensions/articleshow/124840225.cms,"Pak-Afghan delgates at the talks (ANI)

Should India Engage With Taliban Amid Pak-Afghan Truce? Ex-Diplomat Explains| India Connect





The latest round of peace talks between Pakistan and Afghanistan has reportedly hit a stalemate, with Islamabad accusing the Afghan Taliban of taking an “illogical and detached” position on key security issues, including cooperation against cross-border militancy, Geo News reported.The second phase of discussions, held in Istanbul on Saturday, came a week after the initial negotiations in Doha following an October 16 ceasefire that ended the deadliest border clashes between the two sides since the Taliban seized power in 2021.Citing official sources, Geo News said Pakistan presented “clear, evidence-based and solution-oriented” demands urging Kabul to act against militant groups operating from Afghan soil. However, the Taliban delegation allegedly remained “unwilling to cooperate or acknowledge ground realities.”The talks in Istanbul, mediated by Turkey’s intelligence chief Ibrahim Kalin, focused on creating a joint monitoring mechanism to curb militant movement across the border and facilitate smoother trade. Radio Pakistan reported that both sides also discussed the possibility of a long-term political framework to stabilise relations.According to reports, Turkey is attempting to bridge the gap by helping the Taliban delegation understand the seriousness of Pakistan’s security concerns. Islamabad has reportedly conveyed its final position, warning that any tolerance or shelter for militants targeting its territory “will not be acceptable.”Sources told Geo News that progress in the talks now hinges entirely on the Taliban’s attitude and readiness to cooperate in good faith. Pakistani officials described the Taliban’s responses during the exchanges as “illogical and detached from ground realities,” further deepening doubts about Kabul’s sincerity.During the discussions, Pakistan pressed the Taliban regime to dismantle terrorist networks and prevent militant infiltration. Kabul’s delegation submitted a written response to Islamabad’s proposals late Sunday night.The ongoing negotiations mark the second round of peace efforts, following the Doha talks where both sides agreed to a ceasefire mediated by Qatar and Turkey after intense cross-border clashes.The conflict saw multiple days of heavy clashes across the border of two neighbours. Pakistani forces claimed they killed over 200 Taliban fighters, while 23 soldiers lost their lives, according to media reports. Following the violence, key border crossings were shut, citing security concerns.Meanwhile, Pakistani defence minister Khawaja Asif has warned of an “all-out war” if the peace efforts fail.","The latest round of peace talks between Pakistan and Afghanistan has reportedly hit a stalemate. Islamabad has accused the Afghan Taliban of taking an “illogical and detached” position on key security issues. The talks in Istanbul, mediated by Turkey’s intelligence chief Ibrahim Kalin, focused on creating a joint monitoring mechanism.","https://static.toiimg.com/thumb/msid-124841008,imgsize-538616,width-400,resizemode-4/pak-afghan-delgates-at-the-talks-ani.jpg"
'Both countries will support each other': Top Pak military official meets Yunus; discusses defence ties,https://timesofindia.indiatimes.com/world/pakistan/both-countries-will-support-each-other-top-pak-military-official-meets-yunus-discusses-defence-ties/articleshow/124838481.cms,"In this image received on Oct. 26, 2025, Pakistan's Joint Chiefs of Staff Committee (CJCSC) Chairman General Sahir Shamshad Mirza meets Chief Adviser of Bangladesh Muhammad Yunus, in Dhaka. (Bangladesh Chief Adviser's office via PTI Photo)

Pak-Bangladesh Reset? Gen Mirza Meets Muhammad Yunus After 'Next War Won’t Stay in Kashmir' Warning





Visiting Pakistan Joint Chiefs of Staff Committee chairman General Sahir Shamshad Mirza called on Bangladesh chief adviser Muhammad Yunus and discussed ways to enhance bilateral cooperation, including in areas of ""trade, connectivity and defence"".Emphasising ""shared historical, cultural and people-to-people ties"" between the two countries, Mirza expressed Pakistan's desire to strengthen cooperation in multiple sectors, said Yunus' press wing on Sunday.The two sides expressed satisfaction over the positive trajectory of bilateral relations, and Mirza noted the vast potential for expanding trade, connectivity and investment between the two nations.""Our two countries will support each other,"" he said, adding that a two-way shipping route between Karachi and Chittagong has begun operations, while a Dhaka-Karachi air route is likely to open within a few months. The press wing said both sides also underscored the need to de-escalate tensions in West Asia and Europe.","Pakistan's Joint Chiefs of Staff Committee chairman General Sahir Shamshad Mirza called on Bangladesh chief adviser Muhammad Yunus. The two sides expressed satisfaction over the positive trajectory of bilateral relations. Mirza noted the vast potential for expanding trade, connectivity and investment between the two nations.","https://static.toiimg.com/thumb/msid-124838450,imgsize-170848,width-400,resizemode-4/pak-general-meets-muhammad-yunus.jpg"
"'5 soldiers, 25 militants killed': Pakistan reports fresh border clashes with Afghanistan; incident amid truce talks",https://timesofindia.indiatimes.com/world/pakistan/5-soldiers-25-militants-killed-pakistan-reports-fresh-border-clashes-with-afghanistan-incident-amid-truce-talks/articleshow/124830120.cms,"""I will Solve It Very Quickly..."" Trump Vows To Solve Pakistan-Afghanistan Tensions Quickly





Pakistan army on Sunday said that five of its soldiers and 25 militants were killed during border clashes with Afghanistan.These attacks occurred while Afghan and Pakistani officials met in Istanbul amid a recent ceasefire agreement.""These assaults occur while Afghan and Pakistani officials meet in Istanbul amid a recent ceasefire agreement. The earlier confrontations between their forces this month represented the most intense border violence since the Taliban took control in 2021,"" the Pakistani military's media wing, ISPR said in a post on X.Questioning the timing of the attack, the military said, ""It is significant to point out that these infiltration attempts by Fitna al Khwarij are being carried out at a time when delegations of Pakistan and Afghanistan are engaged in talks in Türkiye; casting doubts on intentions of Interim Afghan Government with regards to addressing the issue of terrorism emanating from its soil.""""Pakistan has consistently been asking Interim Afghan Government to ensure effective border management on their side of the border and is expected to fulfil its obligations of Doha Agreement and deny the use of Afghan soil by Khwarij against Pakistan,"" it added.Earlier, Pakistan’s defence minister Khawaja Asif warned that Islamabad will go into an “open war” with Afghanistan if the ongoing peace talks in Istanbul collapse, TOLO News reported.The discussions in Istanbul come after an initial round of negotiations in Doha on October 18–19, facilitated by Qatar and Türkiye. In those talks, both countries agreed to an “immediate ceasefire” following fierce border fighting that left dozens dead.The earlier confrontations between their forces this month represented the most intense border violence since the Taliban took control in 2021.","Pakistan army on Sunday said that five of its soldiers and 25 militants were killed during border clashes with Afghanistan. These attacks occurred while Afghan and Pakistani officials met in Istanbul amid a recent ceasefire agreement. Earlier, Pakistan’s defence minister Khawaja Asif warned that Islamabad will go into an “open war” with Afghanistan if the ongoing peace talks in Istanbul collapse.","https://static.toiimg.com/thumb/msid-124830310,imgsize-1081737,width-400,resizemode-4/-.jpg"
‘Open war if … ’: Pakistan issues new warning to Afghanistan amid border tension; what Khawaja Asif said,https://timesofindia.indiatimes.com/world/pakistan/open-war-if-pakistan-issues-new-warning-to-afghanistan-amid-border-tension-what-khawaja-asif-said/articleshow/124821236.cms,"Defence minister Asif cautions open war if peace talks with Afghanistan fail

Focus on

border tensions

, refugees and

trade restrictions

Background: Fragile ceasefire and ongoing mistrust

Rising tensions along the border





Pakistan’s defence minister Khawaja Asif has warned that Islamabad will go into an “open war” with Afghanistan if the ongoing peace talks in Istanbul collapse, according to a report by TOLO News. The discussions are aimed at defusing weeks of cross-border tensions and deadly clashes between the two countries.Speaking to reporters, Asif said there had been no fresh incidents along the border in recent days, suggesting that the Doha Agreement had been “somewhat effective.” However, he cautioned that the calm could be temporary if diplomacy fails to resolve long-standing disputes. Afghan officials have not yet responded to his remarks.Delegations from both countries are in Istanbul for the second round of talks, which focus on strengthening the Doha Agreement, preventing cross-border attacks, and restoring bilateral trust. According to TOLO News, the negotiations are centred on four key issues: creating a joint border monitoring system, ensuring mutual respect for sovereignty, addressing Pakistan’s long-standing security concerns, and lifting trade barriers.The dialogue also includes discussions on halting the forced deportation of Afghan refugees and preventing the refugee issue from becoming politicised. Pakistan recently began demolishing refugee camps in Balochistan, displacing thousands of Afghans. Camps in Loralai, Gardi Jungle, Saranan, Zhob, Qala-e-Saifullah, Pishin, and Muslim Bagh were cleared, with residents saying they were forced out abruptly without time to collect their belongings.Asif reminded reporters that Pakistan had supported Afghanistan “for decades” by sheltering millions of migrants. “We have stood by them through the hardest times,” he said, adding that Islamabad’s patience was running thin after continued militant attacks allegedly originating from Afghan soil.The Istanbul talks follow the first round of negotiations held in Doha on October 18 and 19, jointly mediated by Qatar and Turkiye. During those meetings, both sides agreed to an “immediate ceasefire” after intense border clashes that killed dozens.Qatar’s Ministry of Foreign Affairs said at the time that the follow-up discussions in Turkiye were meant to ensure “the sustainability of the ceasefire and verify its implementation in a reliable and sustainable manner.”“A round of negotiations between the Islamic Republic of Pakistan and Afghanistan was held in Doha, mediated by the State of Qatar and the Republic of Turkiye. During the negotiations, the two sides agreed to an immediate ceasefire and the establishment of mechanisms to consolidate lasting peace and stability between the two countries,” the Qatari statement said.The flare-up between Islamabad and Kabul earlier this month began after Pakistan demanded that the Taliban government take stronger action against militants launching attacks from inside Afghanistan. In response, Pakistan carried out cross-border airstrikes, leading to heavy exchanges of fire that killed and injured dozens on both sides.Taliban officials, however, rejected Islamabad’s claims. The Islamic Emirate said Afghan territory “is not being used to attack Pakistan” and that it “does not interfere in the internal affairs of other countries.” Kabul insisted it remains committed to maintaining peace and regional stability.Despite recent calm, Pakistan’s warning of an “open war” has reignited concerns of a potential escalation between the two neighbours, who share deep historical, ethnic, and economic ties but remain divided over border security, militancy, and the treatment of refugees.The outcome of the Istanbul talks is expected to determine whether the fragile ceasefire holds or if the region faces yet another round of hostilities.(With inputs from ANI and TOLO news)","Pakistan’s defence minister Khawaja Asif has warned that Islamabad will go into an “open war” with Afghanistan if the ongoing peace talks collapse. The discussions are aimed at defusing weeks of cross-border tensions and deadly clashes between the two countries. Delegations from both countries are in Istanbul for the second round of talks, which focus on strengthening the Doha Agreement.","https://static.toiimg.com/thumb/msid-124821400,imgsize-21750,width-400,resizemode-4/khawaja-asif-file-photo.jpg"
Afghanistan-Pakistan tensions: Islamabad warns of 'open war' if talks fail amid border conflict; negotiations continue in Istanbul,https://timesofindia.indiatimes.com/world/pakistan/afghanistan-pakistan-tensions-islamabad-warns-of-open-war-if-talks-fail-amid-border-conflict-negotiations-continue-in-istanbul/articleshow/124808596.cms,"File photo: Pakistan’s defence minister Khawaja Muhammad Asif

Tensions Escalate As Pakistan-Taliban Trade Warnings After Heavy Clashes Along Afghanistan Border





Pakistan’s defence minister Khawaja Muhammad Asif on Saturday said that while Afghanistan appears to want peace, failure to reach a lasting agreement during ongoing talks in Istanbul could lead to “open war”.The discussions, which began on Saturday and are expected to continue into Sunday, follow deadly border clashes earlier this month, marking the latest effort by both sides to prevent a relapse into violence since the Taliban ’s 2021 takeover of Kabul.As quoted by news agency Reuters, Asif said in televised remarks, “We have the option, if no agreement takes place, we have an open war with them. But I saw that they want peace.”The clashes erupted after Islamabad demanded the Taliban curb militants it says have been attacking Pakistan from sanctuaries inside Afghanistan.Pakistan responded with cross-border airstrikes, and both sides exchanged heavy fire, killing dozens and prompting the closure of key crossings, which remain shut.The talks in Istanbul aim to devise a mechanism to enforce a longer-term Doha ceasefire.“There have been no incidents in the four to five days since it was agreed, and both sides were complying with the truce,” Asif said, underlining the delicate situation along the 2,640-km Durand Line border.Earlier, Pakistan and Afghanistan had agreed to an immediate ceasefire after days of deadly clashes, according to Qatar’s foreign ministry, which said both sides also agreed to establish mechanisms to ensure lasting peace and stability.The violence, which began on October 11, followed Pakistani airstrikes in Kabul and Paktika targeting groups linked to the Tehrik-i-Taliban Pakistan (TTP).Amid the tensions, the Taliban government has ordered construction of a dam on the Kunar River to limit Pakistan’s water supply, according to RT, escalating non-military pressure on Islamabad and adding another layer to the strained bilateral relations.","Talks in Istanbul aim to devise a mechanism to enforce a longer-term Doha ceasefire. The discussions began on Saturday and are expected to continue into Sunday. The talks follow deadly border clashes earlier this month, marking the latest effort by both sides to prevent a relapse into violence.","https://static.toiimg.com/thumb/msid-124808686,imgsize-806236,width-400,resizemode-4/untitled-design-44.jpg"
Pakistan SC reinforces marital rights: Affirms right to Khula; women can divorce husband without consent,https://timesofindia.indiatimes.com/world/pakistan/pakistan-sc-reinforces-marital-rights-affirms-right-to-khula-women-can-divorce-husband-without-consent/articleshow/124803273.cms,"Pakistan's Supreme Court upholds 'Khula'

Toronto Conference Highlights Pakistan’s Human Rights Violations In Balochistan, Sindh And KPK





Pakistan’s Supreme Court, in a landmark ruling, has reinforced a woman’s right to dissolve her marriage through Khula—an Islamic provision that allows a woman to seek divorce independently.The decision came after a woman challenged the Peshawar High Court’s rejection of her dissolution request. The PHC had denied her petition, stating that her husband’s consent was necessary and that all efforts at reconciliation had not been exhausted.The two-member bench, comprising Justice Ayesha A Malik and Justice Naeem Afghan, ruled that the PHC’s decision was incorrect and reinstated the Family Court’s decree of dissolution. The court clarified that Khula is a voluntary right of the wife and cannot be made conditional upon the husband’s consent or judicial discretion.Justice Malik, who authored the judgment, wrote, as quoted by PTI, “The Family Court's role is not to force a woman to stay in a marriage where there is no harmony or substance.”The ruling also marks a significant step in recognising psychological abuse — including humiliation, neglect, intimidation, and emotional abuse — as valid grounds for seeking divorce under Islamic law.“Cruelty need not always manifest in physical violence,” the judgment stated. The court emphasised that mental cruelty can be as damaging as physical abuse, and a woman’s emotional well-being should be taken into account when assessing the viability of a marriage.The Supreme Court criticised the patriarchal interpretations used by lower courts, which limited women’s agency and autonomy. It cited Articles 14, 25, and 35 of the Constitution, which guarantee dignity, equality before the law, and protection of the family, emphasising that the right to seek Khula embodies these guarantees.The court restored the Family Court’s decree of dissolution, recognising the petitioner’s right to seek divorce on the grounds of second marriage and psychological cruelty. It also ruled that the petitioner would retain her dower, including the gold, money, and property given at the time of marriage.",Pakistan's Supreme Court upholds a woman's right to dissolve her marriage through Khula. Khula is an Islamic provision that allows a woman to seek divorce independently. The decision came after a woman challenged the Peshawar High Court’s rejection of her dissolution request.,"https://static.toiimg.com/thumb/msid-124803288,imgsize-700264,width-400,resizemode-4/pic-71.jpg"
