Article Title,Article Link,Article Text,Article Summary,Article Image
SNAP benefits to end on November 1; air traffic controllers to miss first paychecks — will Trump and Democrats strike a deal to end shutdown?,https://timesofindia.indiatimes.com/world/us/us-shutdown-snap-benefits-to-end-on-november-1-air-traffic-controllers-to-miss-first-paychecks/articleshow/124861067.cms,"

Will Medicare and Medicaid be affected by the government shutdown?

US shutdown affects air travel

Will lawmakers make peace for Americans





As the US government shutdown drags into its fourth week, millions of Americans are facing the threat of losing food assistance, and air traffic controllers are preparing to miss their first paychecks.The Department of Agriculture says Supplemental Nutrition Assistance Program benefits will stop on November 1, warning that “the well has run dry, ABC news reported.SNAP, commonly known as food stamps, provides support to about 42 million low-income Americans. The program is federally funded but administered by states, meaning the shutdown’s effects will vary across the country.For now, beneficiaries of Medicare and Medicaid should still be able to access medical care without disruption. The Centers for Medicare & Medicaid Services (CMS) confirmed that both programs will continue operating during the shutdown, with Medicaid funding secured through the end of the year, US Today reported.However, experts caution that prolonged gridlock could cause ripple effects. If the shutdown stretches on, doctors, hospitals, and other health providers may begin to experience delays in reimbursements from Medicare and Medicaid — potentially straining operations and patient services over time.Air travel chaos worsened across the US on Monday as the government shutdown entered its 27th day, with more than 5,600 flights delayed nationwide amid a surge in air traffic controller absences.The Federal Aviation Administration (FAA) blamed staffing shortages for widespread disruptions, implementing ground delay programs at Newark Liberty International in New Jersey, Austin-Bergstrom in Texas, and Dallas-Fort Worth International Airport. Earlier in the day, flights in the Southeast were also affected by shortages at the Atlanta Terminal Radar Approach Control.Around 13,000 air traffic controllers and 50,000 Transportation Security Administration (TSA) officers have been working without pay since the shutdown began, after a funding standoff between President Donald Trump and congressional Democrats, as per Reuters.Officials have warned that delays and cancellations could worsen as air traffic controllers miss their first full paycheck on Tuesday. On Sunday alone, more than 8,800 flights were delayed nationwide.Secretary of transport department Sean Duffy said that air traffic controllers will stop getting paid starting October 28.In a post on X, he said, ""Air traffic controllers will stop getting paid starting TOMORROW. This is not ok! I just visited several of them at @goingplacesCLE and they are worried about paying their mortgage. @SenSchumer and @RepJeffriesyou’ve got to do better!""As the shutdown continues to impact Americans and key deadlines loom, all eyes are on Capitol Hill where lawmakers are still in a stalemate.And it seems that President Donald Trump and Democrats are in the negotiating terms, according to the ABC news.Over the weekend, the Trump administration said it will not extend additional funding for SNAP, blaming Democrats for the continued stalemate. The position marks a reversal from a contingency plan published by USDA in September, which suggested that multi-year funds could sustain operations during a shutdown.Democrats are blasting President Donald Trump for refusing to tap into contingency funds to keep food aid flowing during the government shutdown.In a joint statement Friday, Congresswomen Rosa DeLauro and Angie Craig called the move “perhaps the most cruel and unlawful offense the Trump administration has perpetrated yet.”They also accused Trump of misplaced priorities — pointing to his decision to provide financial assistance to Argentina and fund a new White House ballroom even as millions of Americans face losing access to food assistance.","USDA says food stamps will stop on November 1, warning that ""the well has run dry"" More than 5,600 flights were delayed nationwide on Monday as the government shutdown entered its 27th day. Air traffic controllers are preparing to miss their first paychecks on Tuesday.","https://static.toiimg.com/thumb/msid-124861273,imgsize-44848,width-400,resizemode-4/us-government-shutdown-ap-image.jpg"
Top doctor reveals why Trump suddenly got an MRI scan: 'Undisclosed medical problems...',https://timesofindia.indiatimes.com/world/us/top-doctor-reveals-why-trump-suddenly-got-an-mri-scan-undisclosed-medical-problems-/articleshow/124858277.cms,"Trump’s ‘DEMENTIA SYMPTOMS’ AWKWARDLY VISIBLE During Japan Visit? Sanae Takaichi ‘Guides’ US Prez

The consultation



'Perfect' results



Trump Slips Up, Admits MRI At Walter Reed In Latest 'Routine Physical' Checkup At Medical Centre

No MRI without a clear reason



Medications







A top American cardiologist has suggested that President Donald Trump may have quietly undergone an MRI scan due to potential neurological or cardiovascular symptoms.Dr Jonathan Reiner is a professor of medicine at George Washington University. He is also a former cardiologist to ex-vice president Dick Cheney.Reiner told CNN that MRIs are never performed as part of a routine check-up, implying that Trump’s test was probably forced due to symptoms.“Typically, they’re prompted by symptoms,” Reiner explained. “They can be neurologic symptoms that prompt an MRI. They could be back pain that prompts an MRI. There can be issues with the heart that would prompt an MRI. And for those reasons, the public should really be told, you know, why did the president undergo the test, what consultants he saw, and what was the result of the testing?”79-year-old Trump told reporters aboard Air Force One that he had received an MRI, calling the results “perfect.” When asked about why the scan was done, he redirected questions to his doctors and added, “I gave you the full results. We had an MRI… you know the whole thing. And it was perfect.”The White House has not disclosed the reason for the MRI, with press secretary Karoline Leavitt describing it as part of a “routine health check.” However, Reiner strongly disagreed, saying, “An MRI is never part of a routine evaluation, whether you’re president of the United States or whether you’re just a civilian.”Public health physician Dr Vin Gupta supported Reiner’s statement, writing on X, “Even if you are leader of the free world, you don’t just get an MRI without a clear reason to do so. There’s no such thing as a ‘screening’ MRI.”Concerns about Trump’s health have grown in recent months after several public appearances showed him with visible bruises on his hands and a noticeably uneven gait. At times, he appeared slower on his feet and struggled with short-term recollection.The White House announced in July that Trump suffers from chronic venous insufficiency, a condition in which veins struggle to send blood from the legs back to the heart. Reiner suggested that Trump’s visible bruising and cankles might be linked to blood-thinning medication, which is commonly prescribed for cardiovascular issues.“There are a lot of things that can do that,” Reiner said. “The most common cause for bruising in the back of a 79-year-old person’s hand is medications. And the typical medication that causes that would be a blood thinner.”He added that people usually take such drugs with conditions like pulmonary embolism, deep vein thrombosis, or atrial fibrillation. “People who take blood thinners for atrial fibrillation typically are on them indefinitely, and the side effects of medications like that are bruising,” Reiner said.He concluded that the key question is not just what the MRI showed, but why it was ordered. “Why he would have an MRI depends on the underlying reason for either that medication or other undisclosed medical problems. It is just as important why he had the test as what the test showed.”","Dr Jonathan Reiner is a professor of medicine at George Washington University. He is also a former cardiologist to ex-vice president Dick Cheney. Reiner said MRIs are never performed as part of a routine check-up, implying that Trump’s test was probably forced due to symptoms.","https://static.toiimg.com/thumb/msid-124858385,imgsize-781887,width-400,resizemode-4/-.jpg"
What is the Dunki route? 50 Haryana men deported from US after chasing a Shah Rukh Khan-style dream,https://timesofindia.indiatimes.com/world/us/what-is-the-dunki-route-50-haryana-men-deported-from-us-after-chasing-a-shah-rukh-khan-style-dream/articleshow/124857658.cms,"What is the Dunki route?



Dunki Disaster: 50 Haryana Boys Return in Handcuffs, Families Ruined As Agents Disappear After Scam

From hope to heartbreak in Haryana



Trump-era crackdown







At least 50 young men from Haryana, aged between 25 and 30, have returned home in handcuffs after being deported from the United States. Their pursuit of the “American dream” took them through the infamous dunki route — a perilous, illegal path across continents that promises hope but often ends in heartbreak and jail cells.In Shah Rukh Khan’s 2023 film Dunki, the term symbolises the dangerous journey many Indians take to reach countries like the US, UK, or Canada without proper visas. The story follows four friends from Punjab chasing a better life abroad through smugglers, only to face violence, betrayal, and despair. The film’s mix of humour and tragedy mirrors the real-life struggles of countless migrants who risk everything for foreign dreams on a daily basis.Naresh Kumar, one of 14 deported youths from Kaithal, said he sold his farmland and paid an agent Rs 57 lakh to reach the US through Panama’s dense jungles. “I sold my agricultural land and paid an agent Rs 57 lakh to go to the US via the Panama jungle route. After spending 14 months in jail, I was deported,” he told reporters.Naresh added that the agent extorted money at every stage. “He took Rs 42 lakh initially, then Rs 6 lakh in Guatemala, another Rs 6 lakh when I reached Mexico, and the rest was taken when we crossed the border.But instead of helping me reach the US safely, they got me arrested and put in jail,” he said, urging others to avoid the dunki route.Officials confirmed that 16 deportees were from Karnal, 14 from Kaithal, five from Kurukshetra, three from Jind, and others from Ambala and Panipat. “The youths were brought from the Delhi airport by CM squad personnel and handed over to their families at the police lines,” said DSP Sandeep Kumar of Karnal.Kaithal SP Upasana added, “All records are being checked thoroughly and one person was found to have a criminal background.”Jind SP Kuldeep Singh warned, “Travelling abroad through the ‘dunki’ route is a serious criminal offence and also tarnishes the image of our society. Such illegal journeys not only lead to financial loss but also pose a grave threat to life. In many cases, youths face physical abuse, fraud, and even death along the way.”Under Donald Trump’s hard-line immigration policies, the dunki dream has turned darker than ever. Across Haryana, families who once hoped for a better life abroad now watch their sons return home in handcuffs, as authorities tighten their grip on illegal migration networks and agents who sell false promises.","At least 50 young men from Haryana, aged between 25 and 30, have returned home in handcuffs after being deported from the United States. Their pursuit of the ‘American dream’ took them through the infamous dunki route. The term symbolises the dangerous journey many Indians take to reach countries like the US, UK, or Canada without proper visas.","https://static.toiimg.com/thumb/msid-124857974,imgsize-695361,width-400,resizemode-4/-.jpg"
Mehdi Hasan trolls Elon Musk for calling Zohran Mamdani 'future of Democratic Party': ‘Worst person you know just...’,https://timesofindia.indiatimes.com/world/us/mehdi-hasan-trolls-elon-musk-over-zohran-mamdani-remark-worst-person-you-know-just-made-a-great-point/articleshow/124856048.cms,"Trump BOOED At NYC Rally As Bernie Sanders GOES OFF On 'American Oligarchy' During Mamdani Rally





British journalist Mehdi Hasan trolled Elon Musk on X after the billionaire praised New York mayoral candidate Zohran Mamdani , calling him “the future of the Democratic Party.”Hasan replied to Musk’s post with a popular meme captioned, “Heartbreaking: The worst person you know just made a great point,” implying that while he disagreed with Musk on most things, he surprisingly agreed with this one.Musk’s original comment came after New York governor Kathy Hochul endorsed Mamdani, describing him as “a chance to reclaim the Senate and America.” The Tesla CEO’s comment quickly went viral, with netizens in confusion over whether he was being sincere or sarcastic.The video Musk reacted to showed Hochul alongside Alexandria Ocasio-Cortez and Bernie Sanders at a rally calling for rent freezes and tax reforms — themes closely tied to Mamdani’s socialist agenda. Chants of “tax the rich” were heard through the crowd. This showed a clear rift within the Democratic Party between moderates and progressives.X users flooded Musk’s replies, with MAGA supporters accusing Mamdani of “pushing communist ideology” and others viewing Musk’s post as an ironic endorsement. Meanwhile, supporters of Mamdani saw the attention as proof that his campaign is cutting through the political noise.The New York mayoral race is heating up, with only days left to decide the fate of one of America’s most populous and wealthiest cities. Republicans have thrown their weight behind Curtis Sliwa, the Red Beret activist, while former governor Andrew Cuomo is running as an independent with the backing of outgoing mayor Eric Adams.","British journalist Mehdi Hasan trolled Elon Musk on X after the billionaire praised New York mayoral candidate Zohran Mamdani. Hasan replied to Musk’s post with a popular meme captioned, “Heartbreaking: The worst person you know just made a great point,” implying that while he disagreed with Musk on most things, he surprisingly agreed with this one.","https://static.toiimg.com/thumb/msid-124857167,imgsize-1044923,width-400,resizemode-4/-.jpg"
Pakistani man kills estranged Indian-origin wife with cyanide-like powder in New York as she was seeking divorce,https://timesofindia.indiatimes.com/world/us/pakistani-man-kills-estranged-indian-origin-wife-with-cyanide-like-powder-in-new-york-as-she-was-seeking-divorce/articleshow/124854737.cms,"Old photo of Aleena Asif with her husband Asif Qureshi and their three children.

CCTV video shows Qureshi hiding and waiting to attack Aleena





Aleena was stalked, threatened; informed law enforcement





Qureshi pleads not guilty, attorney calls him good US citizen









Aleena Asif, an Indian-origin woman, was killed by her estranged husband, Asif Qureshi, in Long Island over their ongoing marital dispute. Asif Qureshi was arraigned in a Long Island courtroom Friday, a week after Aleena Asif's body was found asphyxiated with chemical burns to the face at her home in Herricks. Aleena and Qureshi were parents to three children. While Aleena is originally from Mumbai, Qureshi is from Pakistan but a US citizen.Nassau County Police nabbed the husband after he was seen sneaking into the wife's home wearing a mask, hoodie and gloves, hiding and waiting for his wife to return from walking their seven-year-old child to school. As she returned, he attacked her with a chemical mixture, which was a cyanide-like compound. Then Qureshi got away on an e-bike and fled the crime scene.Aleena's 18-year-old daughter raised an alarm and called 911 when she didn't pick up her 7-year-old sister from school. The medical examiner determined she died of asphyxiation by an unknown chemical substance, police said. The incident was ruled a homicide.Police said Aleena tried to leave Qureshi and served him with divorce papers. Qureshi did not accept the papers and started stalking her, showing up at her house.Once, he threatened Aleena that he would make her swallow bleach. Aleena, an accountant, called law enforcement four times with safety concerns.Qureshi, an unemployed software engineer, pleaded not guilty to the second-degree murder charge. His attorney called him a good US citizen and provider for his family.According to reports, Qureshi had been arrested before for a 'domestic incident' with Asif, and also had five prior incidents - four with his wife and one with a daughter.","Aleena Asif, an Indian-origin woman, was killed by her estranged husband, Asif Qureshi, in Long Island over their ongoing marital dispute. Asif was seen sneaking into the wife's home wearing a mask, hoodie and gloves, hiding and waiting for his wife to return from walking their seven-year-old child to school. As she returned, he attacked her with a cyanide-like compound.","https://static.toiimg.com/thumb/msid-124854760,imgsize-1152441,width-400,resizemode-4/old-photo-of-aleena-asif-with-her-husband-asif-qureshi-and-their-three-children.jpg"
Sean ‘Diddy’ Combs’ prison release date announced: 5 major events in his legal battle behind bars,https://timesofindia.indiatimes.com/world/us/sean-diddy-combs-prison-release-date-announced-5-major-events-in-his-legal-battle-behind-bars/articleshow/124854315.cms,"Sean ‘Diddy’ Combs Sentenced To 50 Months In Prison

Here are five major events in the mogul's legal journey:



1. Arrest and detention (September 2024)

2. Trial and split verdict (July 2025)

3. Sentencing scheduled (October 2025)

4. Sentence imposed (3 October 2025)

5. Forecasted release (8 May 2028)

What comes next?







Sean “Diddy” Combs is set to walk out of prison on 8 May 2028, according to the Bureau of Prisons website, following his sentencing for two federal prostitution-related convictions.He is currently being held at the Metropolitan Detention Centre in Brooklyn, where he has remained since his arrest in September 2024.55-year-old Combs was taken into federal custody following an indictment on charges including racketeering, sex trafficking and transportation to engage in prostitution. A judge denied bail, ruling that “detention is mandatory” given allegations of abuse, violence and risk to the community.On July 2, 2025, a jury found Combs guilty of two counts of transportation to engage in prostitution but cleared him of sex trafficking and racketeering charges. The convictions carried potential sentences of up to 10 years each.Combs’ sentencing date was set for October 3, 2025, after both defence and prosecution agreed. He remained in custody pending the hearing.On that date, Indian-origin judge Arun Subramanian sentenced Combs to four years and two months (50 months) in prison.He also ordered a $500,000 fine and five years of supervised release. The judge acknowledged Combs’ achievements but said a “substantial sentence must be given to send a message to abusers and victims alike.”With his 50-month sentence in place and credit for time already served in detention since September 2024, Combs’ release date is projected to be May 8, 2028. During his term, he may be transferred to a different facility.Combs will serve his time amid ongoing civil lawsuits against him, while his team may pursue appeals or other legal motions. Prosecutors had recommended more than 11 years behind bars, citing his “extensive history of abuse and violence.” His defence argued he should receive no more than 14 months, pointing to the time he had already spent in custody.","Sean ‘Diddy’ Combs is set to walk out of prison on 8 May 2028, according to the Bureau of Prisons website. He is currently being held at the Metropolitan Detention Centre in Brooklyn, where he has remained since his arrest in September 2024. A jury found Combs guilty of two counts of transportation to engage in prostitution but cleared him of sex trafficking and racketeering charges.","https://static.toiimg.com/thumb/msid-124854513,imgsize-28586,width-400,resizemode-4/-.jpg"
Japan's new PM has a trump card for Donald Trump,https://timesofindia.indiatimes.com/world/us/japans-new-pm-has-a-trump-card-for-donald-trump-her-friendship-with-abe-san/articleshow/124853878.cms,"Takaichi's 'golden chance' to impress Trump



Trump in Tokyo: What's on the agenda?



The enemy of my enemy is my friend







Japan’s new Prime Minister, Sanae Takaichi, is preparing for her first meeting with US President Donald Trump this week, and her most powerful diplomatic tool may not be policy but personal history — her deep connection to the late Shinzo Abe, Trump’s closest ally in Asia.Takaichi became Japan’s first female prime minister last week. She will meet Trump in Tokyo on Tuesday as part of his state visit. While she doesn’t share Trump’s love of golf or hamburgers, she is expected to lean on her ties to Abe, her mentor and political role model, to build rapport with the American president.“She will be looking to cloak herself in the mantle of Abe to persuade Trump that she is his woman in Asia and a steadfast partner that he can count on,” said Mira Rapp-Hooper, a partner at the Asia Group, a strategic advisory firm.Abe was assassinated in 2022 and was widely seen as a master at managing Trump during his first term. The two leaders developed a personal bond over lavish state dinners, golf outings, and mutual admiration. Takaichi, analysts say, has studied Abe’s style closely — and now has a “golden chance” to reset the Japan–US relationship under her leadership.“She has studied how Prime Minister Abe handled President Trump,” said Shinsuke J.Sugiyama, Japan’s former ambassador to Washington. “She learned a lot from him. And if she and President Trump can start talking about how great Shinzo Abe was, I think they won’t be able to disagree on anything.”Trump arrived in Tokyo on Monday and will meet Emperor Naruhito at the Imperial Palace before sitting down with Takaichi for lunch at Akasaka Palace. He is also expected to address American troops stationed in Japan, which hosts more than 50,000 US military personnel.On the agenda are two major issues: trade and defence. Japan has committed to investing $550 billion in the United States, and Takaichi is likely to seek a stronger say in how that money is spent. Meanwhile, Trump is expected to press her to accelerate military spending and deepen Japan’s role in countering China’s influence in the Indo-Pacific.Takaichi has already pledged to raise defence expenditure to 2 per cent of Japan’s GDP by next spring — two years earlier than planned. Her commitment aligns with Trump’s long-standing demand for US allies to shoulder more of their defence costs.Like Abe, Takaichi has also voiced support for Taiwan and warned against China’s militarisation of the South China Sea. Earlier this year, she met Taiwan’s president, Lai Ching-te, to call for stronger security ties, a move that Beijing did not like. Notably, Chinese President Xi Jinping has yet to publicly congratulate her on her election victory.Analysts believe Takaichi will use the meeting to gauge Trump’s current stance on China and Taiwan. “Japanese officials want to know what the American strategy in the Indo-Pacific is,” said Jeffrey W. Hornung, a Japan expert at the RAND Corporation.Trade will also be high on the agenda. In July, Japan secured a 15 per cent tariff on exports, lower than the rate initially threatened by the Trump administration, in exchange for its large-scale investment commitment. Both sides are still negotiating the finer details of how that money will be channelled into investments and loan guarantees.","Takaichi became Japan’s first female prime minister last week. She will meet Trump in Tokyo on Tuesday as part of his state visit. Takaichi is expected to lean on her ties to Abe, her mentor and political role model.","https://static.toiimg.com/thumb/msid-124854201,imgsize-21164,width-400,resizemode-4/sanae-takaichi.jpg"
