Article Title,Article Link,Article Text,Article Summary,Article Image
"Dubai Fitness Challenge 2025: 30 days of fitness, workouts, and wellness across the city starting November 1",https://timesofindia.indiatimes.com/world/middle-east/dubai-fitness-challenge-2025-30-days-of-fitness-workouts-and-wellness-across-the-city-starting-november-1/articleshow/124779195.cms,"Join Dubai Fitness Challenge 2025 from November 1 for 30 days of running, cycling, yoga, and free citywide workouts/Representative Image

A vision for an active city





Flagship events and 2025 highlights





Dubai Ride – November 2

Kicking off the challenge, Dubai Ride will transform Sheikh Zayed Road into a massive cycling track. The free event begins at 5am, with two route options of 4km and 12km. A special Speed Laps category, introduced last year, invites experienced cyclists who can maintain an average speed of 30kph to start first. All other riders will begin at 6:15am, with People of Determination having a dedicated start zone. Registration is free at dubairide.com.

Kicking off the challenge, Dubai Ride will transform Sheikh into a massive cycling track. The free event begins at 5am, with two route options of 4km and 12km. A special Speed Laps category, introduced last year, invites experienced cyclists who can maintain an average speed of 30kph to start first. All other riders will begin at 6:15am, with People of Determination having a dedicated start zone. Registration is free at dubairide.com. Dubai Stand-Up Paddle – November 8 and 9

Set against the scenic backdrop of Hatta Dam, this event welcomes paddleboarders of all skill levels to navigate a marked course across the calm mountain waters. Participants can bring their own boards or borrow free equipment from Hatta Kayak , and will receive certificates upon completion. Sunset yoga sessions will also be held on paddleboards, led by expert instructors. A free shuttle service will operate between Dubai city and Hatta for registered participants.

Set against the scenic backdrop of Hatta Dam, this event welcomes paddleboarders of all skill levels to navigate a marked course across the calm mountain waters. Participants can bring their own boards or borrow free equipment from , and will receive certificates upon completion. Sunset yoga sessions will also be held on paddleboards, led by expert instructors. A free shuttle service will operate between Dubai city and Hatta for registered participants. Dubai Run – November 23

One of the city’s largest fitness events, Dubai Run will once again see thousands of participants running down Sheikh Zayed Road at dawn. The 5km and 10km routes will pass key landmarks including the Museum of the Future, Emirates Towers, Dubai Opera, and Burj Khalifa . The race begins at 6:30am, with a dedicated zone for People of Determination and volunteer support. All runners receive free bibs and T-shirts, and registration is open at dubairun.com.

One of the city’s largest fitness events, Dubai Run will once again see thousands of participants running down Sheikh Zayed Road at dawn. The 5km and 10km routes will pass key landmarks including the Museum of the Future, Emirates Towers, Dubai Opera, and . The race begins at 6:30am, with a dedicated zone for People of Determination and volunteer support. All runners receive free bibs and T-shirts, and registration is open at dubairun.com. Dubai Yoga – November 30

Closing the month, Dubai Yoga at Zabeel Park will bring together global yoga experts for an afternoon of wellness and mindfulness starting at 2:30pm. The event will feature interactive sessions against the Dubai skyline, with dedicated zones for ladies, families, and People of Determination.

Fitness villages and community hubs





Kite Beach Fitness Village

Zabeel Park Fitness Village

Al Warqa’a Park Fitness Village

Beyond the 30 days – Sustaining the momentum









Dubai is once again turning into the world’s largest open-air gym as the Dubai Fitness Challenge (DFC) returns from November 1 to 30, 2025. Initiated by His Highness Sheikh Hamdan bin Mohammed bin Rashid Al Maktoum, Crown Prince of Dubai, Deputy Prime Minister and Minister of Defence of the UAE, and Chairman of The Executive Council of Dubai, the month-long movement invites residents and visitors to commit to 30 minutes of activity for 30 days (the 30x30 challenge). With an expanded lineup of flagship events, fitness villages, community hubs, and wellness experiences, this year’s edition aims to inspire an active, health-conscious culture across the city.Since its launch in 2017, the Dubai Fitness Challenge has grown into one of the emirate’s most anticipated community initiatives. Conceived by Sheikh Hamdan, the challenge reflects his belief that Dubai should be a city that not only encourages physical fitness but also supports mental and social well-being.In his message announcing the 2025 edition, Sheikh Hamdan emphasised:“Dubai is a city that recognises the importance of physical, mental and social well-being, and constantly strives to provide everyone opportunities for an active lifestyle. All it takes for you to succeed is an unyielding pledge to enjoy 30 minutes of activity for 30 days. I challenge each and every one of you to embrace your fitness journey and make a difference in your life.Together, let’s make the UAE the most active country in the world. ”The initiative has inspired millions since inception. In 2024, over 2.7 million people took part, and organisers expect an even larger turnout this year. The campaign’s goal remains clear: to build a lasting culture of fitness through accessible, inclusive, and citywide participation.The 2025 edition features an extensive programme designed for people of all ages and abilities. From sunrise cycling on Sheikh Zayed Road to mountain-side yoga at Hatta, DFC offers something for every fitness preference.Key events and datesIn addition to these headline events, DFC 2025 introduces innovative workout sessions, community-led challenges, and new sports experiences across the city’s most iconic venues.The heart of DFC lies in its Fitness Villages—free, month-long fitness destinations offering classes, sports activities, and workshops for all ages.The largest of all, Kite Beach transforms into a beachfront sports hub where participants can explore football, basketball, yoga, spinning, padel, and more. Expert instructors will host daily sessions designed for every fitness level.Home to multiple fitness zones, Zabeel Park’s village caters to all abilities with facilities for cricket, padel, basketball, boxing, and spinning. A dedicated kids’ fitness zone and open-air gym make it a family-friendly destination.A community-focused space featuring a 2.8km running and cycling track and a Cycling Hub with 75 bikes and on-site mechanics. It also offers football, tennis, volleyball, and padel courts, along with designated zones for ladies and children. Daily fitness classes and family activities complete the experience.Beyond these major venues, Community Fitness Hubs across Dubai will provide residents with easy access to running, cycling, yoga, and emerging fitness trends, helping to make physical activity a daily habit throughout the cityWhile the Dubai Fitness Challenge lasts 30 days, its vision extends far beyond. Through initiatives like Find Your 30, participants are encouraged to maintain their exercise routines year-round. The platform offers guidance, new activity ideas, and community programmes to help residents stay consistent long after the festival concludes.As Sheikh Hamdan envisioned, the Dubai Fitness Challenge is not merely an event—it is a movement. Each year, it reaffirms Dubai’s commitment to well-being, inclusivity, and community spirit, proving that a healthier lifestyle begins with just 30 minutes a day.","Join Dubai Fitness Challenge 2025 from November 1 for 30 days of running, cycling, yoga, and free citywide workouts. Dubai Run will once again see thousands of participants running down Sheikh Zayed Road at dawn. Dubai Yoga at Zabeel Park will bring together global yoga experts for an afternoon of wellness and mindfulness.","https://static.toiimg.com/thumb/msid-124779797,imgsize-1226023,width-400,resizemode-4/dubai-fitness-challenge-2025.jpg"
"Saudi's new traffic rule: Prepare to stop at orange light or risk SAR6,000 fine",https://timesofindia.indiatimes.com/world/middle-east/saudis-new-traffic-rule-prepare-to-stop-at-orange-light-or-risk-sar6000-fine/articleshow/124841093.cms,"Why Saudi drivers should treat yellow lights seriously now / AI-generated Image

Saudi traffic rules explained

The SAR 6,000 fine risk you need to know

Practical guidance for drivers

Slow down when you see amber. Treat it as “prepare to stop.” This avoids risky last-second accelerations.

If you’re already past the stop line when amber starts, proceed cautiously, don’t floor it; but understand cameras may capture a red-light crossing if timing lines up.

Don’t use amber as an excuse to speed up or “beat” the light; that behavior is treated as dangerous and can lead to the same penalties as red-light violations.

If fined and you think the ticket is wrong, dispute it through the official MOI/Absher channels automated systems provide evidence and can be reviewed

The takeaway





Saudi authorities say the yellow (amber) traffic signal is a transition warning that requires drivers to slow and prepare to stop, not a cue to speed up. While simply passing on amber is not automatically fined, entering or crossing the stop line after the light turns red is treated as a red-light violation carrying steep penalties (SR 3,000–6,000 in severe or repeated cases).The General Directorate of Traffic in Saudi Arabia (Murur) has issued a clear warning to all drivers: the orange (or yellow) traffic light is not a cue to speed up. This transitional light serves a critical safety purpose, marking the final stage before a complete stop. It is meant to be a non-negotiable alert for drivers to immediately begin slowing down. The Murur clarifies that this brief yellow phase is not for aesthetics or a gentle reminder, but a crucial opportunity to prepare for a safe, gradual halt. Ignoring this signal by speeding up or trying to rush through the intersection is classified as a serious driving error. This behavior not only disregards the law but also poses a direct threat to the safety of all road users and their property.The consequences of misinterpreting the orange light can be severe, potentially mirroring the penalties for running a red light. The law views a driver who fails to stop safely during the yellow phase, resulting in them running the subsequent red light, as committing the greater violation.This failure to stop in time can lead to a fine for running a red light, a Category 1 offense. The penalty for this starts at SAR 3,000 and can reach a maximum of SAR 6,000. Furthermore, the fine can be escalated to the maximum amount for repeat offenders or under aggravated conditions. In serious situations, especially if the violation causes an accident with injuries, the driver may face legal accountability and even vehicle impoundment.Keep these straight and simple:The General Directorate of Traffic maintains that strict adherence to all traffic laws is the sole path to safety. By respecting the orange light and the entire signaling system, drivers contribute to protecting lives and property, and ensure a predictable, smooth, and sustainable flow of traffic across the Kingdom's road networks.","Saudi authorities say the yellow (amber) traffic signal is a transition warning that requires drivers to slow and prepare to stop. Ignoring this signal by speeding up or trying to rush through the intersection is classified as a serious driving error. Failure to stop in time can lead to a fine for running a red light, a Category 1 offense, which starts at SAR 3,000 and can reach a maximum of SAR 6,000.","https://static.toiimg.com/thumb/msid-124841322,imgsize-1410213,width-400,resizemode-4/saudi-traffic.jpg"
Alaska Airlines ground all flights: What caused the nationwide disruption?,https://timesofindia.indiatimes.com/world/us/alaska-airlines-ground-all-flights-what-caused-the-nationwide-flight-disruption/articleshow/124774453.cms,"Why were the Airlines grounded?





US Chaos: Leavitt’s Shutdown Warning Comes True; Tech Meltdown Grounds Alaska Airlines Flights





Alaska Airlines on Thursday grounded its flights at all airports. The ground stop also applies to Alaska Airlines' subsidiary Horizon Air, a Federal Aviation Administration advisory showed, which was requested for a period of 1 hour 10 minutes ending at 0000 GMT, according to the advisory.The Alaska airline grounded all its flights nationwide because of an ""IT outage affecting operations.""""Alaska Airlines is experiencing an IT outage affecting operations. A temporary ground stop is in place. We apologize for the inconvenience,"" Alaska Airlines said in a statement issued on social media.The airline was also responding on social media to customers who were posting concerns and complaints online.""Unfortunately, we are experiencing an error on our system, but our IT team is working to get this resolved as soon as possible,"" it said, in response to an X user who asked if the airline's app was also having issues, Reuters reported.According to the latest advisory from the FAA, Alaska Airlines flights departing from Seattle Tacoma International Airport were not affected. This is the second IT outage affecting the airline this year.Alaska Airlines, which operates Hawaiian Airlines and Horizon Air, is one of the largest U.S. carriers, serving 140 destinations worldwide, including 37 states and 12 countries, according to its website.CBS News reached out for clarification on whether the ground stop was affecting those two subsidiaries and has sought comment from the FAA. Air travel in the U.S. has experienced some stresses as a result of the govt shutdown that started at the beginning of October, with shortages of air traffic controllers causing flight delays at several airports.","Alaska Airlines grounded all its flights nationwide because of an ""IT outage affecting operations"" The ground stop also applies to Alaska Airlines' subsidiary Horizon Air. Air travel in the U.S. has experienced some stresses as a result of the govt shutdown that started at the beginning of October.","https://static.toiimg.com/thumb/msid-124774497,imgsize-54904,width-400,resizemode-4/alaska-airlines-file-image.jpg"
"'I respect him a lot': Trump on Xi Jinping; US, Chinese presidents set to meet in South Korea on Thursday",https://timesofindia.indiatimes.com/world/us/i-respect-him-a-lot-trump-on-xi-jinping-us-chinese-presidents-set-to-meet-in-south-korea-on-thursday/articleshow/124861544.cms,"Donald Trump; Xi Jinping (File photo)

BIG! Trump To ABANDON 100% Tariffs On China’s Goods Ahead Of Historic Meet With Xi Jinping





Optimism grew Monday that US President Donald Trump and China's Xi Jinping will end their bruising trade war during talks this week, as the US president touched down in Tokyo on the latest leg of an Asian tour.Trump said en route to close US ally Japan that he was hopeful of a deal when he sees Xi on Thursday, while also indicating he was willing to extend his trip in order to meet North Korean leader Kim Jong Un. ""I have a lot of respect for President Xi and we are going to I think... come away with a deal,"" Trump told reporters on Air Force One, adding that he aimed to go to China ""in the earlier part"" of 2026. The optimism boosted stock markets, with Japan's Nikkei surpassing 50,000 points for the first time.As dozens of people gathered at Haneda Airport to take photos, the presidential plane - also bearing secretary of state Marco Rubio and treasury secretary Scott Bessent - landed at sunset.Sporting a golden tie, Trump boarded a helicopter to take him into the bright lights of the Japanese metropolis in time for an evening audience with the emperor. ""A great man,"" Trump said.On Tuesday, Trump is expected to meet new conservative PM Sanae Takaichi and make a speech on the USS George Washington aircraft carrier, docked at the US naval base Yokosuka.""I hear phenomenal things. (Takaichi) was a great ally and friend of Shinzo Abe, who was my friend,"" the US President said, referring to the assassinated former premier.Trump is due to meet Xi on Thursday in South Korea for their first face-to-face talks since Trump's return to the White House. Before Trump's arrival in Malaysia, Bessent and China's Vice Premier He Lifeng held two days of trade talks, seeking an agreement to avoid additional 100% tariffs due from Nov 1. Negotiators from China and the US have said a ""framework"" has been agreed.","US President Donald Trump touches down in Tokyo on the latest leg of an Asian tour. Trump is due to meet Xi on Thursday in South Korea for their first face- to-face talks since Trump's return to the White House. The optimism boosted stock markets, with Japan's Nikkei surpassing 50,000 points for the first time.","https://static.toiimg.com/thumb/msid-124861732,imgsize-272702,width-400,resizemode-4/us-china-seek-to-avoid-trade-war-escalation-salvage-trump-xi-meeting-in-malaysia-talksltstronggtltbrgtltdivgt.jpg"
Suspect who fatally shot deputy crashes into car in California during high-speed chase — Video,https://timesofindia.indiatimes.com/world/us/suspect-who-fatally-shot-deputy-crashes-into-car-in-california-during-high-speed-chase-video/articleshow/124861510.cms,"



A motorcyclist accused of fatally shooting a San Bernardino County sheriff’s deputy was captured Monday after crashing into another vehicle during a high-speed chase on the 210 Freeway near Ontario.Authorities say the suspect was wanted in connection with a possible domestic violence incident in Rancho Cucamonga. When deputies responded around 1.30 pm (US time), one of them — identified as Deputy Andrew Nunez — was shot and killed, Fox news reported.The gunman fled the scene on a motorcycle, reaching triple-digit speeds and reportedly riding against oncoming traffic multiple times along the 210 Freeway. About five minutes later, the suspect collided with a car on the eastbound lanes near exit 56 in Ontario.Footage from SkyFOX showed the suspect sitting upright in a neck brace, surrounded by law enforcement before being placed on a gurney and airlifted to a hospital. A firearm was visible on the roadway near the crash site.Earlier, a large police presence was seen at an apartment complex on the 12300 block of Hollycock in Rancho Cucamonga — the initial scene of the shooting — where a bloody vest and a patrol vehicle with a shattered window were spotted.The suspect’s condition remains unclear. Officials have not yet released details about his injuries or identity. He was taken to a nearby hospital for treatment.","Authorities say the suspect was wanted in connection with a possible domestic violence incident in Rancho Cucamonga. When deputies responded around 1.30 pm (US time), one of them — identified as Deputy Andrew Nunez — was shot and killed. The gunman fled the scene on a motorcycle, reaching triple-digit speeds and reportedly riding against oncoming traffic.","https://static.toiimg.com/thumb/msid-124861866,imgsize-4731707,width-400,resizemode-4/motorcyclist-crashes-into-car.jpg"
'I have best numbers ever': Donald Trump ‘would love’ to run for third presidential term — Can he really make it happen?,https://timesofindia.indiatimes.com/world/us/i-have-best-numbers-ever-donald-trump-would-love-to-run-for-third-presidential-term-can-he-really-make-it-happen/articleshow/124861356.cms,"Trump As US V-P In 2028? President's ‘Too Cute’ Attack On Dems, Leaves Door Open For 3rd Term

Can Trump again run for President?

Can Trump amend the 22nd Amendment?

Has any president ever served more than two terms?





US President Donald Trump on Monday ruled out running for vice president in the 2028 election — but notably stopped short of ruling out a third term, fueling speculation about how he might try to extend his time in office.Trump, 79, has repeatedly teased the idea of serving beyond the constitutionally limited two terms, joking at rallies and even selling “Trump 2028” hats. While most constitutional scholars have dismissed such talk as legally impossible, some of his allies have suggested exploring “creative” ways to make it happen.Under the 22nd Amendment, no one can be elected president more than twice. Some Trump supporters have floated a loophole — that he could run as vice president and then assume office if the elected president resigned. But Trump appeared to reject that idea when speaking to reporters aboard Air Force One during his flight from Malaysia to Tokyo.“I’d be allowed to do that,” Trump said. “But I wouldn’t. I think it’s too cute. The people wouldn’t like that. It wouldn’t be right.”Still, Trump left the door open to a future run. Asked whether he was ruling out a third term, he replied, “I would love to do it. I have my best numbers ever,” adding when pressed, “Am I not ruling it out? You’ll have to tell me.”President Donald Trump has hinted several times that he’d like to extend his stay in the White House — even joking about serving beyond the traditional limit. But could he actually run again in 2028 and seek a third term?The short answer: No. The Constitution bars anyone from being elected president more than twice.The 22nd Amendment to the Constitution, ratified in 1951, clearly states that “no person shall be elected to the office of the President more than twice.”Kimberly Wehle, a constitutional law professor at the University of Baltimore and author of ""How to Read the Constitution and Why,"" said the amendment leaves no room for ambiguity. “There was a concern about entrenching power in a kinglike manner,” she explained to New York Times.Amending the Constitution would be an extraordinarily difficult task. A proposed amendment requires approval from two-thirds of both the House and Senate — a far higher threshold than the narrow Republican majorities currently in place — or from two-thirds of state legislatures calling for a constitutional convention.Even then, ratification demands support from three-fourths of all state legislatures or constitutional conventions.Just three days after President Trump was sworn in for his second term, Representative Andy Ogles, a Republican from Tennessee, introduced a long-shot proposal to amend the Constitution and open a path for a potential third term.His resolution stated: “No person shall be elected to the office of the President more than three times, nor be elected to any additional term after being elected to two consecutive terms.”Ogles argued that Trump needed more time to fulfill his agenda and undo the policies of the Biden administration, saying, “He has proven himself to be the only figure in modern history capable of reversing our nation’s decay and restoring America to greatness, and he must be given the time necessary to accomplish that goal.”Yes — Franklin D. Roosevelt was elected to four consecutive terms, serving from 1933 until his death in 1945. His presidency spanned the Great Depression and World War II, a period of immense national crisis that made his continued leadership broadly acceptable at the time.There was no 22nd Amendment then, but Roosevelt’s unprecedented four-term tenure became the catalyst for introducing formal presidential term limits.“Four terms, or 16 years, is the most dangerous threat to our freedom ever proposed,” warned Thomas E. Dewey, the New York governor who ran against Roosevelt in 1944 and later lost to Harry S. Truman in 1948.",President Donald Trump has hinted several times that he’d like to extend his stay in the White House. But could he actually run again in 2028 and seek a third term? The Constitution bars anyone from being elected president more than twice. A proposed amendment requires approval from two-thirds of the House and Senate.,"https://static.toiimg.com/thumb/msid-124861460,imgsize-44386,width-400,resizemode-4/donald-trump-file-image.jpg"
